{"organizations": [], "uuid": "5380ddfbf6e27bb33cde79ed46116c76af1d3673", "thread": {"social": {"gplus": {"shares": 0}, "pinterest": {"shares": 0}, "vk": {"shares": 0}, "linkedin": {"shares": 0}, "facebook": {"likes": 278, "shares": 278, "comments": 10}, "stumbledupon": {"shares": 0}}, "site_full": "www.merdeka.com", "main_image": "https://cdns.klimg.com/merdeka.com/i/w/news/2017/02/17/813912/540x270/adu-argumen-ahok-anies-atasi-banjir-jelang-putaran-2-pilgub-dki.jpg", "site_section": "http://feeds.feedburner.com/Merdekacom", "section_title": "Merdeka.com", "url": "https://www.merdeka.com/jakarta/adu-argumen-ahok-anies-atasi-banjir-jelang-putaran-2-pilgub-dki.html", "country": "ID", "domain_rank": 378, "title": "Adu argumen Ahok & Anies atasi banjir jelang putaran 2 Pilgub DKI", "performance_score": 2, "site": "merdeka.com", "participants_count": 1, "title_full": "Adu argumen Ahok & Anies atasi banjir jelang putaran 2 Pilgub DKI", "spam_score": 0.0, "site_type": "news", "published": "2017-02-18T06:27:00.000+02:00", "replies_count": 0, "uuid": "5380ddfbf6e27bb33cde79ed46116c76af1d3673"}, "author": "editor@merdeka.com (Editor)", "url": "https://www.merdeka.com/jakarta/adu-argumen-ahok-anies-atasi-banjir-jelang-putaran-2-pilgub-dki.html", "ord_in_thread": 0, "title": "Adu argumen Ahok & Anies atasi banjir jelang putaran 2 Pilgub DKI", "locations": [], "entities": {"persons": [{"name": "mardani kandida", "sentiment": "negative"}, {"name": "adu", "sentiment": "negative"}, {"name": "awalnya", "sentiment": "none"}, {"name": "luthfi rahman", "sentiment": "none"}, {"name": "kantor dpp partai gerindra", "sentiment": "none"}, {"name": "rasuna said", "sentiment": "none"}, {"name": "jumat", "sentiment": "none"}, {"name": "menurutnya", "sentiment": "none"}, {"name": "masih", "sentiment": "none"}, {"name": "jadi", "sentiment": "none"}, {"name": "djarot saiful hidayat", "sentiment": "none"}, {"name": "karena", "sentiment": "none"}, {"name": "pada", "sentiment": "none"}, {"name": "maka", "sentiment": "none"}, {"name": "pak basuki pada", "sentiment": "none"}, {"name": "kamis", "sentiment": "none"}, {"name": "basuki tjahaja purnama", "sentiment": "none"}], "locations": [{"name": "karenanya", "sentiment": "none"}, {"name": "jakarta", "sentiment": "none"}, {"name": "bogor", "sentiment": "none"}, {"name": "jakarta selatan", "sentiment": "none"}], "organizations": [{"name": "pilgub dki adu argumen ahok & anies", "sentiment": "negative"}, {"name": "universitas paramadina", "sentiment": "none"}]}, "highlightText": "", "language": "english", "persons": [], "text": "Adu argumen Ahok & Anies atasi banjir jelang putaran 2 Pilgub DKI   06:27 Reporter : Mardani Kandidat debat Pilgub DKI. Â©2017 merdeka.com/Muhammad Luthfi Rahman \nMerdeka.com - Banjir yang melanda sejumlah wilayah di Jakarta beberapa waktu belakangan membuat dua cagub DKI saling adu argumen di media. Awalnya, Cagub DKI nomor urut tiga, Anies Baswedan menyindir calon petahana Basuki Tjahaja Purnama- Djarot Saiful Hidayat, bahwa pernyataan Jakarta sudah bebas banjir tidak tepat.Sebab, nyatanya pekan ini banjir terjadi di sejumlah wilayah ibu kota. Banjir terjadi akibat hujan yang turun terus menerus dan kiriman dari Bogor yang mengakibatkan Ciliwung meluap.Anies pun mengaku memiliki solusi agar Jakarta bebas dari banjir. Anies mengaku memiliki konsep sumur resapan alias biopori untuk mengatasi banjir. Menurutnya, aliran air tidak harus semuanya langsung dibuang ke laut, tapi ada sebagian yang diserap ke dalam tanah.\"Kami memang pada akhirnya air itu harus menggunakan vertical drainase jangan selalu horizontal drainase. Artinya dialirkan ke laut saja enggak cukup, harus tetap dimasukkan ke bumi dan bumi kita di Jakarta membutuhkan air,\" kata Anies di Kantor DPP Partai Gerindra, Jakarta, Kamis (16/2). Banjir di Bukit Duri 2017 Merdeka.com/anisatul \nAhok yang kini sudah aktif kembali menjadi gubernur DKI pun angkat bicara. Dia berpandangan proyek normalisasi kali merupakan cara terbaik untuk menanggulangi banjir.Ahok menjelaskan banjir yang terjadi di sejumlah lokasi akibat rendahnya muka tanah ketimbang tinggi muka air. Karenanya, cara paling efektif agar tidak ada luapan kembali adalah dengan menormalisasi tali-tali air di ibu kota.\"Itukan (limpasan) akibat karena enggak semua (sungai) dilebarin ditinggiin enggak mungkin. Kita butuh waktu butuh bangun rumah susun. Orang kita pindahin orang ke rumah susun aja masih dikritik kok,\" katanya di Balai Kota DKI Jakarta, Jumat (17/2).Ahok juga menanggapi ide vertical drainase Anies. Menurutnya, Pemprov DKI Jakarta pernah mencoba cara vertical drainase sebagai salah satu antisipasi banjir. Namun ternyata, tidak semua wilayah ibu kota bisa dijadikan titik untuk menjadi jalur rembesan limpasan air. Ahok nyoblos di TPS 054 Pantai Mutiara 2017 Merdeka.com/imam buhori \nAhok mengatakan, tekstur lapisan tanah di Jakarta tidak semua bisa menyerap air dengan debit yang besar. Untuk dapat menyerap air, tanah yang paling cocok adalah tanah reservoir atau ground water reservoir (waduk air tanah).\"Masih, ada beberapa titik enggak dapat lapisan reservoir, maka (vertical drainase) enggak ada guna. Jadi harus dapatkan sumur resapan harus masuk ke lapisan tanah yang bisa menyerap air,\" kata Ahok.Menurutnya, untuk dapat berfungsi sebagai akuifer atau lapisan bawah tanah yang mengandung air dan dapat mengalirkan air, lapisan tersebut harus berpori atau berongga. Sehingga air bergerak dari rongga ke rongga.\"Kalau kamu masuk ke tempat lempungan makanya enggak bisa (menampung air). Maka, kamu harus bor. Ada peta geologinya. Kalau banyak bahan endapan vulkanik itu cocok,\" katanya.Untuk itu, dalam pembuatan vertical drainase, pihaknya mesti mengetahui titik-titik dan pada kedalaman tanah yang mengandung endapan vulkanik. Prinsip tersebut terkandung dalam data geologi. Banjir di Bukit Duri 2017 Merdeka.com/imam buhori \n\"Kami sudah kerjakan di beberapa tempat tapi beberapa tempat itu gagal. Karena kontraktor kami itu sudah kerjain banyak. Seharusnya kita bor dulu, kita harusnya tes di mana ada endapan reservoir,\" katanya.Di tempat terpisah, Anies membeberkan ada 3 cara untuk mengatasi permasalahan banjir Jakarta. Tiga cara ini disesuaikan dengan lokasi banjir yang masih ada di Jakarta.\"Jadi ada yang harus dibereskannya dengan penambahan situ. Ada yang harus dibereskannya dengan vertikal drainage. Ada yang harus dibereskannya dengan pengerukan. Jadi tidak satu solusi untuk seluruh masalah,\" kata Anies saat ditemui di kawasan Rasuna Said, Jakarta Selatan, Jumat).Menurut Anies, penyelesaian banjir di Jakarta harus menggunakan pendekatan yang sifatnya konservasi tapi bersahabat dengan lingkungan. Saat disinggung terkait banjir kiriman dari bendungan Katulampa di Bogor, Anies justru menyinggung pernyataan petahana Ahok saat debat di salah satu stasiun televisi pertama.\"Anda bisa cek apa yang diungkapkan Pak Basuki pada debat pertama di NET TV. Pada saat itu saya sampaikan, jadi ada banjir dari hulu. Beliau menyampaikan banjir dari hulu udah enggak masalah lagi. Ternyata itu (banjir) masih jadi masalah. Itu yang harus diantisipasi. Seakan-akan hulu bukan masalah. Memang masih. Bahkan muncul sekarang,\" terang Anies. Anies Baswedan 2017 Merdeka.com/anisyah \nMenurut mantan rektor Universitas Paramadina itu solusi yang tepat untuk mengatasi banjir kiriman adalah mengendalikan air kiriman dari Bogor, yakni dengan mengarahkan air kiriman ke situ untuk ditampung.\"Solusi untuk air yang dari hulu itu memang ada beberapa. Satu, pengendalian air turun. Kedua, penampungan air lewat situ,\" ujar Anies.Ketiga lanjut Anies, harus ada proses penyerapan air ke dalam tanah di hulu. Sebab daerah hulu bermasalah sejak dibukanya lahan untuk perkebunan teh.\"Umumnya air itu terserap tapi setelah ada perkebunan teh, rumah-rumah di sana dibangun tanpa ada ada upaya serius memasukkan air hujan ke dalam tanah sehingga air hujan dialirkan,\" kata Anies.\"Kalau air hujan dialirkan horizontal ke sungai ya nanti yang hilir akan terima kiriman. Karena itu di atas sana airnya harus dimasukkan ke bawah (tanah) sehingga tidak akan mulai terkirim ke sini (hilir),\" pungkas Anies. [dan]", "external_links": [], "published": "2017-02-18T06:27:00.000+02:00", "crawled": "2017-02-18T01:37:23.720+02:00", "highlightTitle": ""}