{"organizations": [], "uuid": "487983705738b2d53a8dd2b3b2ea76ad7e12d3bf", "thread": {"social": {"gplus": {"shares": 0}, "pinterest": {"shares": 0}, "vk": {"shares": 0}, "linkedin": {"shares": 0}, "facebook": {"likes": 159, "shares": 159, "comments": 0}, "stumbledupon": {"shares": 0}}, "site_full": "www.geo.tv", "main_image": "https://www.geo.tv/assets/uploads/updates/2017-02-21/131855_120224_updates.jpg", "site_section": "https://www.geo.tv/rss/1/1", "section_title": "GEO TV - Pakistan", "url": "https://www.geo.tv/latest/131855-PPP-leader-Mustafa-Khar-decides-to-join-PTI", "country": "TV", "domain_rank": 8287, "title": "PPP leader Mustafa Khar decides to join PTI", "performance_score": 1, "site": "geo.tv", "participants_count": 0, "title_full": "PPP leader Mustafa Khar decides to join PTI", "spam_score": 0.0, "site_type": "news", "published": "2017-02-21T19:02:00.000+02:00", "replies_count": 0, "uuid": "487983705738b2d53a8dd2b3b2ea76ad7e12d3bf"}, "author": "", "url": "https://www.geo.tv/latest/131855-PPP-leader-Mustafa-Khar-decides-to-join-PTI", "ord_in_thread": 0, "title": "PPP leader Mustafa Khar decides to join PTI", "locations": [], "entities": {"persons": [{"name": "mustafa khar", "sentiment": "negative"}, {"name": "fakhra younus", "sentiment": "none"}, {"name": "shahbaz sharif", "sentiment": "none"}, {"name": "ishaq khakwani", "sentiment": "none"}, {"name": "jehangir tareen", "sentiment": "none"}, {"name": "fakhira younus", "sentiment": "none"}, {"name": "tehmina durrani", "sentiment": "none"}, {"name": "ghulam mustafa khar", "sentiment": "none"}, {"name": "imran khan", "sentiment": "none"}, {"name": "bilal khar", "sentiment": "none"}, {"name": "durrani", "sentiment": "none"}], "locations": [{"name": "pakistan", "sentiment": "none"}, {"name": "lahore", "sentiment": "none"}, {"name": "ppp", "sentiment": "none"}, {"name": "geo pakistan", "sentiment": "none"}, {"name": "punjab", "sentiment": "none"}], "organizations": [{"name": "pti", "sentiment": "negative"}, {"name": "ppp", "sentiment": "negative"}, {"name": "pti ppp", "sentiment": "negative"}, {"name": "party", "sentiment": "none"}, {"name": "geo news", "sentiment": "none"}]}, "highlightText": "", "language": "english", "persons": [], "text": "PPP leader Mustafa Khar decides to join PTI | 0 0 \nLAHORE: A prominent politician of Pakistan Peoples Party, Ghulam Mustafa Khar, has decided to join Pakistan Tehreek-e-Insaf, putting an end to his decades long association with the party. \nWhile talking to Geo News over the phone, Mustafa Khar confirmed his decision, saying he will announce his defection in his meeting with PTI Chairperson Imran Khan. Mustafa Khar, who is also the former governor of Punjab, said he is getting a big platform after a very long time. However, he did not speak about taking the oath of the party. \nBut he has spoken to PTI Secretary General Jehangir Tareen and another party leader, Ishaq Khakwani, the former governor said. \nHe joined PPP in 1960s as a close friend and political ally. \nMustafa Khar was married to an author and activist, Tehmina Durrani, who is now the wife of Punjab Chief Minister Shahbaz Sharif. \nIn her book, My Feudal Lord, Durrani writes about her troubled marriage with Mustafa Khar. \nHis son Bilal Khar was accused of throwing acid on his wife Fakhra Younus, who later committed suicide. However, Bilal Khar continued to deny that he bore any responsibility for her death, reported The Telegraph. 0 0 PPP leader Mustafa Khar decides to join PTI was posted in pakistan of Geo TV - https://www.geo.tv on February 21, 2017 and was last updated on February 21, 2017. This news story is related to Geo News, Latest News, Geo Pakistan, Ppp, Former Governor, Leader, Party, Defection, Pti, Chairperson, Meeting, Tehmina Durrani, Bilal Khar, Fakhira Younus, Accused. Permanent link to the news story \"PPP leader Mustafa Khar decides to join PTI\" is https://www.geo.tv/latest/131855-PPP-leader-Mustafa-Khar-decides-to-join-PTI . More From Pakistan:", "external_links": [], "published": "2017-02-21T19:02:00.000+02:00", "crawled": "2017-02-21T09:29:20.063+02:00", "highlightTitle": ""}