{"organizations": [], "uuid": "ffc6218101203bf2a696a4ef3e95af1cebcc4db0", "thread": {"social": {"gplus": {"shares": 1}, "pinterest": {"shares": 0}, "vk": {"shares": 0}, "linkedin": {"shares": 0}, "facebook": {"likes": 941, "shares": 941, "comments": 0}, "stumbledupon": {"shares": 0}}, "site_full": "www.thesun.co.uk", "main_image": "https://www.thesun.co.uk/wp-content/uploads/2017/02/nintchdbpict000301253198.jpg?strip=all&#038;w=1200&#038;h=800&#038;crop=1", "site_section": "https://www.thesun.co.uk/feed", "section_title": "The Sun", "url": "https://www.thesun.co.uk/news/2848282/jazz-singer-al-jarreau-dead-at-76-just-days-after-announcing-retirement-from-grammy-winning-career-due-to-exhaustion/", "country": "GB", "domain_rank": 2180, "title": "Jazz singer Al Jarreau dead at 76 just days after announcing retirement from Grammy-winning career due to exhaustion", "performance_score": 9, "site": "thesun.co.uk", "participants_count": 1, "title_full": "Jazz singer Al Jarreau dead at 76 just days after announcing retirement from Grammy-winning career due to exhaustion", "spam_score": 0.0, "site_type": "news", "published": "2017-02-13T05:39:00.000+02:00", "replies_count": 0, "uuid": "ffc6218101203bf2a696a4ef3e95af1cebcc4db0"}, "author": "yjeffery", "url": "https://www.thesun.co.uk/news/2848282/jazz-singer-al-jarreau-dead-at-76-just-days-after-announcing-retirement-from-grammy-winning-career-due-to-exhaustion/", "ord_in_thread": 0, "title": "Jazz singer Al Jarreau dead at 76 just days after announcing retirement from Grammy-winning career due to exhaustion", "locations": [], "entities": {"persons": [{"name": "al jarreau", "sentiment": "negative"}, {"name": "garth brooks", "sentiment": "none"}, {"name": "elton john", "sentiment": "none"}, {"name": "christina grimmie", "sentiment": "none"}, {"name": "jarreau", "sentiment": "none"}, {"name": "pete waterman", "sentiment": "none"}, {"name": "pete burns", "sentiment": "none"}, {"name": "yasmin jeffery", "sentiment": "none"}, {"name": "george michael", "sentiment": "none"}, {"name": "ryan", "sentiment": "none"}, {"name": "susan", "sentiment": "none"}, {"name": "greg lake", "sentiment": "none"}], "locations": [{"name": "san francisco", "sentiment": "none"}, {"name": "us", "sentiment": "none"}, {"name": "milwaukee", "sentiment": "none"}, {"name": "arizona republic", "sentiment": "none"}, {"name": "los angeles", "sentiment": "none"}], "organizations": [{"name": "wisconsin foundation for school music", "sentiment": "none"}, {"name": "epa", "sentiment": "none"}, {"name": "time magazine", "sentiment": "none"}, {"name": "voice", "sentiment": "none"}, {"name": "reuters", "sentiment": "none"}]}, "highlightText": "", "language": "english", "persons": [], "text": "Opinion JAZZ LEGEND DIES Jazz singer Al Jarreau dead at 76 just days after announcing retirement from Grammy-winning career due to exhaustion \nThe singer, whose career spanned 50 years and saw him win seven Grammy Awards, died surrounded by his family BY YASMIN JEFFERY GRAMMY-winning jazz singer Al Jarreau has died in Los Angeles at the age of 76. \nThe shock news comes just days after the singing star announced his retirement from touring. Reuters 3 Jazz star Al Jarreau has died aged 76 mere days after announcing his retirement from touring \nThe cause of death was not immediately clear, though the star was in hospital for exhaustion when he died. \nThe singer, who transcended genres over his 50-year career in the music industry, was surrounded by his wife, son and other close family members when he passed away . \nJarreau was hospitalised earlier in the week and was said to have been improving slowly. \nThe Milwaukee-born star won seven Grammy Awards throughout his career. Reuters The star won seven Grammy Awards over the course of his 50-year career in the music industry \nHis biggest single was 1981’s “We’re in This Love Together” from the album Breakin’ Away. \nJarreau also performed vocals on the 1985 song “We Are the World”, and sang the theme to TV’s Moonlighting. \nHe is one of a handful of musicians to have won Grammy Awards in three separate categories — jazz, pop and R&B. \nTime Magazine once described the star as the “greatest jazz singer alive”. RELATED STORIES Heartbroken fans lay flowers outside George Michael's homes as Elton John leads stars' tributes 'Music bows its head' Prog rock star Greg Lake who sang I Believe In Father Christmas dies after cancer battle aged 69 'HE WANTED TO DIE YOUNG' Pete Burns's pal Pete Waterman says the Dead Or Alive singer knew he was going to die ANOTHER VOICE STAR KILLED US singer who appeared on The Voice shot dead less than a week after Christina Grimmie 'DEEPEST SORROW' Family of gunman who shot dead singer Christina Grimmie post apology note on their front door ‘HE WANTED TO BE NATURAL AGAIN’ Pete Burns’ psychic reveals Dead or Alive singer was desperate to reverse plastic surgery horrors \nSpeaking in 2014 with The Arizona Republic , Jarreau relished in his crossover tendencies. \nHe said: “I grew up in Milwaukee, and I took it all in. I want it all. \n“Don’t cut me off at the pass and say I can’t listen to Muddy Waters because I’m a jazzer. It is with the deepest of sadness to inform you Al Jarreau passed away this morning, at about 600am LA time. He… https://t.co/P3pPccO3vk \n— Al Jarreau (@AlJarreau) February 12, 2017 \n“Or I can’t listen to Garth Brooks because I’m a jazzer. Get out of here,” he joked. \nJarreau was also an athlete who earned a master’s in vocal rehabilitation. \nHe first worked as a counsellor in San Francisco, playing jazz in his spare time. \nHe didn’t record his first album until he was 35. EPA 3 Jarreau, who was once described as the ‘greatest jazz singer alive’, leaves his wife and son behind \nA statement on the star’s website read: “His second priority in life was music. There was no third. \n“His first priority, far ahead of the other, was healing or comforting anyone in need.” \nJarreau leaves his wife Susan and son Ryan behind. \nA donation page for fans has been set up for the Wisconsin Foundation for School Music. \nWe pay for your stories! Do you have a story for The Sun Online news team? Email us at tips@the-sun.co.uk or call 0207 782 4368.", "external_links": [], "published": "2017-02-13T05:39:00.000+02:00", "crawled": "2017-02-13T06:18:43.261+02:00", "highlightTitle": ""}