{"organizations": [], "uuid": "8cc6a37417a5690bda5d3d8094926e325103a07c", "thread": {"social": {"gplus": {"shares": 0}, "pinterest": {"shares": 0}, "vk": {"shares": 0}, "linkedin": {"shares": 0}, "facebook": {"likes": 912, "shares": 912, "comments": 0}, "stumbledupon": {"shares": 0}}, "site_full": "www.thesun.co.uk", "main_image": "https://www.thesun.co.uk/wp-content/uploads/2017/02/composite-shooting.jpg?strip=all&#038;w=750&#038;h=500&#038;crop=1", "site_section": "", "section_title": "", "url": "https://www.thesun.co.uk/news/2902163/first-pictures-man-shot-dead-mercedes-sheffield/", "country": "GB", "domain_rank": 2180, "title": "First pictures of man shot dead in his black Mercedes in Sheffield as he drove to a family do", "performance_score": 9, "site": "thesun.co.uk", "participants_count": 0, "title_full": "First pictures of man shot dead in his black Mercedes in Sheffield as he drove to a family do", "spam_score": 0.293, "site_type": "news", "published": "2017-02-20T05:42:00.000+02:00", "replies_count": 0, "uuid": "8cc6a37417a5690bda5d3d8094926e325103a07c"}, "author": "", "url": "https://www.thesun.co.uk/news/2902163/first-pictures-man-shot-dead-mercedes-sheffield/", "ord_in_thread": 0, "title": "First pictures of man shot dead in his black Mercedes in Sheffield as he drove to a family do", "locations": [], "entities": {"persons": [{"name": "guzelian", "sentiment": "none"}, {"name": "daniel hill", "sentiment": "none"}, {"name": "brittany vonow", "sentiment": "none"}, {"name": "aseel", "sentiment": "none"}, {"name": "walkley", "sentiment": "none"}, {"name": "aseel  friends", "sentiment": "none"}, {"name": "hannah crouch", "sentiment": "none"}], "locations": [{"name": "sheffield", "sentiment": "none"}, {"name": "gangland", "sentiment": "none"}, {"name": "uk", "sentiment": "none"}, {"name": "upperthorpe", "sentiment": "none"}, {"name": "northern general hospital", "sentiment": "none"}], "organizations": [{"name": "south west news service", "sentiment": "none"}, {"name": "south yorkshire police", "sentiment": "none"}, {"name": "black mercedes", "sentiment": "none"}, {"name": "hampshire", "sentiment": "none"}, {"name": "facebook", "sentiment": "none"}, {"name": "mercedes", "sentiment": "none"}]}, "highlightText": "", "language": "english", "persons": [], "text": "Opinion 'I'LL NEVER FORGET YOU' First pictures of man shot dead in his black Mercedes in Sheffield as he drove to a family do \nAseel was just 23-years-old when he was shot dead with police now launching an investigation By BRITTANY VONOW and HANNAH CROUCH 19th February 2017, 2:10 pm Comments A MAN who was shot dead in broad daylight has been remembered as a “top lad”. \nThe 23-year-old man, named locally as Aseel, was either in or near a black Mercedes that he had been driving to a family do when he was shot in the chest in the Upperthorpe area on Saturday. Facebook 5 The young man shot dead in broad daylight has been named locally as Aseel \nFriends have now shared tributes to the young man, with one friend writing: “Will never forget him , I always use to see him in the area, He was, He was a top lad. May allah bless his family and give them patient (sic) to get through this hard time”. \nShe added that he would “always be missed”. \nAnother friend wrote: “RIP sweetheart never forget all the laughs we had. just dont seem real”. Guzelian The young man was in or near the Black Mercedes when he was shot SWNS:South West News Service Cops at the scene where a man was shot in the chest in a busy street in Sheffield at lunchtime on Saturday SWNS:South West News Service 5 The 23-year-old man was taken to hospital where he was treated for a gunshot wound but later died \nAnother friend shared a photograph of the young man, saying: “I will never forget the time we had brother” while another wrote: “It brings a tear to my eye to know that someone who you’ve know for so many years to get taken from this world in the cruelest way possible. \n“I still don’t believe it! Such a funny guy, too many memories! Taken too soon fly safe”. \nPolice swarmed to the area as the young man was rushed to hospital after the shooting on Daniel Hill, but he sadly died soon after. \nLocal residents said the man was a member of a family who live close to the scene of the shooting on Daniel Hill, between the Upperthorpe and Walkley areas of the city. \nThey said relatives had been gathering for a family celebration on Saturday when the man was shot. \nMany came out of the house to try to help him after hearing the incident, neighbours said. \nAfter police officers established a cordon around the Mercedes on Daniel Hill, more relatives arrived in the street, clearly distraught. RELATED STORIES RESERVOIR THUGS Gangland shooting victim jets back to UK surrounded by heavies after fleeing pram-pushing hitman who ambushed him outside his daughter's primary school SLAUGHTERED ON FACEBOOK Two-year-old boy and man, 26, shot dead and pregnant woman hit in horror shooting on Facebook Live 'No remorse' Thug sent chilling Christmas card from prison to vulnerable gun victim months after shooting her in the neck GUNNED DOWN Gunman on the loose in Sheffield after blasting a man in the chest in street shooting SHOOT OUT Woman, 31, third suspect held after man shot in the head in Hampshire 'doorstep gun attack' \nA South Yorkshire Police spokeswoman said: “A 23-year-old man has died following a reported shooting on Daniel Hill, Walkley, Sheffield, this afternoon (Saturday). \n“At around 1.35pm police were called to Daniel Hill following reports that a man had been shot. \n“The 23-year-old man was taken to Northern General Hospital with a suspected gunshot wound. He died a short time later. \n“Police are currently investigating the incident and anyone who was in the area at the time, or has information about the incident is urged to contact police on 101 quoting incident number 571 of 18 February.” Guzelian 5 Forensic officers examined the Mercedes after the fatal shooting \nOn Saturday afternoon, a section of Daniel Hill was sealed off either side of the Mercedes car, which had its front windows open and was parked by the side of the road. \nA large number of officers and forensic examiners were also at the southern end, near the commercial centre of Upperthorpe, where a number of shops and cafes are located. \nThere have been a spate of shootings in Sheffield in recent weeks, although all the previous incidents have been in the north of the city and none have been close to the Upperthorpe area. \nPeople watching the police activity said they could not remember another shooting in the area. \nOne man said: “Upperthorpe has had its problems but it’s been better recently. I’ve never heard of a shooting here. I’m shocked.” \nWe pay for your stories! Do you have a story for The Sun Online news team? Email us at or call 0207 782 4368 \n", "external_links": [], "published": "2017-02-20T05:42:00.000+02:00", "crawled": "2017-02-20T00:44:39.224+02:00", "highlightTitle": ""}