{"organizations": [], "uuid": "16023481234d7fea806fa0caa4eb5032ef8900ef", "thread": {"social": {"gplus": {"shares": 3}, "pinterest": {"shares": 0}, "vk": {"shares": 0}, "linkedin": {"shares": 0}, "facebook": {"likes": 416, "shares": 416, "comments": 0}, "stumbledupon": {"shares": 0}}, "site_full": "www.smh.com.au", "main_image": "http://www.smh.com.au/content/dam/images/g/t/z/r/k/j/image.related.articleLeadwide.620x349.gu5i44.png/1486176069246.jpg", "site_section": "http://www.smh.com.au/rssheadlines/cricket/article/rss.xml#", "section_title": "Sydney Morning Herald RSS News Headlines", "url": "http://www.smh.com.au/federal-politics/political-news/vulnerable-refugee-who-fled-png-could-face-criminal-charges-20170204-gu5i44.html", "country": "AU", "domain_rank": 1534, "title": "'Vulnerable' refugee who fled PNG could face criminal charges", "performance_score": 4, "site": "smh.com.au", "participants_count": 1, "title_full": "'Vulnerable' refugee who fled PNG could face criminal charges", "spam_score": 0.0, "site_type": "news", "published": "2017-02-04T09:41:00.000+02:00", "replies_count": 0, "uuid": "16023481234d7fea806fa0caa4eb5032ef8900ef"}, "author": "Michael Gordon", "url": "http://www.smh.com.au/federal-politics/political-news/vulnerable-refugee-who-fled-png-could-face-criminal-charges-20170204-gu5i44.html", "ord_in_thread": 0, "title": "'Vulnerable' refugee who fled PNG could face criminal charges", "locations": [], "entities": {"persons": [{"name": "michael gordon", "sentiment": "negative"}, {"name": "janet galbraith", "sentiment": "none"}, {"name": "loghman sawari", "sentiment": "none"}, {"name": "rimbink pato", "sentiment": "none"}, {"name": "sawari", "sentiment": "none"}, {"name": "andrew meares", "sentiment": "none"}, {"name": "pato", "sentiment": "none"}, {"name": "catherine stubberfield", "sentiment": "none"}, {"name": "loghaman sawari", "sentiment": "none"}, {"name": "loghman", "sentiment": "none"}], "locations": [{"name": "papua new guinea", "sentiment": "none"}, {"name": "nadi", "sentiment": "none"}, {"name": "manus island", "sentiment": "none"}, {"name": "fiji", "sentiment": "none"}, {"name": "canberra", "sentiment": "none"}, {"name": "australia", "sentiment": "none"}], "organizations": [{"name": "png", "sentiment": "negative"}, {"name": "united nations", "sentiment": "none"}, {"name": "unhcr", "sentiment": "none"}]}, "highlightText": "", "language": "english", "persons": [], "text": "'Vulnerable' refugee who fled PNG could face criminal charges Michael Gordon twitter TWEET More \nAn Iranian refugee who attempted to seek asylum in Fiji could face criminal charges after being forcibly deported back to Papua New Guinea. \nPNG's immigration and foreign minister, Rimbink Pato, has also vowed to tighten border security after Loghman Sawari was deported from Fiji for travelling to Nadi on a false passport. SHARE Refugee Loghaman Sawari now faces criminal charges in PNG Photo: Andrew Meares \n\"We will receive him and take the necessary steps to ensure he is properly questioned and, if appropriate, brought before the courts, noting he is a refugee who has had mental health issues,\" Mr Pato said. \n\"Tendering false statements or documents as part of any application for a passport or travel document is a criminal offence in PNG. Breaches will be investigated and those breaking the law will be prosecuted.\" Related Content Police intercept and deport refugee before he could lodge asylum claim \nThe United Nations refugee agency has expressed grave concerns about the welfare of Mr Sawari, who was 17 when he was transferred to Manus Island after attempting to come to Australia by boat. \nA, spokesperson for UNHCR's Regional Representation in Canberra, Catherine Stubberfield said that the agency was \"profoundly concerned for his well-being,\" stressing that \"after almost four years spent in harsh and isolating conditions on Manus Island, Mr. Sawari's sense of helplessness and hopelessness is acute.\" Advertisement \n\"UNHCR urges the Government of Papua New Guinea to ensure that he is treated in accordance with human rights law and standards,\" she said. \"The need to extend much-needed care to this extremely vulnerable young man is critical.\" \nTrauma worker Janet Galbraith has also appealed for Mr Sawari to be offered sanctuary in another country, saying: \"Having spoken with Loghman many times since he arrived in Fiji, I believe that this is the end for him. He is unable to survive any longer in this brutal and abusive system. His emotional and mental health have been fragile for a long time and none more so than now.\" SHARE", "external_links": [], "published": "2017-02-04T09:41:00.000+02:00", "crawled": "2017-02-04T04:49:01.076+02:00", "highlightTitle": ""}