{"organizations": [], "uuid": "b6c097467d36cf828c7fa62a88797932f3fa4b02", "thread": {"social": {"gplus": {"shares": 0}, "pinterest": {"shares": 0}, "vk": {"shares": 0}, "linkedin": {"shares": 0}, "facebook": {"likes": 270, "shares": 270, "comments": 0}, "stumbledupon": {"shares": 0}}, "site_full": "bdnews24.com", "main_image": "http://d30fl32nd2baj9.cloudfront.net/media/2017/02/18/merkel-hasina1.jpg/ALTERNATES/w640/Merkel-Hasina1.jpg", "site_section": "http://bdnews24.com/?widgetName=rssfeed&widgetId=1150&getXmlFeed=true", "section_title": "wf-escenic-times - Home", "url": "http://bdnews24.com/bangladesh/2017/02/18/pm-hasina-meets-german-chancellor-angela-merkel", "country": "US", "domain_rank": 2276, "title": "PM Hasina meets German Chancellor Angela Merkel", "performance_score": 2, "site": "bdnews24.com", "participants_count": 0, "title_full": "PM Hasina meets German Chancellor Angela Merkel", "spam_score": 0.0, "site_type": "news", "published": "2017-02-19T03:53:00.000+02:00", "replies_count": 0, "uuid": "b6c097467d36cf828c7fa62a88797932f3fa4b02"}, "author": "", "url": "http://bdnews24.com/bangladesh/2017/02/18/pm-hasina-meets-german-chancellor-angela-merkel", "ord_in_thread": 0, "title": "PM Hasina meets German Chancellor Angela Merkel", "locations": [], "entities": {"persons": [{"name": "angela merkel", "sentiment": "negative"}, {"name": "angela merkel sumon mahbub", "sentiment": "negative"}, {"name": "hasina", "sentiment": "negative"}, {"name": "sheikh hasinai", "sentiment": "none"}, {"name": "kamal abdul naser chowdhury", "sentiment": "none"}, {"name": "ursula gertrud von der leyen", "sentiment": "none"}, {"name": "merkel", "sentiment": "none"}, {"name": "shahidul haque", "sentiment": "none"}, {"name": "mahmood ali", "sentiment": "none"}], "locations": [{"name": "munich", "sentiment": "none"}, {"name": "hotel bayerischer hof", "sentiment": "none"}, {"name": "europe", "sentiment": "none"}, {"name": "dhaka", "sentiment": "none"}, {"name": "germany", "sentiment": "none"}, {"name": "bangladesh", "sentiment": "none"}], "organizations": [{"name": "reuters", "sentiment": "none"}]}, "highlightText": "", "language": "english", "persons": [], "text": "PM Hasina meets German Chancellor Angela Merkel Sumon Mahbub from Munich, bdnews24.com Published: 2017-02-18 20:53:48.0 BdST Updated: 2017-02-18 21:08:29.0 BdST German Chancellor Angela Merkel meets Bangladesh Prime Minister Sheikh Hasinai during the 53rd Munich Security Conference in Munich, Germany February 18, 2017. Reuters German Chancellor Angela Merkel meets Bangladesh Prime Minister Sheikh Hasinai during the 53rd Munich Security Conference in Munich, Germany February 18, 2017. Reuters Previous Next Prime Minister Sheikh Hasina has met German Chancellor Angela Merkel. \nThe bilateral meeting was held on the sidelines of 53rd Munich Security Conference at Hotel Bayerischer Hof on Saturday. \nThe issues discussed in the meeting between the two leaders were not available immediately. However, both the leaders earlier have expressed their firm stance against terrorism. \nForeign Minister AH Mahmood Ali, who was also present at the meeting, earlier said the two leaders would discuss improving trade and investment, mitigating risks of climate change, refugee and migration crisis in Europe, global conditions of terrorism and violence. PM's Principal Secretary Kamal Abdul Naser Chowdhury and Foreign Secretary Shahidul Haque were also present. \nHasina went to Germany on Friday on a two-day visit to attend the security conference. \nShe was scheduled to take part in a luncheon to be hosted by German Defence Minister Ursula Gertrud von der Leyen after meeting Merkel. \nShe will also attend a panel discussion on climate change. She is scheduled to start for Dhaka later in the night.", "external_links": [], "published": "2017-02-19T03:53:00.000+02:00", "crawled": "2017-02-18T18:37:12.008+02:00", "highlightTitle": ""}