{"organizations": [], "uuid": "f735f9774618ebdd220cd90f9f5f72f33040e513", "thread": {"social": {"gplus": {"shares": 0}, "pinterest": {"shares": 0}, "vk": {"shares": 0}, "linkedin": {"shares": 0}, "facebook": {"likes": 908, "shares": 908, "comments": 0}, "stumbledupon": {"shares": 0}}, "site_full": "comicbook.com", "main_image": "http://media.comicbook.com/2016/12/spidermanhomecoming-trailer-216703-640x320.png", "site_section": "http://comicbook.com//rss", "section_title": "Comicbook.com", "url": "http://comicbook.com/2017/02/17/tom-holland-spider-man-trailer-reaction/", "country": "US", "domain_rank": 2930, "title": "Tom Holland's First Reaction to Seeing Spider-Man: Homecoming Trailer", "performance_score": 9, "site": "comicbook.com", "participants_count": 1, "title_full": "Tom Holland's First Reaction to Seeing Spider-Man: Homecoming Trailer", "spam_score": 0.0, "site_type": "news", "published": "2017-02-17T08:40:00.000+02:00", "replies_count": 0, "uuid": "f735f9774618ebdd220cd90f9f5f72f33040e513"}, "author": "Megan Peters", "url": "http://comicbook.com/2017/02/17/tom-holland-spider-man-trailer-reaction/", "ord_in_thread": 0, "title": "Tom Holland's First Reaction to Seeing Spider-Man: Homecoming Trailer", "locations": [], "entities": {"persons": [{"name": "tom holland", "sentiment": "negative"}, {"name": "megan peters", "sentiment": "negative"}, {"name": "selenis leyva", "sentiment": "none"}, {"name": "tony stark", "sentiment": "none"}, {"name": "tyne daly", "sentiment": "none"}, {"name": "peter parker/spider-man", "sentiment": "none"}, {"name": "jacob batalon", "sentiment": "none"}, {"name": "peter", "sentiment": "none"}, {"name": "michael keaton", "sentiment": "none"}, {"name": "kenneth choi", "sentiment": "none"}, {"name": "holland", "sentiment": "none"}, {"name": "isabella amara", "sentiment": "none"}, {"name": "tony revolori", "sentiment": "none"}, {"name": "marisa tomei", "sentiment": "none"}, {"name": "robert downey", "sentiment": "none"}, {"name": "michael mando", "sentiment": "none"}, {"name": "robert downey jr", "sentiment": "none"}, {"name": "hannibal buress", "sentiment": "none"}, {"name": "jorge lendeborg", "sentiment": "none"}, {"name": "jj totah", "sentiment": "none"}, {"name": "martin starr", "sentiment": "none"}, {"name": "laura harrier", "sentiment": "none"}, {"name": "donald glover", "sentiment": "none"}, {"name": "peter parker", "sentiment": "none"}, {"name": "jon favreau", "sentiment": "none"}], "locations": [{"name": "bokeem woodbine", "sentiment": "none"}, {"name": "holland", "sentiment": "none"}, {"name": "zendaya", "sentiment": "none"}], "organizations": [{"name": "avengers", "sentiment": "none"}]}, "highlightText": "", "language": "english", "persons": [], "text": "Tom Holland's First Reaction to Seeing Spider-Man: Homecoming Trailer Megan Peters Back to Article Image of \nSpider-Man has a busy cinematic history, and the hero’s legacy is only going to become more convoluted this year. In July, Tom Holland will reprise his role as Peter Parker in Spider-Man: Homecoming after he debuted in the last Captain America film. The British actor left fans excited to see the character make a theatrical comeback after many had voiced their doubts about a third Spider-Man film franchise. Now, those who once doubted the project are starting to change their tune, and the trailer for Spider-Man: Homecoming made converts out of plenty. \nAnd, now, Holland has revealed his personal reaction to the stunning piece of footage. \nRecently, the up-and-coming actor spoke with Hey U Guys about the thrilling trailer during promotions of his latest movie, The Lost City of Z . When asked to recall his reaction to the trailer, Holland had this to say: \n“Dude, I lost my mind because it’s so strange to see Spider-Man and myself on the same screen. That still hasn’t sunk in yet.” \nContinuing, Holland explained, “To see the trailer come out and have such a positive reaction was exactly what we needed, and we’re really proud and excited to show the fans. I’m more excited than the fans, I’m telling you. I’m so excited to see it. \nA young Peter Parker/Spider-Man (Tom Holland), who made his sensational debut in Captain America: Civil War, begins to navigate his newfound identity as the web-slinging super hero in Spider-Man: Homecoming. Thrilled by his experience with the Avengers, Peter returns home, where he lives with his Aunt May (Marisa Tomei), under the watchful eye of his new mentor Tony Stark (Robert Downey, Jr.). Peter tries to fall back into his normal daily routine – distracted by thoughts of proving himself to be more than just your friendly neighborhood Spider-Man – but when the Vulture (Michael Keaton) emerges as a new villain, everything that Peter holds most important will be threatened. \nAre you as excited for Spider-Man: Homecoming as Holland is? Let us know with our anticipation rankings below! Currently, it is ComicBook.com's seventh most anticipated film! Spider-Man: Homecoming 2017 ComicBook Anticipated #11 Best-Rated Before Release Anticipated Rating Full Profile \nThe cast includes Tom Holland, Michael Keaton, Zendaya, Donald Glover, Jacob Batalon, Laura Harrier, Tony Revolori, Tyne Daly, Bokeem Woodbine, with Marisa Tomei, and Robert Downey Jr. It also includes Jon Favreau, Martin Starr, Kenneth Choi, Michael Mando, Selenis Leyva, Isabella Amara, Jorge Lendeborg, Jr., JJ Totah, Hannibal Buress, and Jacob Batalon.", "external_links": [], "published": "2017-02-17T08:40:00.000+02:00", "crawled": "2017-02-17T03:50:18.441+02:00", "highlightTitle": ""}