{"organizations": [], "uuid": "649207456cd55b4c9351bcd447c6edcd973c4f7f", "thread": {"social": {"gplus": {"shares": 0}, "pinterest": {"shares": 0}, "vk": {"shares": 0}, "linkedin": {"shares": 0}, "facebook": {"likes": 107, "shares": 107, "comments": 0}, "stumbledupon": {"shares": 0}}, "site_full": "www.geo.tv", "main_image": "https://www.geo.tv/assets/uploads/updates/2017-02-22/131999_023847_updates.jpg", "site_section": "https://www.geo.tv/rss/1/0", "section_title": "GEO TV - Pakistan", "url": "https://www.geo.tv/latest/131999-PM-leaves-for-Turkey-will-hold-talks-with-Erdogan", "country": "TV", "domain_rank": 8287, "title": "PM leaves for Turkey, will hold talks with Erdogan", "performance_score": 1, "site": "geo.tv", "participants_count": 0, "title_full": "PM leaves for Turkey, will hold talks with Erdogan", "spam_score": 0.0, "site_type": "news", "published": "2017-02-22T21:29:00.000+02:00", "replies_count": 0, "uuid": "649207456cd55b4c9351bcd447c6edcd973c4f7f"}, "author": "", "url": "https://www.geo.tv/latest/131999-PM-leaves-for-Turkey-will-hold-talks-with-Erdogan", "ord_in_thread": 0, "title": "PM leaves for Turkey, will hold talks with Erdogan", "locations": [], "entities": {"persons": [{"name": "muhammad nawaz s", "sentiment": "negative"}, {"name": "erdogan", "sentiment": "negative"}, {"name": "tariq fatemi", "sentiment": "none"}, {"name": "binali yildirim", "sentiment": "none"}, {"name": "begum kalsoom nawaz", "sentiment": "none"}, {"name": "khurram dastgir", "sentiment": "none"}, {"name": "nawaz sharif", "sentiment": "none"}, {"name": "recep tayyip erdogan", "sentiment": "none"}, {"name": "shahid khaqan abbasi", "sentiment": "none"}], "locations": [{"name": "turkey", "sentiment": "none"}, {"name": "islamabad", "sentiment": "none"}, {"name": "turkey pakistan", "sentiment": "none"}, {"name": "pakistan", "sentiment": "none"}, {"name": "ankara", "sentiment": "none"}, {"name": "geo news", "sentiment": "none"}], "organizations": [{"name": "mous", "sentiment": "none"}, {"name": "turkish parliament", "sentiment": "none"}]}, "highlightText": "", "language": "english", "persons": [], "text": "PM leaves for Turkey, will hold talks with Erdogan | 0 0 \nISLAMABAD: Prime Minister Muhammad Nawaz Sharif on Wednesday left for Turkey's capital Ankara to participate in the 5th Session of the Pakistan-Turkey High Level Strategic Cooperation Council (HLSCC). \nThe Prime Minister was accompanied by Begum Kalsoom Nawaz, Minister for Petroleum Shahid Khaqan Abbasi, Minister for Commerce Khurram Dastgir and PM's Special Assistant on Foreign Affairs Tariq Fatemi. \n\"The Prime Minister's visit to Turkey and the convening of the 5th Session of HLSCC would further deepen the time-tested, unparalleled and historic ties between the two brotherly countries and would impart a strong impetus to their flourishing cooperation in diverse fields,\" a Foreign Office statement said. \nThe Prime Minister along with Turkish Prime Minister Binali Yildirim will co-chair the HLSCC meeting. \nA Joint Declaration will be issued at the conclusion of the meeting and a number of MoUs are expected to be signed. \nThe Prime Minister will hold talks with Turkish President Recep Tayyip Erdogan on bilateral, regional and international issues. \nThe Prime Minister will also visit the Turkish Parliament to reaffirm Pakistan's unequivocal support and solidarity with the Government and people of Turkey against the failed coup attempt in Turkey \n0 0 PM leaves for Turkey, will hold talks with Erdogan was posted in pakistan   Latest Pakistan News, Geo News, Turkey Pakistan, Erdogan, Nawaz Sharif, Turkish Parliament.   \"PM leaves for Turkey, will hold talks with Erdogan\" is https://www.geo.tv/latest/131999-PM-leaves-for-Turkey-will-hold-talks-with-Erdogan . More From Pakistan:", "external_links": [], "published": "2017-02-22T21:29:00.000+02:00", "crawled": "2017-02-22T11:39:05.529+02:00", "highlightTitle": ""}