{"organizations": [], "uuid": "ef70359935394f0f6733abed72738869b3677b87", "thread": {"social": {"gplus": {"shares": 0}, "pinterest": {"shares": 0}, "vk": {"shares": 0}, "linkedin": {"shares": 0}, "facebook": {"likes": 266, "shares": 266, "comments": 0}, "stumbledupon": {"shares": 0}}, "site_full": "bdnews24.com", "main_image": "http://d30fl32nd2baj9.cloudfront.net/media/2013/09/12/22_dipu-moni_foreign-minister_120913.jpg/ALTERNATES/w640/22_Dipu+Moni_Foreign+Minister_120913.jpg", "site_section": "http://bdnews24.com/?widgetName=rssfeed&widgetId=1150&getXmlFeed=true", "section_title": "wf-escenic-times - Home", "url": "http://bdnews24.com/bangladesh/2017/02/23/dipu-moni-briefs-british-mps-in-bangladesh-caucus-in-london", "country": "US", "domain_rank": 2276, "title": "Dipu Moni briefs British MPs in Bangladesh caucus in London", "performance_score": 2, "site": "bdnews24.com", "participants_count": 0, "title_full": "Dipu Moni briefs British MPs in Bangladesh caucus in London", "spam_score": 0.0, "site_type": "news", "published": "2017-02-23T09:55:00.000+02:00", "replies_count": 0, "uuid": "ef70359935394f0f6733abed72738869b3677b87"}, "author": "", "url": "http://bdnews24.com/bangladesh/2017/02/23/dipu-moni-briefs-british-mps-in-bangladesh-caucus-in-london", "ord_in_thread": 0, "title": "Dipu Moni briefs British MPs in Bangladesh caucus in London", "locations": [], "entities": {"persons": [{"name": "dipu moni", "sentiment": "negative"}, {"name": "bob blackman", "sentiment": "none"}, {"name": "nazmul quaunine", "sentiment": "none"}, {"name": "paul scully", "sentiment": "none"}, {"name": "rupa huq", "sentiment": "none"}, {"name": "flick drummond", "sentiment": "none"}, {"name": "rohingya", "sentiment": "none"}, {"name": "mark field", "sentiment": "none"}, {"name": "sheikh hasina", "sentiment": "none"}, {"name": "simon danczuk", "sentiment": "none"}, {"name": "rushanara ali", "sentiment": "none"}, {"name": "david mackintosh", "sentiment": "none"}, {"name": "matthew offord", "sentiment": "none"}, {"name": "hasina", "sentiment": "none"}], "locations": [{"name": "london dipu moni", "sentiment": "none"}, {"name": "london", "sentiment": "none"}, {"name": "bangladesh", "sentiment": "none"}, {"name": "uk md", "sentiment": "none"}, {"name": "uk", "sentiment": "none"}], "organizations": [{"name": "parliament anne main", "sentiment": "none"}, {"name": "high commission", "sentiment": "none"}, {"name": "all-party parliamentary group", "sentiment": "none"}, {"name": "british parliament", "sentiment": "none"}, {"name": "british members of parliament", "sentiment": "none"}, {"name": "house of commons", "sentiment": "none"}, {"name": "parliamentary standing committee on ministry of foreign affairs", "sentiment": "none"}]}, "highlightText": "", "language": "english", "persons": [], "text": "Dipu Moni briefs British MPs in Bangladesh caucus in London Senior Correspondent, bdnews24.com Published: 2017-02-23 02:55:33.0 BdST Updated: 2017-02-23 02:55:33.0 BdST অহদড ঢ়বগটগ Chairperson of the Parliamentary Standing Committee on Ministry of Foreign Affairs and former foreign minister, Dipu Moni, has briefed some British MPs on the Bangladesh issues in London. \nBangladesh High Commissioner to the UK Md. Nazmul Quaunine also briefed the ten MPs of British Parliament at the House of Commons on Wednesday, the High Commission said in a statement. \nChair of All-Party Parliamentary Group (APPG) on Bangladesh of the UK Parliament Anne Main, Mark Field, Paul Scully, Rupa Huq, Rushanara Ali, Simon Danczuk, Bob Blackman, David Mackintosh, Flick Drummond, and Matthew Offord were, among others, present at the luncheon meeting. \nThis was an event organised for familiarisation with the British Members of Parliament having an interest in Bangladesh affairs. \nThe MPs lauded the role of Prime Minister Sheikh Hasina in efficiently countering the terrorism and radicalisation in the post-July 1 attack. \nDuring the meeting, they wanted to know about the contemporary security situation, Rohingya issues, new election commission and development activities in Bangladesh. \nThe High Commissioner thanked the British MPs for joining the briefing and gave them an overview of the history of Bangladesh and its political background and recent developments. \nHe pinpointed the autocratic rule and culture of impunity that prevailed in Bangladesh before the present government came to power. \nHe highlighted the significant measures taken by the present government led by Prime Minister Sheikh Hasina in strengthening democracy, the rule of law and steering the country towards development path. \nDipu Moni briefed them on Rohingya issue, recent developmental matters and political situations.", "external_links": [], "published": "2017-02-23T09:55:00.000+02:00", "crawled": "2017-02-22T23:23:29.135+02:00", "highlightTitle": ""}