{"organizations": [], "uuid": "c00eac0abad7ae1c05e396b8cb98cd18852753ce", "thread": {"social": {"gplus": {"shares": 0}, "pinterest": {"shares": 0}, "vk": {"shares": 0}, "linkedin": {"shares": 1}, "facebook": {"likes": 280, "shares": 280, "comments": 1}, "stumbledupon": {"shares": 0}}, "site_full": "www.telegraph.co.uk", "main_image": "http://www.telegraph.co.uk/content/dam/Travel/2017/February/sofia-AKG1BH-xlarge.jpg", "site_section": "http://www.telegraph.co.uk/travel/destinations/northamerica/usa/rss", "section_title": "Travel", "url": "http://www.telegraph.co.uk/travel/news/sofia-the-cheapest-city-in-the-world/", "country": "GB", "domain_rank": 317, "title": "38p pints and burgers for less than £2: which are the cheapest cities on Earth?", "performance_score": 2, "site": "telegraph.co.uk", "participants_count": 1, "title_full": "38p pints and burgers for less than £2: which are the cheapest cities on Earth?", "spam_score": 0.0, "site_type": "news", "published": "2017-02-16T23:53:00.000+02:00", "replies_count": 0, "uuid": "c00eac0abad7ae1c05e396b8cb98cd18852753ce"}, "author": "Hugh Morris", "url": "http://www.telegraph.co.uk/travel/news/sofia-the-cheapest-city-in-the-world/", "ord_in_thread": 0, "title": "38p pints and burgers for less than £2: which are the cheapest cities on Earth?", "locations": [], "entities": {"persons": [{"name": "hoppa", "sentiment": "none"}], "locations": [{"name": "earth", "sentiment": "none"}, {"name": "sofia", "sentiment": "none"}, {"name": "philippines", "sentiment": "none"}, {"name": "qatar", "sentiment": "none"}, {"name": "stockholm", "sentiment": "none"}, {"name": "ukraine", "sentiment": "none"}, {"name": "kiev", "sentiment": "none"}, {"name": "doha", "sentiment": "none"}, {"name": "dubai", "sentiment": "none"}, {"name": "caracas", "sentiment": "none"}, {"name": "colombia", "sentiment": "none"}, {"name": "ibiza", "sentiment": "none"}, {"name": "london", "sentiment": "none"}, {"name": "switzerland", "sentiment": "none"}, {"name": "italy", "sentiment": "none"}, {"name": "copenhagen", "sentiment": "none"}, {"name": "sunny beach", "sentiment": "none"}, {"name": "rome", "sentiment": "none"}, {"name": "dublin", "sentiment": "none"}, {"name": "oslo", "sentiment": "none"}, {"name": "sydney", "sentiment": "none"}, {"name": "mexico city", "sentiment": "none"}, {"name": "manilla", "sentiment": "none"}, {"name": "manila", "sentiment": "none"}, {"name": "venice", "sentiment": "none"}, {"name": "malta", "sentiment": "none"}, {"name": "zurich", "sentiment": "none"}, {"name": "egypt", "sentiment": "none"}, {"name": "cairo", "sentiment": "none"}, {"name": "cambodia", "sentiment": "none"}, {"name": "new york", "sentiment": "none"}, {"name": "mexico", "sentiment": "none"}, {"name": "sliema", "sentiment": "none"}, {"name": "paris", "sentiment": "none"}, {"name": "venezuela", "sentiment": "none"}, {"name": "cartagena", "sentiment": "none"}, {"name": "beijing", "sentiment": "none"}, {"name": "bulgaria", "sentiment": "none"}], "organizations": [{"name": "bloomberg finance", "sentiment": "none"}, {"name": "telegraph travel", "sentiment": "none"}]}, "highlightText": "", "language": "english", "persons": [], "text": "38p pints and burgers for less than £2: which are the cheapest cities on Earth? Sofia, the capital of Bulgaria, has taken top spot 16 February 2017 • 4:53pm \nS ofia is the cheapest city in the world for a short break, according to new research. \nThe Bulgarian capital took top place in a price index by airport transfers company Hoppa , with a night’s stay in the city, including a hotel, food, drink, a taxi journey and entertainment, costing just £38.21. As an added bonus, return flights to Sofia are available for as little as £50. Top 10 cheapest cities Mexico City, Mexico - £50.62 Sliema, Malta - £51.64 \nThe next cheapest destination was Cairo, Egypt, with all of the above setting you back just £39.09. Cartagena in Colombia was marginally dearer, at £39.70. Caracas was a surprise inclusion in the world's most expensive cities Credit: © 2016 Bloomberg Finance LP/Wilfredo Riera \nAt the other end of the spectrum in Hoppa’s annual survey, which this year included 84 cities, was Zurich, where the package of purchases costs £170.43. New York ranked second (£157.29), followed by Copenhagen (£150.72). \nLondon registered as the 12th most expensive city, just behind Dublin, with a cost of £121.41 next to the Irish capital’s £122.80. In pictures: The 15 cheapest destinations for 2017 \nThe top 10 was largely occupied by cities traditional renowned for their expense - Venice, Stockholm and Rome - and then there was Caracas. \nThe Venezuelan capital made a surprise appearance in tenth place. Known for its problems with crime, a night in Caracas apparently costs £123.08, dearer than 74 other cities, including Paris, Sydney and Ibiza. Top 10 most expensive cities Zurich, Switzerland - £170.43 Rome, Italy - £123.37 Caracas, Venezuela - £123.08 \nHoppa also broke down the costs of each night, highlighting where in the world has the most expensive hotels (New York) and the cheapest (Sunny Beach, Bulgaria). \nAnd what of the cost of a pint, a timeless barometer. The most expensive beer is to be had in Doha, Qatar, where it will set you back £6.39. Next is Oslo and Dubai, both tied at £6 a pint. Doha, where a pint will set you back £6.39 \nFor those looking for bargain booze, head to Manilla in the Philippines, where a pint costs just 38p, as it does in Siem Reap, Cambodia. In Beijing, a lager costs just 48p. \nThe cost of a burger is another way decent yardstick for measuring a city’s value, and it is once again Manila that offers the cheapest bite, at just £1.97, followed by Kiev in Ukraine, where a burger costs just £1.98. \nAt the other end of the scale, peckish punters will face the prospect of spending £12.81 for a burger in Zurich. That's enough to make you lose your appetite. \nFor a full breakdown of the results, see here . Follow the latest Telegraph Travel news Read more 16 Feb 2017 , 11:58am", "external_links": [], "published": "2017-02-16T23:53:00.000+02:00", "crawled": "2017-02-16T19:00:57.413+02:00", "highlightTitle": ""}