{"organizations": [], "uuid": "388a5e05af32c7e0901dbe6ba1fb97e80306f897", "thread": {"social": {"gplus": {"shares": 1}, "pinterest": {"shares": 0}, "vk": {"shares": 0}, "linkedin": {"shares": 0}, "facebook": {"likes": 214, "shares": 214, "comments": 0}, "stumbledupon": {"shares": 0}}, "site_full": "bdnews24.com", "main_image": "http://d30fl32nd2baj9.cloudfront.net/media/2017/02/09/80_showkat-aziz-russel_090217_0001.jpg/ALTERNATES/w640/80_Showkat+Aziz+Russel_090217_0001.jpg", "site_section": "http://bdnews24.com/?widgetName=rssfeed&widgetId=1150&getXmlFeed=true#", "section_title": "wf-escenic-times - Home", "url": "http://bdnews24.com/bangladesh/2017/02/09/partex-chairman-s-son-and-former-rajuk-chairman-land-in-jail-on-graft-charges", "country": "US", "domain_rank": 2276, "title": "Partex chairman's son and former RAJUK chairman land in jail on graft charges", "performance_score": 2, "site": "bdnews24.com", "participants_count": 0, "title_full": "Partex chairman's son and former RAJUK chairman land in jail on graft charges", "spam_score": 0.0, "site_type": "news", "published": "2017-02-10T00:16:00.000+02:00", "replies_count": 0, "uuid": "388a5e05af32c7e0901dbe6ba1fb97e80306f897"}, "author": "", "url": "http://bdnews24.com/bangladesh/2017/02/09/partex-chairman-s-son-and-former-rajuk-chairman-land-in-jail-on-graft-charges", "ord_in_thread": 0, "title": "Partex chairman's son and former RAJUK chairman land in jail on graft charges", "locations": [], "entities": {"persons": [{"name": "partex", "sentiment": "none"}, {"name": "russell", "sentiment": "none"}, {"name": "ma hashem", "sentiment": "none"}, {"name": "rubel", "sentiment": "none"}, {"name": "rezaul karim tarafdar", "sentiment": "none"}, {"name": "pranab kumar bhattacharya", "sentiment": "none"}, {"name": "ashfaq aziz rubel", "sentiment": "none"}, {"name": "chowdhury", "sentiment": "none"}, {"name": "jahirul haque", "sentiment": "none"}, {"name": "showkat aziz russell", "sentiment": "none"}, {"name": "iqbal uddin chowdhury", "sentiment": "none"}], "locations": [{"name": "gulshan", "sentiment": "none"}, {"name": "dhaka", "sentiment": "none"}, {"name": "paribagh", "sentiment": "none"}], "organizations": [{"name": "rajuk", "sentiment": "negative"}, {"name": "partex", "sentiment": "negative"}, {"name": "acc", "sentiment": "none"}, {"name": "bangladesh cricket board", "sentiment": "none"}, {"name": "amber group", "sentiment": "none"}, {"name": "partex group", "sentiment": "none"}, {"name": "city bank", "sentiment": "none"}, {"name": "anti-corruption commission", "sentiment": "none"}, {"name": "motijheel police station", "sentiment": "none"}, {"name": "akm waheedul islam", "sentiment": "none"}, {"name": "united commercial bank", "sentiment": "none"}]}, "highlightText": "", "language": "english", "persons": [], "text": "Partex chairman's son and former RAJUK chairman land in jail on graft charges Staff Correspondent, bdnews24.com Published: 2017-02-09 17:16:03.0 BdST Updated: 2017-02-09 17:54:52.0 BdST Showkat Aziz Russell was produced before a Dhaka court on Thursday after he was arrested from Gulshan. Partex Group Chairman MA Hashem's son Showkat Aziz Russell and former RAJUK chairman Iqbal Uddin Chowdhury have landed in jail as the court denied bail to them in graft charges brought by the Anti-Corruption Commission (ACC). Related Stories \nFormer RAJUK chairman, Partex chief's son arrested \nOn Thursday, the ACC arrested Russell from the capital's Gulshan while Chowdhury from Paribagh. \nThey were produced in the court and where counsels pleaded for bail while the ACC sought a seven-day remand to interrogate Russell. \nThe court turned down the bail petitions as well as the remand plea, but said investigators will be able to question Russell at the prison gate for two days in the next five working days. \nOn Wednesday, the ACC filed the case against eight persons with the Motijheel Police Station in Dhaka. \nThe six others are Russellâ€™s brother Ashfaq Aziz Rubel and former RAJUK members SD Foyez, AKM Waheedul Islam, FM Jafrullah, HM Jahirul Haque and Rezaul Karim Tarafdar. \nAccording to the case documents, the suspects conspired to allot 16.5 decimal land plots each to Partex Group chairman's sons Russell and Rubel against the public interest. \nRussell is the chairman and managing director of Amber Group, which was formed after splitting Partex's businesses. He also sits on the board of United Commercial Bank and is a director of the Bangladesh Cricket Board. \nHis brother Rubel is in charge of several business organisations of the Partex Group. He sits on the board of City Bank. \nA former housing and public works secretary, Chowdhury served as the chairman of RAJUK between 2001 and 2004, ACC Deputy Director (Public Relations) Pranab Kumar Bhattacharya told bdnews24.com. \nHe had been behind bars during the military-backed caretaker regime in a a graft case over selling 18 government-owned buildings below market price.", "external_links": [], "published": "2017-02-10T00:16:00.000+02:00", "crawled": "2017-02-09T14:09:28.511+02:00", "highlightTitle": ""}