{"organizations": [], "uuid": "2aea556b8565d314d9cf4dd1e910bba902cc4b6c", "thread": {"social": {"gplus": {"shares": 0}, "pinterest": {"shares": 0}, "vk": {"shares": 0}, "linkedin": {"shares": 0}, "facebook": {"likes": 209, "shares": 209, "comments": 0}, "stumbledupon": {"shares": 0}}, "site_full": "www.thesun.co.uk", "main_image": "https://www.thesun.co.uk/wp-content/uploads/2017/02/lw-comp-recovery.jpg?strip=all&#038;w=750&#038;h=500&#038;crop=1", "site_section": "https://www.thesun.co.uk/feed", "section_title": "The Sun", "url": "https://www.thesun.co.uk/living/2788990/cancer-patient-cured-clinical-trial/", "country": "GB", "domain_rank": 2180, "title": "Cancer patient who was given just 18 months to live now has NO TRACE of the disease", "performance_score": 2, "site": "thesun.co.uk", "participants_count": 1, "title_full": "Cancer patient who was given just 18 months to live now has NO TRACE of the disease", "spam_score": 0.0, "site_type": "news", "published": "2017-02-05T19:49:00.000+02:00", "replies_count": 0, "uuid": "2aea556b8565d314d9cf4dd1e910bba902cc4b6c"}, "author": "lfruen", "url": "https://www.thesun.co.uk/living/2788990/cancer-patient-cured-clinical-trial/", "ord_in_thread": 0, "title": "Cancer patient who was given just 18 months to live now has NO TRACE of the disease", "locations": [], "entities": {"persons": [{"name": "bob berry", "sentiment": "none"}, {"name": "berry", "sentiment": "none"}, {"name": "lauren fruen", "sentiment": "none"}, {"name": "lydia", "sentiment": "none"}, {"name": "bob", "sentiment": "none"}, {"name": "theresa may", "sentiment": "none"}, {"name": "matthew krebs", "sentiment": "none"}, {"name": "grace", "sentiment": "none"}, {"name": "maisie", "sentiment": "none"}, {"name": "christie", "sentiment": "none"}], "locations": [{"name": "stockport", "sentiment": "none"}, {"name": "europe manchester", "sentiment": "none"}, {"name": "europe", "sentiment": "none"}], "organizations": [{"name": "manchester evening news bob", "sentiment": "none"}, {"name": "nhs", "sentiment": "none"}, {"name": "facebook", "sentiment": "none"}, {"name": "christie", "sentiment": "none"}, {"name": "manchester evening news", "sentiment": "none"}]}, "highlightText": "", "language": "english", "persons": [], "text": "DEATH DODGING MIRACLE Cancer patient who was given just 18 months to live now has NO TRACE of the disease \nMedics told Bob Berry it was bad news after surgery, radiotherapy and chemotherapy all failed By LAUREN FRUEN Click to share on Facebook (Opens in new window) Comments A CANCER patient given just 18 months to live now has NO TRACE of the disease after testing a new wonder drug. \nTerminally ill Bob Berry was one of the first in the world to take part in the trial after being diagnosed with lung cancer three years ago. Manchester Evening News Bob Berry, 60, has been left with no trace of cancer after being one of the first in the world to take part in a new drugs trial Manchester Evening News 4 Bobpictured with his great niece and two great, great nieces, Maisie, Grace and Lydia \nThe 60-year-old is just one of just 12 across the world to try the brand new drug, which cannot yet be named. \nIt has left him with no apparent trace of tumour in his body. \nBob, from Stockport, had tried surgery, radiotherapy and chemotherapy – all of which were unsuccessful. related stories TEEN ‘FAKED CANCER’ Cops probe claims 'cancer patient faked terminal illness so he could get free stuff including guitar and holiday from charity’ CANCER NET PLEAS Seven times as many cancer sufferers are turning to crowdfunding for treatment not available on the NHS 'helping each person live well' Theresa May to unveil plans for better post-treatment care for cancer patients 'THE CANCER ATE AWAY AT MY SPINE' Footballer who had a broken neck for three months is told his 'muscle pain' is cancer 'I WAS ADAMANT SHE WOULDN'T HAVE IT' Furious mum blasts school after daughter is given cervical cancer jab 'without consent' \nMedics told him he had around a year-and-a-half left to live, the Mirror Online reports. \nBut Bob took part in the clinical trial using the drug which combines the drug with an immunotherapy treatment. Manchester Evening News Bob, pictured with Dr Matthew Krebs, said he couldn’t be more grateful for the treatment at The Christie one of the largest cancer treatment centres in Europe Manchester Evening News 4 Bob was one of just three people to take part in the trial at the hospital – and one of just 12 across the globe \nHis consultant at The Christie, one of the largest cancer treatment centres in Europe, Dr Matthew Krebs, said: “Bob has had a phenomenal response to taking part in this clinical trial.” \nMr Berry said: “Three years ago, I was given 12 – 18 months to live but I have already surpassed that and I feel well. \n“At the end of the day, this clinical trial at The Christie has extended my life and I couldn’t be more grateful.” \nWe pay for your stories! Do you have a story for The Sun Online news team? Email us at or call 0207 782 43", "external_links": [], "published": "2017-02-05T19:49:00.000+02:00", "crawled": "2017-02-05T15:00:28.744+02:00", "highlightTitle": ""}