{"organizations": [], "uuid": "acf1ff09dd4b46456099290fb5f0602899e715aa", "thread": {"social": {"gplus": {"shares": 0}, "pinterest": {"shares": 0}, "vk": {"shares": 0}, "linkedin": {"shares": 0}, "facebook": {"likes": 635, "shares": 635, "comments": 0}, "stumbledupon": {"shares": 0}}, "site_full": "www.vanguardngr.com", "main_image": "http://d19lga30codh7.cloudfront.net/wp-content/uploads/2017/01/power.png", "site_section": "http://www.vanguardngr.com/feed/", "section_title": "Vanguard News", "url": "http://www.vanguardngr.com/2017/02/buhari-appoints-usman-mohammed-interim-tcn-boss/", "country": "US", "domain_rank": 2203, "title": "Buhari appoints Usman Mohammed interim TCN boss", "performance_score": 6, "site": "vanguardngr.com", "participants_count": 1, "title_full": "Buhari appoints Usman Mohammed interim TCN boss", "spam_score": 0.0, "site_type": "news", "published": "2017-02-04T03:40:00.000+02:00", "replies_count": 0, "uuid": "acf1ff09dd4b46456099290fb5f0602899e715aa"}, "author": "Tony", "url": "http://www.vanguardngr.com/2017/02/buhari-appoints-usman-mohammed-interim-tcn-boss/", "ord_in_thread": 0, "title": "Buhari appoints Usman Mohammed interim TCN boss", "locations": [], "entities": {"persons": [{"name": "usman mohammed", "sentiment": "negative"}, {"name": "buhari", "sentiment": "negative"}, {"name": "mohammed", "sentiment": "none"}, {"name": "louis edozien", "sentiment": "none"}, {"name": "muhammed", "sentiment": "none"}, {"name": "alhaji usman gur mohammed", "sentiment": "none"}], "locations": [{"name": "zaria", "sentiment": "none"}], "organizations": [{"name": "tcn", "sentiment": "negative"}, {"name": "national electric power authority", "sentiment": "none"}, {"name": "transmission service providers", "sentiment": "none"}, {"name": "works and housing", "sentiment": "none"}, {"name": "bayero university kano", "sentiment": "none"}, {"name": "federal ministry of power", "sentiment": "none"}, {"name": "afdb", "sentiment": "none"}, {"name": "african development bank", "sentiment": "none"}, {"name": "ahmadu bello university", "sentiment": "none"}, {"name": "transmission company of nigeria", "sentiment": "none"}, {"name": "tcn’s project management unit", "sentiment": "none"}, {"name": "principal power utility transformation specialist", "sentiment": "none"}, {"name": "nepa", "sentiment": "none"}]}, "highlightText": "", "language": "english", "persons": [], "text": "Home » News » Buhari appoints Usman Mohammed interim TCN boss Buhari appoints Usman Mohammed interim TCN boss On 9:40 pm In News by Tony Comments \nThe Buhari-led Federal Government has approved the secondment of Alhaji Usman Gur Mohammed of the African Development Bank (AfDB) as the interim Managing Director and Chief Executive Officer of the Transmission Company of Nigeria (TCN). \nA statement by Mr Louis Edozien, Permanent Secretary of the Federal Ministry of Power, Works and Housing, said Muhammed’s appointment was part of efforts by government to reposition the company for better service delivery to Nigerians. \nIt said that Mohammed has resumed duty with a 12-month non-extendable deadline to complete his transformational mandate and set Transmission Service Providers and Independent System Operators on a path of greater operational efficiency and effectiveness. \nIt also said that his approval was designed to ensure responsiveness to the needs of the generation companies and distribution companies, who are TCN’s customers. \nIt said Mohammed was until his secondment, the Principal Power Utility Transformation Specialist in the AfDB’s Nigerian Office. \n“Mohammed joined the service of the AfDB in 2009. He has served in various senior level management roles in charge of financial control, power utility policy and transformation. \n“Before joining AfDB, Mr. Mohammed worked for the then National Electric Power Authority (NEPA),” it said. \nThe statement said that Mohammed also served as the Secretary of revenue cycle management project, which was NEPA’s first public private partnership initiative. \nAccording to the statement, he also served as head of financial management for TCN’s Project Management Unit (PMU). \nIt said Mohammed is a Chartered Accountant and a member of the various professional bodies related to his profession. \n“Mohammed holds a BSc Degree in Accountancy, Ahmadu Bello University Zaria, and a Master of Business Administration (Management), Bayero University Kano“ it said.", "external_links": [], "published": "2017-02-04T03:40:00.000+02:00", "crawled": "2017-02-04T01:52:14.332+02:00", "highlightTitle": ""}