{"organizations": [], "uuid": "38f875607140be760d879f6dac8b6218816080b6", "thread": {"social": {"gplus": {"shares": 0}, "pinterest": {"shares": 0}, "vk": {"shares": 0}, "linkedin": {"shares": 0}, "facebook": {"likes": 219, "shares": 219, "comments": 0}, "stumbledupon": {"shares": 0}}, "site_full": "nz.news.yahoo.com", "main_image": "https://s.yimg.com/iu/api/res/1.2/5N0rQFF0kDUPAYoYlepcMQ--/YXBwaWQ9eXZpZGVvO3c9NzM5O2g9MzU0O2R4PTE3O2R5PTE7Y3c9NDM4O2NoPTI0NTtxPTcwO249MTt1bGNyb3A7cm90YXRlPWF1dG8-/https://s.yimg.com/ea/img/-/170220/58a9e0a8c45da_627stevefb.jpg", "site_section": "", "section_title": "", "url": "https://nz.news.yahoo.com/top-stories/a/34449595/funeral-for-sas-soldier-pilot-killed-fighting-port-hills-fire-to-be-held/", "country": "AU", "domain_rank": 5, "title": "Funeral for SAS soldier, pilot killed fighting Port Hills fire to be held - Yahoo New Zealand", "performance_score": 2, "site": "yahoo.com", "participants_count": 0, "title_full": "Funeral for SAS soldier, pilot killed fighting Port Hills fire to be held - Yahoo New Zealand", "spam_score": 0.026, "site_type": "news", "published": "2017-02-20T07:29:00.000+02:00", "replies_count": 0, "uuid": "38f875607140be760d879f6dac8b6218816080b6"}, "author": "Yahoo", "url": "https://nz.news.yahoo.com/top-stories/a/34449595/funeral-for-sas-soldier-pilot-killed-fighting-port-hills-fire-to-be-held/", "ord_in_thread": 0, "title": "Funeral for SAS soldier, pilot killed fighting Port Hills fire to be held - Yahoo New Zealand", "locations": [], "entities": {"persons": [{"name": "askin", "sentiment": "none"}, {"name": "steve askin", "sentiment": "none"}, {"name": "elizabeth", "sentiment": "none"}], "locations": [{"name": "yahoo new zealand", "sentiment": "none"}, {"name": "port hills", "sentiment": "none"}, {"name": "sugar loaf", "sentiment": "none"}, {"name": "christchurch", "sentiment": "none"}, {"name": "kabul", "sentiment": "none"}, {"name": "wigram airforce base", "sentiment": "none"}, {"name": "afghanistan", "sentiment": "none"}, {"name": "new zealand", "sentiment": "none"}], "organizations": [{"name": "sas", "sentiment": "neutral"}, {"name": "defence force", "sentiment": "none"}, {"name": "intercontinental hotel", "sentiment": "none"}, {"name": "taliban", "sentiment": "none"}]}, "highlightText": "", "language": "english", "persons": [], "text": "Share Funeral for SAS soldier, pilot killed fighting Port Hills fire to be held - Yahoo New Zealand The funeral for Steve Askin, 38, the former SAS soldier who died in a helicopter crash while fighting the Port Hills fire is due to be held. Close Funeral for SAS soldier, pilot killed fighting Port HIlls fire to be held UP NEXT VIDEO Funeral for SAS soldier, pilot killed fighting Port HIlls fire to be held. Source: One News Funeral for SAS soldier, pilot killed fighting Port HIlls fire to be held \nMr Askin's SAS comrades will be pallbearers at the service at Christchurch's Wigram Airforce Base on Monday, according to a post on the Givealittle page set up to raise money for his family. \nThe army will film the funeral and make sure identities remain confidential, the post says. \nThe page had raised over $200,000 for his family on Monday morning. Photos: Supplied \nMr Askin did not have life insurance and also had a hefty student loan from helicopter pilot training, according to the post on Givealittle . \nThe Squirrel helicopter Mr Askin was flying crashed near Sugar Loaf car park last Tuesday. \nMr Askin was a former SAS soldier cited multiple times for his exceptional bravery in Afghanistan, the Defence Force has said. Photos: Supplied \nHe received the New Zealand Gallantry Star, New Zealand's second-highest gallantry award, in 2014, his identity not being made public at the time. \nThe medal citation said that, during a Taliban attack on the Intercontinental Hotel in Kabul in 2011, Mr Askin was wounded by grenade and rifle fire, but carried on rescuing hotel guests as a fire broke out. \nHe is survived by his wife Elizabeth and two young children. \nâ€“ With NZN ", "external_links": [], "published": "2017-02-20T07:29:00.000+02:00", "crawled": "2017-02-20T01:45:35.547+02:00", "highlightTitle": ""}