{"organizations": [], "uuid": "67e3fa8a1e811fa504a4e9f5ab68db5a1b336bcb", "thread": {"social": {"gplus": {"shares": 0}, "pinterest": {"shares": 0}, "vk": {"shares": 0}, "linkedin": {"shares": 0}, "facebook": {"likes": 656, "shares": 656, "comments": 0}, "stumbledupon": {"shares": 0}}, "site_full": "www.thesun.co.uk", "main_image": "https://www.thesun.co.uk/wp-content/uploads/2017/02/enm.jpg?strip=all&#038;w=1200&#038;h=800&#038;crop=1", "site_section": "https://www.thesun.co.uk/feed", "section_title": "The Sun", "url": "https://www.thesun.co.uk/news/2922646/theresa-may-slaps-down-wannabe-french-president-emmanuel-macron-over-his-plan-to-poach-british-banks-after-brexit/", "country": "GB", "domain_rank": 2180, "title": "Theresa May slaps down wannabe French president Emmanuel Macron over his plan to poach British banks after Brexit", "performance_score": 6, "site": "thesun.co.uk", "participants_count": 1, "title_full": "Theresa May slaps down wannabe French president Emmanuel Macron over his plan to poach British banks after Brexit", "spam_score": 0.0, "site_type": "news", "published": "2017-02-22T05:51:00.000+02:00", "replies_count": 0, "uuid": "67e3fa8a1e811fa504a4e9f5ab68db5a1b336bcb"}, "author": "ttowers", "url": "https://www.thesun.co.uk/news/2922646/theresa-may-slaps-down-wannabe-french-president-emmanuel-macron-over-his-plan-to-poach-british-banks-after-brexit/", "ord_in_thread": 0, "title": "Theresa May slaps down wannabe French president Emmanuel Macron over his plan to poach British banks after Brexit", "locations": [], "entities": {"persons": [{"name": "theresa may", "sentiment": "negative"}, {"name": "emmanuel macron", "sentiment": "negative"}, {"name": "mrs may", "sentiment": "none"}, {"name": "nick clegg getty", "sentiment": "none"}, {"name": "putin", "sentiment": "none"}, {"name": "peter mandelson", "sentiment": "none"}, {"name": "iain duncan smith", "sentiment": "none"}, {"name": "harry cole", "sentiment": "none"}, {"name": "hollande", "sentiment": "none"}, {"name": "jeremy corbyn", "sentiment": "none"}, {"name": "brexit", "sentiment": "none"}, {"name": "macron", "sentiment": "none"}], "locations": [{"name": "britain", "sentiment": "none"}, {"name": "france", "sentiment": "none"}, {"name": "calais", "sentiment": "none"}, {"name": "downing street", "sentiment": "none"}, {"name": "paris", "sentiment": "none"}, {"name": "eu", "sentiment": "none"}, {"name": "uk", "sentiment": "none"}, {"name": "london", "sentiment": "none"}, {"name": "westminster", "sentiment": "none"}], "organizations": [{"name": "epa", "sentiment": "none"}, {"name": "european union", "sentiment": "none"}, {"name": "un", "sentiment": "none"}, {"name": "brexit reuters", "sentiment": "none"}, {"name": "reuters macron", "sentiment": "none"}, {"name": "eu", "sentiment": "none"}, {"name": "facebook", "sentiment": "none"}, {"name": "macron", "sentiment": "none"}]}, "highlightText": "", "language": "english", "persons": [], "text": "Opinion macwrong Theresa May slaps down wannabe French president Emmanuel Macron over his plan to poach British banks after Brexit \nThe PM hit back at Emmanuel Macron’s offer to call for 'banks, talents, researchers, academics' to flock from London to France By HARRY COLE, Westminster Correspondent 21st February 2017, 10:51 pm Click to share on Facebook (Opens in new window) Comments THERESA May slapped down the French Presidential favourite after he called for an exodus of bankers to Paris from the doorstep of No10. \nThe PM hit back at Emmanuel Macron’s offer to call for “banks, talents, researchers, academics” to flock from London to France following a private meeting in Downing Street . Getty Images 7 The PM hit back at Emmanuel Macron after his bid to poach British banks \nMrs May’s spokesman blasted: “The simple fact is London is a leading global financial centre and will remain so after Brexit .” \nAnd they added: “We are not the only one to think that either.” \nVisiting the 200,000 French voters who live in London, the former French finance minister requested a meeting with the PM where they discussed Brexit. Getty Images The former French finance minister requested a meeting with the PM where they discussed Brexit Reuters 7 Macron arrives at 10 Downing Street before talks with Theresa May \nBut following their private chat, Mr Macron stepped out of the famous black door of No10 to tell the waiting cameras he has a “series of initiatives to get talented people in research and lots of fields working here to come to France.” \nPolls show Mr Macron is currently the frontrunner to replace hated President Hollande when France goes to the polls in May. \nHe claimed that “France and the European Union are a very attractive space now, so in my programme I will do everything I can to make it attractive and successful.” RELATED STORIES Labour grandee Peter Mandelson says he's working to undermine 'manic' Jeremy Corbyn every day DID RUSSIA HACK BRIT ELECTION? 'Clear evidence' Putin has interfered with British election results, claims former EU minister NON MERCI Theresa May meets French Presidential hopeful Emmanuel Macron - who wants to nick UK talent post-Brexit STOKE VOTES Here is all you need to know about the crucial Stoke-on-Trent Central by-election PAY SLIP What is the Living Wage, is it different from the national wage, how much is the new rate and is it higher in London? BREXIT BILL EU chief warns of 'very hefty' Brexit bill as sources suggest €60 billion price tag \nBut No10 hit back saying: “The British economy is open to investment, Britain is open for business.” \nAnd in a win for Mrs May, Mr Macron also signalled a u-turn on his threat to tear up border agreements with the UK that see passports checked in France before passengers cross the Channel. \nHe had said last year that if the UK backed Brexit the deal would “unravel” and any migrants would be sent straight to Britain rather than detained in Calais . \nBut he rowed back and said he wished to “improve” the Le Touquet agreement that was signed in 2003 and is recognised by the UN. Vantage News He also visited the 200,000 French voters who live in London Reuters Macron meets Lib Dem MP and Europhile Nick Clegg Getty Images He stands on stage and sings at the end of the campaign event EPA 7 Macron is currently the frontrunner to replace hated President Hollande when France goes to the polls in May \nSpeaking in English, Mr Macron said he had assured the PM that he wished for a “fair” Brexit, but warned any deal must “protect and defend French and European interests”. \nHe also backed conducting negotiations over a future trade deal at the same time as hammering out our EU divorce, in a further boost for Britain. \nAsked about Mr Macron’s threats poach bankers from the UK to France, arch-Brexiteer Iain Duncan Smith told the French hopeful to “dream on”, adding there was “fat chance” of his plan working. \nMr Macron later addressed 3,000 french citizens at an event in Westminster.", "external_links": [], "published": "2017-02-22T05:51:00.000+02:00", "crawled": "2017-02-22T06:14:17.095+02:00", "highlightTitle": ""}