{"organizations": [], "uuid": "338f8a556a2267e065585a6c3dee29a1c8d3497b", "thread": {"social": {"gplus": {"shares": 0}, "pinterest": {"shares": 0}, "vk": {"shares": 0}, "linkedin": {"shares": 0}, "facebook": {"likes": 183, "shares": 183, "comments": 0}, "stumbledupon": {"shares": 0}}, "site_full": "bdnews24.com", "main_image": "http://d30fl32nd2baj9.cloudfront.net/media/2017/02/18/pm-munich03.jpg/ALTERNATES/w640/PM-Munich03.jpg", "site_section": "http://bdnews24.com/?widgetName=rssfeed&widgetId=1150&getXmlFeed=true#", "section_title": "wf-escenic-times - Home", "url": "http://bdnews24.com/bangladesh/2017/02/19/pm-hasina-leaves-germany-for-dhaka-after-attending-security-conference-meeting-merkel", "country": "US", "domain_rank": 2276, "title": "PM Hasina leaves Germany for Dhaka after attending security conference, meeting Merkel", "performance_score": 1, "site": "bdnews24.com", "participants_count": 0, "title_full": "PM Hasina leaves Germany for Dhaka after attending security conference, meeting Merkel", "spam_score": 0.0, "site_type": "news", "published": "2017-02-19T11:48:00.000+02:00", "replies_count": 0, "uuid": "338f8a556a2267e065585a6c3dee29a1c8d3497b"}, "author": "", "url": "http://bdnews24.com/bangladesh/2017/02/19/pm-hasina-leaves-germany-for-dhaka-after-attending-security-conference-meeting-merkel", "ord_in_thread": 0, "title": "PM Hasina leaves Germany for Dhaka after attending security conference, meeting Merkel", "locations": [], "entities": {"persons": [{"name": "hasina", "sentiment": "negative"}, {"name": "merkel", "sentiment": "negative"}, {"name": "merkel sumon mahbub", "sentiment": "negative"}, {"name": "imtiaz ahmed", "sentiment": "none"}, {"name": "mahmud ali", "sentiment": "none"}, {"name": "ihsanul karim", "sentiment": "none"}, {"name": "kamal abdul naser chowdhury", "sentiment": "none"}, {"name": "shahidul haque", "sentiment": "none"}, {"name": "angela merkel", "sentiment": "none"}, {"name": "kamaluddin ahmed", "sentiment": "none"}], "locations": [{"name": "dhaka", "sentiment": "none"}, {"name": "germany", "sentiment": "none"}, {"name": "munich international airport", "sentiment": "none"}, {"name": "abu dhabi", "sentiment": "none"}, {"name": "munich", "sentiment": "none"}, {"name": "bangladesh", "sentiment": "none"}], "organizations": [{"name": "53rd munich security conference", "sentiment": "none"}, {"name": "awami league", "sentiment": "none"}]}, "highlightText": "", "language": "english", "persons": [], "text": "PM Hasina leaves Germany for Dhaka after attending security conference, meeting Merkel Sumon Mahbub from Munich, bdnews24.com Published: 2017-02-19 04:48:34.0 BdST Updated: 2017-02-19 04:48:34.0 BdST Prime Minister Sheikh Hasina has left Munich for Dhaka after a two-day visit to Germany. \nThe aircraft carrying the prime minister and her entourage departed Munich International Airport at 9:45 pm local time on Saturday (3:45 am BDsT on Sunday). \nBangladesh Ambassador in Germany Imtiaz Ahmed saw her off at the airport. \nShe is expected to reach Dhaka Sunday night after a six-hour stopover in Abu Dhabi. \nShe reached Germany on Friday to join the 53rd Munich Security Conference. She is the first Bangladeshi head of state or government to join the conference. \nOn Saturday, she held a bilateral meeting with German Chancellor Angela Merkel and took part in a panel discussion. \nOn Friday, she attended a reception organised by German Awami League. \nForeign Minister AH Mahmud Ali, PM's Principal Secretary Kamal Abdul Naser Chowdhury, Foreign Secretary Shahidul Haque, Home Secretary Kamaluddin Ahmed and PM's Press Secretary Ihsanul Karim were in the PM's entourage.", "external_links": [], "published": "2017-02-19T11:48:00.000+02:00", "crawled": "2017-02-19T08:47:21.930+02:00", "highlightTitle": ""}