{"organizations": [], "uuid": "ad9105be29664357baf7c6e5ee6a2da3d8eeadfc", "thread": {"social": {"gplus": {"shares": 0}, "pinterest": {"shares": 0}, "vk": {"shares": 0}, "linkedin": {"shares": 0}, "facebook": {"likes": 457, "shares": 457, "comments": 0}, "stumbledupon": {"shares": 0}}, "site_full": "au.news.yahoo.com", "main_image": "https://s.yimg.com/iu/api/res/1.2/xAzFp0IrGMMXjYmtQCsDUw--/YXBwaWQ9eXZpZGVvO3c9NjMwO2g9MzU0O2R4PTE7ZHk9MTtjdz05NzU7Y2g9NTQ4O3E9NzA7bj0xO3VsY3JvcDtyb3RhdGU9YXV0bw--/https://s.yimg.com/ea/img/-/170221/58abf188d57da_809ristevskinew.jpg", "site_section": "", "section_title": "", "url": "https://au.news.yahoo.com/a/34463154/decaying-remains-found-in-bushland-confirmed-to-be-missing-mum-karen-ristevski/", "country": "AU", "domain_rank": 5, "title": "Decaying remains found in bushland confirmed to be missing mum Karen Ristevski - Yahoo7", "performance_score": 4, "site": "yahoo.com", "participants_count": 0, "title_full": "Decaying remains found in bushland confirmed to be missing mum Karen Ristevski - Yahoo7", "spam_score": 0.021, "site_type": "news", "published": "2017-02-21T09:55:00.000+02:00", "replies_count": 0, "uuid": "ad9105be29664357baf7c6e5ee6a2da3d8eeadfc"}, "author": "Aap", "url": "https://au.news.yahoo.com/a/34463154/decaying-remains-found-in-bushland-confirmed-to-be-missing-mum-karen-ristevski/", "ord_in_thread": 0, "title": "Decaying remains found in bushland confirmed to be missing mum Karen Ristevski - Yahoo7", "locations": [], "entities": {"persons": [{"name": "karen ristevski", "sentiment": "negative"}, {"name": "ms ristevski", "sentiment": "none"}, {"name": "ian flannery", "sentiment": "none"}, {"name": "lyn middleton", "sentiment": "none"}, {"name": "borce", "sentiment": "none"}, {"name": "melva edwards", "sentiment": "none"}, {"name": "anthony", "sentiment": "none"}, {"name": "adrian bayley", "sentiment": "none"}, {"name": "mal ross", "sentiment": "none"}, {"name": "karen", "sentiment": "none"}, {"name": "jill meagher", "sentiment": "none"}, {"name": "ristevski", "sentiment": "none"}, {"name": "karen ristevski karen ristevski", "sentiment": "none"}], "locations": [{"name": "mt macedon", "sentiment": "none"}, {"name": "avondale heights", "sentiment": "none"}, {"name": "maribyrnong river", "sentiment": "none"}, {"name": "loch road", "sentiment": "none"}, {"name": "bella bleu", "sentiment": "none"}, {"name": "mount macedon", "sentiment": "none"}, {"name": "mount macedon regional park", "sentiment": "none"}, {"name": "melbourne", "sentiment": "none"}], "organizations": [{"name": "ses north west", "sentiment": "none"}, {"name": "ses", "sentiment": "none"}, {"name": "news  missing persons squad", "sentiment": "none"}, {"name": "avondale heights", "sentiment": "none"}, {"name": "news", "sentiment": "none"}, {"name": "news police", "sentiment": "none"}]}, "highlightText": "", "language": "english", "persons": [], "text": "Share Decaying remains found in bushland confirmed to be missing mum Karen Ristevski - Yahoo7 Police have confirmed human remains found at Mount Macedon parkland on Monday are that of missing Melbourne woman Karen Ristevski. Close Police arrive at Ristevski family home UP NEXT VIDEO Police arrive at Ristevski family home. 7News Police arrive at Ristevski family home \nDetectives had arrived at the Ristevski family home in Avondale Heights on Tuesday afternoon to break the news, and made no comment to media as they left the property. \n\"Police can confirm the human remains found at Mount Macedon yesterday are that of missing Avondale Heights, woman Karen Ristevski,\" a police spokesperson said. Karen Ristevski (middle), pictured with her husband and daughter. Picture: 7 News Police at the Mount Macedon scene. Picture: 7 News \n\"Investigators received the results following forensic testing this afternoon.\" \nThe decomposing human remains were found by a bushwalker on Monday, with a large police presence moving in to the scene. Close Melbourne mother missing more than seven months UP NEXT VIDEO Melbourne mother missing since June 2016 Melbourne mother missing more than seven months \nA team of more than 20 SES volunteers began a line search across bushland near a dirt road at Mount Macedon Regional Park at 10.30am Tuesday. \nVolunteers combed about a kilometre of rugged bushland before wrapping up just after 2pm. Police confirmed remains found in bushland are that of Karen Ristevski. Picture: 7 News \n\"I'm just glad they found her remains, but it's still horrible to have something like this happen anywhere,\" nearby resident Melva Edwards said. \n\"It was terrible because it is such a nice quiet place up here,\" resident Lyn Middleton added. Karen Ristevski with her husband. Picture: 7 News \nAnother walker who frequents the bushland where Karen's body was found said he had noticed a smell while taking his dogs through. \n\"About six or eight months ago, every time I'd come down with the dogs, one of the dogs would actually stop in this position most of the time,\" Ian Flannery said. Karen Ristevski. Picture: 7 News \nMissing Persons Squad detectives are now appealing for anyone that may have been walking along the dirt track off Loch Road or anyone that may have seen any vehicles to contact them. \n\"Investigators are also hoping to speak to anyone that may have been at Mount Macedon any time from June last year and took photos or any video footage in the area,\" a police spokesperson said. \nAnyone with information should call Crime Stoppers on 1800 333 000. The Ristevski family had appealed for the public's help to find Karen. Picture: 7 News \nEarlier on Tuesday, SES North West regional manager Mal Ross said his units weren't expected to return to the bushland on Wednesday. \n\"That's it now. We've covered the area that police were initially looking at so at this stage we've finished,\" he told AAP. Karen Ristevski was last seen in June 2016. Picture: 7 News \nThe crime scene was cleared and the site, around 60km north of Melbourne, reopened to the public on Tuesday afternoon. \nThe body was found about 25 kilometres from where police had previously searched for missing Ms Ristevski, who was last seen in June 2016. THE SEARCH FOR KAREN RISTEVSKI Karen Ristevski was last seen at her Avondale Heights home about 10am on June 29 The 47-year-old was the owner of the Bella Bleu boutique in Taylors Lakes She has not used her phone or bank accounts since she went missing Ms Ristevski is 160cm tall, with a slim build and shoulder length brown hair Her husband Borce was questioned by police but released Ms Ristevski's step-son Anthony was interviewed over the disappearance but denied killing her, despite saying he was angry over a family dispute Police searched the Maribyrnong River and grassland near the Ristevski's home They also drained dams and searched the same road where Adrian Bayley buried Jill Meagher. On February 20, human remains found at Mt Macedon, about 25km from where police were searching for Ms Ristevski Forensic tests confirm body belongs to Karen Ristevski on February 21. ", "external_links": [], "published": "2017-02-21T09:55:00.000+02:00", "crawled": "2017-02-21T10:44:40.053+02:00", "highlightTitle": ""}