{"organizations": [], "uuid": "220cac3e7bf4848c34b1dfc6dd27c8683c5505a5", "thread": {"social": {"gplus": {"shares": 0}, "pinterest": {"shares": 0}, "vk": {"shares": 0}, "linkedin": {"shares": 0}, "facebook": {"likes": 644, "shares": 644, "comments": 0}, "stumbledupon": {"shares": 0}}, "site_full": "www.thesun.co.uk", "main_image": "https://www.thesun.co.uk/wp-content/uploads/2017/02/sport-preview-chinese-fans.jpg?strip=all&#038;w=620&#038;h=413&#038;crop=1", "site_section": "https://www.thesun.co.uk/feed", "section_title": "The Sun", "url": "https://www.thesun.co.uk/sport/football/2936279/manchester-united-china-football-fans/", "country": "GB", "domain_rank": 2180, "title": "Manchester United overtake Bayern Munich as the most popular football team in China… but Bundesliga is still most followed league", "performance_score": 6, "site": "thesun.co.uk", "participants_count": 1, "title_full": "Manchester United overtake Bayern Munich as the most popular football team in China… but Bundesliga is still most followed league", "spam_score": 0.0, "site_type": "news", "published": "2017-02-23T18:55:00.000+02:00", "replies_count": 0, "uuid": "220cac3e7bf4848c34b1dfc6dd27c8683c5505a5"}, "author": "gstonehouse", "url": "https://www.thesun.co.uk/sport/football/2936279/manchester-united-china-football-fans/", "ord_in_thread": 0, "title": "Manchester United overtake Bayern Munich as the most popular football team in China… but Bundesliga is still most followed league", "locations": [], "entities": {"persons": [{"name": "chi", "sentiment": "negative"}, {"name": "samir nasri", "sentiment": "none"}, {"name": "mesut ozil", "sentiment": "none"}, {"name": "arsene wenger", "sentiment": "none"}, {"name": "sam", "sentiment": "none"}, {"name": "weibo", "sentiment": "none"}, {"name": "david hornby", "sentiment": "none"}, {"name": "hornby", "sentiment": "none"}, {"name": "hector herrera", "sentiment": "none"}, {"name": "jose mourinho", "sentiment": "none"}], "locations": [{"name": "china", "sentiment": "none"}, {"name": "man city", "sentiment": "none"}, {"name": "far east", "sentiment": "none"}], "organizations": [{"name": "efl", "sentiment": "negative"}, {"name": "bayern munich", "sentiment": "negative"}, {"name": "manchester united", "sentiment": "negative"}, {"name": "porto", "sentiment": "none"}, {"name": "far east news group newspapers ltd united", "sentiment": "none"}, {"name": "chinese super league", "sentiment": "none"}, {"name": "bayern", "sentiment": "none"}, {"name": "mailman", "sentiment": "none"}, {"name": "barcelona", "sentiment": "none"}, {"name": "premier league", "sentiment": "none"}, {"name": "arsenal contract tv times manchester united vs southampton", "sentiment": "none"}, {"name": "red card", "sentiment": "none"}, {"name": "borussia dortmund", "sentiment": "none"}, {"name": "bbc sport", "sentiment": "none"}, {"name": "news group newspapers ltd manchester united", "sentiment": "none"}, {"name": "news group newspapers ltd", "sentiment": "none"}, {"name": "associated press", "sentiment": "none"}, {"name": "manchester united vs southampton", "sentiment": "none"}, {"name": "red devils", "sentiment": "none"}, {"name": "manchester city", "sentiment": "none"}, {"name": "memphis depay", "sentiment": "none"}, {"name": "liverpool", "sentiment": "none"}, {"name": "united", "sentiment": "none"}]}, "highlightText": "", "language": "english", "persons": [], "text": "EFL FAR EAST FAVES Manchester United overtake Bayern Munich as the most popular football team in China… but Bundesliga is still most followed league \nJose Mourinho's Red Devils are the biggest hit online for Chinese football fans BY GARY STONEHOUSE Comments MANCHESTER UNITED are the most popular team online in China, according to a new report. \nThe Red Devils have overtaken German giants Bayern Munich at the top of the list after the sixth edition of the Red Card was revealed. News Group Newspapers Ltd Manchester United are the most popular team online in China, according to a new report \nThe study analyses the influence of 53 European clubs on China’s social media platforms. \nKeep up to date with ALL the Manchester United news, gossip, transfers and goals on our club page plus fixtures, results and live match commentary \nAnd aside from the Bundesliga champions, the Premier League makes up the top five favourites in the Far East. \nArsenal and Liverpool are placed jointly in third place with Manchester City sitting in fifth. related articles Mesut Ozil attracting interest from Chinese Super League as he dithers on new Arsenal contract TV Times Manchester United vs Southampton: What TV channel is the EFL Cup final on and when is it? Preview Manchester United vs Southampton: When is the EFL Cup final and what TV channel is it on? that's some feet Porto star Hector Herrera reveals foot injury in gruesome snap… having played on for 40 minutes Sam slams Gunners Samir Nasri insists Arsenal players must take the blame for failure... not under-fire Arsene Wenger TOP TEN MOST POPULAR TEAMS ONLINE IN CHINA \n1 MANCHESTER UNITED \n9 BORUSSIA DORTMUND \n10 BARCELONA \nDespite the English clubs dominating, it remains the German top-flight that is the most influential league online. \nThe study has taken its data from Chinese social media platforms Weibo and WeChat as well as audience figures from live streams and the number of visitors to individual club websites in the country. \nDavid Hornby, the head of sport at Mailman, who produce of the annual report, told BBC Sport: “The Premier League is complacent. Its clubs have decent numbers of followers on Weibo, but not as high engagement. News Group Newspapers Ltd The sixth edition of the Red Card study confirmed United as top dogs in the Far East News Group Newspapers Ltd United are top dogs, but Arsenal, Liverpool and Man City also make it into the top five AP:Associated Press 4 Bayern Munich are in second, while the Bundesliga remains the most popular league \n“The Bundesliga clubs are far more active. The German league tells its clubs what to do, whereas the respective Premier League clubs are in control of what they do.” \nAnd when quizzed about United’s move to the top spot, Hornby added: “There was a gap between following and engagement. \n“United were the most followed, but Bayern were a country mile ahead regarding activity online. But United have taken big strides with fan events and a tour last year.” Memphis Depay shares the moment Manchester United make flight diversion in China", "external_links": [], "published": "2017-02-23T18:55:00.000+02:00", "crawled": "2017-02-23T14:22:13.188+02:00", "highlightTitle": ""}