{"organizations": [], "uuid": "0ff190a43ed90b3ce56411dbb4a90a974d2a97a1", "thread": {"social": {"gplus": {"shares": 1}, "pinterest": {"shares": 0}, "vk": {"shares": 0}, "linkedin": {"shares": 0}, "facebook": {"likes": 203, "shares": 203, "comments": 0}, "stumbledupon": {"shares": 0}}, "site_full": "www.latimes.com", "main_image": "http://www.trbimg.com/img-58a500fe/turbine/tn-dpt-me-storm-20170215", "site_section": "http://www.latimes.com/socal/coastline-pilot/rss2.0.xml", "section_title": "Coastline Pilot - Los Angeles Times", "url": "http://www.latimes.com/socal/daily-pilot/news/tn-dpt-me-storm-20170215-story.html", "country": "US", "domain_rank": 609, "title": "Powerful storm to bring heavy rain, strong wind and high surf to O.C.", "performance_score": 2, "site": "latimes.com", "participants_count": 1, "title_full": "Powerful storm to bring heavy rain, strong wind and high surf to O.C.", "spam_score": 0.0, "site_type": "news", "published": "2017-02-16T08:25:00.000+02:00", "replies_count": 0, "uuid": "0ff190a43ed90b3ce56411dbb4a90a974d2a97a1"}, "author": "Hannah Fry", "url": "http://www.latimes.com/socal/daily-pilot/news/tn-dpt-me-storm-20170215-story.html", "ord_in_thread": 0, "title": "Powerful storm to bring heavy rain, strong wind and high surf to O.C.", "locations": [], "entities": {"persons": [{"name": "schroeter", "sentiment": "none"}, {"name": "hannah fry", "sentiment": "none"}, {"name": "bryce alderton", "sentiment": "none"}, {"name": "derek schroeter", "sentiment": "none"}], "locations": [{"name": "laguna", "sentiment": "none"}, {"name": "san diego", "sentiment": "none"}, {"name": "laguna canyon", "sentiment": "none"}, {"name": "laguna canyon road", "sentiment": "none"}, {"name": "marina park", "sentiment": "none"}, {"name": "warner ave.  newport beach", "sentiment": "none"}, {"name": "fountain valley", "sentiment": "none"}, {"name": "adolfo lopez drive", "sentiment": "none"}, {"name": "superior ave.  seal beach", "sentiment": "none"}, {"name": "city hall", "sentiment": "none"}, {"name": "huntington beach", "sentiment": "none"}, {"name": "heil avenue", "sentiment": "none"}, {"name": "gothard st.", "sentiment": "none"}, {"name": "laguna beach", "sentiment": "none"}, {"name": "brookhurst st.  costa mesa", "sentiment": "none"}, {"name": "south coast highway", "sentiment": "none"}, {"name": "mount herrmann st.", "sentiment": "none"}, {"name": "aliso beach park", "sentiment": "none"}, {"name": "888 ocean ave.", "sentiment": "none"}], "organizations": [{"name": "edison community center", "sentiment": "none"}, {"name": "los angeles times", "sentiment": "none"}, {"name": "national weather service", "sentiment": "none"}]}, "highlightText": "", "language": "english", "persons": [], "text": "Powerful storm to bring heavy rain, strong wind and high surf to O.C. Heil Avenue flood File photo | Los Angeles Times A Huntington Beach police officer diverts traffic on flooded Heil Avenue during a storm last month. Forecasters say a storm arriving late Thursday will be similar to those that downed trees and power lines and flooded roads in late January. A Huntington Beach police officer diverts traffic on flooded Heil Avenue during a storm last month. Forecasters say a storm arriving late Thursday will be similar to those that downed trees and power lines and flooded roads in late January. (File photo | Los Angeles Times) Hannah Fry .\nThe storm, which is expected to taper off by Sunday, could dump up to 3 inches of rain along the coast and 5 inches in the mountains and foothills, according to Derek Schroeter, a meteorologist with the National Weather Service in San Diego. \nThe majority of the rain in the area will fall Friday, Schroeter said. Winds blowing up to 45 mph are expected that day, he said. \nThe National Weather Service issued high-wind and flash-flood advisories through Saturday. Large surf with the potential to damage beach structures like piers will hit Thursday night through Sunday, the weather service said. \nWaves are expected to range from 5 to 9 feet Friday and build up to 15 feet late Saturday through early Sunday, according to forecasters. \nLaguna Beach officials are encouraging downtown business owners and Laguna Canyon residents to insert their flood gates within doorways to protect their property from rising water, according to a city news release. \nLaguna residents can pick up free filled sandbags from the Act V parking lot at 1900 Laguna Canyon Road and a parking lot on the east side of South Coast Highway across from Aliso Beach Park. Unfilled sandbags are available at Laguna's four fire stations. \nIn Huntington Beach, free sandbags are available at the city yard at 17371 Gothard St., the Edison Community Center at 21377 Magnolia St. and the fire station at 3831 Warner Ave. \nNewport Beach residents may pick up 10 filled sandbags at the city yard at 592 Superior Ave. \nSeal Beach is offering complimentary sandbags at the marine safety headquarters at 888 Ocean Ave., the naval weapons station, several fire stations, Marina Park and the public works yard at 1776 Adolfo Lopez Drive. \nIn Fountain Valley, sandbags are available at the city yard at 17300 Mount Herrmann St. and the sports park at 16210 Brookhurst St. \nCosta Mesa residents can pick up 15 free sandbags at the southeast corner of the parking lot at City Hall, 77 Fair Drive. \nDaily Pilot staff writer Bryce Alderton contributed to this report.", "external_links": [], "published": "2017-02-16T08:25:00.000+02:00", "crawled": "2017-02-16T05:42:43.519+02:00", "highlightTitle": ""}