{"organizations": [], "uuid": "97c45848961e91f30b4b02b3b66d2fd94ae74fe2", "thread": {"social": {"gplus": {"shares": 1}, "pinterest": {"shares": 0}, "vk": {"shares": 0}, "linkedin": {"shares": 0}, "facebook": {"likes": 482, "shares": 482, "comments": 0}, "stumbledupon": {"shares": 0}}, "site_full": "www.manchestereveningnews.co.uk", "main_image": "http://i3.manchestereveningnews.co.uk/incoming/article12601340.ece/ALTERNATES/s1200/Britains-most-notorious-prisoner-Charles-Bronson.jpg", "site_section": "http://www.manchestereveningnews.co.uk/all-about/rss.xml", "section_title": "men - News", "url": "http://www.manchestereveningnews.co.uk/news/greater-manchester-news/notorious-prisoner-charles-bronson-reported-12600966", "country": "GB", "domain_rank": 7505, "title": "Notorious prisoner Charles Bronson reported to have proposed to former Coronation Street actress", "performance_score": 4, "site": "manchestereveningnews.co.uk", "participants_count": 1, "title_full": "Notorious prisoner Charles Bronson reported to have proposed to former Coronation Street actress", "spam_score": 0.0, "site_type": "news", "published": "2017-02-14T18:26:00.000+02:00", "replies_count": 0, "uuid": "97c45848961e91f30b4b02b3b66d2fd94ae74fe2"}, "author": "Andrew Bardsley", "url": "http://www.manchestereveningnews.co.uk/news/greater-manchester-news/notorious-prisoner-charles-bronson-reported-12600966", "ord_in_thread": 0, "title": "Notorious prisoner Charles Bronson reported to have proposed to former Coronation Street actress", "locations": [], "entities": {"persons": [{"name": "charles bronson", "sentiment": "negative"}, {"name": "charlie", "sentiment": "none"}, {"name": "tom hardy", "sentiment": "none"}, {"name": "jennie mcalpine", "sentiment": "none"}, {"name": "paula", "sentiment": "none"}, {"name": "fiz brown", "sentiment": "none"}, {"name": "paula williamson", "sentiment": "none"}, {"name": "bronson", "sentiment": "none"}, {"name": "dale cregan", "sentiment": "none"}, {"name": "anders hanson", "sentiment": "none"}], "locations": [{"name": "hollyoaks", "sentiment": "none"}, {"name": "invalid email  britain", "sentiment": "none"}, {"name": "hmp wakefield", "sentiment": "none"}, {"name": "wakefield prison", "sentiment": "none"}, {"name": "stoke-on-trent", "sentiment": "none"}], "organizations": [{"name": "liverpool echo", "sentiment": "none"}, {"name": "weatherfield general", "sentiment": "none"}, {"name": "scott & bailey", "sentiment": "none"}, {"name": "manchester metropolitan university", "sentiment": "none"}, {"name": "facebook", "sentiment": "none"}]}, "highlightText": "", "language": "english", "persons": [], "text": "News Notorious prisoner Charles Bronson reported to have proposed to former Coronation Street actress Paula Williamson, 36, was popped the question by jailbird Bronson, 64, when she visited him at HMP Wakefield Share Charles Bronson (Photo: Liverpool Echo) Share Get daily updates directly to your inbox + Subscribe Thank you for subscribing! Could not subscribe, try again later Invalid Email \nBritain’s most notorious prisoner Charles Bronson is reported to have proposed to a former Coronation Street actress. \nPaula Williamson, 36, was popped the question by jailbird Bronson, 64, when she visited him at HMP Wakefield. \nThe actress appeared on the cobbles three times between 2008 and 2012 in bit parts as an unnamed nurse working at Weatherfield General. \nIn one episode she is seen caring for Fiz Brown, played by Jennie McAlpine, when the character had recently given birth. \nPaula, who graduated from the school of theatre at Manchester Metropolitan University in 2005, has also appeared in Hollyoaks, Scott & Bailey and Emmerdale. Paula Williamson visits Charles Bronson at Wakefield Prison (Photo: Daily Mirror) Read More Dale Cregan feared 'ending up like Charles Bronson' in plot to move to psychiatric hospital \nShe was pictured outside the prison in a revealing red dress ahead of the meeting. \nBronson is said to have planned the proposal for Valentine’s Day, but brought it forward for her visit. \nHe has spent 41 years in prison, initially for armed robbery and has had his sentence increased for attacking prison guards and taking them hostage. \nA biopic about his life starring Tom Hardy was released in 2008. \nThe couple became friendly after becoming pen pals, and are thought to have been in a relationship for five months. \nPaula, from Stoke-on-Trent, said: “We are so in love. Wakefield Prison (Photo: Anders Hanson/ Flickr) Read More \n“I’ve had relationships with both men and women in the past, but none of them come close to my love for Charlie. \n“He’s so eccentric, but so am I. It’s a perfect match.” \nPaula said they will work to make their relationship work, despite Bronson being locked up. \nShe added: “I know he has a public image of being a violent prisoner, but in reality he is so different. \n“He can never change the things he has done in the past, but he is working so hard to put that behind him. \n“There are obviously difficulties him being in prison cause our relationship, but we feel so strongly about each other we’re determined to make it work.” Like us on Facebook", "external_links": [], "published": "2017-02-14T18:26:00.000+02:00", "crawled": "2017-02-14T14:02:03.630+02:00", "highlightTitle": ""}