{"organizations": [], "uuid": "3836ba1ce3161603a0a900b3a88def6add8ba637", "thread": {"social": {"gplus": {"shares": 0}, "pinterest": {"shares": 0}, "vk": {"shares": 0}, "linkedin": {"shares": 0}, "facebook": {"likes": 216, "shares": 216, "comments": 0}, "stumbledupon": {"shares": 0}}, "site_full": "www.vulture.com", "main_image": "http://pixel.nymag.com/imgs/daily/vulture/2017/02/23/23-oscar-statues-2.w1200.h630.jpg", "site_section": "http://feeds.feedburner.com/nymag/vulture", "section_title": "Vulture", "url": "http://www.vulture.com/2017/02/2017-oscar-winners-full-list.html?utm_source=feedburner&utm_medium=feed&utm_campaign=Feed%3A+nymag%2Fvulture+%28Vulture+-+nymag.com%27s+Entertainment+and+Culture+Blog%29", "country": "US", "domain_rank": 2191, "title": "2017 Oscar Winners: See the Full List", "performance_score": 2, "site": "vulture.com", "participants_count": 1, "title_full": "2017 Oscar Winners: See the Full List", "spam_score": 0.0, "site_type": "news", "published": "2017-02-27T03:13:00.000+02:00", "replies_count": 0, "uuid": "5f3dbb40752c2314c05ce324b8206b7ae018aee3"}, "author": "", "url": "http://www.vulture.com/2017/02/2017-oscar-winners-full-list.html", "ord_in_thread": 0, "title": "2017 Oscar Winners: See the Full List", "locations": [], "entities": {"persons": [{"name": "mahershala ali", "sentiment": "none"}, {"name": "michelle williams", "sentiment": "none"}, {"name": "natalie portman", "sentiment": "none"}, {"name": "michael shannon", "sentiment": "none"}, {"name": "john mulaney", "sentiment": "none"}, {"name": "barry jenkins", "sentiment": "none"}, {"name": "neil fingleton", "sentiment": "none"}, {"name": "jim", "sentiment": "none"}, {"name": "jackie  best makeup", "sentiment": "none"}, {"name": "bill paxton paxton", "sentiment": "none"}, {"name": "mel gibson", "sentiment": "none"}, {"name": "david harewood", "sentiment": "none"}, {"name": "ryan gosling", "sentiment": "none"}, {"name": "david edelstein", "sentiment": "none"}, {"name": "andrew garfield", "sentiment": "none"}, {"name": "viola davis", "sentiment": "none"}, {"name": "hacksaw ridge  viggo mortensen", "sentiment": "none"}, {"name": "jenkins isabelle huppert", "sentiment": "none"}, {"name": "bill paxton vulture", "sentiment": "none"}, {"name": "moonlight  nicole kidman", "sentiment": "none"}, {"name": "elle ruth negga", "sentiment": "none"}, {"name": "andy samberg", "sentiment": "none"}, {"name": "ava duvernay", "sentiment": "none"}, {"name": "casey affleck", "sentiment": "none"}, {"name": "moonlight jeff bridges", "sentiment": "none"}, {"name": "damien chazelle", "sentiment": "none"}, {"name": "kenneth lonergan", "sentiment": "none"}, {"name": "zootopia kubo", "sentiment": "none"}, {"name": "bill paxton dead", "sentiment": "none"}, {"name": "bill paxton", "sentiment": "none"}, {"name": "denis villeneuve", "sentiment": "none"}, {"name": "kubo", "sentiment": "none"}, {"name": "james cameron", "sentiment": "none"}, {"name": "joe", "sentiment": "none"}, {"name": "wapner", "sentiment": "none"}, {"name": "jackie  meryl streep", "sentiment": "none"}, {"name": "jamie will", "sentiment": "none"}, {"name": "caesar", "sentiment": "none"}, {"name": "dev patel", "sentiment": "none"}, {"name": "trump", "sentiment": "none"}, {"name": "moonlight  kenneth lonergan", "sentiment": "none"}, {"name": "james foley", "sentiment": "none"}, {"name": "nick kroll", "sentiment": "none"}, {"name": "naomie harris", "sentiment": "none"}, {"name": "keanu reeves", "sentiment": "none"}, {"name": "grieve", "sentiment": "none"}, {"name": "joseph wapner dead", "sentiment": "none"}, {"name": "jimmy kimmel", "sentiment": "none"}, {"name": "moana", "sentiment": "none"}, {"name": "emily yoshida", "sentiment": "none"}, {"name": "ron howard remembers bill paxton", "sentiment": "none"}, {"name": "claire", "sentiment": "none"}, {"name": "emma stone", "sentiment": "none"}], "locations": [{"name": "florence", "sentiment": "none"}, {"name": "america", "sentiment": "none"}, {"name": "u.s.", "sentiment": "none"}, {"name": "la la land lion  manchester", "sentiment": "none"}, {"name": "hollywood", "sentiment": "none"}, {"name": "hulu", "sentiment": "none"}, {"name": "manchester", "sentiment": "none"}], "organizations": [{"name": "lion lucas hedges", "sentiment": "none"}, {"name": "salesman land of mine tanna", "sentiment": "none"}, {"name": "chatham", "sentiment": "none"}, {"name": "chicago movie theater patrons of chicago", "sentiment": "none"}, {"name": "sea  denzel washington", "sentiment": "none"}, {"name": "people’s court", "sentiment": "none"}, {"name": "pregnancy remy ma drops nicki minaj diss track", "sentiment": "none"}, {"name": "oscar predictions for every category college", "sentiment": "none"}, {"name": "full list people’s court", "sentiment": "none"}, {"name": "miles  best cinematography la la land moonlight arrival silence lion  best", "sentiment": "none"}, {"name": "illicit telephone lobbying illicit", "sentiment": "none"}, {"name": "la la land", "sentiment": "none"}, {"name": "sea la la land hell", "sentiment": "none"}, {"name": "facebook tweet", "sentiment": "none"}, {"name": "lagerfeld issues apology bill paxton dead", "sentiment": "none"}, {"name": "la la land ’s dreamy los angeles mia", "sentiment": "none"}, {"name": "hbo nocturnal animals has two endings", "sentiment": "none"}, {"name": "netflix", "sentiment": "none"}, {"name": "amazon", "sentiment": "none"}, {"name": "secret soldiers of benghazi  best", "sentiment": "none"}, {"name": "indie spirit awards", "sentiment": "none"}, {"name": "red turtle my life", "sentiment": "none"}]}, "highlightText": "", "language": "english", "persons": [], "text": "Photo: GABRIEL BOUYS/AFP/Getty Images After slogging through awards season, we’ve finally made it to movies’ most important night, and it appears the lion’s share of awards are La La Land ’s to lose . The 2017 Oscars are live from Hollywood’s Dolby Theatre, with Jimmy Kimmel hosting. Even though a La La Land sweep is expected, questions still linger: Will local crush Mahershala Ali complete his awards-season streak? Can Hidden Figures pull out a surprise win? And just how is Kenneth Lonergan’s scowl doing? Whether you’re watching from the bar or nestled on your couch, see the full list of nominees, with winners in bold, below.\nBest Supporting Actor\nMahershala Ali, Moonlight\nJeff Bridges, Hell or High Water\nDev Patel, Lion\nLucas Hedges, Manchester by the Sea\nMichael Shannon, Nocturnal Animals \nBest Costume Design\nFlorence Foster Jenkins\nLa La Land\nFantastic Beasts and Where to Find Them\nAllied\nJackie \nBest Makeup and Hairstyling\nStar Trek Beyond\nA Man Called Ove\nSuicide Squad \nBest Documentary Feature\nO.J.: Made in America\n13th\nFire at Sea\nI Am Not Your Negro\nLife Animated \nBest Sound Editing\nHacksaw Ridge\nArrival\nDeepwater Horizon\nLa La Land\nSully \nBest Sound Mixing\nRogue One: A Star Wars Story\nHacksaw Ridge\nLa La Land\nArrival\n13 Hours: The Secret Soldiers of Benghazi \nBest Supporting Actress\nViola Davis, Fences \nMichelle Williams, Manchester by the Sea \nNaomie Harris, Moonlight \nNicole Kidman, Lion \nOctavia Spencer, Hidden Figures \nBest Foreign Language Film\nToni Erdmann\nThe Salesman\nLand of Mine\nTanna\nA Man Called Ove \nBest Animated Feature\nZootopia\nKubo and the Two Strings\nThe Red Turtle\nMy Life As a Zucchini\nMoana \nBest Animated Short\nPiper\nPearl\nBorrowed Time\nBlind Vaysha\nPear Cider and Cigarettes \nBest Production Design\nLa La Land\nFantastic Beasts and Where to Find Them\nHail, Caesar!\nArrival\nPassengers \nBest Visual Effects\nThe Jungle Book\nRogue One: A Star Wars Story\nKubo and the Two Strings\nDoctor Strange\nDeepwater Horizon \nBest Film Editing\nLa La Land\nMoonlight\nArrival\nHacksaw Ridge\nHell or High Water \nBest Short Film, Live Action\nTimecode\nSilent Nights\nLa Femme et le TGV\nEnnemis Interieurs\nSing \nBest Documentary, Short Subject\nJoe’s Violin\nThe White Helmets\nExtremis\nWatani: My Homeland\n4.1 Miles \nBest Cinematography\nLa La Land\nMoonlight\nArrival\nSilence\nLion \nBest Original Score\nLa La Land\nLion\nJackie\nMoonlight\nPassengers \nBest Original Song\n“City of Stars,” La La Land \n“Audition (The Fools Who Dream),” La La Land\n“How Far I’ll Go,” Moana\n“Can’t Stop the Feeling,” Trolls\n“The Empty Chair,” Jim: The James Foley Story \nBest Original Screenplay\nManchester by the Sea\nLa La Land\nHell or High Water\nThe Lobster\n20th Century Women \nBest Adapted Screenplay\nMoonlight\nArrival\nFences\nLion\nHidden Figures \nBest Director\nDamien Chazelle, La La Land \nBarry Jenkins, Moonlight \nKenneth Lonergan, Manchester by the Sea \nDenis Villeneuve, Arrival\nMel Gibson, Hacksaw Ridge \nBest Actor\nCasey Affleck, Manchester by the Sea \nDenzel Washington, Fences \nRyan Gosling, La La Land\nAndrew Garfield, Hacksaw Ridge \nViggo Mortensen, Captain Fantastic \nBest Actress\nEmma Stone, La La Land\nNatalie Portman, Jackie \nMeryl Streep, Florence Foster Jenkins\nIsabelle Huppert, Elle\nRuth Negga, Loving \nBest Picture\nArrival\nFences\nHacksaw Ridge\nHell or High Water\nHidden Figures\nLa La Land\nLion \nManchester by the Sea \nMoonlight \nTags: top story breaking oscars 2017 and the winner is... winners list movies 2017 Oscar Winners: See the Full List Share on Facebook Tweet this Story Top Stories 2017 Oscar Winners: See the Full List People’s Court ’s Judge Joseph Wapner Dead at 97 Australian Author Recounts Terrifying Detainment by U.S. Immigration Officers Most Viewed Stories ‘Defamed’ Meryl Streep Slams Karl Lagerfeld Over Oscars Dress Controversy; Lagerfeld Issues Apology Bill Paxton Dead at 61 Neil Fingleton, Game of Thrones ’ Mag the Mighty, Dead at 36 Natalie Portman Skipping Oscars Due to Pregnancy Remy Ma Drops Nicki Minaj Diss Track; Minaj Responds What to Stream Now See what's new and notable on Netflix, Amazon, Hulu, and HBO Nocturnal Animals Has Two Endings, and Both of Them Are Killer Nick Kroll and John Mulaney’s Hilarious Spirit Awards Monologue Confirms They Should Be Hosting the Oscars Next Year Celebrities Grieve the Death of Bill Paxton Vulture’s Final 2017 Oscar Predictions for Every Category College Champion Lives Your Wildest Intellectual Dreams by Writing Joke ‘Final Jeopardy’ Answer Most Popular Video On Vulture Keanu Reeves Is Obsessed With Doing His Own Stunts Latest News from Vulture 11 mins ago Ron Howard Remembers Bill Paxton’s “Charm” and “Admirable Joie de Vivre” Bill Paxton, actor in Apollo 13 , Aliens , and Twister , died on Sunday. He was 61.\n18 mins ago 2017 Oscar Winners: See the Full List The night is La La Land ’s to lose.\n7:31 p.m. Join Vulture’s Oscars Live Blog With Critics David Edelstein and Emily Yoshida Here’s to the ones who blog.\n6:53 p.m. See All of the 2017 Oscars Red-Carpet Looks Strike a haute couture pose.\n4:43 p.m. Chance the Rapper Giving Away a Day of Get Out Showings at Chicago Movie Theater Patrons of Chicago’s Chatham 14 are in for a terrifying treat.\n4:10 p.m. Outlander ’s Claire and Jamie Will Still Have Smokin’ Hot Sex 20 Years Later With age comes wisdom and the undiminished capacity for a very compelling sex scene.\n3:52 p.m. This Video Shows 15 of the Most Memorable Oscars Outfits of All Time Some of the Oscars’ most iconic looks.\n3:35 p.m. James Cameron Remembers Friend, Collaborator, and ‘Creative Dynamo’ Bill Paxton “I hope that amid the gaudy din of Oscar night, people will take a moment to remember this wonderful man.”\n3:11 p.m. People’s Court ’s Judge Joseph Wapner Dead at 97 Wapner was a massive figure in the rise of reality TV.\n2:51 p.m. Australian Author Recounts Terrifying Detainment by U.S. Immigration Officers “This is what happens when extremists take power.”\n1:55 p.m. Watch the 3 Color Tricks That Defined La La Land ’s Dreamy Los Angeles Mia’s yellow dress is pretty—and a pretty important plot device.\n12:45 p.m. The Good Fight Recap: Who Voted for Trump? “The Schtup List” tees up storylines for the rest of the season.\n12:34 p.m. Celebrities Grieve the Death of Bill Paxton Paxton died Saturday at the age of 61.\n11:48 a.m. Neil Fingleton, Game of Thrones ’ Mag the Mighty, Dead at 36 The 7’7” actor died of heart failure.\n11:26 a.m. Andy Samberg Breaks Out Eddie Vedder Impression to Celebrate Alive Celebs Call it a “non-memoriam” segment.\n10:45 a.m. David Harewood Doesn’t Want Doctor Who ’s Next Doctor to Be a White Man “It needs to do something different.”\n10:41 a.m. Bill Paxton Dead at 61 The actor died from complications due to surgery.\n9:56 a.m. Barry Jenkins, Ava DuVernay Mad Over Trans Rights Threats at Indie Spirit Awards “I’m pretty sure the majority of the room in that hangar is pissed off.”\n9:50 a.m. Academy Strips 13 Hours’ Sound Mixer of Nom Due to Illicit Telephone Lobbying Illicit. Telephone. Lobbying.\n9:17 a.m. Watch a Definitive Snapshot of the Past 20 Years of Costume-Design Winners All in one place.", "external_links": [], "published": "2017-02-27T03:13:00.000+02:00", "crawled": "2017-02-27T06:01:36.465+02:00", "highlightTitle": ""}