{"organizations": [], "uuid": "a3037a2d78bac6289517183e89f203935f0c197f", "thread": {"social": {"gplus": {"shares": 0}, "pinterest": {"shares": 0}, "vk": {"shares": 0}, "linkedin": {"shares": 0}, "facebook": {"likes": 154, "shares": 154, "comments": 0}, "stumbledupon": {"shares": 0}}, "site_full": "www.financialexpress.com", "main_image": "http://images.financialexpress.com/2017/02/encounter-1.jpg", "site_section": "http://www.financialexpress.com/feed/atom", "section_title": "The Financial Express", "url": "http://www.financialexpress.com/india-news/february-23-9-am-news-update-kashmir-attack-3-jawans-woman-killed-up-polls-live-updates-sp-candidates-son-3-others-injured/563169/", "country": "US", "domain_rank": 4726, "title": "February 23, 9 am news update: Kashmir attack- 3 jawans, woman killed, UP Polls Live Updates, SP Candidate’s son, 3 others injured", "performance_score": 1, "site": "financialexpress.com", "participants_count": 1, "title_full": "February 23, 9 am news update: Kashmir attack- 3 jawans, woman killed, UP Polls Live Updates, SP Candidate’s son, 3 others injured", "spam_score": 0.0, "site_type": "news", "published": "2017-02-23T11:36:00.000+02:00", "replies_count": 0, "uuid": "a3037a2d78bac6289517183e89f203935f0c197f"}, "author": "FE Online", "url": "http://www.financialexpress.com/india-news/february-23-9-am-news-update-kashmir-attack-3-jawans-woman-killed-up-polls-live-updates-sp-candidates-son-3-others-injured/563169/", "ord_in_thread": 0, "title": "February 23, 9 am news update: Kashmir attack- 3 jawans, woman killed, UP Polls Live Updates, SP Candidate’s son, 3 others injured", "locations": [], "entities": {"persons": [{"name": "sonia gandhi", "sentiment": "none"}, {"name": "siddhgopal sahu", "sentiment": "none"}, {"name": "banda", "sentiment": "none"}, {"name": "chitrakoot", "sentiment": "none"}, {"name": "kunda", "sentiment": "none"}, {"name": "jalaun", "sentiment": "none"}, {"name": "rae bareli", "sentiment": "none"}], "locations": [{"name": "kashmir", "sentiment": "none"}, {"name": "india", "sentiment": "none"}, {"name": "jhansi", "sentiment": "none"}, {"name": "fatehpur", "sentiment": "none"}, {"name": "manjhanpur", "sentiment": "none"}, {"name": "allahabad north", "sentiment": "none"}, {"name": "lalitpur", "sentiment": "none"}, {"name": "allahabad", "sentiment": "none"}, {"name": "shopian", "sentiment": "none"}, {"name": "jammu", "sentiment": "none"}, {"name": "kaushambi", "sentiment": "none"}, {"name": "pratapgarh", "sentiment": "none"}, {"name": "mahoba", "sentiment": "none"}, {"name": "hamirpur", "sentiment": "none"}, {"name": "new delhi", "sentiment": "none"}, {"name": "khaga", "sentiment": "none"}], "organizations": [{"name": "sp candidate", "sentiment": "negative"}, {"name": "congress", "sentiment": "none"}, {"name": "parliament", "sentiment": "none"}, {"name": "samajwadi party", "sentiment": "none"}, {"name": "uttar pradesh assembly", "sentiment": "none"}, {"name": "bsp", "sentiment": "none"}]}, "highlightText": "", "language": "english", "persons": [], "text": "India news February 23, 9 am news update: Kashmir attack- 3 jawans, woman killed, UP Polls Live Updates, SP Candidate’s son, 3 others injured February 23, 9 am news update: Kashmir attack- 3 jawans, woman killed, UP Polls Live Updates, SP Candidate’s son, 3 others injured Three jawans and a woman were killed after terrorists attacked a patrolling party in Shopian district of Jammu and Kashmir, according to TV reports. Four other army personnel were injured in the ambush. By: FE Online | New Delhi | Published: February 23, 2017 10:06 AM Three jawans and a woman were killed after terrorists attacked a patrolling party in Shopian district of Jammu and Kashmir. Representative image \n3 jawans, woman killed in terrorist attack on patrolling party in Jammu and Kashmir’s Shopian \nThree jawans and a woman were killed after terrorists attacked a patrolling party in Shopian district of Jammu and Kashmir, according to TV reports. Four other army personnel were injured in the ambush. The woman was killed in firing. Three of the injured personnel were stated to be critical. Security forces have cordoned off the area and search operations are on. According to a recent report, the army has lost 26 soldiers in the line of duty in Jammu and Kashmir in the first two months of 2017, while the security forces have stepped up the heat against militants, killing 22 ultras in 50 days — the highest since 2010. \nRead More \nUttar Pradesh Assembly Elections 2017 Phase 4 Polling Live Updates: Voting begins for 53 seats \nPolling for the fourth phase of seven-phased Uttar Pradesh Assembly Elections 2017 has started today. Parties are contesting today for 53 assembly constituencies spread over 12 districts including the poverty-hit Bundelkhand region and Congress party’s home turf Rae Bareli. For the first time since 1998, Congress president Sonia Gandhi couldn’t campaign for her party in the district which she also represents in the Parliament. Some other districts going to the polls in the fourth phase include Pratapgarh, Kaushambi, Allahabad, Jalaun, Jhansi, Lalitpur, Mahoba, Banda, Hamirpur, Chitrakoot and Fatehpur. There are as many as 680 candidates in the fray and their fate would be decided by 1.84 crore voters. The maximum number of 26 candidates are in Allahabad North, while only six candidates are in the fray in Khaga (Fatehpur), Manjhanpur (Kaushambi) and Kunda (Pratapgarh). \nRead More \nUP elections 2017: SP candidate’s son, 3 others injured in clash with BSP supporters \nFour persons, including Samajwadi Party candidate Siddhgopal Sahu’s son were injured after party workers and supporters of the ruling party in the state and BSP clashed during phase 4 polling for Uttar Pradesh Elections 2017, according to ANI report. Polling for the fourth phase of seven-phased Uttar Pradesh Assembly Elections 2017 has started today. Parties are contesting today for 53 assembly constituencies spread over 12 districts including the poverty-hit Bundelkhand region and Congress party’s home turf Rae Bareli.", "external_links": [], "published": "2017-02-23T11:36:00.000+02:00", "crawled": "2017-02-23T07:28:35.703+02:00", "highlightTitle": ""}