{"organizations": [], "uuid": "a361449d55564a03c3bd6de4e5832dc38c810e7f", "thread": {"social": {"gplus": {"shares": 0}, "pinterest": {"shares": 0}, "vk": {"shares": 0}, "linkedin": {"shares": 0}, "facebook": {"likes": 126, "shares": 126, "comments": 0}, "stumbledupon": {"shares": 0}}, "site_full": "www.slate.com", "main_image": "http://www.slate.com/content/dam/slate/articles/news_and_politics/the_angle/2017/01/the_immigration_fight_merrick_garland_s_supreme_court_seat_and_canceling/519568188-supreme-court-justice-nominee-merrick-garland-talks.jpg.CROP.cq5dam_web_1280_1280_jpeg.jpg", "site_section": "http://www.slate.com/articles.teaser.all.10.rss", "section_title": "Slate Articles", "url": "http://www.slate.com/articles/news_and_politics/the_angle/2017/01/the_immigration_fight_merrick_garland_s_supreme_court_seat_and_canceling.html", "country": "US", "domain_rank": 628, "title": "The Angle: When Does This Become a Constitutional Crisis? Edition", "performance_score": 1, "site": "slate.com", "participants_count": 1, "title_full": "The Angle: When Does This Become a Constitutional Crisis? Edition", "spam_score": 0.0, "site_type": "news", "published": "2017-02-01T06:13:00.000+02:00", "replies_count": 0, "uuid": "a361449d55564a03c3bd6de4e5832dc38c810e7f"}, "author": "L.V. Anderson", "url": "http://www.slate.com/articles/news_and_politics/the_angle/2017/01/the_immigration_fight_merrick_garland_s_supreme_court_seat_and_canceling.html", "ord_in_thread": 0, "title": "The Angle: When Does This Become a Constitutional Crisis? Edition", "locations": [], "entities": {"persons": [{"name": "frankenstein", "sentiment": "none"}, {"name": "mary shelley", "sentiment": "none"}, {"name": "trump", "sentiment": "none"}, {"name": "johnsen", "sentiment": "none"}, {"name": "l.v. anderson  l.v. anderson", "sentiment": "none"}, {"name": "leon neyfakh", "sentiment": "none"}, {"name": "dessem", "sentiment": "none"}, {"name": "merrick garland", "sentiment": "none"}, {"name": "salam", "sentiment": "none"}, {"name": "obama", "sentiment": "none"}, {"name": "dawn johnsen", "sentiment": "none"}, {"name": "dahlia lithwick", "sentiment": "none"}, {"name": "matthew dessem", "sentiment": "none"}, {"name": "mark joseph stern", "sentiment": "none"}, {"name": "reihan salam", "sentiment": "none"}], "locations": [{"name": "washington", "sentiment": "none"}, {"name": "hollywood", "sentiment": "none"}, {"name": "d.c.", "sentiment": "none"}], "organizations": [{"name": "senate", "sentiment": "none"}, {"name": "lva", "sentiment": "none"}, {"name": "trump", "sentiment": "none"}, {"name": "justice department", "sentiment": "none"}, {"name": "trump’s supreme court", "sentiment": "none"}, {"name": "white house", "sentiment": "none"}, {"name": "department of homeland security", "sentiment": "none"}, {"name": "hart senate office building on capitol hill", "sentiment": "none"}, {"name": "supreme court", "sentiment": "none"}]}, "highlightText": "", "language": "english", "persons": [], "text": "Sharp takes on big stories. Jan. 31 2017 6:13 PM The Angle: When Does This Become a Constitutional Crisis? Edition Slate ’s daily newsletter on the fight over immigration, Merrick Garland’s Supreme Court seat, and canceling the Oscars. Merrick Garland meets with senators in the Hart Senate Office Building on Capitol Hill on April 7, 2016, in Washington, D.C. Chip Somodevilla/Getty Images \nYou think this is a constitutional crisis? Federal judges have ordered the Department of Homeland Security to stop enforcing various aspects of Trump’s travel ban. But what if it refuses? Dahlia Lithwick, Leon Neyfakh, and Mark Joseph Stern walk through the possible outcomes if Trump refuses a federal court order . L.V. Anderson \nL.V. Anderson is a Slate associate editor. \nWinning the battle, losing the war: Trump’s executive order looks like a major blow against immigrant rights—but Reihan Salam thinks the White House’s battle against immigrants is “ a fight [it] won’t be able to win .” According to Salam, the coalition of groups that oppose immigration are far less united than the coalition of groups that favor immigration. Advertisement \nThat seat belongs to Merrick Garland: Dawn Johnsen urges Senate Democrats to filibuster Trump’s Supreme Court nominee until Trump appoints Merrick Garland , whom Senate Republicans refused to consider when Obama nominated him. Johnsen knows a little something about stalled nominations: Her nomination by Obama for a Justice Department role was also stalled by Senate Republicans. \nDon’t cancel the Oscars: If Hollywood wants to make a statement about Trump’s travel ban, it shouldn’t call off the Academy Awards , argues Matthew Dessem. After all, “You can’t hurt a rabbit by throwing him into the briar patch where he was born and raised, and you can’t hurt Trump’s most vocal supporters by canceling a cultural event, no matter how gauche.” Dessem has a better idea for drawing attention to the plight of refugees. \nFor fun: How much do you know about the legacy of Mary Shelley’s Frankenstein ? Take this quiz to find out. \nThat seat belongs to me, LVA", "external_links": [], "published": "2017-02-01T06:13:00.000+02:00", "crawled": "2017-02-01T01:34:31.056+02:00", "highlightTitle": ""}