{"organizations": [], "uuid": "3a14a31499a33e2bf9c34d53fb94f4b9113e1c4a", "thread": {"social": {"gplus": {"shares": 0}, "pinterest": {"shares": 0}, "vk": {"shares": 0}, "linkedin": {"shares": 0}, "facebook": {"likes": 126, "shares": 126, "comments": 0}, "stumbledupon": {"shares": 0}}, "site_full": "www.telegraph.co.uk", "main_image": "http://www.telegraph.co.uk/content/dam/news/2017/02/14/trump-xlarge_trans_NvBQzQNjv4BqCBO9P00YZE308Tg8w1vIMz2EnqS1kQuNoLjTVrXQV1U.png", "site_section": "http://www.telegraph.co.uk/rss.xml", "section_title": "www.telegraph.co.uk for the latest news from the UK and around the world.", "url": "http://www.telegraph.co.uk/news/2017/02/14/inside-winter-white-house-exclusive-holiday-snaps-donald-melania/", "country": "GB", "domain_rank": 317, "title": "Inside the Winter White House: Exclusive holiday snaps with Donald and Melania Trump are now the ultimate status symbol for wealthy Americans", "performance_score": 1, "site": "telegraph.co.uk", "participants_count": 1, "title_full": "Inside the Winter White House: Exclusive holiday snaps with Donald and Melania Trump are now the ultimate status symbol for wealthy Americans", "spam_score": 0.0, "site_type": "news", "published": "2017-02-14T18:13:00.000+02:00", "replies_count": 0, "uuid": "3a14a31499a33e2bf9c34d53fb94f4b9113e1c4a"}, "author": "Helena Horton", "url": "http://www.telegraph.co.uk/news/2017/02/14/inside-winter-white-house-exclusive-holiday-snaps-donald-melania/", "ord_in_thread": 0, "title": "Inside the Winter White House: Exclusive holiday snaps with Donald and Melania Trump are now the ultimate status symbol for wealthy Americans", "locations": [], "entities": {"persons": [{"name": "melania trump", "sentiment": "negative"}, {"name": "donald", "sentiment": "negative"}, {"name": "richard deagazio", "sentiment": "none"}, {"name": "putin", "sentiment": "none"}, {"name": "trump", "sentiment": "none"}, {"name": "donald trump", "sentiment": "none"}, {"name": "amy", "sentiment": "none"}, {"name": "chelsea clinton", "sentiment": "none"}, {"name": "helena horton", "sentiment": "none"}, {"name": "john reed", "sentiment": "none"}, {"name": "abe", "sentiment": "none"}, {"name": "george w bush", "sentiment": "none"}, {"name": "abigail", "sentiment": "none"}, {"name": "mark simone", "sentiment": "none"}, {"name": "chase thomas", "sentiment": "none"}, {"name": "eric trump", "sentiment": "none"}, {"name": "team trump", "sentiment": "none"}, {"name": "bauman", "sentiment": "none"}], "locations": [{"name": "winter white house", "sentiment": "none"}, {"name": "texas", "sentiment": "none"}, {"name": "north korea", "sentiment": "none"}, {"name": "crawford", "sentiment": "none"}, {"name": "washington d.c", "sentiment": "none"}, {"name": "japan", "sentiment": "none"}], "organizations": [{"name": "winter white house", "sentiment": "negative"}, {"name": "new york time", "sentiment": "none"}, {"name": "facebook  r", "sentiment": "none"}, {"name": "mar-a-lago", "sentiment": "none"}, {"name": "abbey", "sentiment": "none"}, {"name": "cnn", "sentiment": "none"}, {"name": "facebook", "sentiment": "none"}]}, "highlightText": "", "language": "english", "persons": [], "text": "Inside the Winter White House: Exclusive holiday snaps with Donald and Melania Trump are now the ultimate status symbol for wealthy Americans A holiday in the 'heart of Government' is now the ultimate status symbol Credit: Instagram/johnclayreed Helena Horton  13am \nU S citizens with the means to pay now have the chance of unprecedented access to the First Couple. For a price, members of the exclusive Mar-a-Lago club, now known as the 'Winter White House' might find themselves sitting across from Melania Trump at breakfast, taking a sun-soaked selfie with the President at Happy Hour and some guests have even witnessed him at work as he took part in a security briefing over dinner on the patio. \nFrom the recent social media posts of members, it appears taking a holiday in the 'heart of Government' is now the ultimate status symbol, as they tag their pictures #WinterWhiteHouse and try to get a selfie with members of the First Family. \nMembership of the exclusive club - which reportedly has a hefty initiation fee of $200,000 - has the bonus of a sighting and perhaps even a selfie with the First Family, as President Trump has been there two out of the three weekends he has been in office. Security briefings as dinnertime entertainment Security briefings are now dinnertime entertainment Credit: Facebook \nR elaxed holidaymakers have uploaded images of Donald Trump and his security team having a briefing, almost as if it were dinner entertainment. \nRichard DeAgazio wrote on Facebook: \"Holy Moly! It was fascinating to watch the flurry of activity at dinner when the news came that North Korea had launched a missile in the direction of Japan. \n\"The Prime Minister Abe of Japan huddles with his staff and the President is on the phone with Washington D.C. The two world leaders conferred and then went into another room for a hastily arranged press conference. \n\"Wow...The center of the action!\" Breakfast with the First Lady Feb 11, 2017 at 1:35pm PST \nV isitors breakfasting at the exclusive club can have a full view of members of the First Family. \nPictured is Melania Trump, in the post proudly displayed on Instagram. Selfies with Donald Trump \nIt appears the President is happy to take pictures with his paying guests. \nAppearing to play 'spot the President', members of the club are seen posing with him at a wedding and during Happy Hour on the golf course. A post shared by John Reed (@johnclayreed) on Feb 12, 2017 at 6:24pm PST A post shared by valeriemarion (@valeriemarion) on Feb 12, 2017 at 9:51am PST \nO ne holidaymaker wrote: \"Sharing this fairytale with my girlfriends!!\" and informed her followers she was having a post-golf Happy Hour 'pre-game' with the President. Watch | Trump appears to crash wedding after North Korea missile statement 00:52 Partying with the President \nA fter a sun-soaked day on the golf course or by the pool, guests don their finery and go to one of many of the galas and balls held at the club. \nPresident Trump hasn't let his busy schedule as a world leader stop him from attending multiple events at Mar-a-Lago. \nGuests are pictured below proudly spotting the First Couple, and some even managed to get a selfie with them. A post shared by Amy (@amypnyc) on Feb 11, 2017 at 9:49pm PST A post shared by Chase Thomas (@1chaseyourdreams) on Feb 5, 2017 at 11:16am PST A post shared by Mark Simone (@marksimoneny) on Feb 5, 2017 at 5:47pm PST A post shared by Abigail (Abbey) Bauman (@abbeybauman22) on Feb 6, 2017 at 8:39pm PST The access to the First Family has caused criticism \nC ritics have pointed to the national security threat posed by the easy access many have to the President and First Lady. \nChelsea Clinton asked: \"How many of Mar-a-Lago’s new members will be (already are?) members of foreign intelligence agencies and media organisations?\" \nCNN and the Guardian have both raised concerns about the fact the President entertained the Japanese Prime Minister at the club. \nHowever, Team Trump has dismissed all talk of threats to national security. \nIn an interview with the New York Time s, Eric Trump compared it to George W Bush’s use of his Crawford, Texas ranch, and added that the use of the club to entertain foreign leaders could be an asset for the country. \nHe said: “If he could do that with Putin ... and he can make them friends and they can have trust in one another, he just did something that not many presidents have been able to do.”", "external_links": [], "published": "2017-02-14T18:13:00.000+02:00", "crawled": "2017-02-14T13:19:27.538+02:00", "highlightTitle": ""}