{"organizations": [], "uuid": "1ffa25ed32f48e0a410ecc172fcbaf36488e7b90", "thread": {"social": {"gplus": {"shares": 0}, "pinterest": {"shares": 0}, "vk": {"shares": 0}, "linkedin": {"shares": 0}, "facebook": {"likes": 997, "shares": 997, "comments": 0}, "stumbledupon": {"shares": 0}}, "site_full": "au.news.yahoo.com", "main_image": "https://s.yimg.com/iu/api/res/1.2/_K0Vp4dSeJotOQ1qxgWpxw--/YXBwaWQ9eXZpZGVvO3c9NjMxO2g9MzU0O2R4PTE7ZHk9MTtjdz05Nzc7Y2g9NTQ4O3E9NzA7bj0xO3VsY3JvcDtyb3RhdGU9YXV0bw--/https://s.yimg.com/ea/img/-/170206/5897e2bf5d370_832in_jail.jpg", "site_section": "", "section_title": "", "url": "https://au.news.yahoo.com/vic/a/34350780/new-288m-youth-prison-for-melbourne/", "country": "US", "domain_rank": 5, "title": "New $288m youth prison for Melbourne - Yahoo7", "performance_score": 9, "site": "yahoo.com", "participants_count": 0, "title_full": "New $288m youth prison for Melbourne - Yahoo7", "spam_score": 0.706, "site_type": "news", "published": "2017-02-06T12:23:00.000+02:00", "replies_count": 0, "uuid": "1ffa25ed32f48e0a410ecc172fcbaf36488e7b90"}, "author": "Yahoo", "url": "https://au.news.yahoo.com/vic/a/34350780/new-288m-youth-prison-for-melbourne/", "ord_in_thread": 0, "title": "New $288m youth prison for Melbourne - Yahoo7", "locations": [], "entities": {"persons": [{"name": "mikakos", "sentiment": "none"}, {"name": "comrie", "sentiment": "none"}, {"name": "jenny mikakos", "sentiment": "none"}, {"name": "neil comrie", "sentiment": "none"}, {"name": "andrews", "sentiment": "none"}, {"name": "daniel andrews", "sentiment": "none"}, {"name": "malmsbury", "sentiment": "none"}], "locations": [{"name": "melbourne", "sentiment": "none"}, {"name": "barwon prison", "sentiment": "none"}, {"name": "parkville", "sentiment": "none"}, {"name": "werribee south", "sentiment": "none"}, {"name": "hoppers lane", "sentiment": "none"}, {"name": "malmsbury detention centre", "sentiment": "none"}], "organizations": [{"name": "department of health and human services", "sentiment": "none"}, {"name": "victoria police", "sentiment": "none"}, {"name": "department of justice", "sentiment": "none"}]}, "highlightText": "", "language": "english", "persons": [], "text": "Share New $288m youth prison for Melbourne - Yahoo7 A new $288 million high-security juvenile prison will be built and Melbourne's Parkville centre will be shut down after a series of riots sparked a crisis in the Barwon Prison sector. Close 'Significant changes' to youth justice needed: VIC Premier UP NEXT VIDEO The Victorian Government has vowed to make sweeping changes to the states youth justice system after a major breakout at a detention centre. Source: 7 News 'Significant changes' to youth justice needed: VIC Premier \nUnder a massive shake-up of youth justice, responsibility will be taken off the Department of Health and Human Services in April. \nRepeated riots in Parkville and Malmsbury, and a mass break-out late last month, threw the system into crisis. Youths on the Malmsbury Detention Centre roof. Source: 7 News \nRiots in Parkville in November rendered residential units in Parkville uninhabitable and detainees were moved to the adult, maximum security Barwon Prison. \nThe new Werribee South facility will include 224 beds for remand and sentenced offenders, a 12-bed mental health unit and an intensive supervision unit of at least eight beds, Premier Daniel Andrews announced to media on Monday morning. Victorian Premier Daniel Andrews announced the new high-security juvenile prison would be built in Melbourne’s outer west. Picture: 7 News \nThere is also scope for further expansion within the 31-hectare government-owned site, in Hoppers Lane, close to the freeway. \nA six-metre-high reinforced concrete wall will surround the facility, with all entries protected by mechanical and electrical anti-vehicle ramming systems. Fifteen thugs leave trail of destruction after escape \nAdministration of youth justice will move out of the Department of Health and Human Services and into the Department of Justice, with 650 staff to transition from April 3, he said. \nThe facility will be built with a significant buffer from residential areas, as the Premier emphasised public safety was priority. \n\"We're replacing outdated infrastructure and taking action to deal with the changing nature of young offenders. \n\"These reforms are what's needed to help keep the community safe and ensure the security of our youth justice facilities.\" \nAbout 2000 to 3000 jobs are expected to be created to build the prison, with construction to commence next year. The facility will be built with a significant buffer from residential areas. Picture: Artist impression/Victoria Government \nThe Parkville facility will close upon completion in 2020. \nHe expected the prison should not impact Werribee South's property prices, given Parkville real estate remained strong despite the existing facility. \nDespite the administrative move to Department of Justice, Jenny Mikakos would remain Minister for Youth Justice, Mr Andrews confirmed. \n“The previous Liberal Government put these reforms in the too hard basket and ignored Ombudsman reports calling for a new youth justice facility,” Mikakos said. \n\"We are getting on with building a fit-for-purpose, high-security facility that is more secure and will address capacity issues for years to come.\" The new Werribee South facility will include 224 beds for remand and sentenced offenders, a 12-bed mental health unit and an intensive supervision unit. Picture: Artist impression/Victoria Government \nA report by former Victoria Police Commissioner Neil Comrie into riots at Parkville last November, completed in January, found the facility had \"inherent safety and security issues\" and was \"not adequate for its intended purpose\". \nMr Andrews said the Comrie report was \"damning\". \n\"We cannot continue with the Parkville arrangement as it is structured now,\" he said. ", "external_links": [], "published": "2017-02-06T12:23:00.000+02:00", "crawled": "2017-02-06T07:24:31.935+02:00", "highlightTitle": ""}