{"organizations": [], "uuid": "f769f0484558f1c37bf9d078fbe5f80e83b77095", "thread": {"social": {"gplus": {"shares": 0}, "pinterest": {"shares": 0}, "vk": {"shares": 0}, "linkedin": {"shares": 0}, "facebook": {"likes": 261, "shares": 261, "comments": 0}, "stumbledupon": {"shares": 0}}, "site_full": "www.thesun.co.uk", "main_image": "https://www.thesun.co.uk/wp-content/uploads/2017/02/dd-composite-k-matthews.jpg?strip=all&#038;w=750&#038;h=500&#038;crop=1", "site_section": "https://www.thesun.co.uk/feed", "section_title": "The Sun", "url": "https://www.thesun.co.uk/news/2858767/mum-karen-matthews-abroad-start-new-life-spain/", "country": "GB", "domain_rank": 2180, "title": "Disgraced mum Karen Matthews plans to escape limelight by fleeing abroad to start a new life in SPAIN", "performance_score": 2, "site": "thesun.co.uk", "participants_count": 1, "title_full": "Disgraced mum Karen Matthews plans to escape limelight by fleeing abroad to start a new life in SPAIN", "spam_score": 0.0, "site_type": "news", "published": "2017-02-14T14:42:00.000+02:00", "replies_count": 0, "uuid": "f769f0484558f1c37bf9d078fbe5f80e83b77095"}, "author": "lfruen", "url": "https://www.thesun.co.uk/news/2858767/mum-karen-matthews-abroad-start-new-life-spain/", "ord_in_thread": 0, "title": "Disgraced mum Karen Matthews plans to escape limelight by fleeing abroad to start a new life in SPAIN", "locations": [], "entities": {"persons": [{"name": "karen matthews", "sentiment": "negative"}, {"name": "julie bushby", "sentiment": "none"}, {"name": "sheridan smith", "sentiment": "none"}, {"name": "shannon  she", "sentiment": "none"}, {"name": "karen", "sentiment": "none"}, {"name": "matthews", "sentiment": "none"}, {"name": "shannon matthews", "sentiment": "none"}, {"name": "shannon", "sentiment": "none"}, {"name": "michael donovan", "sentiment": "none"}], "locations": [{"name": "spain", "sentiment": "none"}, {"name": "britain", "sentiment": "none"}, {"name": "spain", "sentiment": "none"}, {"name": "england", "sentiment": "none"}, {"name": "uk", "sentiment": "none"}, {"name": "costa blanca", "sentiment": "none"}], "organizations": [{"name": "bbc", "sentiment": "none"}, {"name": "press association", "sentiment": "none"}, {"name": "news group newspapers ltd", "sentiment": "none"}, {"name": "news group newspapers ltd karen", "sentiment": "none"}, {"name": "facebook", "sentiment": "none"}]}, "highlightText": "", "language": "english", "persons": [], "text": "Opinion RUNNING FROM HER PAST Disgraced mum Karen Matthews plans to escape limelight by fleeing abroad to start a new life in SPAIN \nDespised mum-of-seven Matthews is looking for a move after being abused in the street Exclusive Click to share on Facebook (Opens in new window) Comments KAREN Matthews has applied for a passport after telling a pal she’s planning to flee Britain for a new life in Spain. \nThe kidnapper had wanted to go live in Spain after being released from prison in 2012 but was barred by probation bosses. News Group Newspapers Ltd Karen Matthews was jailed for eight years for her part in faking the kidnap of her daughter, Shannon in 2008 News Group Newspapers Ltd 5 Disgraced Karen now wants to flee to Spain following abuse for her role in the kidnap of her daughter Shannon \nShe was still on licence for four years following her being freed half-way through her eight-year jail term. \nThat licence has now expired and she’s free to travel abroad and last night a friend revealed she was looking at start again in the sun. \nThe source revealed: “She knows she can never avoid her past and with this new drama programme on the telly she’s realised that living abroad might be a better option for her.” related stories MONSTER'S MATE Julie Bushby led the search for Karen Matthews' missing daughter - but the truth left her horrified A COLD CASE Here's everything you need to know about episode two of Shannon Matthews drama, The Moorside SHANNON BOOK DEAL 'Kidnapped' Shannon Matthews offered tell-all book deal to heap more shame on mum Karen ROTTEN TO THE CORE Karen Matthews in constant pain from 'black decaying' teeth after choc and sweets diet while in jail for kidnap of daughter Shannon 'CONSPIRACY OF SILENCE' Karen Matthews' pal insists evil mum wasn't 'smart enough' to mastermind kidnap plot \nThe source added: “She can probably get a job out there and enjoy a better life than always looking over her shoulder. She’s applied for a passport now and that’s the first step towards leaving the UK for good.” \nThe show, starring Sheridan Smith as Matthews’ duped pal Julie Bushby, is on BBC tonight. PA:Press Association 5 Shannon Matthews was found tethered and drugged inside the base of a double bed at relative Michael Donovan’s grotty flat almost a month after she disappeared \nThe mum-of-seven held talks with probation officers about spending six months of the year on the coast on the Costa Blanca following her release but they banned the plan. \nThe source added: “She argued that she could live there out-of-season when there wouldn’t be so many Brits about. She said she could get a cleaning job and a small flat to rent and would feel far safer than in some town in England. \n“She said there are lots of holiday complexes out there where people own second homes and apartments and so there would be a ready supply of cleaning jobs. \n“This is what she is now looking at trying to put in place again.” News Group Newspapers Ltd Karen – who made public appeals to find Shannon during her ‘disappearance’– wanted to go live in Spain after being released from prison in 2012 Sky News", "external_links": [], "published": "2017-02-14T14:42:00.000+02:00", "crawled": "2017-02-14T09:50:01.125+02:00", "highlightTitle": ""}