{"organizations": [], "uuid": "1ab770cb382b3b2f878e223d939f1ee3ad507fae", "thread": {"social": {"gplus": {"shares": 1}, "pinterest": {"shares": 0}, "vk": {"shares": 0}, "linkedin": {"shares": 0}, "facebook": {"likes": 152, "shares": 152, "comments": 0}, "stumbledupon": {"shares": 0}}, "site_full": "www.smh.com.au", "main_image": "http://www.smh.com.au/content/dam/images/g/u/l/5/s/u/image.related.articleLeadwide.620x349.gul5sl.png/1487991877785.png", "site_section": "http://www.smh.com.au/rssheadlines/soccer/article/rss.xml#", "section_title": "Sydney Morning Herald RSS News Headlines", "url": "http://www.smh.com.au/environment/animals/drone-footage-captures-great-white-shark-stalking-unsuspecting-surfers-20170225-gul5sl.html", "country": "AU", "domain_rank": 1534, "title": "Drone footage captures great white shark stalking unsuspecting surfers", "performance_score": 1, "site": "smh.com.au", "participants_count": 1, "title_full": "Drone footage captures great white shark stalking unsuspecting surfers", "spam_score": 0.0, "site_type": "news", "published": "2017-02-25T10:04:00.000+02:00", "replies_count": 0, "uuid": "1ab770cb382b3b2f878e223d939f1ee3ad507fae"}, "author": "Han Nguyen", "url": "http://www.smh.com.au/environment/animals/drone-footage-captures-great-white-shark-stalking-unsuspecting-surfers-20170225-gul5sl.html", "ord_in_thread": 0, "title": "Drone footage captures great white shark stalking unsuspecting surfers", "locations": [], "entities": {"persons": [{"name": "john faulkner", "sentiment": "none"}, {"name": "lachlan harris", "sentiment": "none"}, {"name": "gordon wood", "sentiment": "none"}, {"name": "dashcam", "sentiment": "none"}, {"name": "paul barry", "sentiment": "none"}, {"name": "di westaway", "sentiment": "none"}], "locations": [{"name": "chatswood woman", "sentiment": "none"}, {"name": "blue mountains", "sentiment": "none"}, {"name": "bankstown", "sentiment": "none"}, {"name": "chatswood  police", "sentiment": "none"}, {"name": "hamilton", "sentiment": "none"}, {"name": "bondi", "sentiment": "none"}, {"name": "lighthouse beach", "sentiment": "none"}, {"name": "coastrek", "sentiment": "none"}, {"name": "ballina", "sentiment": "none"}, {"name": "sydney", "sentiment": "none"}, {"name": "bankstown airport", "sentiment": "none"}], "organizations": [{"name": "nsw department of primary industry", "sentiment": "none"}, {"name": "rsl", "sentiment": "none"}, {"name": "newcastle herald", "sentiment": "none"}, {"name": "nsw government", "sentiment": "none"}, {"name": "katoomba rsl", "sentiment": "none"}]}, "highlightText": "", "language": "english", "persons": [], "text": "Drone footage captures great white shark stalking unsuspecting surfers Han Nguyen twitter TWEET More \nA NSW Government drone has captured the moment a great white shark stalks unsuspecting surfers at Lighthouse Beach, Ballina, in the state's north. \nThe footage was shot by the NSW Department of Primary Industry over summer as part of the government's $16 million shark management strategy. The Bondi to Manly walk Play Video NSW Government's $16m shark strategy NSW Government's $16m shark strategy \nShark detecting drones are being trialled on beaches in NSW to combat shark attacks along the state's coast. Vision courtesy NSW DPI. Up Next The Bondi to Manly walk Play Video The Bondi to Manly walk The Bondi to Manly walk \nJohn Faulkner, former defence minister; Di Westaway, founder of Coastrek; and Lachlan Harris, co-founder/CEO of One Big Switch, are looking to establish the Bondi to Manly harbour walk. Up Next Dashcam video: police officer found not guilty of assault Play Video Dashcam video: police officer found not ... Dashcam video: police officer found not guilty of assault \nDashcam video shows a police officer kicking, punching and stomping on a man after he was involved in a high-speed crash during a pursuit through Hamilton in January 2016. Vision first appeared on the the Newcastle Herald . Up Next The resurfaced Gordon Wood interview Play Video The resurfaced Gordon Wood interview The resurfaced Gordon Wood interview \nAlmost 20 years after it first aired, a court has been shown a television interview in which Gordon Wood asks Paul Barry, 'So, do you think I did it?'. Vision: Seven Network Up Next Plane crash at Bankstown airport Play Video Plane crash at Bankstown airport Plane crash at Bankstown airport \nFire crews are on scene as an ex-military jet has made a crash landing on a runway at Bankstown Airport. Vision: Seven News Up Next Katoomba RSL gutted by fire Play Video Katoomba RSL gutted by fire Katoomba RSL gutted by fire \nA popular RSL club in the Blue Mountains has been gutted by fire on Friday afternoon. Vision: Seven News. Up Next Woman struck by car in Chatswood Play Video Woman struck by car in Chatswood Woman struck by car in Chatswood \nPolice continue to make inquiries after a woman was hit by a car on Sydney's North Shore on Friday morning. More videos NSW Government's $16m shark strategy \nShark detecting drones are being trialled on beaches in NSW to combat shark attacks along the state's coast. Vision courtesy NSW DPI. \nIt shows a great white swimming in open water before moving closer to two surfers who are unaware of the predator. \nOne surfer catches a wave and speeds away from the shark. The shark then moves its attention to the second surfer, who is dangling his legs in the water before suddenly swimming away. SHARE", "external_links": [], "published": "2017-02-25T10:04:00.000+02:00", "crawled": "2017-02-25T05:32:17.317+02:00", "highlightTitle": ""}