{"organizations": [], "uuid": "18d8224668e141b0d03990f344de576a62771238", "thread": {"social": {"gplus": {"shares": 0}, "pinterest": {"shares": 0}, "vk": {"shares": 0}, "linkedin": {"shares": 1}, "facebook": {"likes": 291, "shares": 291, "comments": 0}, "stumbledupon": {"shares": 0}}, "site_full": "www.nbcnews.com", "main_image": "http://media4.s-nbcnews.com/j/newscms/2017_07/1901651/170214-kim-jong-nam-cr-0927_03_e4330eabf215eef7a9b0b195bb47b77c.nbcnews-fp-1200-800.jpg", "site_section": "", "section_title": "", "url": "http://www.nbcnews.com/news/north-korea/kim-jong-un-s-half-brother-killed-myanmar-woman-detained-n721096", "country": "US", "domain_rank": 478, "title": "Kim Jong Un's Half-Brother Killed, Myanmar Woman Detained: Report - NBC News", "performance_score": 2, "site": "nbcnews.com", "participants_count": 0, "title_full": "Kim Jong Un's Half-Brother Killed, Myanmar Woman Detained: Report - NBC News", "spam_score": 0.17, "site_type": "news", "published": "2017-02-15T17:35:00.000+02:00", "replies_count": 0, "uuid": "18d8224668e141b0d03990f344de576a62771238"}, "author": "Alexander Smith", "url": "http://www.nbcnews.com/news/north-korea/kim-jong-un-s-half-brother-killed-myanmar-woman-detained-n721096", "ord_in_thread": 0, "title": "Kim Jong Un's Half-Brother Killed, Myanmar Woman Detained: Report - NBC News", "locations": [], "entities": {"persons": [{"name": "kim jong un", "sentiment": "negative"}, {"name": "toshifumi kitamura", "sentiment": "none"}, {"name": "donald trump", "sentiment": "none"}, {"name": "kim byung kee", "sentiment": "none"}, {"name": "kim", "sentiment": "none"}, {"name": "kim chol", "sentiment": "none"}, {"name": "kim jong nam", "sentiment": "none"}, {"name": "alexander smith", "sentiment": "none"}], "locations": [{"name": "myanmar", "sentiment": "none"}, {"name": "malaysia", "sentiment": "none"}, {"name": "narita", "sentiment": "none"}, {"name": "macau", "sentiment": "none"}, {"name": "tokyo", "sentiment": "none"}, {"name": "north korea", "sentiment": "none"}, {"name": "tokyo disneyland", "sentiment": "none"}, {"name": "japan", "sentiment": "none"}, {"name": "kuala lumpur", "sentiment": "none"}, {"name": "south korea", "sentiment": "none"}], "organizations": [{"name": "bernama", "sentiment": "none"}, {"name": "national intelligence service", "sentiment": "none"}, {"name": "getty images  nis", "sentiment": "none"}]}, "highlightText": "", "language": "english", "persons": [], "text": "Kim Jong Un's Half-Brother Killed in Malaysia 1:26 autoplay autoplay Copy this code to your website or blog <iframe src=\"http://www.nbcnews.com/widget/video-embed/877318723771\" width=\"560\" height=\"315\" frameborder=\"0\" allowfullscreen></iframe> \nA woman from Myanmar was detained Wednesday in connection with the suspected killing of North Korean leader Kim Jong Un's half-brother, Malaysian state media reported. \nThe Bernama news agency didn't provide any more information about the arrest, which came a day after Kim Jong Nam reportedly died after falling ill at Kuala Lumpur's airport. \nMalaysian police identified the dead man only as 46-year-old Kim Chol, based on the documents he was carrying when he died. \nLawmakers from South Korea, bitter enemy of the North, said that their intelligence agencies believe this was a false alias and that the man was in fact the half-brother of North Korea's dictator. \nSouth Korea's National Intelligence Service (NIS) said Kim Jong Nam has been under a \"kill order\" since his half-brother took power in 2011, according to opposition politician Kim Byung Kee. Kim Jong Nam at Tokyo's Narita airport in 2001. Toshifumi Kitamura / AFP - Getty Images \nNIS officials believe two women approached Kim and poisoned him as he was waiting in line for a flight to Macau, according to the lawmaker, although he added they were waiting for the autopsy report. \nThe man who is thought to be Kim Jong Un's sibling fell ill and died en route to the hospital. \nTwo women fled the scene in a taxi, South Korean officials said, although it was not immediately clear whether either of them was the women who was reportedly arrested Wednesday. \nBelieved to be aged in his 40s, Kim Jong Nam is believed to have fallen out of favor with the regime in 2001 after he was caught trying to enter Japan under a fake passport, saying he wanted to enter Tokyo Disneyland. \nHis reported death comes days after North Korea declared its first missile test since the inauguration of President Donald Trump. \nEarlier this month, South Korea said its secretive northern neighbor dismissed its minister of state security , who was a key aide to Kim Jong Un and ran the country's secret police. Alexander Smith ", "external_links": [], "published": "2017-02-15T17:35:00.000+02:00", "crawled": "2017-02-15T12:35:32.687+02:00", "highlightTitle": ""}