{"organizations": [], "uuid": "c35b947f643be7b46919d3f4692b61e668cc4ce4", "thread": {"social": {"gplus": {"shares": 2}, "pinterest": {"shares": 0}, "vk": {"shares": 0}, "linkedin": {"shares": 285}, "facebook": {"likes": 101, "shares": 101, "comments": 0}, "stumbledupon": {"shares": 0}}, "site_full": "news.cognizant.com", "main_image": "http://mma.prnewswire.com/media/337585/cognizant_logo.jpg", "site_section": "http://news.cognizant.com/pressreleases?pagetemplate=rss", "section_title": "Cognizant Press Releases, Company News | Cognizant Technology Solutions", "url": "http://news.cognizant.com/2017-02-14-Cognizant-Named-a-Leader-in-Gartner-Magic-Quadrant-for-Managed-Workplace-Services-in-North-America", "country": "IN", "domain_rank": 7175, "title": "Cognizant Named a Leader in Gartner Magic Quadrant for Managed Workplace Services in North America", "performance_score": 1, "site": "cognizant.com", "participants_count": 0, "title_full": "Cognizant Named a Leader in Gartner Magic Quadrant for Managed Workplace Services in North America", "spam_score": 0.0, "site_type": "news", "published": "2017-02-14T18:00:00.000+02:00", "replies_count": 0, "uuid": "c35b947f643be7b46919d3f4692b61e668cc4ce4"}, "author": "", "url": "http://news.cognizant.com/2017-02-14-Cognizant-Named-a-Leader-in-Gartner-Magic-Quadrant-for-Managed-Workplace-Services-in-North-America", "ord_in_thread": 0, "title": "Cognizant Named a Leader in Gartner Magic Quadrant for Managed Workplace Services in North America", "locations": [], "entities": {"persons": [{"name": "daniel barros", "sentiment": "none"}, {"name": "karen a. hobert", "sentiment": "none"}, {"name": "jodi sorensen", "sentiment": "none"}, {"name": "kabra", "sentiment": "none"}, {"name": "venu lambu", "sentiment": "none"}, {"name": "grazia valentino-boschi", "sentiment": "none"}, {"name": "helen huntley", "sentiment": "none"}], "locations": [{"name": "north america", "sentiment": "none"}, {"name": "u.s.", "sentiment": "none"}, {"name": "europe", "sentiment": "none"}, {"name": "teaneck", "sentiment": "none"}, {"name": "n.j.", "sentiment": "none"}], "organizations": [{"name": "gartner magic quadrant for managed workplace services", "sentiment": "negative"}, {"name": "magic quadrant for managed workplace services", "sentiment": "none"}, {"name": "gartner", "sentiment": "none"}, {"name": "cognizant infrastructure services", "sentiment": "none"}, {"name": "magic quadrant for managed workplace services north america", "sentiment": "none"}, {"name": "gartner disclaimer gartner", "sentiment": "none"}]}, "highlightText": "", "language": "english", "persons": [], "text": "Cognizant Named a Leader in Gartner Magic Quadrant for Managed Workplace Services in North America Evaluation Based on Completeness of Vision and Ability to Execute CLOSE \nTEANECK, N.J. , Feb. 14, 2017 / PRNewswire / -- Cognizant (NASDAQ: CTSH) today announced that it has been recognized by Gartner as a Leader in Gartner's January 2017 report, \" Magic Quadrant for Managed Workplace Services, North America. \" The newly released report evaluates 21 managed workplace services providers on their completeness of vision and ability to execute across a variety of criteria, including service delivery capabilities, customer experience, operations, market understanding and strategy, and innovation. \nGartner says Leaders \"deliver their service solutions skillfully, have a clear vision of the direction of the service market, and are actively building and improving their competencies to sustain their leadership positions.\" In addition, the Leaders quadrant indicates the direction of the MWS market. However, most digital workplace offerings still have low adoption rates. Eight service providers have emerged as Leaders in this Magic Quadrant. \"Leaders have demonstrated their experience in delivering managed workplace services and understand the requirements to successfully deliver these services. They have proved their Ability to Execute and their Completeness of Vision.\" \n\"In less than four years of debuting in this Gartner report, we are pleased to be recognized as a Leader in workplace services in North America ,\" said Venu Lambu, Senior Vice President and Global Head, Cognizant Infrastructure Services. \"The traditional workplace is evolving to provide a more personalized and intuitive user experience, requiring enterprises to adjust their strategies accordingly. Leveraging the power of cloud, artificial intelligence, automation and analytics, Cognizant enables higher employee productivity and engagement in a secure environment. We feel the Gartner recognition speaks to the strength of our vision and deep understanding of workplace services, as well as our ability to connect people, processes and technology to deliver a more flexible and adaptive infrastructure for today's digital workforce.\" \nRead the Gartner \"Magic Quadrant for Managed Workplace Services North America\" by Daniel Barros , Helen Huntley , and Karen A. Hobert . \nGartner Disclaimer Gartner does not endorse any vendor, product or service depicted in its research publications, and does not advise technology users to select only those vendors with the highest ratings or other designation. Gartner research publications consist of the opinions of Gartner's research organization and should not be construed as statements of fact. Gartner disclaims all warranties, expressed or implied, with respect to this research, including any warranties of merchantability or fitness for a particular purpose. \nAbout Cognizant Cognizant (NASDAQ-100: CTSH) is one of the world's leading professional services companies, transforming clients' business, operating and technology models for the digital era. Our unique industry-based, consultative approach helps clients envision, build and run more innovative and efficient businesses. Headquartered in the U.S., Cognizant is ranked 230 on the Fortune 500 and is consistently listed among the most admired companies in the world. Learn how Cognizant helps clients lead with digital at www.cognizant.com or follow us @Cognizant. \nSOURCE Cognizant For further information: For further information, contact: U.S.: Jodi Sorensen, +1-201-294-5358, jodi.sorensen@cognizant.com ; Europe: Grazia Valentino-Boschi, + 33 (0)6 07 85 80 63, grazia@cognizant.com ; Asia-Pac: Harsh Kabra, +91-855-188-2111, harsh.kabra@cognizant.com Twitter", "external_links": [], "published": "2017-02-14T18:00:00.000+02:00", "crawled": "2017-02-17T19:44:59.193+02:00", "highlightTitle": ""}