{"organizations": [], "uuid": "798134520ad4107489bb27b227e5a776e4b601f4", "thread": {"social": {"gplus": {"shares": 0}, "pinterest": {"shares": 0}, "vk": {"shares": 0}, "linkedin": {"shares": 0}, "facebook": {"likes": 170, "shares": 170, "comments": 0}, "stumbledupon": {"shares": 0}}, "site_full": "bdnews24.com", "main_image": "http://d30fl32nd2baj9.cloudfront.net/media/2017/02/26/sylhet-khadija-in-court-01.jpg/ALTERNATES/w640/Sylhet-khadija-in-court-01.jpg", "site_section": "http://bdnews24.com/?widgetName=rssfeed&widgetId=1150&getXmlFeed=true", "section_title": "wf-escenic-times - Home", "url": "http://bdnews24.com/bangladesh/2017/02/26/sylhet-girl-khadiza-appears-in-court-over-case-in-machete-attack", "country": "US", "domain_rank": 2276, "title": "Sylhet girl Khadiza appears in court over case in machete attack", "performance_score": 1, "site": "bdnews24.com", "participants_count": 0, "title_full": "Sylhet girl Khadiza appears in court over case in machete attack", "spam_score": 0.0, "site_type": "news", "published": "2017-02-26T19:18:00.000+02:00", "replies_count": 0, "uuid": "798134520ad4107489bb27b227e5a776e4b601f4"}, "author": "", "url": "http://bdnews24.com/bangladesh/2017/02/26/sylhet-girl-khadiza-appears-in-court-over-case-in-machete-attack", "ord_in_thread": 0, "title": "Sylhet girl Khadiza appears in court over case in machete attack", "locations": [], "entities": {"persons": [{"name": "khadiza", "sentiment": "negative"}, {"name": "mahfuzur rahman", "sentiment": "none"}, {"name": "khadiza begum nargis", "sentiment": "none"}, {"name": "badrul", "sentiment": "none"}, {"name": "badrul alam", "sentiment": "none"}], "locations": [{"name": "sylhet", "sentiment": "none"}, {"name": "dhaka's square hospital", "sentiment": "none"}, {"name": "savar", "sentiment": "none"}, {"name": "bangladesh", "sentiment": "none"}], "organizations": [{"name": "chhatra league", "sentiment": "none"}, {"name": "bangladesh chhatra league", "sentiment": "none"}, {"name": "crp", "sentiment": "none"}, {"name": "sylhet mc college", "sentiment": "none"}, {"name": "sylhet university", "sentiment": "none"}, {"name": "shahjalal university of science and technology", "sentiment": "none"}, {"name": "awami league", "sentiment": "none"}]}, "highlightText": "", "language": "english", "persons": [], "text": "Sylhet girl Khadiza appears in court over case in machete attack Sylhet Correspondent bdnews24.com Previous Next Khadiza Begum Nargis has testified before a Sylhet court in the case over a machete attack by a local leader of the ruling party's student front. \nBangladesh Chhatra League's (BCL) Sylhet university unit leader Badrul Alam is being tried for the October 2016 attack at the chief metropolitan magistrate's court. \nBCL is the student affiliate of the ruling Awami League. \nAdditional Public Prosecutor Mahfuzur Rahman said Khadiza arrived at the court premises around 10:30am on Sunday. \nDefendant Badrul has been also brought to the court for the hearing. With the court recording Khadiza's statement, testifying of 34 witnesses produced by the plaintiff has concluded. Badrul Alam, former Chhatra League vice-president at Shahjalal University of Science and Technology hacked Khadiza with a sharp weapon outside Sylhet MC College on Oct 3 last year. The blows ruptured her skull, causing injury to her brain. She was admitted to Dhaka's Square Hospital where she went through a number of surgeries before being n transferred to CRP at Savar. Khadiza received physiotherapy and counseling from an eight-member team at CRP for three months before returning to Sylhet on Friday. Badrul carried out the attack reportedly for an unrequited love affair with Khadiza. He was caught by the people who witnessed the incident and was handed over to the police immediately after the attack. A video of Badrul hacking Khadiza went viral on the social media triggering protests across Bangladesh. Khadiza's family started an attempted murder case against Badrul, who has who confessed to attacking the college girl under Section 164 in court. On Nov 8 last year, police submitted the chargesheet against Badrul and the trial started on Nov 29 after the court indicted the former Chhatra League leader.", "external_links": [], "published": "2017-02-26T19:18:00.000+02:00", "crawled": "2017-02-26T10:05:29.600+02:00", "highlightTitle": ""}