{"organizations": [], "uuid": "e7b6e62344a1d8dac6cd9c7ff87d58adbe90407f", "thread": {"social": {"gplus": {"shares": 0}, "pinterest": {"shares": 0}, "vk": {"shares": 0}, "linkedin": {"shares": 0}, "facebook": {"likes": 355, "shares": 355, "comments": 0}, "stumbledupon": {"shares": 0}}, "site_full": "metro.co.uk", "main_image": "", "site_section": "", "section_title": "", "url": "http://metro.co.uk/2017/02/15/lequipe-player-ratings-hammer-home-just-how-bad-barcelona-were-against-psg-6449642/", "country": "US", "domain_rank": 1779, "title": "PSG 4 Barcelona 0: L’Equipe player ratings hammer home just how bad Barca were | Metro News", "performance_score": 3, "site": "metro.co.uk", "participants_count": 0, "title_full": "PSG 4 Barcelona 0: L’Equipe player ratings hammer home just how bad Barca were | Metro News", "spam_score": 0.019, "site_type": "news", "published": "2017-02-15T16:21:00.000+02:00", "replies_count": 0, "uuid": "e7b6e62344a1d8dac6cd9c7ff87d58adbe90407f"}, "author": "Simon Rice For Metro.Co.Uk", "url": "http://metro.co.uk/2017/02/15/lequipe-player-ratings-hammer-home-just-how-bad-barcelona-were-against-psg-6449642/", "ord_in_thread": 0, "title": "PSG 4 Barcelona 0: L’Equipe player ratings hammer home just how bad Barca were | Metro News", "locations": [], "entities": {"persons": [{"name": "messi", "sentiment": "negative"}, {"name": "simon rice", "sentiment": "negative"}, {"name": "neymar", "sentiment": "negative"}, {"name": "andres iniesta", "sentiment": "none"}, {"name": "roy keane", "sentiment": "none"}, {"name": "getty", "sentiment": "none"}, {"name": "marc-andre ter stegen", "sentiment": "none"}, {"name": "suarez", "sentiment": "none"}, {"name": "jordi alba", "sentiment": "none"}, {"name": "gibbs", "sentiment": "none"}, {"name": "lionel messi", "sentiment": "none"}, {"name": "andre gomes", "sentiment": "none"}, {"name": "luis suaez", "sentiment": "none"}], "locations": [{"name": "barca", "sentiment": "none"}, {"name": "paris", "sentiment": "none"}, {"name": "barcelona", "sentiment": "none"}], "organizations": [{"name": "psg", "sentiment": "negative"}, {"name": "barcelona", "sentiment": "negative"}, {"name": "paris st germain", "sentiment": "none"}, {"name": "parc de princes", "sentiment": "none"}]}, "highlightText": "", "language": "english", "persons": [], "text": "Simon Rice for Metro.co.uk Wednesday 15 Feb 2017 9:21 am Barcelona stars Neymar and Messi in Paris (Getty) \nBarcelona were bad last night, but then you could probably tell that from the eye-catching 4-0 scoreline . \nThe likes of Lionel Messi, Luis Suaez and Neymar were anonymous on this much-anticipated Champions League night against Paris St Germain. And the hosts in the French capital took full advantage, playing some scintillating football to kill the Round of 16 tie before the second leg. ‘How can Gibbs be captain?!’ Man Utd legend Roy Keane TEARS into Arsenal flops \nBut just how bad Barcelona were was rammed home by influential French newspaper L’Equipe. The publication’s player ratings from the Parc de Princes didn’t hold back. \nMessi, Suarez, captain Andres Iniesta, Andre Gomes and Jordi Alba were all given a score of just 2/10. The only Barcelona player who emerged with a slither of credit was their goalkeeper, Marc-Andre Ter Stegen who was given 6/10. ", "external_links": [], "published": "2017-02-15T16:21:00.000+02:00", "crawled": "2017-02-16T13:46:39.245+02:00", "highlightTitle": ""}