{"organizations": [], "uuid": "81fc019f087cd76f468f9a611ea7e2b299e2df73", "thread": {"social": {"gplus": {"shares": 0}, "pinterest": {"shares": 0}, "vk": {"shares": 0}, "linkedin": {"shares": 0}, "facebook": {"likes": 101, "shares": 101, "comments": 0}, "stumbledupon": {"shares": 0}}, "site_full": "en.prothom-alo.com", "main_image": "http://en.prothom-alo.com/contents/cache/images/1200x630x1/uploads/media/2017/02/19/4a2058189f69838d44e272609bf65b1f-rampal.jpg?jadewits_media_id=130519", "site_section": "", "section_title": "", "url": "http://en.prothom-alo.com/bangladesh/news/139779/Rampal-plant-construction-to-begin-next-month-BSS", "country": "BD", "domain_rank": 1033, "title": "Rampal plant construction to begin next month: BSS", "performance_score": 1, "site": "prothom-alo.com", "participants_count": 0, "title_full": "Rampal plant construction to begin next month: BSS", "spam_score": 0.135, "site_type": "news", "published": "2017-02-19T07:00:00.000+02:00", "replies_count": 0, "uuid": "81fc019f087cd76f468f9a611ea7e2b299e2df73"}, "author": "Online Desk", "url": "http://en.prothom-alo.com/bangladesh/news/139779/Rampal-plant-construction-to-begin-next-month-BSS", "ord_in_thread": 0, "title": "Rampal plant construction to begin next month: BSS", "locations": [], "entities": {"persons": [{"name": "rampal", "sentiment": "negative"}, {"name": "bifpcl anwarul azim", "sentiment": "none"}, {"name": "shahnewaz ali", "sentiment": "none"}, {"name": "arun chowdhury", "sentiment": "none"}, {"name": "vinod", "sentiment": "none"}, {"name": "rajnagar", "sentiment": "none"}, {"name": "sheikh hasina", "sentiment": "none"}, {"name": "bifpcl vinod bhoyar", "sentiment": "none"}, {"name": "oliullah", "sentiment": "none"}], "locations": [{"name": "kaigardaskhati", "sentiment": "none"}, {"name": "veramara", "sentiment": "none"}, {"name": "indonesia", "sentiment": "none"}, {"name": "babu bari", "sentiment": "none"}, {"name": "pashur river", "sentiment": "none"}, {"name": "india", "sentiment": "none"}, {"name": "khulna-mongla", "sentiment": "none"}, {"name": "khulna", "sentiment": "none"}, {"name": "bagerhat", "sentiment": "none"}, {"name": "sundarbans", "sentiment": "none"}, {"name": "australia", "sentiment": "none"}, {"name": "south africa", "sentiment": "none"}, {"name": "sapmari-katakhali", "sentiment": "none"}, {"name": "padma bridge", "sentiment": "none"}, {"name": "bangladesh", "sentiment": "none"}], "organizations": [{"name": "bss rampal", "sentiment": "negative"}, {"name": "sunderban protection national committee sm", "sentiment": "none"}, {"name": "national tharmal power company", "sentiment": "none"}, {"name": "power plants", "sentiment": "none"}, {"name": "bss", "sentiment": "none"}, {"name": "pvt) ltd", "sentiment": "none"}, {"name": "ntpc", "sentiment": "none"}, {"name": "agm) of bangladesh-india friendship power company (pvt) ltd.", "sentiment": "none"}, {"name": "heavy electrical ltd", "sentiment": "none"}, {"name": "rampal", "sentiment": "none"}, {"name": "bangladesh power development board", "sentiment": "none"}, {"name": "bpdb", "sentiment": "none"}, {"name": "rampal power plant", "sentiment": "none"}, {"name": "bangladesh-india friendship power company", "sentiment": "none"}]}, "highlightText": "", "language": "english", "persons": [], "text": "Rampal plant construction to begin next month: BSS Online Desk | Update: 14:16, Feb 19, 2017 0 Like \nConstruction works of two-unit 1320 (660x2) megawatt coal-based power plant at Rampal will begin at the end of next March, reports BSS.While visiting the area a correspondent of the state-run news agency found that earth filling work on the requisite 915 acres of land has already been completed.Surrounding with high boundary wall along with fence, most of the land covered with kashbon, five high watch tower and office cum residence and other small residence for the officers and caretakers has already been set up.While entering the six kilometers bypass roads towards the power plants from Khulna-Mongla highway, hundreds of labourer works on the land. They are engaged for making blocks made by cement concrete, unloading bricks, stones and other construction materials from the jetty, according to the report.Convener of Khulna unit Sunderban Protection National Committee SM Shahnewaz Ali said the project will be harmful for Sundrbans.\"We have no objection if the project is established on another places,\" he said.The BSS report said a total of two pontoons and jetty has been set up on the bank of the Pashur River at the west side of the main power plants.Arun Chowdhury, additional general manager (AGM) of Bangladesh-India Friendship Power Company (Pvt) Ltd. told the news agency, safe guard (Dhal) will be made with concrete blocks which will be surrounded on the boundary of the power plants.BSS quoting \"Sources concerned\" said, a MoU has been signed between Bangladesh Power Development Board (BPDB) and Bangladesh-India Friendship Power Company (Pvt) Ltd (BIFPCL) to set up 1320 MW coal-based 'Maitree Super Tharmal Power Project' on 915 acres of land at Sapmari-Katakhali and Kaigardaskhati mouja under Rajnagar union of Rampal upazila in Bagerhat on October 2012.Deputy general manager of BIFPCL Vinod Bhoyar told BSS, construction works of main Power Plants will begin likely at the end of March next after settling monetary issues from the bank concerned on 420 acres of land out of 915 acres.Construction works of the power project is expected to complete on 2019-20 fiscal year. Heavy Electrical Ltd of India will construct the main plants, he said adding that officers-employees and workers' residence, school, hospital, prayer place, community center and other infrastructures' construction works will be complete at the rest lands.On environment issue, Vinod said, Rampal power plant would not harm Sundarbans as many ultra modern technologies including ultra super critical technology would be used in the plants.Referring various coal based power plant near the forest across the world, he said, the plants situated at least 21 km away from Sundarbans and 65km away from mangrove forest.AGM Arun Chowdhury said, BPDB and National Tharmal Power Company (NTPC) would hold the ownership of the power plant on the basis of fifty percent equally.A total of 70 per cent cost out of involving cost Tk 14,000 crore is on credit as loan from Exim bank.Manager (public relations) of BIFPCL Anwarul Azim said, ultra super critical technology, 910 feet height chimney and others technology will be used at the project.\"Everyday 11,000 tonnes of coal will be needed for the power project and it will be brought from Indonesia, Australia and South Africa,\" he said adding that \"over 600 people directly and 10-15 thousand people indirectly would be benefitted from the project.\"Constructing 6km by pass road from Babu Bari area highway to power plant has facilitated the local villagers to easily market their shrimps and crops at a lower cost, he said.He also added, the local people would get work on basis of their quality in the project.To fulfill the increasing demand of electricity for the expansion of business in the southern part of Bangladesh after turning on (establishing) the Padma Bridge, Bangladesh and India is setting up the coal based power plant in a joint venture at Rampal, Bagerhat, said Md. Oliullah, deputy manager (administration and security) of BIFPC.Several movements of the some environmentalists regarding Rampal Power Plant are illogical as it has no harmful effect on the Sunderbans, he said.On 5 October 2013 prime minister Sheikh Hasina in a function inaugurated the 1320 MW coal based Rampal Power Plant from Veramara area through pressing electric switch. ", "external_links": [], "published": "2017-02-19T07:00:00.000+02:00", "crawled": "2017-02-20T00:04:59.333+02:00", "highlightTitle": ""}