{"organizations": [], "uuid": "7cf3749d401df8fcc419dbf5d5d0f45932c541ca", "thread": {"social": {"gplus": {"shares": 1}, "pinterest": {"shares": 0}, "vk": {"shares": 0}, "linkedin": {"shares": 0}, "facebook": {"likes": 625, "shares": 625, "comments": 0}, "stumbledupon": {"shares": 0}}, "site_full": "bleacherreport.com", "main_image": "http://img.bleacherreport.net/img/images/photos/003/661/251/hi-res-9043519bd7d750fa38196610a04662ef_crop_north.jpg?1488067170&amp;w=9999&amp;h=9999", "site_section": "http://feeds.bleacherreport.com/articles/feed/", "section_title": "Bleacher Report - Front Page", "url": "http://bleacherreport.com/articles/2694976-baylor-womens-basketball-coach-kim-mulkey-addresses-sexual-assault-concerns", "country": "US", "domain_rank": 506, "title": "Baylor Women's Basketball Coach Kim Mulkey Addresses Sexual Assault Concerns", "performance_score": 6, "site": "bleacherreport.com", "participants_count": 1, "title_full": "Baylor Women's Basketball Coach Kim Mulkey Addresses Sexual Assault Concerns", "spam_score": 0.0, "site_type": "news", "published": "2017-02-26T07:23:00.000+02:00", "replies_count": 0, "uuid": "7cf3749d401df8fcc419dbf5d5d0f45932c541ca"}, "author": "Adam Wells", "url": "http://bleacherreport.com/articles/2694976-baylor-womens-basketball-coach-kim-mulkey-addresses-sexual-assault-concerns", "ord_in_thread": 0, "title": "Baylor Women's Basketball Coach Kim Mulkey Addresses Sexual Assault Concerns", "locations": [], "entities": {"persons": [{"name": "kim mulkey", "sentiment": "neutral"}, {"name": "cooper", "sentiment": "neutral"}, {"name": "lady bears", "sentiment": "none"}, {"name": "adam wells   kim mulkey", "sentiment": "none"}, {"name": "paula lavigne", "sentiment": "none"}, {"name": "mulkey", "sentiment": "none"}, {"name": "john elizondo", "sentiment": "none"}, {"name": "ralph d. russo", "sentiment": "none"}, {"name": "mark schlabach", "sentiment": "none"}, {"name": "elizondo", "sentiment": "none"}], "locations": [{"name": "texas", "sentiment": "none"}, {"name": "waco", "sentiment": "none"}], "organizations": [{"name": "baylor women", "sentiment": "neutral"}, {"name": "texas rangers", "sentiment": "none"}, {"name": "abc", "sentiment": "none"}, {"name": "texas tech", "sentiment": "none"}, {"name": "associated press", "sentiment": "none"}, {"name": "ncaa", "sentiment": "none"}, {"name": "baylor", "sentiment": "none"}]}, "highlightText": "", "language": "english", "persons": [], "text": "Baylor Women's Basketball Coach Kim Mulkey Addresses Sexual Assault Concerns Cooper Neill/Getty Images Adam Wells   Kim Mulkey, head coach of Baylor's women's basketball team, offered an impassioned defense of the school in light of the sexual assault scandal that continues to be the focus of an NCAA investigation, according to Outside the Lines' Paula Lavigne and Mark Schlabach . Per John Elizondo of ABC 25 in Waco, Texas, Mulkey made these comments after the Bears defeated Texas Tech on Saturday: John Elizondo @JohnElizondo25 Kim Mulkey sounds off on recent national scrutiny about #Baylor and female student safety on campus after Lady Bears' win. https://t.co/Jy8YUDhtBW After the dust had settled on Baylor's 86-48 win, Mulkey expanded on the comments during the postgame press conference, per Elizondo: John Elizondo @JohnElizondo25 2/25/2017, 10:34:05 PM In January, a lawsuit filed by a former student alleged 31 different Baylor football players committed 52 \" acts of rape\" between 2011 and 2014, per the Dallas Morning News . A representative from the state of Texas proposed a resolution earlier this week in which the Texas Rangers would investigate Baylor for its alleged improprieties. The Big 12 voted earlier this month to withhold 25 percent of Baylor's revenue share \" until an outside review determines the university and athletic department are complying with Title IX guidelines and other regulations in the wake of a campus sexual assault scandal,\" per Ralph D. Russo of the Associated Press. Mulkey has been the head coach of Baylor's women's basketball team since 2000. She won her 500th game with the Bears on Saturday and led the program to national titles in 2005 and 2012.  ", "external_links": [], "published": "2017-02-26T07:23:00.000+02:00", "crawled": "2017-02-26T03:56:21.933+02:00", "highlightTitle": ""}