{"organizations": [], "uuid": "b00c4512016917813e2d6cbb1dd3af2e82d1fec9", "thread": {"social": {"gplus": {"shares": 1}, "pinterest": {"shares": 0}, "vk": {"shares": 0}, "linkedin": {"shares": 0}, "facebook": {"likes": 760, "shares": 760, "comments": 0}, "stumbledupon": {"shares": 0}}, "site_full": "www.baltimoresun.com", "main_image": "http://www.trbimg.com/img-589101b0/turbine/bs-md-umd-travel-ban-20170131", "site_section": "http://www.baltimoresun.com/news/maryland/rss2.0.xml", "section_title": "Maryland - Baltimore Sun", "url": "http://www.baltimoresun.com/news/maryland/bs-md-umd-travel-ban-20170131-story.html", "country": "US", "domain_rank": 7432, "title": "UMD president says 350 on campus affected by Trump's travel ban", "performance_score": 7, "site": "baltimoresun.com", "participants_count": 1, "title_full": "UMD president says 350 on campus affected by Trump's travel ban", "spam_score": 0.0, "site_type": "news", "published": "2017-02-01T04:15:00.000+02:00", "replies_count": 0, "uuid": "b00c4512016917813e2d6cbb1dd3af2e82d1fec9"}, "author": "Tim Prudente", "url": "http://www.baltimoresun.com/news/maryland/bs-md-umd-travel-ban-20170131-story.html", "ord_in_thread": 0, "title": "UMD president says 350 on campus affected by Trump's travel ban", "locations": [], "entities": {"persons": [{"name": "tim prudente", "sentiment": "negative"}, {"name": "trump", "sentiment": "negative"}, {"name": "kenneth k. lam/baltimore sun", "sentiment": "none"}, {"name": "loh", "sentiment": "none"}, {"name": "sonja santelises", "sentiment": "none"}, {"name": "donald trump", "sentiment": "none"}, {"name": "emma patti harris/baltimore sun", "sentiment": "none"}, {"name": "wallace loh", "sentiment": "none"}, {"name": "johns hopkins", "sentiment": "none"}], "locations": [{"name": "muslim-majority", "sentiment": "none"}, {"name": "u.s.", "sentiment": "none"}, {"name": "baltimore city", "sentiment": "none"}, {"name": "peru", "sentiment": "none"}, {"name": "maryland", "sentiment": "none"}, {"name": "china", "sentiment": "none"}], "organizations": [{"name": "umd", "sentiment": "negative"}, {"name": "news maryland umd", "sentiment": "negative"}, {"name": "barclay elementary school", "sentiment": "none"}, {"name": "loyola university maryland", "sentiment": "none"}, {"name": "white house", "sentiment": "none"}, {"name": "university of maryland", "sentiment": "none"}, {"name": "johns hopkins university", "sentiment": "none"}]}, "highlightText": "", "language": "english", "persons": [], "text": "News Maryland UMD president says 350 on campus affected by Trump's travel ban Tim Prudente , are affected by the Trump administration's federal travel ban on seven Muslim-majority countries, university president Wallace Loh said Tuesday.\nLoh weighed in on the controversy with a statement saying President Donald Trump's 90-day ban \"poses human, moral, and constitutional dilemmas.\" \n\"As a public institution, the University of Maryland does not normally take stands on political issues. However, we have an obligation to speak out when government actions are fundamentally antithetical to the core values and missions of the institution,\" Loh said. \nOne graduate student was blocked while trying to return to the U.S., and possibly three others have also been blocked, Loh said. \nAlso, a visiting professor told the university he would not be coming to campus as a personal protest. The professor was not subject to the ban. \nLoh reaffirmed the university will not release information on the immigration status of students unless forced by court order. Caption Santelises looks to cut staff, services to close $130 million budget gap \nBaltimore City schools CEO Sonja Santelises is prepared to lay off more than 1,000 employees, from classroom teachers to custodians, in order to close a $130 million budget gap. (Emma Patti Harris/Baltimore Sun video) \nBaltimore City schools CEO Sonja Santelises is prepared to lay off more than 1,000 employees, from classroom teachers to custodians, in order to close a $130 million budget gap. (Emma Patti Harris/Baltimore Sun video) Caption Sixth grade students design 'robo-arms' \nJohns Hopkins undergraduates worked with sixth grade students at Barclay Elementary School to build a \"robo-arm.\" (Kenneth K. Lam/Baltimore Sun video) \nJohns Hopkins undergraduates worked with sixth grade students at Barclay Elementary School to build a \"robo-arm.\" (Kenneth K. Lam/Baltimore Sun video) \nLoh was born in China and moved with his family to Peru. After completing high school in Peru, he immigrated to the U.S. and became a naturalized citizen. \nTrump and White House aides have defended the ban as a necessary step for national security despite growing criticism and widespread protests at airports around the country and abroad. \nThe presidents of Loyola University Maryland and Johns Hopkins University, and the chancellor of the University System of Maryland have all expressed concern over the ban and support for immigrant and international students.", "external_links": [], "published": "2017-02-01T04:15:00.000+02:00", "crawled": "2017-02-01T00:25:25.408+02:00", "highlightTitle": ""}