{"organizations": [], "uuid": "71a84b56e00723eaa5976b263c7b3815513e495f", "thread": {"social": {"gplus": {"shares": 0}, "pinterest": {"shares": 0}, "vk": {"shares": 0}, "linkedin": {"shares": 0}, "facebook": {"likes": 221, "shares": 221, "comments": 0}, "stumbledupon": {"shares": 0}}, "site_full": "www.vulture.com", "main_image": "http://pixel.nymag.com/imgs/daily/vulture/2017/02/26/oscars/26-mean-tweets.w1200.h630.jpg", "site_section": "http://feeds.feedburner.com/nymag/vulture", "section_title": "Vulture", "url": "http://www.vulture.com/2017/02/watch-jimmy-kimmel-bring-his-mean-tweets-to-the-oscars.html?utm_source=feedburner&utm_medium=feed&utm_campaign=Feed%3A+nymag%2Fvulture+%28Vulture+-+nymag.com%27s+Entertainment+and+Culture+Blog%29", "country": "US", "domain_rank": 2191, "title": "Watch Jimmy Kimmel Bring His Mean Tweets to the Oscars", "performance_score": 2, "site": "vulture.com", "participants_count": 1, "title_full": "Watch Jimmy Kimmel Bring His Mean Tweets to the Oscars", "spam_score": 0.0, "site_type": "news", "published": "2017-02-27T06:37:00.000+02:00", "replies_count": 0, "uuid": "9dc815e951066f75fcfbf748bce68e2c161acba9"}, "author": "", "url": "http://www.vulture.com/2017/02/watch-jimmy-kimmel-bring-his-mean-tweets-to-the-oscars.html", "ord_in_thread": 0, "title": "Watch Jimmy Kimmel Bring His Mean Tweets to the Oscars", "locations": [], "entities": {"persons": [{"name": "ryan gosling", "sentiment": "negative"}, {"name": "natalie portman", "sentiment": "negative"}, {"name": "jimmy kimmel", "sentiment": "negative"}, {"name": "emma stone", "sentiment": "negative"}, {"name": "casey affleck", "sentiment": "none"}, {"name": "bill paxton", "sentiment": "none"}, {"name": "john mulaney", "sentiment": "none"}, {"name": "hacksaw ridge", "sentiment": "none"}, {"name": "neil fingleton", "sentiment": "none"}, {"name": "jamie will", "sentiment": "none"}, {"name": "asghar farhadi", "sentiment": "none"}, {"name": "nicki minaj", "sentiment": "none"}, {"name": "wilson", "sentiment": "none"}, {"name": "richard shepard", "sentiment": "none"}, {"name": "trump", "sentiment": "none"}, {"name": "ivanka", "sentiment": "none"}, {"name": "keanu reeves", "sentiment": "none"}, {"name": "david edelstein", "sentiment": "none"}, {"name": "joseph wapner dead", "sentiment": "none"}, {"name": "matthew rhys", "sentiment": "none"}, {"name": "jeff bridges", "sentiment": "none"}, {"name": "kevin o’connell", "sentiment": "none"}, {"name": "emily yoshida", "sentiment": "none"}, {"name": "claire", "sentiment": "none"}, {"name": "viola davis", "sentiment": "none"}, {"name": "ron howard remembers bill paxton", "sentiment": "none"}, {"name": "damon", "sentiment": "none"}, {"name": "eugene", "sentiment": "none"}, {"name": "john legend", "sentiment": "none"}, {"name": "bill paxton vulture", "sentiment": "none"}, {"name": "streep", "sentiment": "none"}], "locations": [{"name": "new york", "sentiment": "none"}, {"name": "hollywood", "sentiment": "none"}, {"name": "hulu", "sentiment": "none"}], "organizations": [{"name": "john legend single-handedly saves la la land", "sentiment": "none"}, {"name": "chatham", "sentiment": "none"}, {"name": "chicago movie theater patrons of chicago", "sentiment": "none"}, {"name": "full list people’s court", "sentiment": "none"}, {"name": "facebook tweet", "sentiment": "none"}, {"name": "lagerfeld issues apology bill paxton dead", "sentiment": "none"}, {"name": "la la land", "sentiment": "none"}, {"name": "vulture", "sentiment": "none"}, {"name": "hbo nick kroll", "sentiment": "none"}, {"name": "production company donated to trump without affleck knowing affleck/middleton project", "sentiment": "none"}, {"name": "minaj responds college", "sentiment": "none"}, {"name": "denzel washington marrying", "sentiment": "none"}, {"name": "netflix", "sentiment": "none"}, {"name": "amazon", "sentiment": "none"}]}, "highlightText": "", "language": "english", "persons": [], "text": "Ryan Gosling, Emma Stone, Natalie Portman and more star in Mean Tweets: #Oscars edition. pic.twitter.com/5NHHvxuT3D \n— Hollywood Reporter (@THR) February 27, 2017 Did you really think that Jimmy Kimmel would get through his Oscars-hosting gig without doing an extra star-studded edition of celebrities reading mean tweets? Of course not! Since nobody is safe from the wrath of Jimmy Kimmel’s infamous Mean Tweets, not even Academy Award nominees, please enjoy watching Casey Affleck read what most definitely is not the meanest tweet that has ever been written about him.\n\nTags: top story roll clip! oscars 2017 oscars celebs jimmy kimmel Watch Jimmy Kimmel Bring His Mean Tweets to the Oscars Share on Facebook Tweet this Story Top Stories Watch Jimmy Kimmel Bring His Mean Tweets to the Oscars 2017 Oscar Winners: See the Full List People’s Court ’s Judge Joseph Wapner Dead at 97 Most Viewed Stories ‘Defamed’ Meryl Streep Slams Karl Lagerfeld Over Oscars Dress Controversy; Lagerfeld Issues Apology Bill Paxton Dead at 61 Neil Fingleton, Game of Thrones ’ Mag the Mighty, Dead at 36 Natalie Portman Skipping Oscars Due to Pregnancy Nocturnal Animals Has Two Endings, and Both of Them Are Killer What to Stream Now See what's new and notable on Netflix, Amazon, Hulu, and HBO Nick Kroll and John Mulaney’s Hilarious Spirit Awards Monologue Confirms They Should Be Hosting the Oscars Next Year Remy Ma Drops Nicki Minaj Diss Track; Minaj Responds College Champion Lives Your Wildest Intellectual Dreams by Writing Joke ‘Final Jeopardy’ Answer Celebrities Grieve the Death of Bill Paxton Vulture’s Final 2017 Oscar Predictions for Every Category Most Popular Video On Vulture Keanu Reeves Is Obsessed With Doing His Own Stunts Latest News from Vulture 2 mins ago John Legend Single-Handedly Saves La La Land ’s Songs at The Oscars City of stars, are you shining just for John Legend?\n12 mins ago Watch Jimmy Kimmel Bring His Mean Tweets to the Oscars “I think Jeff Bridges wears pants a lot less than we all think he does.”\n15 mins ago 2017 Oscar Winners: See the Full List The night is La La Land ’s to lose.\n26 mins ago Only Denzel Washington Marrying a Couple Could Save Jimmy Kimmel’s Oscars Bit The only reason to say “I do” to this bit.\n11:00 p.m. Billions Recap: A Calculated Risk “Dead Cat Bounce” introduces a lot of new faces to Billions. \n10:58 p.m. Iranian Director Asghar Farhadi Renounces Exclusionary Politics After Oscar Win “Dividing the world into the “us” and “our enemies” categories creates fear.”\n10:30 p.m. Girls Director Richard Shepard on Fake Penises, Bottle Episodes and Matthew Rhys “It’s actually very hard to find a not-fully-erect dildo.”\n10:12 p.m. This 21-Time Oscar Nominee Finally Won a Damn Oscar Kevin O’Connell won his first Oscar for his sound work on Hacksaw Ridge .\n10:11 p.m. Watch Viola Davis, Inventor of Acting, Give an Impassioned Oscars Speech “So here’s to August Wilson who exhumed and exalted the ordinary people.”\n10:09 p.m. The Walking Dead Recap: Welcome Home, Haircut Whether he’s truly turning into Dr. Evil or not, Eugene is finally worth watching.\n10:00 p.m. Homeland Recap: The New York Groove Anyone else miss the action-packed Homeland of seasons past?\n9:54 p.m. Casey Affleck’s Production Company Donated to Trump Without Affleck Knowing Affleck/Middleton Project donated $5,000 to Trump’s transition team.\n9:36 p.m. Jimmy Kimmel Goes After Trump, Streep, and, of Course, Damon in Oscars Monologue “Nice dress, by the way. Is that an Ivanka?”\n8:57 p.m. Blood Orange’s Dev Hynes Named His New Band As Part of MailChimp Promo Campaign Rhymes with VeilHymn\n8:20 p.m. Ron Howard Remembers Bill Paxton’s “Charm” and “Admirable Joie de Vivre” Bill Paxton, actor in Apollo 13 , Aliens , and Twister , died on Sunday. He was 61.\n7:31 p.m. Join Vulture’s Oscars Live Blog With Critics David Edelstein and Emily Yoshida Here’s to the ones who blog.\n6:53 p.m. See All of the 2017 Oscars Red-Carpet Looks Strike a haute couture pose.\n4:43 p.m. Chance the Rapper Giving Away a Day of Get Out Showings at Chicago Movie Theater Patrons of Chicago’s Chatham 14 are in for a terrifying treat.\n4:10 p.m. Outlander ’s Claire and Jamie Will Still Have Smokin’ Hot Sex 20 Years Later With age comes wisdom and the undiminished capacity for a very compelling sex scene.\n3:52 p.m. This Video Shows 15 of the Most Memorable Oscars Outfits of All Time Some of the Oscars’ most iconic looks.", "external_links": [], "published": "2017-02-27T06:37:00.000+02:00", "crawled": "2017-02-27T07:22:29.475+02:00", "highlightTitle": ""}