{"organizations": [], "uuid": "d43d6c1b5fa57b1c86035d770efdcd656e84c0f9", "thread": {"social": {"gplus": {"shares": 2}, "pinterest": {"shares": 0}, "vk": {"shares": 0}, "linkedin": {"shares": 0}, "facebook": {"likes": 129, "shares": 129, "comments": 4}, "stumbledupon": {"shares": 0}}, "site_full": "www.freep.com", "main_image": "http://www.gannett-cdn.com/-mm-/d336aa03e24b49cda384a9b0b74097acc07a2c89/c=0-0-2045-1155&amp;r=x633&amp;c=1200x630/local/-/media/2017/02/22/DetroitFreePress/DetroitFreePress/636233592552675020-16722682-10155102584185530-8441229862230212122-o.jpg", "site_section": "http://rssfeeds.freep.com/freep/news", "section_title": "GANNETT Syndication Service", "url": "http://www.freep.com/story/news/local/michigan/detroit/2017/02/22/detroit-michigan-weather/98242658/", "country": "US", "domain_rank": 2980, "title": "Two days of record heat could hit southeast Michigan", "performance_score": 1, "site": "freep.com", "participants_count": 1, "title_full": "Two days of record heat could hit southeast Michigan", "spam_score": 0.0, "site_type": "news", "published": "2017-02-22T23:28:00.000+02:00", "replies_count": 0, "uuid": "d43d6c1b5fa57b1c86035d770efdcd656e84c0f9"}, "author": "Detroit Free Press", "url": "http://www.freep.com/story/news/local/michigan/detroit/2017/02/22/detroit-michigan-weather/98242658/", "ord_in_thread": 0, "title": "Two days of record heat could hit southeast Michigan", "locations": [], "entities": {"persons": [{"name": "eric seals/detroit", "sentiment": "none"}, {"name": "michigan perry a. farrell", "sentiment": "none"}, {"name": "nikk baxter", "sentiment": "none"}, {"name": "richter", "sentiment": "none"}, {"name": "mike richter", "sentiment": "none"}, {"name": "fenton", "sentiment": "none"}], "locations": [{"name": "michigan", "sentiment": "none"}, {"name": "michigan metro detroiters", "sentiment": "none"}, {"name": "pontiac lake recreation area", "sentiment": "none"}, {"name": "waterford", "sentiment": "none"}, {"name": "white lake township", "sentiment": "none"}], "organizations": [{"name": "metro detroiters", "sentiment": "none"}, {"name": "time", "sentiment": "none"}, {"name": "national weather service", "sentiment": "none"}, {"name": "detroit free press", "sentiment": "none"}, {"name": "facebook two", "sentiment": "none"}]}, "highlightText": "", "language": "english", "persons": [], "text": "  Two days of record heat could hit southeast Michigan Metro Detroiters could see highs in the mid-60s today and Thursday, but heavy thunderstorms could sweep through Friday Post to Facebook Two days of record heat could hit southeast Michigan Metro Detroiters could see highs in the mid-60s today and Thursday, but heavy thunderstorms could sweep through Friday  //on.freep.com/2m80HL6   4   Two days of record heat could hit southeast Michigan Perry A. Farrell , Detroit Free Press Published 10:56 a.m. ET Feb. 22, 2017 | Updated 2 hours ago Metro Detroiters could see highs in the mid-60s today and Thursday, but heavy thunderstorms could sweep through Friday Buy Photo Nikk Baxter, 27, of Fenton enjoys the 64 degree day at Pontiac Lake Recreation Area in Waterford on Saturday, Feb. 18, 2017. (Photo: Eric Seals/Detroit Free Press) Buy Photo 53 CONNECT 4 COMMENT EMAIL MORE \nTime is running out for firing up the grill in shorts and a t-shirt. \nMetro Detroiters could see record-breaking temperatures over the next two days, with highs in the mid-60s. After that, it's back to normal for late February into early March. \nThe high today is expected to reach at least 64 degrees. The record of 65 was set back in 1930, said Mike Richter of the National Weather Service in White Lake Township. \n“It’s going to be in the vicinity (record high), so we’ll have to watch it,\" Richter said. “It’ll be right at the edge. Tomorrow’s (Thursday) record high was 59. Because the record high is lower tomorrow; our high is expected to be 60. So it’ll be a little bit cooler, but because the record high is lower I think we’re going to be in that territory. \n\"So yes, near record highs both days.\" \nRead more:", "external_links": [], "published": "2017-02-22T23:28:00.000+02:00", "crawled": "2017-02-22T20:20:30.652+02:00", "highlightTitle": ""}