{"organizations": [], "uuid": "159eef7e212cf6e9b82d0338555d02e4baaff453", "thread": {"social": {"gplus": {"shares": 1}, "pinterest": {"shares": 0}, "vk": {"shares": 0}, "linkedin": {"shares": 0}, "facebook": {"likes": 429, "shares": 429, "comments": 0}, "stumbledupon": {"shares": 0}}, "site_full": "www.telegraph.co.uk", "main_image": "http://www.telegraph.co.uk/content/dam/women/2017/02/21/JS120576820_Hulton-Royals-Collection_Silver-Wedding-1918-xlarge_trans_NvBQzQNjv4BqMLrZ2J758MaqNfFhMX8nM3panlaB43xubNKzSm94m_U.jpg", "site_section": "", "section_title": "", "url": "http://www.telegraph.co.uk/women/family/100-years-since-house-windsor-got-name-did-happen/", "country": "US", "domain_rank": 317, "title": "100 years since the House of Windsor got its name - but how did it happen?", "performance_score": 4, "site": "telegraph.co.uk", "participants_count": 0, "title_full": "100 years since the House of Windsor got its name - but how did it happen?", "spam_score": 0.004, "site_type": "news", "published": "2017-02-22T04:19:00.000+02:00", "replies_count": 0, "uuid": "159eef7e212cf6e9b82d0338555d02e4baaff453"}, "author": "Harry Mount", "url": "http://www.telegraph.co.uk/women/family/100-years-since-house-windsor-got-name-did-happen/", "ord_in_thread": 0, "title": "100 years since the House of Windsor got its name - but how did it happen?", "locations": [], "entities": {"persons": [{"name": "george vi", "sentiment": "neutral"}, {"name": "duke", "sentiment": "none"}, {"name": "william", "sentiment": "none"}, {"name": "elizabeth windsor", "sentiment": "none"}, {"name": "elizabeth tudor", "sentiment": "none"}, {"name": "mary", "sentiment": "none"}, {"name": "george v", "sentiment": "none"}, {"name": "albert", "sentiment": "none"}, {"name": "henry", "sentiment": "none"}, {"name": "elizabeth stuart", "sentiment": "none"}, {"name": "graham greene", "sentiment": "none"}, {"name": "elizabeth plantagenet", "sentiment": "none"}, {"name": "prince george", "sentiment": "none"}, {"name": "harewood", "sentiment": "none"}, {"name": "queen victoria", "sentiment": "none"}, {"name": "george", "sentiment": "none"}], "locations": [{"name": "hertfordshire", "sentiment": "none"}, {"name": "gloucester", "sentiment": "none"}, {"name": "london", "sentiment": "none"}, {"name": "windsor", "sentiment": "none"}], "organizations": [{"name": "house of windsor", "sentiment": "neutral"}, {"name": "duke of kent", "sentiment": "none"}, {"name": "queen mary credit: w. & d. downey/getty images harry mount", "sentiment": "none"}]}, "highlightText": "", "language": "english", "persons": [], "text": "Family 100 years since the House of Windsor got its name - but how did it happen? King George VI, Prince Albert, Prince George, Duke of Kent, Queen Mary, Prince Henry, Duke of Gloucester, King George V, (1865 - 1936), and Countess of Harewood, Mary, Princess Royal celebrating the Silver Wedding Anniversary of King George and Queen Mary Credit: W. & D. Downey/Getty Images Harry Mount 21 February 2017 • 2:42pm \nI f history had gone a little differently, it wouldn’t be Elizabeth Windsor who has just celebrated 65 years on the throne – but Elizabeth Tudor, Elizabeth Stuart or even Elizabeth Plantagenet. \nAll those ancient, dynastic names were considered a century ago as replacements for George V’s real surname – Saxe-Coburg-Gotha, given to the royal family by Prince Albert when he married Queen Victoria . \nIn 1917, anti-German feeling was so bad that, Graham Greene said, dachshunds were kicked on the streets of his native Berkhamsted, in Hertfordshire; it is that sentiment that is explored in a new Channel 4 series, The Royal House of Windsor. Prince William's christening in 1982 Credit: Fox Photos/Getty Images \nD uring the First World War, the royal family were doubly damned. Not only did they have a German surname, and buckets of German blood flowing through their veins. But also the bombs raining down on London were dropped by planes with the distinctly embarrassing name... Premium Subscribe now for full access or register to continue reading Subscribe now for full access or register to continue Register / free One Premium article per week Newsletters and daily briefings ", "external_links": [], "published": "2017-02-22T04:19:00.000+02:00", "crawled": "2017-02-21T23:56:06.873+02:00", "highlightTitle": ""}