{"organizations": [], "uuid": "21a3882a4f4fd394e084e4e31f2856993f42e734", "thread": {"social": {"gplus": {"shares": 0}, "pinterest": {"shares": 0}, "vk": {"shares": 0}, "linkedin": {"shares": 0}, "facebook": {"likes": 796, "shares": 796, "comments": 0}, "stumbledupon": {"shares": 0}}, "site_full": "metro.co.uk", "main_image": "", "site_section": "", "section_title": "", "url": "http://metro.co.uk/2017/02/27/zlatan-ibrahimovic-is-carrying-jose-mourinhos-manchester-united-says-liverpool-great-jamie-carragher-6477402/", "country": "US", "domain_rank": 1779, "title": "Man United news: Zlatan Ibrahimovic is 'carrying' Jose Mourinho’s side, says Jamie Carragher | Metro News", "performance_score": 7, "site": "metro.co.uk", "participants_count": 0, "title_full": "Man United news: Zlatan Ibrahimovic is 'carrying' Jose Mourinho’s side, says Jamie Carragher | Metro News", "spam_score": 0.046, "site_type": "news", "published": "2017-02-28T03:02:00.000+02:00", "replies_count": 0, "uuid": "21a3882a4f4fd394e084e4e31f2856993f42e734"}, "author": "Louis Sealey For Metro.Co.Uk", "url": "http://metro.co.uk/2017/02/27/zlatan-ibrahimovic-is-carrying-jose-mourinhos-manchester-united-says-liverpool-great-jamie-carragher-6477402/", "ord_in_thread": 0, "title": "Man United news: Zlatan Ibrahimovic is 'carrying' Jose Mourinho’s side, says Jamie Carragher | Metro News", "locations": [], "entities": {"persons": [{"name": "zlatan ibrahimovic", "sentiment": "negative"}, {"name": "pictur", "sentiment": "negative"}, {"name": "louis sealey", "sentiment": "negative"}, {"name": "jamie carragher", "sentiment": "negative"}, {"name": "jose mourinho", "sentiment": "negative"}, {"name": "zlatan", "sentiment": "none"}, {"name": "getty", "sentiment": "none"}, {"name": "carragher", "sentiment": "none"}, {"name": "ibrahimovic", "sentiment": "none"}, {"name": "andriy shevchenko", "sentiment": "none"}], "locations": [{"name": "old trafford", "sentiment": "none"}, {"name": "england", "sentiment": "none"}, {"name": "italy", "sentiment": "none"}, {"name": "wembley", "sentiment": "none"}], "organizations": [{"name": "metro news", "sentiment": "negative"}, {"name": "manchester united", "sentiment": "negative"}, {"name": "efl", "sentiment": "none"}, {"name": "southampton", "sentiment": "none"}, {"name": "red devils", "sentiment": "none"}, {"name": "liverpool", "sentiment": "none"}, {"name": "premier league", "sentiment": "none"}, {"name": "united", "sentiment": "none"}]}, "highlightText": "", "language": "english", "persons": [], "text": "Louis Sealey for Metro.co.uk Monday 27 Feb 2017 8:02 pm Manchester United boss Jose Mourinho (Picture: Getty) \nZlatan Ibrahimovic is ‘carrying’ Manchester United through the current campaign, according to Liverpool great Jamie Carragher. \nThe Swedish superstar, who joined the Red Devils on a free transfer last summer, took his tally for the season to 26 at the weekend. \nIbrahimovic scored a brace at Wembley to ensure United beat Southampton 3-2 in the EFL Cup final, and Carragher admits his performances have been ‘unbelievable’. \n‘I think it’s unbelievable what we’re watching,’ Carragher said on Monday Night Football. \n‘Zlatan throughout his career, there was always a feeling in England, that he was a flat track bully. He won everything in Italy but in Champions League games against English sides, it never quite happened. Zlatan Ibrahimovic has been in fine form under Jose Mourinho (Picture: Getty) Jamie Carragher has hailed Ibrahimovic’s influence at Old Trafford (Picture: Getty) \n‘But to think that after the age of 30, he’s got 200 goals. You think of Andriy Shevchenko, one of the best strikers in the world, he found it too difficult [in the Premier League]. ", "external_links": [], "published": "2017-02-28T03:02:00.000+02:00", "crawled": "2017-02-28T04:52:31.643+02:00", "highlightTitle": ""}