{"organizations": [], "uuid": "9b95a163b622bc79dc2ff7fe3fa5b22713505d54", "thread": {"social": {"gplus": {"shares": 2}, "pinterest": {"shares": 0}, "vk": {"shares": 0}, "linkedin": {"shares": 0}, "facebook": {"likes": 250, "shares": 250, "comments": 0}, "stumbledupon": {"shares": 0}}, "site_full": "m.mlb.com", "main_image": "http://m.mlb.com/assets/images/9/6/4/217194964/cuts/de_aza_1280_s4nlfbbz_5kcjjxy6.jpg", "site_section": "http://mlb.mlb.com/partnerxml/gen/news/rss/oak.xml", "section_title": "OAK Homepage News", "url": "http://m.mlb.com/news/article/217154658/revere-valbuena-lamarre-lift-angels-past-as/", "country": "US", "domain_rank": 627, "title": "De Aza, Canha click in A's home opener", "performance_score": 2, "site": "mlb.com", "participants_count": 1, "title_full": "De Aza, Canha click in A's home opener", "spam_score": 0.0, "site_type": "news", "published": "2017-02-27T05:53:00.000+02:00", "replies_count": 0, "uuid": "9b95a163b622bc79dc2ff7fe3fa5b22713505d54"}, "author": "Jane Lee and Maria Guardado", "url": "http://m.mlb.com/news/article/217154658/revere-valbuena-lamarre-lift-angels-past-as/", "ord_in_thread": 0, "title": "De Aza, Canha click in A's home opener", "locations": [], "entities": {"persons": [{"name": "canha", "sentiment": "negative"}, {"name": "de aza", "sentiment": "negative"}, {"name": "alejandro de aza", "sentiment": "negative"}, {"name": "sean manaea", "sentiment": "none"}, {"name": "ben revere", "sentiment": "none"}, {"name": "luis valbuena", "sentiment": "none"}, {"name": "bud norris", "sentiment": "none"}, {"name": "mike scioscia", "sentiment": "none"}, {"name": "mark canha", "sentiment": "none"}, {"name": "jc ramirez", "sentiment": "none"}, {"name": "ryan lamarre", "sentiment": "none"}, {"name": "lamarre", "sentiment": "none"}, {"name": "ryan lavarnway", "sentiment": "none"}, {"name": "jane lee", "sentiment": "none"}, {"name": "kendall graveman", "sentiment": "none"}, {"name": "franklin barreto", "sentiment": "none"}, {"name": "jaycob brugman", "sentiment": "none"}, {"name": "maria guardado", "sentiment": "none"}], "locations": [{"name": "scottsdale stadium", "sentiment": "none"}, {"name": "hohokam stadium", "sentiment": "none"}, {"name": "los angeles", "sentiment": "none"}, {"name": "tempe diablo stadium", "sentiment": "none"}], "organizations": [{"name": "cactus league", "sentiment": "none"}, {"name": "rbi", "sentiment": "none"}, {"name": "angels", "sentiment": "none"}, {"name": "giants", "sentiment": "none"}, {"name": "major league baseball", "sentiment": "none"}, {"name": "padres", "sentiment": "none"}]}, "highlightText": "", "language": "english", "persons": [], "text": "De Aza, Canha click in A's home opener De Aza's triple 0:30 Alejandro De Aza slides into 3rd base with a triple after unloading a deep shot to center field in the bottom of the 3rd By Jane Lee and Maria Guardado / MLB.com | +   Outfielder Ryan LaMarre 's tiebreaking, two-run single in the seventh inning propelled the Angels to a 5-3 Cactus League victory over the A's at Hohokam Stadium on Sunday afternoon. \nOutfielder Ben Revere and third baseman Luis Valbuena -- who signed with the Angels this offseason -- chipped in with RBI doubles to help Los Angeles secure its second win in as many tries. Full Game Coverage \nThe A's, meanwhile, seek their first spring victory, despite out-hitting the Angels, 6-5. Outfielder Alejandro De Aza tripled and scored on Mark Canha 's ensuing double in the third, and catcher Ryan Lavarnway doubled and was brought home on outfielder Jaycob Brugman 's single in the seventh. Top prospect Franklin Barreto finished with two hits. LaMarre's two-RBI single LAA@OAK: LaMarre drives in two runs with bloop single Ryan LaMarre brings home two runs with a bloop single up the middle to give the Angels a 4-2 lead in the top of the 7th \nRight-hander Bud Norris , competing for the fifth spot in the Angels' rotation after signing on as a free agent last month, struck out two and issued one free pass in 1 2/3 innings in his first spring start. \n\"Bud was fine, just overthrowing a little bit,\" Angels manager Mike Scioscia said. \"I think he settled in. You saw him really show some life on his fastball, really good slider.\" \nOn the other side, A's No.   -- getting a surprise start amid team pitching changes -- provided two scoreless innings with no hits and two walks allowed. \n\"He got outs,\"   \"Probably not the command that he wanted, but probably some nerves in his first start.\" \nWHAT'S NEXT Angels: Right-hander JC Ramirez , who is competing for the fifth spot in the Angels' rotation, will make his first start of the spring Monday when the Halos host the Padres at Tempe Diablo Stadium. First pitch is scheduled for 12:10 p.m. PT (watch live on MLB.TV ). \nAthletics: Right-hander Kendall Graveman , who anchored an injury-riddled staff last year, will make   in a 12:05 p.m. PT matchup with the host Giants at Scottsdale Stadium on Monday. Left-hander Sean Manaea , expected to slot behind Graveman in the No. 3 spot of the rotation, will also pitch in the game. Listen to a free webcast on athletics.com. \nWatch every out-of-market regular-season game live on MLB.TV . has covered the A's for MLB.com since 2010. covers the Angels for MLB.com. This story was not subject to the approval of Major League Baseball or its clubs. Share This", "external_links": [], "published": "2017-02-27T05:53:00.000+02:00", "crawled": "2017-02-27T02:04:08.366+02:00", "highlightTitle": ""}