{"organizations": [], "uuid": "1429e7de03236c97d6b83d4f4041468aafc8f168", "thread": {"social": {"gplus": {"shares": 0}, "pinterest": {"shares": 0}, "vk": {"shares": 0}, "linkedin": {"shares": 0}, "facebook": {"likes": 175, "shares": 175, "comments": 0}, "stumbledupon": {"shares": 0}}, "site_full": "bdnews24.com", "main_image": "http://d30fl32nd2baj9.cloudfront.net/bangla-media/2017/02/04/sirajganj-journalist-dead-5-.jpg/ALTERNATES/w640/Sirajganj-Journalist-dead+%285%29.jpg", "site_section": "http://bdnews24.com/?widgetName=rssfeed&widgetId=1150&getXmlFeed=true#", "section_title": "wf-escenic-times - Home", "url": "http://bdnews24.com/bangladesh/2017/02/04/police-blame-mayor-for-sirajganj-journalist-shimul-s-death", "country": "US", "domain_rank": 2276, "title": "Police blame mayor for Sirajganj journalist Shimul's death", "performance_score": 1, "site": "bdnews24.com", "participants_count": 0, "title_full": "Police blame mayor for Sirajganj journalist Shimul's death", "spam_score": 0.0, "site_type": "news", "published": "2017-02-04T21:15:00.000+02:00", "replies_count": 0, "uuid": "1429e7de03236c97d6b83d4f4041468aafc8f168"}, "author": "", "url": "http://bdnews24.com/bangladesh/2017/02/04/police-blame-mayor-for-sirajganj-journalist-shimul-s-death", "ord_in_thread": 0, "title": "Police blame mayor for Sirajganj journalist Shimul's death", "locations": [], "entities": {"persons": [{"name": "shimul", "sentiment": "negative"}, {"name": "km nasuruddin", "sentiment": "none"}, {"name": "azad rahman", "sentiment": "none"}, {"name": "upazila", "sentiment": "none"}, {"name": "hasnat", "sentiment": "none"}, {"name": "abdul hakim shimul", "sentiment": "none"}, {"name": "abdur rahim", "sentiment": "none"}, {"name": "miru", "sentiment": "none"}, {"name": "swapan", "sentiment": "none"}, {"name": "rahim", "sentiment": "none"}, {"name": "rezaul", "sentiment": "none"}, {"name": "kamal debnath", "sentiment": "none"}, {"name": "hasibur rahman swapan", "sentiment": "none"}, {"name": "habibul haque mintu", "sentiment": "none"}, {"name": "abul hasnat", "sentiment": "none"}, {"name": "hafizul haque pintu", "sentiment": "none"}, {"name": "samakal", "sentiment": "none"}, {"name": "halimul haque miru", "sentiment": "none"}], "locations": [{"name": "sirajganj", "sentiment": "none"}, {"name": "shahzadpur", "sentiment": "none"}, {"name": "bogra", "sentiment": "none"}, {"name": "dhaka", "sentiment": "none"}], "organizations": [{"name": "mamun al rajib", "sentiment": "none"}, {"name": "shahzadpur awami league", "sentiment": "none"}, {"name": "upazila council", "sentiment": "none"}, {"name": "shahzadpur pilot high school", "sentiment": "none"}, {"name": "awami league", "sentiment": "none"}, {"name": "uno", "sentiment": "none"}]}, "highlightText": "", "language": "english", "persons": [], "text": "Police blame mayor for Sirajganj journalist Shimul's death Sirajganj Correspondent, bdnews24.com Journalist Abdul Hakim Shimul died when hit by bullet fired by Sirajganj's Shahzadpur Municipality Mayor Halimul Haque Miru, police said. Related Stories \n'Mayor' fired the fatal shot \nOn Thursday, there was a violent clash between supporters of sacked Shahzadpur Awami League president Abdur Rahim (VP Rahim) and those of the party unit's Organising Secretary and Mayor Miru. \nBangla national daily Samakal's local correspondent Shimul was hit on his head by a bullet while covering the clash. \nThat led to his death on Friday while he was being transferred for better treatment to Dhaka from Bogra. \nPolice said they acted promptly after the clash erupted. \n\"I was there on the spot. The mayor opened fire ignoring my repeated requests. Only the mayor fired, no one else did. He fired several times,\" said Additional Superintendent of Police Abul Hasnat. \nHis statement came on Saturday before Shimul's funeral prayer at the Shahzadpur Pilot High School grounds. \"It's an unfortunate incident, which took place in front of us. We will bring the culprit to justice.\" \nThe senior police officer said they have seized 43 rounds of ammunition from the mayor's house and six empty cartridges from the spot. \nA manhunt is on for Mayor Miru and he can be arrested soon, said Hasnat. \nLocal MP Hasibur Rahman Swapan, Upazila administration chief (UNO) Mamun Al Rajib, Upazila Council Chairman and Shahzadpur Awami League General Secretary Azad Rahman also attended the funeral prayers. \n\"Shahzadpur residents are well aware of the gun-toting mayor and his brothers. A journalist has died when hit by bullets fired by him (mayor). It's a shameful incident,\" said Awami League lawmaker Swapan. \nMayor Miru, however, claimed after Thursday's clash that he had fired only once in the air. Tension has gripped through the Shahzadpur town since the incident. A six-hour general strike has been observed on Saturday.\nShimul's family has started a police case against 18 persons, including Mayor Miru. \nThe investigating officer, Sub-Inspector Kamal Debnath said they have detained three persons so far. \nThey are the mayor's brothers, Hafizul Haque Pintu and Habibul Haque Mintu, and local Awami League leader KM Nasuruddin. \nThe mayor's shotgun has been seized already, said Shahzadpur police OC Rezaul.", "external_links": [], "published": "2017-02-04T21:15:00.000+02:00", "crawled": "2017-02-04T11:34:15.807+02:00", "highlightTitle": ""}