{"organizations": [], "uuid": "6f26cc5aa2cc940c23e368bfa90c861a754a4a50", "thread": {"social": {"gplus": {"shares": 0}, "pinterest": {"shares": 0}, "vk": {"shares": 0}, "linkedin": {"shares": 0}, "facebook": {"likes": 871, "shares": 871, "comments": 0}, "stumbledupon": {"shares": 0}}, "site_full": "au.news.yahoo.com", "main_image": "https://s.yimg.com/iu/api/res/1.2/r1O.3O4FBEmUksHqfEwGgg--/YXBwaWQ9eXZpZGVvO3c9NjMxO2g9MzU0O2R4PTc7ZHk9MTtjdz0xMTIzO2NoPTYzMDtxPTcwO249MTt1bGNyb3A7cm90YXRlPWF1dG8-/https://s.yimg.com/ea/img/-/170226/58b22514bacc8_635screen_shot_2017_02_26_at_11.05.22_am.png", "site_section": "", "section_title": "", "url": "https://au.news.yahoo.com/a/34499996/kurdish-rudaw-tv-reporter-killed-by-roadside-bomb-while-on-assignment-in-war-torn-mosul-iraq/", "country": "AU", "domain_rank": 5, "title": "Kurdish Rudaw TV reporter killed by roadside bomb while on assignment in war-torn Mosul Iraq - Yahoo7", "performance_score": 8, "site": "yahoo.com", "participants_count": 0, "title_full": "Kurdish Rudaw TV reporter killed by roadside bomb while on assignment in war-torn Mosul Iraq - Yahoo7", "spam_score": 0.012, "site_type": "news", "published": "2017-02-26T07:34:00.000+02:00", "replies_count": 0, "uuid": "6f26cc5aa2cc940c23e368bfa90c861a754a4a50"}, "author": "On February", "url": "https://au.news.yahoo.com/a/34499996/kurdish-rudaw-tv-reporter-killed-by-roadside-bomb-while-on-assignment-in-war-torn-mosul-iraq/", "ord_in_thread": 0, "title": "Kurdish Rudaw TV reporter killed by roadside bomb while on assignment in war-torn Mosul Iraq - Yahoo7", "locations": [], "entities": {"persons": [{"name": "masoud barzani", "sentiment": "none"}, {"name": "gardi", "sentiment": "none"}, {"name": "safeen dizayee", "sentiment": "none"}, {"name": "albu saif", "sentiment": "none"}, {"name": "rudow  cameraman younis mustafa", "sentiment": "none"}, {"name": "rudaw", "sentiment": "none"}, {"name": "shifa gardi", "sentiment": "none"}, {"name": "orla guerin", "sentiment": "none"}, {"name": "nicholas kristof", "sentiment": "none"}, {"name": "barzani", "sentiment": "none"}], "locations": [{"name": "mosul iraq", "sentiment": "none"}, {"name": "iran", "sentiment": "none"}, {"name": "albu saif", "sentiment": "none"}, {"name": "kurdistan", "sentiment": "none"}, {"name": "erbil", "sentiment": "none"}, {"name": "mosul airport gardi", "sentiment": "none"}, {"name": "shifa gardi", "sentiment": "none"}, {"name": "iraq", "sentiment": "none"}, {"name": "mosul", "sentiment": "none"}], "organizations": [{"name": "kurdistan", "sentiment": "none"}, {"name": "islamic state", "sentiment": "none"}, {"name": "isis", "sentiment": "none"}, {"name": "rudaw media network", "sentiment": "none"}, {"name": "salahaddin university", "sentiment": "none"}]}, "highlightText": "", "language": "english", "persons": [], "text": "Share Kurdish Rudaw TV reporter killed by roadside bomb while on assignment in war-torn Mosul Iraq - Yahoo7 A Kurdish reporter has been killed by a roadside bomb in Mosul, Iraq on the same day she reported live from the scene in the war-torn city. Close Kurdish journalist Shifa Gardi killed by roadside bomb while reporting in Mosul UP NEXT VIDEO The reporter and anchor had reported live from the scene on February 25, as the footage shows, before she was killed. Source: Rudaw Kurdish journalist Shifa Gardi killed by roadside bomb while reporting in Mosul \nKurdish news outlet Rudaw announced on Saturday that its journalist and anchor, Shifa Gardi, 30, had been killed by a bomb while on assignment covering the advance of Iraqi forces into western parts of the nation held by Islamic State militants. \nGardi had reported live from Mosul earlier in the day and had been embedded with Iraqi forces in the western Mosul offensive in Albu Saif as recently as February 22. Gardi was described as \"daring and courageous\" by the TV network that employed her. Photo: Rudow The reporter was killed by a roadside bomb. Photo: Rudow \nCameraman Younis Mustafa was injured in the same attack, Rudaw said. \nA statement from Rudaw said she was one of the network's most daring and courageous journalists. \n\"She was known as a renowned skilled journalist in Kurdish news media, and brought outstanding coverage to Rudaw TV right from the beginning of its establishment,\" the statement on the network's website said. \nGardi and her team were on a mission to investigate a mass grave where it was alleged that IS militants had killed and buried hundreds of civilians in Mosul, the website said. Close Iraq Forces Take Full Control of Mosul Airport UP NEXT VIDEO Iraq Forces Take Full Control of Mosul Airport Gardi had done a live cross from Mosul earlier in the day. Photo: Rudow The TV reporter was killed the same day that she made this live cross from the scene in Mosul. Photo: Rudow The reporter, seen here interviewing a military official in Mosul, has been remembered as brave in the face of danger. Photo: Rudow \nWhile Iraqi forces continue to face stiff resistance from IS in the area, troops entered the western districts of Mosul for the first time on Friday as part of an offensive which began in October. \nThe Rudaw website said Gardi had been presenting a daily special program on the Mosul offensive. #Rudaw 's war corespondent and anchor, a female journalist who \"cracked the glass ceiling\" killed by roadside bomb in #Mosul pic.twitter.com/FsOoUUU9se — Rudaw English (@RudawEnglish) February 25, 2017 \nIt said in her last report she had spoken about the people that had fled IS by bus. \n\"Five buses, fraught with people, including a majority of women and children have run away,” she said. \n\"Their situation is miserable and have left everything,” said added aboard one such bus. \n\"There were only women and children with some men and juveniles. After they undergo investigations making sure that they have not helped ISIS militants, they will be allowed to take shelter at refugee camps.” \nGardi was born a refugee in Iran on July 1, 1986 and started her career in the media in 2006 after graduating from a media studies course from the Salahaddin University in Erbil. Not an enemy of the people. Just a brave reporter who is no more. RIP. https://t.co/coGr4kJufI — Nicholas Kristof (@NickKristof) February 25, 2017 Very sorry to learn of the death of brave Kurdish reporter #ShifaGardi of #Rudaw `TV on the frontline in #Mosul . Sympathies with her family https://t.co/MEYIPAeF7O — Orla Guerin (@OrlaGuerin) February 25, 2017 My heartfelt condolences to Shifa Gardi's family, friends & co-workers. Kurdistan lost a great journalist. Wish the cameraman full recovery. — Safeen Dizayee (@SafeenDizayee) February 25, 2017 \nTributes have flown in for the journalist, with Kurdish President Masoud Barzani describing her as a \"role model\" for women. \n\"Her death reiterates the role, position, sacrifice and resilience of women and proud youth of Kurdistan’s nation,\" President Barzani's statement said. \n\"On this sad occasion, I direct my condolences to the family of Gardi, her colleagues at Rudaw Media Network and Kurdistan’s journalists as a whole. May she rest in peace.\" \nOn February 21, while she was covering the war, Gardi rescued a wounded rabbit that had been searching for refuge. \n\"I encountered an injured rabbit in the village of Albu Saif which was liberated yesterday evening,” Gardi told Rudaw when she returned to the newsroom. Gardi rescued a wounded rabbit while reporting on the war in Iraq. Photo: Rudaw \n\"The rabbit is suffering from malnutrition which has caused visible damage to its face. \n\"I brought it back with me. We will be treating the rabbit and then give it to an animal protection agency which is willing to look after it.\" Close No food or water in Iraq's Mosul UP NEXT ", "external_links": [], "published": "2017-02-26T07:34:00.000+02:00", "crawled": "2017-02-26T04:23:33.501+02:00", "highlightTitle": ""}