{"organizations": [], "uuid": "89dd3dbd27073a425904956658e40fbb21ac6d0d", "thread": {"social": {"gplus": {"shares": 0}, "pinterest": {"shares": 0}, "vk": {"shares": 0}, "linkedin": {"shares": 0}, "facebook": {"likes": 210, "shares": 210, "comments": 0}, "stumbledupon": {"shares": 0}}, "site_full": "www.thesun.co.uk", "main_image": "https://www.thesun.co.uk/wp-content/uploads/2017/02/sport-preview-arsenal-training.jpg?strip=all&#038;w=620&#038;h=413&#038;crop=1", "site_section": "https://www.thesun.co.uk/feed", "section_title": "The Sun", "url": "https://www.thesun.co.uk/sport/football/2905047/arsene-wenger-admits-fa-cup-defeat-against-sutton-on-plastic-pitch-would-be-a-disaster/", "country": "GB", "domain_rank": 2180, "title": "Arsene Wenger admits FA Cup defeat against Sutton on plastic pitch would be a disaster", "performance_score": 2, "site": "thesun.co.uk", "participants_count": 1, "title_full": "Arsene Wenger admits FA Cup defeat against Sutton on plastic pitch would be a disaster", "spam_score": 0.0, "site_type": "news", "published": "2017-02-20T06:03:00.000+02:00", "replies_count": 0, "uuid": "89dd3dbd27073a425904956658e40fbb21ac6d0d"}, "author": "supal", "url": "https://www.thesun.co.uk/sport/football/2905047/arsene-wenger-admits-fa-cup-defeat-against-sutton-on-plastic-pitch-would-be-a-disaster/", "ord_in_thread": 0, "title": "Arsene Wenger admits FA Cup defeat against Sutton on plastic pitch would be a disaster", "locations": [], "entities": {"persons": [{"name": "sutton", "sentiment": "negative"}, {"name": "arsene wenger", "sentiment": "negative"}, {"name": "ian wright", "sentiment": "none"}, {"name": "tom barclay malachi linton", "sentiment": "none"}, {"name": "danny cowley", "sentiment": "none"}, {"name": "sutton  danny welbeck", "sentiment": "none"}, {"name": "danny welbeck", "sentiment": "none"}, {"name": "lionel messi", "sentiment": "none"}, {"name": "neil ashton comments arsene wenger", "sentiment": "none"}, {"name": "roarie deacon", "sentiment": "none"}, {"name": "willy caballero", "sentiment": "none"}, {"name": "lincoln", "sentiment": "none"}, {"name": "mauricio pochettino", "sentiment": "none"}, {"name": "gabriel jesus", "sentiment": "none"}, {"name": "radamel falcao", "sentiment": "none"}, {"name": "sean raggett", "sentiment": "none"}, {"name": "ross worner", "sentiment": "none"}, {"name": "wayne shaw", "sentiment": "none"}, {"name": "walcott", "sentiment": "none"}, {"name": "wenger", "sentiment": "none"}, {"name": "welbeck", "sentiment": "none"}, {"name": "shaw", "sentiment": "none"}, {"name": "ben chilwell", "sentiment": "none"}, {"name": "steve morison", "sentiment": "none"}, {"name": "collins", "sentiment": "none"}], "locations": [{"name": "man city", "sentiment": "none"}, {"name": "kingsmeadow", "sentiment": "none"}, {"name": "warbury", "sentiment": "none"}, {"name": "manchester city", "sentiment": "none"}, {"name": "leicester", "sentiment": "none"}, {"name": "mars", "sentiment": "none"}, {"name": "gander green lane", "sentiment": "none"}], "organizations": [{"name": "getty images arsenal", "sentiment": "none"}, {"name": "barca struggles barcelona", "sentiment": "none"}, {"name": "press association", "sentiment": "none"}, {"name": "southampton", "sentiment": "none"}, {"name": "tottenham", "sentiment": "none"}, {"name": "leeds", "sentiment": "none"}, {"name": "getty images", "sentiment": "none"}, {"name": "millwall", "sentiment": "none"}, {"name": "nine premier league", "sentiment": "none"}, {"name": "ipswich", "sentiment": "none"}, {"name": "arsenal", "sentiment": "none"}, {"name": "fulham", "sentiment": "none"}, {"name": "nandos", "sentiment": "none"}, {"name": "psg", "sentiment": "none"}, {"name": "bayern munich", "sentiment": "none"}, {"name": "burnley", "sentiment": "none"}, {"name": "leganes", "sentiment": "none"}, {"name": "lincoln", "sentiment": "none"}, {"name": "sutton united", "sentiment": "none"}, {"name": "liverpool", "sentiment": "none"}, {"name": "allianz arena", "sentiment": "none"}]}, "highlightText": "", "language": "english", "persons": [], "text": "Arsene Wenger admits FA Cup defeat against Sutton on plastic pitch would be a disaster \nGunners will face Lincoln at home if they can overcome the non-league side By NEIL ASHTON Comments ARSENE WENGER has confessed defeat on Sutton’s plastic pitch would be an absolute sickener. \nWenger warned his fading Arsenal stars not to take it easy in Monday’s fifth-round clash at the Sun Bets-sponsored non-league side’s Gander Green Lane. Getty Images 5 Arsene Wenger looked stressed during Arsenals training session on Sunday \nThe Gunners are under huge pressure to reach the quarter-finals after their shameful 5-1 defeat against Bayern Munich. \nKeep up to date with ALL the Arsenal news, gossip, transfers and goals on our club page plus fixtures, results and live match commentary. \nWenger said: “When you hate defeat like I hate defeat, it’s always tough. As well, I’m determined to fight back. Every defeat is harder. I can never transmit to you my feelings about defeats. \n“A player I managed for the first time when I was 33 or 34 said that I threw up after our first defeat. Whether you are young or old, every defeat hurts.” \nWenger, who also admitted he is not happy to be playing on a synthetic surface, needs a victory to save Arsenal’s season. PA:Press Association Arsene Wenger needs a victory against Sutton to save his and Arsenal’s season \nAnd he is determined to avoid an embarrassing exit like Leicester and Burnley suffered. \nThe Emirates chief added: “First we have to worry about the pitch and secondly their enthusiasm. \n“And thirdly that we are not ready for a big fight and subconsciously think that they are a non-league team and it is no matter. That will not happen.” Southampton 0-5 Arsenal : Walcott bags a hat-trick and Welbeck a brace Getty Images Arsenal train on Sunday ahead of visiting Sutton in the fifth round on Monday night related articles New striker: There's trouble in the changing room at Warbury... Holy Cowl Danny Cowley's motivation for stunning FA Cup upset came from his daughter's Mars bar a week ago barcA STRUGGLES Barcelona 2 Leganes 1: Lionel Messi's late penalty sees off relegation battlers as Catalan side fail to impress again following PSG rout He Shaw is saucy Sutton United's reserve goalkeeper Wayne Shaw is famed for his 'Roly-Poly Goalie' chilli sauce Cup and away Liverpool and Man City among the NINE Premier League teams using cup action to take their own winter break Tree surgin' Sutton goalkeeper Ross Worner used to be a lumberjack... and now he's ready to cut Arsenal down to size JESUS HEALING Manchester City star Gabriel Jesus on the mend after successful metatarsal operation Peri-peri special Lincoln's FA Cup hero Sean Raggett celebrated his winner by 'eating like a king' at Nandos foxes chick it in Leicester's Ben Chilwell was too scared of Millwall fans to take throw-ins, claims Steve Morison TALKING POINT Mauricio Pochettino reveals how crisis talks spurred his Tottenham side on prior to Fulham FA Cup win EXCLUSIVE Willy Caballero fears that Radamel Falcao is rediscovering world-class form ahead of Euro clash TOM BARCLAY Malachi Linton handed chance to reignite Ipswich dream less than a year after being released I will be a manager somewhere next season says Arsenal manager Wenger \nWimbledon players moaned about the pitch before they were beaten in a replay at Kingsmeadow, while Championship side Leeds also did not find it to their liking, either, in the last round. \nNow it is the turn of Arsenal to find a way to combat a 3G surface that was installed in 2015. \nWenger, who has lost just once to lower-league opposition in 21 years in charge, said: “Ideally we would like to play on a normal pitch. \n“But it has been accepted and the competition is to deal with what you face. We have practised inside because that is an artificial pitch. Sutton United 1-0 Leeds : Collins’ penalty causes FA Cup shock PA:Press Association 5 Arsene Wenger has lost just one game against lower league opposition in the last 21 days \n“It is not the same because it’s a dry pitch and I’ve heard Sutton water theirs before games and is quicker. \n“The weight on the joints is different and you cannot slide to block every time, so it makes football a bit different. \n“The ball comes to you suddenly and accelerates and does not slow down like in a normal game, so we have to get used to the different speed.” \nWenger knows he is under scrutiny again following last Wednesday’s humiliation inside the Allianz Arena. \nThe Frenchman, who wants to stay at Arsenal beyond the end of the season, insists he is a winner. He added: “I am a positive person. I am a fighter. You don’t stay as long in this job otherwise.” Sutton United's Roarie Deacon tells us his Arsenal story and how he cannot wait to meet his old pals Getty Images Danny Welbeck will not be risked on the artificial pitch against Sutton \nDanny Welbeck will not be involved tonight after claiming the pitch will affect his recovery from injury. \nThe striker, 26, KO’d by two serious knee injuries in 20 months, played 70 minutes for the Under-23s in their 2-1 defeat by Leicester. \nBut Welbeck tweeted: “Glad to get 70 minutes to build up my match fitness. Plastic pitch at Sutton isn’t the best idea at the moment.” Ian Wright checks out the Sutton United players' shooting ability", "external_links": [], "published": "2017-02-20T06:03:00.000+02:00", "crawled": "2017-02-20T04:39:19.752+02:00", "highlightTitle": ""}