{"organizations": [], "uuid": "d17c19139e33117199addb0c2c997b50e6b2a0de", "thread": {"social": {"gplus": {"shares": 0}, "pinterest": {"shares": 0}, "vk": {"shares": 0}, "linkedin": {"shares": 0}, "facebook": {"likes": 975, "shares": 975, "comments": 0}, "stumbledupon": {"shares": 0}}, "site_full": "www.bola.net", "main_image": "http://cdn.klimg.com/bola.net/library/upload/20/2017/02/barsa_cd2beb8.jpg", "site_section": "http://www.bola.net/feed/", "section_title": "Bola.net", "url": "http://www.bola.net/open-play/highlights-la-liga-barcelona-3-0-athletic-bilbao-823087.html", "country": "ID", "domain_rank": 6470, "title": "Highlights La Liga: Barcelona 3-0 Athletic Bilbao", "performance_score": 9, "site": "bola.net", "participants_count": 1, "title_full": "Highlights La Liga: Barcelona 3-0 Athletic Bilbao", "spam_score": 0.0, "site_type": "news", "published": "2017-02-05T00:21:00.000+02:00", "replies_count": 0, "uuid": "d17c19139e33117199addb0c2c997b50e6b2a0de"}, "author": "editor@bola.net (Editor)", "url": "http://www.bola.net/open-play/highlights-la-liga-barcelona-3-0-athletic-bilbao-823087.html", "ord_in_thread": 0, "title": "Highlights La Liga: Barcelona 3-0 Athletic Bilbao", "locations": [], "entities": {"persons": [{"name": "la liga", "sentiment": "negative"}, {"name": "bilbao", "sentiment": "none"}, {"name": "gomes", "sentiment": "none"}, {"name": "williams", "sentiment": "none"}, {"name": "laporte", "sentiment": "none"}, {"name": "iturraspe", "sentiment": "none"}, {"name": "lionel messi", "sentiment": "none"}, {"name": "de marcos", "sentiment": "none"}, {"name": "vidal", "sentiment": "none"}, {"name": "benat", "sentiment": "none"}, {"name": "garcia", "sentiment": "none"}, {"name": "san jose", "sentiment": "none"}, {"name": "sabtu", "sentiment": "none"}, {"name": "mascherano", "sentiment": "none"}, {"name": "messi", "sentiment": "none"}, {"name": "balenziaga", "sentiment": "none"}, {"name": "aleix vidal", "sentiment": "none"}, {"name": "eraso", "sentiment": "none"}, {"name": "paco alcacer", "sentiment": "none"}, {"name": "iraizoz", "sentiment": "none"}, {"name": "rakitic", "sentiment": "none"}, {"name": "roberto", "sentiment": "none"}, {"name": "rafinha", "sentiment": "none"}, {"name": "alcacer", "sentiment": "none"}, {"name": "lekue", "sentiment": "none"}, {"name": "mathieu", "sentiment": "none"}, {"name": "aduriz", "sentiment": "none"}, {"name": "alvarez", "sentiment": "none"}, {"name": "ter stegen", "sentiment": "none"}], "locations": [{"name": "barcelona", "sentiment": "none"}, {"name": "neymar", "sentiment": "none"}, {"name": "muniain", "sentiment": "none"}, {"name": "umtiti", "sentiment": "none"}], "organizations": [{"name": "la liga", "sentiment": "negative"}, {"name": "athletic bilbao highlights la liga", "sentiment": "negative"}, {"name": "barcelona", "sentiment": "negative"}, {"name": "turan", "sentiment": "none"}, {"name": "athletic bilbao", "sentiment": "none"}, {"name": "statistik barcelona - bilbao", "sentiment": "none"}, {"name": "athletic bilbao minggu", "sentiment": "none"}]}, "highlightText": "", "language": "english", "persons": [], "text": "HOME » OPEN PLAY » HIGHLIGHTS LA LIGA: BARCELONA 3-0 ATHLETIC BILBAO Highlights La Liga: Barcelona 3-0 Athletic Bilbao Minggu, 05-02-2017 00:21 Barcelona © AFP Bola.net - La Liga Spanyol 2016/17 jornada 21, Sabtu (04/2). Barcelona 3 (Paco Alcacer 18, Lionel Messi 40, Aleix Vidal 67); Athletic Bilbao 0. Barcelona (4-3-3): Ter Stegen; Mathieu, Umtiti, Pique (kuning 22) (Mascherano 46), Vidal; Turan, Gomes, Rafinha (Rakitic 54); Neymar, Alcacer, Messi (Roberto 64). Bilbao (4-2-3-1): Iraizoz; Balenziaga, Laporte (kuning 70), Alvarez, De Marcos (kuning 34); Iturraspe (kuning 27), San Jose (Benat 59); Muniain, Garcia (Eraso 74), Lekue (Aduriz 52); Williams. Statistik Barcelona - Bilbao", "external_links": [], "published": "2017-02-05T00:21:00.000+02:00", "crawled": "2017-02-05T01:04:22.761+02:00", "highlightTitle": ""}