{"organizations": [], "uuid": "1066a0783be225ee7302f9b6ca41dadbf8a5027d", "thread": {"social": {"gplus": {"shares": 0}, "pinterest": {"shares": 0}, "vk": {"shares": 0}, "linkedin": {"shares": 0}, "facebook": {"likes": 126, "shares": 126, "comments": 0}, "stumbledupon": {"shares": 0}}, "site_full": "www.news.com.au", "main_image": "http://cdn.newsapi.com.au/image/v1/ac576fcca5231354607873d690442455", "site_section": "http://feeds.news.com.au/public/rss/2.0/news_top_stories_48.xml", "section_title": "RSS News.com.au | 6b4763d854a2308e2a767518cb5372b7", "url": "http://www.news.com.au/national/rush-hour/rush-hour-the-stories-you-need-to-know-today/news-story/c9df3e82ba61b7cda169351b2aede29f", "country": "US", "domain_rank": 1340, "title": "RUSH HOUR: The stories you need to know today", "performance_score": 1, "site": "news.com.au", "participants_count": 0, "title_full": "RUSH HOUR: The stories you need to know today", "spam_score": 0.0, "site_type": "news", "published": "2017-02-06T02:51:00.000+02:00", "replies_count": 0, "uuid": "1066a0783be225ee7302f9b6ca41dadbf8a5027d"}, "author": "", "url": "http://www.news.com.au/national/rush-hour/rush-hour-the-stories-you-need-to-know-today/news-story/c9df3e82ba61b7cda169351b2aede29f", "ord_in_thread": 0, "title": "RUSH HOUR: The stories you need to know today", "locations": [], "entities": {"persons": [{"name": "trump", "sentiment": "negative"}, {"name": "malcolm turnbull", "sentiment": "none"}, {"name": "tommy", "sentiment": "none"}, {"name": "vetrano", "sentiment": "none"}, {"name": "rodrigo duterte", "sentiment": "none"}, {"name": "chris snyder", "sentiment": "none"}, {"name": "donald trump", "sentiment": "none"}, {"name": "putin", "sentiment": "none"}, {"name": "emily jayne collie", "sentiment": "none"}, {"name": "boyce", "sentiment": "none"}, {"name": "emily jayne collier", "sentiment": "none"}, {"name": "bill o’reilly", "sentiment": "none"}, {"name": "hanson", "sentiment": "none"}, {"name": "lewis", "sentiment": "none"}, {"name": "tony abbott", "sentiment": "none"}, {"name": "robert boyce", "sentiment": "none"}, {"name": "laurie oakes", "sentiment": "none"}, {"name": "chanel lewis", "sentiment": "none"}, {"name": "pauline hanson", "sentiment": "none"}, {"name": "duterte", "sentiment": "none"}, {"name": "turnbull", "sentiment": "none"}], "locations": [{"name": "united states", "sentiment": "none"}, {"name": "us", "sentiment": "none"}, {"name": "victoria", "sentiment": "none"}, {"name": "thailand", "sentiment": "none"}, {"name": "kata beach", "sentiment": "none"}, {"name": "karina vetrano", "sentiment": "none"}, {"name": "melbourne", "sentiment": "none"}, {"name": "adelaide", "sentiment": "none"}, {"name": "victoria  thunderstorms", "sentiment": "none"}, {"name": "queens", "sentiment": "none"}, {"name": "new york", "sentiment": "none"}, {"name": "phuket", "sentiment": "none"}, {"name": "australia", "sentiment": "none"}, {"name": "norway", "sentiment": "none"}, {"name": "kyabram", "sentiment": "none"}], "organizations": [{"name": "fox news", "sentiment": "none"}, {"name": "ms collie", "sentiment": "none"}, {"name": "republican party", "sentiment": "none"}, {"name": "department of foreign affairs and trade", "sentiment": "none"}, {"name": "labor", "sentiment": "none"}, {"name": "news corp", "sentiment": "none"}, {"name": "bureau of meteorology", "sentiment": "none"}, {"name": "afp", "sentiment": "none"}, {"name": "coalition", "sentiment": "none"}, {"name": "the new york post", "sentiment": "none"}, {"name": "bangkok post", "sentiment": "none"}, {"name": "arthurs seat", "sentiment": "none"}, {"name": "new york daily news", "sentiment": "none"}, {"name": "new people’s army", "sentiment": "none"}, {"name": "news corp australia", "sentiment": "none"}, {"name": "state emergency service", "sentiment": "none"}]}, "highlightText": "", "language": "english", "persons": [], "text": "RUSH HOUR: The stories you need to know today Live Updates Image Turnbull says that Trump has a commitment to the the refugee deal 0:30 \nOn 60 Minutes with Laurie Oakes, Prime Minister Malcolm Turnbull says that Donald Trump has committed to the refugee deal, but will not have to honour it. February 5th 2017 10 hours ago /video/video.news.com.au/News/Politics/ Saturday Night Live has spoofed Donald Trump once again. But this time, our Prime Minister has been thrown into the mix too. \nMan arrested six months after jogger slaying \nPolice have made a long-awaited arrest over the killing of Queens jogger Karina Vetrano. \nTwenty-year-old Chanel Lewis, from east New York, will be charged with murder and sexual assault, based on DNA testing and “detailed incriminating statements and admissions” he made to detectives. \nChief of Detectives Robert Boyce said Lewis, who has no prior arrest record, was taken into custody on Saturday night. \nLewis was interviewed by police on Thursday after being identified as a potential suspect. He voluntarily provided a DNA sample, which was then matched with DNA recovered from under Ms Vetrano’s fingernails, her back and mobile phone, Boyce said. \nSources told The New York Post the man is in his 20s and had been on the police radar for a while, after an off-duty officer saw him acting suspiciously. He had been questioned previously, and last week had agreed to a DNA sample. \nA close friend of Ms Vetrano’s told the New York Daily News : “I’m literally shaking right now,” upon hearing the news. Police have made a long-awaited arrest over the killing of Queens jogger Karina Vetrano. Source: Supplied \n7.30am \nDuterte threatens air strikes against rebels \nPhilippine President Rodrigo Duterte has issued a warning that the military is ready to respond with air strikes and new offensives if communist rebels launch new attacks. \nMr Duterte called the rebels “terrorists,” as months of steady progress in talks brokered by Norway rapidly turned hostile after New People’s Army rebels killed six soldiers and kidnapped two others in fresh violence. \n“It seems to me that these terrorists want another 50 years of war, of killing of Filipinos,” he said. \n“I don’t want a bloody thing, but if they choose to do it, fine. \n“With my lifting of the ceasefire, they can begin their attacks and we are prepared and I will use the assets. We have so many planes now, we have jets, I will drop all (the bombs).” Rodrigo Duterte has threatened air strikes against communist rebels. Source: AFP \n7.15am \nTrump’s shocking Putin admission \nJaws have dropped within the Republican Party over the following exchange between President Donald Trump and Fox News anchor Bill O’Reilly. Preview: Trump talks @oreillyfactor tmrw before #SuperBowl on @FOXTV - on Putin's record, \"what do you think? Our country's so innocent?\" pic.twitter.com/ohQ8VknFDS — Chris Snyder (@ChrisSnyderFox) February 4, 2017 \nSeveral of Mr Trump’s fellow Republicans have condemned his remarks, saying there is no moral equivalence between the United States and a regime known for killing its political opponents. \nThe full interview will air at 8AM (AEST) today on Fox News. \n7.00am \nAustralian woman killed in Thailand \nAn Australian woman has been killed in a jet-ski collision with her partner in waters off the Thai tourist island of Phuket. \nEmily Jayne Collie, 20, suffered severe neck and shoulder injuries in the crash near Kata Beach late on Sunday afternoon, Thai media reports. \nMs Collie, reportedly from Kyabram, and her partner, named by The Sun as Tommy, had reportedly both hired jet-skis. \nThe paper reported that the couple smashed into each other after they were both blinded by strong sun light reflected from the sea on the island’s Kata Beach at 4.45pm local time. \nMs Collie was reportedly unconscious when she was pulled out of the sea by lifeguards. \nAlongside her partner, they frantically tried to perform CPR but Ms Collie was pronounced dead before arriving at hospital, Bangkok Post reported. Her partner suffered minor injuries. \nNews Corp Australia has contacted the Department of Foreign Affairs and Trade for comment. Emily Jayne Collier with her partner Tommy. Source: Supplied \n6.30am \nWild weather to ease in Victoria \nThunderstorms and flooding are expected to ease across Victoria this afternoon, after a wild and woolly end to the weekend that led to hundreds of emergency call outs. \nThe Bureau of Meteorology said weather conditions would ease today, with a high of only 19C and rains clearing. \n5-10mm of rain is expected, following a wet Sunday that saw up to 33mm in some parts of Melbourne and up to 46mm at Arthurs Seat. \nState Emergency Service crews have responded to 328 calls for assistance since 10pm last night with coastal areas such as Sorrento the hardest hit. \nA plane was also diverted due to Melbourne’s weather conditions, leaving passengers stranded in Adelaide. \n6.15am \nSupport for Pauline Hanson surges in polls \nMalcolm Turnbull has copped a belting in the polls, with support for the Coalition collapsing to the lowest level since Tony Abbott was toppled as Prime Minister. \nThe first Newspoll of the year, taken for The Australian , shows the government trailing Labor by 46 to 54 per cent in two-party terms, with support for independents surging from 15 to 19 per cent. \nFollowing Mr Turnbull’s explosive phone call with US President Donald Trump over the refugee deal, the Coalition’s primary vote has tumbled four points over the summer holidays to 35 per cent. \nMeanwhile, Pauline Hanson’s One Nation has a national primary vote of eight per cent. This is the same level of support it achieved at the 1998 federal election. \nIt comes as Senator Hanson outlined her blueprint for Australia, which would include forcing newlyweds to have pre-nuptial agreements and changes to the tax system. \nThe One Nation leader said she’d also cut the number of politicians, limit migration, introduce an Australian identity card, and axe the GST and consider a flat two per cent tax rate if she ran the country. Malcolm Turnbull has copped a belting in the polls, with support for the Coalition collapsing to the lowest level since Tony Abbott was toppled as Prime Minister. Source: News Corp Australia", "external_links": [], "published": "2017-02-06T02:51:00.000+02:00", "crawled": "2017-02-06T01:11:20.709+02:00", "highlightTitle": ""}