{"organizations": [], "uuid": "62ca4585d5f1f6712f947f50bb0fad6503b4cd6e", "thread": {"social": {"gplus": {"shares": 2}, "pinterest": {"shares": 0}, "vk": {"shares": 0}, "linkedin": {"shares": 1}, "facebook": {"likes": 351, "shares": 351, "comments": 0}, "stumbledupon": {"shares": 0}}, "site_full": "www.thewrap.com", "main_image": "http://www.thewrap.com/wp-content/uploads/2017/02/milo-yiannopoulos.jpg", "site_section": "http://www.thewrap.com/feed/\r", "section_title": "TheWrapTheWrap", "url": "http://www.thewrap.com/milo-yiannopoulos-resigns-breitbart-news/", "country": "US", "domain_rank": 5807, "title": "Milo Yiannopoulos Resigns From Breitbart News", "performance_score": 3, "site": "thewrap.com", "participants_count": 1, "title_full": "Milo Yiannopoulos Resigns From Breitbart News", "spam_score": 0.0, "site_type": "news", "published": "2017-02-22T02:48:00.000+02:00", "replies_count": 0, "uuid": "62ca4585d5f1f6712f947f50bb0fad6503b4cd6e"}, "author": "Brian Flood", "url": "http://www.thewrap.com/milo-yiannopoulos-resigns-breitbart-news/", "ord_in_thread": 0, "title": "Milo Yiannopoulos Resigns From Breitbart News", "locations": [], "entities": {"persons": [{"name": "milo yiannopoulos", "sentiment": "negative"}, {"name": "breitbart", "sentiment": "none"}, {"name": "jones", "sentiment": "none"}, {"name": "brian flood", "sentiment": "none"}, {"name": "bill maher", "sentiment": "none"}, {"name": "trump", "sentiment": "none"}, {"name": "donald trump", "sentiment": "none"}, {"name": "milo", "sentiment": "none"}, {"name": "yiannopoulos", "sentiment": "none"}, {"name": "maher", "sentiment": "none"}, {"name": "leslie jones", "sentiment": "none"}, {"name": "steve bannon", "sentiment": "none"}, {"name": "breitbart milo", "sentiment": "none"}], "locations": [{"name": "breitbart", "sentiment": "none"}, {"name": "u.s.", "sentiment": "none"}, {"name": "earth", "sentiment": "none"}, {"name": "berkeley", "sentiment": "none"}], "organizations": [{"name": "breitbart news milo yiannopoulos resigns from breitbart news  far-right", "sentiment": "neutral"}, {"name": "berkeley protesters", "sentiment": "none"}, {"name": "hbo", "sentiment": "none"}, {"name": "simon & schuster", "sentiment": "none"}, {"name": "university of california at berkeley", "sentiment": "none"}, {"name": "islam", "sentiment": "none"}, {"name": "sony", "sentiment": "none"}, {"name": "breitbart news", "sentiment": "none"}, {"name": "university of milwaukee", "sentiment": "none"}, {"name": "conservative political action conference", "sentiment": "none"}, {"name": "university of washington", "sentiment": "none"}, {"name": "cpac", "sentiment": "none"}, {"name": "conservative political action committee", "sentiment": "none"}]}, "highlightText": "", "language": "english", "persons": [], "text": "Milo Yiannopoulos Resigns From Breitbart News \nFar-right firebrand insists “decision is mine alone” Brian Flood | February 21, 2017 @ 11:48 AM \nMilo Yiannopoulos resigned from Breitbart minutes before he addressed recent pedophilia comments he made that sparked outrage across the nation and announced he will now starting a new “independently funded” media venture. \n“Breitbart News has stood by me when others caved. They allowed me to carry conservative and libertarian ideas to communities that would otherwise never have heard them. They have been a significant factor in my success. I’m grateful for that freedom and for the friendships I forged here,” Yiannopoulos said in a statement. \nHe continued: “I would be wrong to allow my poor choice of words to detract from my colleagues’ important reporting, so today I am resigning from Breitbart, effective immediately. This decision is mine alone.” \nOn Sunday, a video surfaced in which Yiannopoulos said some relationships between adults and 13-year-olds are consensual. The Breitbart editor and outspoken Donald Trump supporter also joked that being molested had made him good at oral sex. \n“I am horrified by pedophilia,” he said during the press conference. “I do not support child abuse.” Also Read: Milo Yiannopoulos Promises to Remain 'Offensive' After Breitbart Resignation (Video) \nDuring Tuesday’s press conference, Yiannopoulos said he will continue to make jokes and mock issues that are often considered controversial. His pedophilia comments have resulted in being uninvited to speak at CPAC, Simon & Schuster canceling his book deal and now he has stepped down as the Breitbart tech editor. \nYiannopoulos concluded his resignation statement: “When your friends have done right by you, you do right by them. For me, now, that means stepping aside to my colleagues at Breitbart can get back to the great work they do.” Also Read: Watch Milo Yiannopoulos Press Conference Live Stream (Video) \nYiannopoulos said his book, “Dangerous,” has received interest from other publishers. \n“The book will come out this year as planned, with perhaps an additional chapter,” he said before adding that 10 percent of proceeds will help support child abuse charities. \nYiannopoulos said that a new “independently funded” media venture will be announced shortly and a live tour that he called the “Troll Academy Tour” will kick off this year. \n“I started my career as a technology editor who wrote about politics but I have since mutated and grown into something quite different,” he said. “I’m now a performer with millions of fans… I look forward to making you all laugh, cry and think for many, many decades to come. My full focus is now going to be on entertaining and educating everyone.” \nHe previously defended his comments on Facebook : “I am a gay man, and a child abuse victim… My own experiences as a victim led me to believe I could say anything I wanted to on this subject, no matter how outrageous.” Milo Yiannopoulos' Rise and Fall, From GamerGate to Pedophilia Comments (Photos) \nBreitbart News editor Milo Yiannopoulos' rising star has turned into a meteor plummeting toward Earth. After video of Milo voicing support for adults to have sexual relationships with boys began circulating the internet, the Conservative Political Action Conference dropped him for its keynote and his book deal was canceled. \nHere's the complete timeline of Milo's rise, from his opportunism in the \"GamerGate\" harassment campaign against women in the video game industry, to his resignation from Breitbart News. \n2011 — Milo founds “The Kernel” The British journalist launches the London-based blog, which covered tech startups. By 2012, he was sued for allegedly not paying contributors who alleged that he owed them more than £10,000. The blog closes in 2013 and Milo sold it in 2014 . \n2014 — Milo joins Breitbart News As an incendiary Breitbart columnist, Milo relies on shock, and mostly targets feminism, Islam, liberals, social justice and his idea of political correctness. Column subjects have included “ Why I Don’t Like Beyonce ” and “ Birth Control Makes Women Unattractive and Crazy .” \nAugust 2014 — GamerGate The online “movement” called \" GamerGate \" draws on some existing toxic attitudes in the video game community as women gain more visibility in the space. Beginning with a screed by a jilted man against his ex-girlfriend, GamerGaters claimed to fight for “ethics in games journalism.” However, the most vocal component of GamerGate almost exclusively focused on harassing female game developers and journalists online. \nOctober 2014 — Milo and GamerGate Milo begins to write about GamerGate for Breitbart, claiming feminists are taking over and destroying the industry . He gains acclaim in the GamerGate community and becomes one of its stars, gaining many online followers from his involvement. \n2015 — Breitbart starts \"Breitbart Tech\" Breitbart starts “Tech” section that Yiannopoulos runs as a senior editor. Through GamerGate in particular, he rises as a figure in the “alt-right” movement. Breitbart Chairman and Donald Trump adviser Steve Bannon once described Breitbart as the “platform of the alt-right.” The “alt-right,” it should be noted, is widely regarded as a white nationalist movement . \n2015 — \"Dangerous Faggot” College Tour starts As he becomes better known for his incendiary, often hateful conservative opinions, Milo kicks off a speaking tour of U.S. college campuses called the “Dangerous Faggot Tour.\" (He is openly gay.) His appearances are met with protests, with critics claiming he spreads hate speech. These protests sometimes cause university officials to cancel his speaking engagements. \nJuly 2016 — Milo goes after \"Ghostbusters\" Again gaining notoriety in conservative “geek” circles, Milo pans Sony's all-women “Ghostbusters” reboot on Breitbart. His review of the movie coincided with many complaints around the internet , mostly leveled by men, claiming the reboot with a female cast was somehow an attack on culture by the forces of political correctness and feminism. \nJuly 2016 — Milo attacks Leslie Jones and is banned from Twitter Milo takes to Twitter to insult \"Ghostbusters\" co-star Leslie Jones, and in so doing kicks off a harassment campaign against Jones by his followers. Jones leaves Twitter, and Milo is permanently banned from the site for “inciting harassment.” Milo positions the ban as an attack on his free speech rights. \nJuly 2016 — Milo stumps for Trump Gaining fame and notoriety, Milo throws his particular influence behind Donald Trump's campaign for president. He hosts a \"Gays for Trump\" event at the GOP National Convention, and refers to Trump as \" Daddy .\" \nDecember 2016 — Milo blasts transgender student on stage While visiting the University of Milwaukee , Milo showed the photo of a transgender student, named her, and disparaged her on stage. \nDecember 2016 — Book deal Threshold Editions, an imprint of publisher Simon & Schuster that focuses on conservative works, signs a $250,000 book deal with Milo for a book titled \"Dangerous.\" \nJan. 23, 2017 — Milo supporter shoots man at protest A Milo appearance at the University of Washington prompts a student protest during which a supporter of Milo and Donald Trump shot a protester , seriously injuring him. The shooter claimed he was acting in self-defense. \nFeb. 2, 2017 — Protesters force speech cancellation at Berkeley Protesters appear before a Milo event at the University of California at Berkeley, including members of the “Black Bloc” anarchy group. The protests turn violent . Police break up the rally, and Berkeley cancels Milo’s appearance as a result. \nFeb. 18, 2017 — Comedian Bill Maher hosts Milo on “Real Time” Maher interviews Milo on HBO's “Real Time With Bill Maher,” despite the controversy the move created. Maher, responding to the Berkeley protest in particular, claims that bringing Milo to the show was essential to the protection of free speech. \nFeb. 18, 2017 — CPAC announces Milo will headline conference The Conservative Political Action Committee announced Milo as its keynote speaker. \nFeb. 20, 2017 — Milo on video defending sexual relations with boys A recording from Milo’s appearance on the podcast “Drunken Peasants” begins to circulate the internet. In it, Milo defends the idea of adults having sexual relationships with adolescent boys . He also joked that his experience of being molested by an older man when he was a young teen had made him good at oral sex. \nFeb. 20, 2017 — Milo suffers backlash Milo's comments defending pedophilia draw backlash from both progressive and conservative quarters. CPAC rescinds its invitation to Milo to speak and Simon & Schuster cancels his book contract . \nFeb. 20, 2017 — Milo resigns from Breitbart Milo says in a statement, \"I would be wrong to allow my poor choice of words to detract from my colleagues' important reporting, so today I am resigning from Breitbart, effective immediately. This decision is mine alone.\" Previous Slide 1 of 19 \nA timeline of the conservative pundit high-profile career in the spotlight \nBreitbart News editor Milo Yiannopoulos' rising star has turned into a meteor plummeting toward Earth. After video of Milo voicing support for adults to have sexual relationships with boys began circulating the internet, the Conservative Political Action Conference dropped him for its keynote and his book deal was canceled. \nHere's the complete timeline of Milo's rise, from his opportunism in the \"GamerGate\" harassment campaign against women in the video game industry, to his resignation from Breitbart News.", "external_links": [], "published": "2017-02-22T02:48:00.000+02:00", "crawled": "2017-02-22T05:32:43.572+02:00", "highlightTitle": ""}