{"organizations": [], "uuid": "77b239d4848c832ae0ba3ff062694c664b424d17", "thread": {"social": {"gplus": {"shares": 0}, "pinterest": {"shares": 0}, "vk": {"shares": 0}, "linkedin": {"shares": 0}, "facebook": {"likes": 221, "shares": 221, "comments": 0}, "stumbledupon": {"shares": 0}}, "site_full": "metro.co.uk", "main_image": "", "site_section": "", "section_title": "", "url": "http://metro.co.uk/2017/02/22/lucas-perez-insists-he-feels-comfortable-at-arsenal-amid-shock-exit-reports-6466690/", "country": "US", "domain_rank": 1779, "title": "Arsenal transfer news: Lucas Perez insists he ‘feels comfortable’ at Emirates amid shock exit reports | Metro News", "performance_score": 2, "site": "metro.co.uk", "participants_count": 0, "title_full": "Arsenal transfer news: Lucas Perez insists he ‘feels comfortable’ at Emirates amid shock exit reports | Metro News", "spam_score": 0.0, "site_type": "news", "published": "2017-02-23T05:29:00.000+02:00", "replies_count": 0, "uuid": "77b239d4848c832ae0ba3ff062694c664b424d17"}, "author": "Louis Sealey For Metro.Co.Uk", "url": "http://metro.co.uk/2017/02/22/lucas-perez-insists-he-feels-comfortable-at-arsenal-amid-shock-exit-reports-6466690/", "ord_in_thread": 0, "title": "Arsenal transfer news: Lucas Perez insists he ‘feels comfortable’ at Emirates amid shock exit reports | Metro News", "locations": [], "entities": {"persons": [{"name": "lucas perez", "sentiment": "negative"}, {"name": "louis sealey", "sentiment": "negative"}, {"name": "ranieri", "sentiment": "none"}, {"name": "mourinho", "sentiment": "none"}, {"name": "arsene wenger", "sentiment": "none"}, {"name": "getty", "sentiment": "none"}, {"name": "lincoln", "sentiment": "none"}, {"name": "perez", "sentiment": "none"}], "locations": [{"name": "emirates", "sentiment": "none"}, {"name": "spain", "sentiment": "none"}, {"name": "manchester city", "sentiment": "none"}, {"name": "gander green lane", "sentiment": "none"}, {"name": "london", "sentiment": "none"}], "organizations": [{"name": "ars", "sentiment": "negative"}, {"name": "metro news", "sentiment": "negative"}, {"name": "deportivo la coruna", "sentiment": "none"}, {"name": "mar bayern munich", "sentiment": "none"}, {"name": "liverpool", "sentiment": "none"}, {"name": "sutton united", "sentiment": "none"}, {"name": "apr crystal palace", "sentiment": "none"}, {"name": "arsenal player", "sentiment": "none"}, {"name": "arsenal", "sentiment": "none"}]}, "highlightText": "", "language": "english", "persons": [], "text": "Louis Sealey for Metro.co.uk Wednesday 22 Feb 2017 10:29 pm Lucas Perez scored the opener during Arsenal’s 2-0 win over Sutton United (Picture: Getty) \nLucas Perez insists he feels ‘really comfortable’ at Arsenal after reports suggested the Spanish striker was hoping to leave the club. \nPerez scored his seventh goal for the Gunners in the comfortable 2-0 FA Cup fifth-round win over Sutton United on Monday. Keep smiling! Mourinho of all people melts hearts with touching message to Ranieri \nThe start at Gander Green Lane was just his ninth in all competitions since joining from Deportivo La Coruna for around £17million. \nPerez was said to be disgruntled by the lack of opportunities under Arsene Wenger – and even considering quitting the Gunners in order to gain more regular football. \nHowever, the 28-year-old says he now feels settled in London and comfortable in his new surroundings. Arsenal fixtures \nLiverpool (A) – Sat 4 Mar Bayern Munich – Champions League (H) – Tue 7 Mar Lincoln – FA Cup (H) – 11/12 Mar West Brom (A) – Sat 18 Mar Manchester City (H) – Sat 1 Apr West Ham (H) – Tue 4 Apr Crystal Palace (A) – Sat 8 Apr \n‘It was still quite a change for me to get used to the English league when I moved here from Spain. Everyone needs some time to adjust,’ Perez told Arsenal Player . Gunners boss Arsene Wenger (Picture: Getty) ", "external_links": [], "published": "2017-02-23T05:29:00.000+02:00", "crawled": "2017-02-24T07:34:18.221+02:00", "highlightTitle": ""}