{"organizations": [], "uuid": "6090381034ad1868d1d86aaf56aab0864439d3af", "thread": {"social": {"gplus": {"shares": 0}, "pinterest": {"shares": 0}, "vk": {"shares": 0}, "linkedin": {"shares": 118}, "facebook": {"likes": 220, "shares": 220, "comments": 0}, "stumbledupon": {"shares": 0}}, "site_full": "www.prnewswire.com", "main_image": "https://mma.prnewswire.com/media/470059/Affiliated_Monitors_Inc_Jay_Rosen.jpg?p=facebook", "site_section": "http://rss.prnewswire.com/industry/fin", "section_title": "PR Newswire: Banking & Financial Services", "url": "http://www.prnewswire.com/news-releases/affiliated-monitors-inc-announces-the-hiring-of-jay-rosen-300410529.html", "country": "US", "domain_rank": 3190, "title": "Affiliated Monitors, Inc. Announces The Hiring Of Jay Rosen", "performance_score": 2, "site": "prnewswire.com", "participants_count": 1, "title_full": "Affiliated Monitors, Inc. Announces The Hiring Of Jay Rosen", "spam_score": 0.0, "site_type": "news", "published": "2017-02-21T15:30:00.000+02:00", "replies_count": 0, "uuid": "6090381034ad1868d1d86aaf56aab0864439d3af"}, "author": "Affiliated Monitors, Inc.", "url": "http://www.prnewswire.com/news-releases/affiliated-monitors-inc-announces-the-hiring-of-jay-rosen-300410529.html", "ord_in_thread": 0, "title": "Affiliated Monitors, Inc. Announces The Hiring Of Jay Rosen", "locations": [], "entities": {"persons": [{"name": "jay rosen", "sentiment": "negative"}, {"name": "jay", "sentiment": "none"}, {"name": "rosen", "sentiment": "none"}, {"name": "vincent l. dicianni", "sentiment": "none"}, {"name": "lyndsey medsker", "sentiment": "none"}], "locations": [{"name": "boston", "sentiment": "none"}, {"name": "united states", "sentiment": "none"}, {"name": "u.s.", "sentiment": "none"}, {"name": "esq.", "sentiment": "none"}, {"name": "ca", "sentiment": "none"}, {"name": "west coast", "sentiment": "none"}, {"name": "los angeles", "sentiment": "none"}], "organizations": [{"name": "inc", "sentiment": "negative"}, {"name": "inc.", "sentiment": "negative"}, {"name": "focalpoint partners", "sentiment": "none"}, {"name": "louis berger international", "sentiment": "none"}, {"name": "timewarner", "sentiment": "none"}, {"name": "herbalife", "sentiment": "none"}, {"name": "legal language solutions", "sentiment": "none"}, {"name": "at&t", "sentiment": "none"}, {"name": "ami", "sentiment": "none"}, {"name": "united language group", "sentiment": "none"}, {"name": "business development", "sentiment": "none"}, {"name": "century fox", "sentiment": "none"}, {"name": "fcpa", "sentiment": "none"}]}, "highlightText": "", "language": "english", "persons": [], "text": "BOSTON , Feb.   Affiliated Monitors, Inc. (AMI) today announced the hiring of Jay Rosen as Vice President, Business Development and Monitoring Specialist. Rosen was recently Vice President of Corporate and Legal Language Solutions at United Language Group.  \n\"Jay's keen depth of knowledge and integrity has earned the respect of his peers in the FCPA and Ethics and Compliance community as well as the attorneys and companies Jay has assisted with global translation needs,\" said Vincent L. DiCianni, Esq., President and Founder, AMI. \"Jay's experience aligns with AMI's client-centric approach of providing value to companies in assessing and strengthening their ethics and compliance programs. His expert understanding of best practices associated with global compliance will enhance and expand AMI's business development activities in both the U.S. and foreign markets,\" added DiCianni.\nContinue Reading\nJay Rosen, Vice President, Business Development and Monitoring Specialist, Affiliated Monitors, Inc. \"Through my experience in investment banking and legal language solutions for global litigation and FCPA investigations, I've learned first-hand what it takes to build the ethics and compliance programs necessary to achieve business success in a complex operational and regulatory environment,\" said Rosen, \"With AMI, I look forward to assisting companies and government agencies in taking appropriate steps to promote and to protect the public's interests in government financial transactions and regulatory enforcement actions, as well as civil and criminal enforcement actions.\"\nRosen will be based in Los Angeles, CA, increasing AMI's physical presence on the West Coast.\nRosen most recently served as Vice President of Corporate and Legal Language Solutions at United Language Group. Prior to joining United Language Group, Mr. Rosen worked in middle market investment banking with FocalPoint Partners and prior to that had a decade and a half career in the entertainment business where he worked with such companies as 21 st Century Fox and TimeWarner in a motion picture production capacity. \nAbout Affiliated Monitors, Inc. (AMI) \nStarted in 2004, AMI was the first company in the United States to focus on providing top-quality, independent integrity monitoring services across a wide range of regulated industries and professions. AMI evaluates and monitors business practices for compliance with federal, state, local and international laws and regulations, and recommends improvements to strengthen a company's ethical culture and achieve sustainable compliance. AMI serves U.S. and international corporations, government contractors, non-profits, wholesale and retail establishments, small and medium- sized businesses, and individual licensed professionals. AMI has served more than 500 clients during the past decade. Among the matters it is handling, Affiliated Monitors provides independent oversight for federal agencies in matters involving AT&T, Herbalife and Louis Berger International. www.affiliatedmonitors.com \nMedia Contact:\nLyndsey Medsker \n202-557-5328\nTo view the original version on PR Newswire, visit: http://www.prnewswire.com/news-releases/affiliated-monitors-inc-announces-the-hiring-of-jay-rosen-300410529.html \nSOURCE Affiliated Monitors, Inc.\nRelated Links \nhttp://www.affiliatedmonitors.com", "external_links": [], "published": "2017-02-21T15:30:00.000+02:00", "crawled": "2017-02-21T15:58:52.554+02:00", "highlightTitle": ""}