{"organizations": [], "uuid": "7f01e353217b576ffbc72ea2d75a5503616e2969", "thread": {"social": {"gplus": {"shares": 0}, "pinterest": {"shares": 0}, "vk": {"shares": 0}, "linkedin": {"shares": 0}, "facebook": {"likes": 879, "shares": 879, "comments": 0}, "stumbledupon": {"shares": 0}}, "site_full": "au.news.yahoo.com", "main_image": "https://s.yimg.com/iu/api/res/1.2/PXXn3zMc_XAj8vQRJay8uA--/YXBwaWQ9eXZpZGVvO3c9NjMwO2g9MzU0O2R4PTE7ZHk9MTtjdz0xMjc5O2NoPTcxOTtxPTcwO249MTt1bGNyb3A7cm90YXRlPWF1dG8-/https://s.yimg.com/ea/img/-/170215/58a3ac26d17f0_256ininemother.jpg", "site_section": "", "section_title": "", "url": "https://au.news.yahoo.com/a/34419475/welsh-mums-burned-body-found-at-holyhead-beach-after-valentines-gift-sent-to-five-kids/", "country": "US", "domain_rank": 5, "title": "Welsh mum s burned body found at Holyhead beach after Valentines gift sent to five kids - Yahoo7", "performance_score": 8, "site": "yahoo.com", "participants_count": 0, "title_full": "Welsh mum s burned body found at Holyhead beach after Valentines gift sent to five kids - Yahoo7", "spam_score": 0.023, "site_type": "news", "published": "2017-02-15T16:54:00.000+02:00", "replies_count": 0, "uuid": "7f01e353217b576ffbc72ea2d75a5503616e2969"}, "author": "News On February", "url": "https://au.news.yahoo.com/a/34419475/welsh-mums-burned-body-found-at-holyhead-beach-after-valentines-gift-sent-to-five-kids/", "ord_in_thread": 0, "title": "Welsh mum s burned body found at Holyhead beach after Valentines gift sent to five kids - Yahoo7", "locations": [], "entities": {"persons": [{"name": "williams", "sentiment": "none"}, {"name": "trump", "sentiment": "none"}, {"name": "lisa bach", "sentiment": "none"}, {"name": "kim jong-un", "sentiment": "none"}, {"name": "hayley williams", "sentiment": "none"}, {"name": "rachel", "sentiment": "none"}, {"name": "nash", "sentiment": "none"}, {"name": "valentine", "sentiment": "none"}, {"name": "lisa williams", "sentiment": "none"}], "locations": [{"name": "holyhead", "sentiment": "none"}, {"name": "north wales", "sentiment": "none"}, {"name": "newry beach", "sentiment": "none"}, {"name": "wales", "sentiment": "none"}], "organizations": [{"name": "daily post", "sentiment": "none"}, {"name": "bbc", "sentiment": "none"}, {"name": "holyhead", "sentiment": "none"}, {"name": "facebook  according", "sentiment": "none"}, {"name": "nsw", "sentiment": "none"}, {"name": "facebook", "sentiment": "none"}]}, "highlightText": "", "language": "english", "persons": [], "text": "‘I love you’: Mum's Valentines gift to five kids before burned body found at beach Yahoo7 News on February 15, 2017, 12:17 pm ‘I love you’: Heartbreaking mum's Valentines gift to kids less than an hour before she died Share Welsh mum s burned body found at Holyhead beach after Valentines gift sent to five kids - Yahoo7 Heartbreaking tributes have been paid to a mother of five who sent her children a loving Valentine’s Day present only days before she was reportedly found burned to death at a popular beach in north Wales. \nThe 31-year-old woman, named by local media as Lisa Williams, sent a card in the mail to her kids, along with their five favourite chocolate treats on January 25 so the gift would arrive in time for Valentine’s Day The Mirror reports. \nOn the card Ms Williams, from Holyhead, tells her \"famous five\" children how much she loves them, promising to see them soon The Mirror reports. The card that was sent to the five children for Valentine's Day. Source: Facebook \n\"I love you all with my Welsh heart, lovely Welsh (parcel), Valentine's treats and chocolate treats,\" she wrote. \n\"Will see you all soon I promise. Kind hands, kind feet, nice words and sharing is caring.” \nShe then posted the touching note onto her Facebook page, however it’s since emerged she sent the message an hour before her body was discovered on the in the small town the BBC reports. \nMs Williams' ‘badly burned’ body was reportedly found on Sunday night in a shelter at Newry Beach according to the BBC. The mother of five sent the card to her children before her death. Source: Facebook \nAccording to The Mirror the spokesman for North Wales Police said: \"At approximately 10.50pm yesterday, Sunday 12 February 2017, emergency services were alerted to the discovery of a woman's body on Newry Beach, Holyhead. \n\"She was pronounced dead at the scene and whilst no formal identification has taken place, officers believe she is a local woman and enquiries are underway to locate and inform her next of kin. \n\"At this time the death is not being treated as suspicious, and the coroner for north-west Wales has been informed.\" Floral tributes have been left for the mother of five. Source: Supplied \nLoved ones have reportedly since left floral tributes close to the spot where her body was found, including a heartbreaking note from her father. \n“Our Lisa Bach [married name]. You'll always be in our hearts. Love you forever. Dad and Rachel,” the tribute began. \nAnother said: “I'm lucky to have called you my friend. Forever in our hearts. G xx.” \n“Shine bright like a diamond Lisa Bach. A tribute left for the mother that was created online. Source: Facebook \n“Looking over your beautiful children until we meet again, love Nash xx.” \nHer sister Hayley Williams told Mirror online: \"I couldn't be more upset. I'm heartbroken.” \n“We want to say thank you to family and friends for all the support.\" \nAccording to various local reports the mother had recently separated with her husband. \nIt is understood an inquest is to be opened soon according to Daily Post. Close News break - February 25 UP NEXT VIDEO Treasurer's tax warning, suspicious apartment fire, NSW bushfire warning, Trump government turmoil, Kim Jong-un's half-brother assassinated, and more... News break - February 25 Share Welsh mum s burned body found at Holyhead beach after Valentines gift sent to five kids - Yahoo7 <p>Sorry, we can't show this content as your browser does not support iframes.</p> Latest From 7News ", "external_links": [], "published": "2017-02-15T16:54:00.000+02:00", "crawled": "2017-02-15T07:01:14.774+02:00", "highlightTitle": ""}