{"organizations": [], "uuid": "3968558fbdca7ede51e04c7cad974b64ca4bc276", "thread": {"social": {"gplus": {"shares": 2}, "pinterest": {"shares": 5}, "vk": {"shares": 0}, "linkedin": {"shares": 0}, "facebook": {"likes": 195, "shares": 195, "comments": 0}, "stumbledupon": {"shares": 0}}, "site_full": "www.hollywoodreporter.com", "main_image": "http://cdn3.thr.com/sites/default/files/2017/02/jeffrey_wright_alexander_skarsgaard_and_james_badge_dale_split.jpg", "site_section": "http://www.hollywoodreporter.com/taxonomy/term/194/all/feed", "section_title": "Movies", "url": "http://www.hollywoodreporter.com/heat-vision/jeffrey-wright-alexander-skarsgard-james-badge-dale-star-netflix-thriller-hold-dark-9745", "country": "US", "domain_rank": 1268, "title": "Jeffrey Wright, Alexander Skarsgard, James Badge Dale to Star in Netflix Thriller 'Hold the Dark' (Exclusive)", "performance_score": 1, "site": "hollywoodreporter.com", "participants_count": 0, "title_full": "Jeffrey Wright, Alexander Skarsgard, James Badge Dale to Star in Netflix Thriller 'Hold the Dark' (Exclusive)", "spam_score": 0.0, "site_type": "news", "published": "2017-02-11T04:32:00.000+02:00", "replies_count": 0, "uuid": "3968558fbdca7ede51e04c7cad974b64ca4bc276"}, "author": "", "url": "http://www.hollywoodreporter.com/heat-vision/jeffrey-wright-alexander-skarsgard-james-badge-dale-star-netflix-thriller-hold-dark-9745", "ord_in_thread": 0, "title": "Jeffrey Wright, Alexander Skarsgard, James Badge Dale to Star in Netflix Thriller 'Hold the Dark' (Exclusive)", "locations": [], "entities": {"persons": [{"name": "jeffrey wright", "sentiment": "negative"}, {"name": "alexander skarsgard", "sentiment": "negative"}, {"name": "james badge dale", "sentiment": "negative"}, {"name": "borys kit jeffrey wright", "sentiment": "negative"}, {"name": "christopher nolan", "sentiment": "none"}, {"name": "bloor", "sentiment": "none"}, {"name": "steven soderbergh", "sentiment": "none"}, {"name": "reese witherspoon", "sentiment": "none"}, {"name": "james badge dale riley keough", "sentiment": "none"}, {"name": "riley keough", "sentiment": "none"}, {"name": "badge dale", "sentiment": "none"}, {"name": "william giraldi", "sentiment": "none"}, {"name": "james bloor", "sentiment": "none"}, {"name": "anton yelchin", "sentiment": "none"}, {"name": "hansen jacobson", "sentiment": "none"}, {"name": "david robert mitchell", "sentiment": "none"}, {"name": "eva maria daniels", "sentiment": "none"}, {"name": "borys kit", "sentiment": "none"}, {"name": "fox", "sentiment": "none"}, {"name": "alexander skarsgaard", "sentiment": "none"}, {"name": "keough", "sentiment": "none"}, {"name": "michael bay", "sentiment": "none"}, {"name": "russell ackerman", "sentiment": "none"}, {"name": "wright", "sentiment": "none"}, {"name": "saulnier", "sentiment": "none"}, {"name": "john schoenfelder", "sentiment": "none"}, {"name": "nicole kidman", "sentiment": "none"}, {"name": "neil kopp  caa-repped wright", "sentiment": "none"}, {"name": "jeremy saulnier", "sentiment": "none"}, {"name": "anish savjani", "sentiment": "none"}, {"name": "macon blair", "sentiment": "none"}], "locations": [{"name": "leatherface", "sentiment": "none"}, {"name": "canada", "sentiment": "none"}, {"name": "grandview", "sentiment": "none"}, {"name": "dunkirk", "sentiment": "none"}, {"name": "logan lucky", "sentiment": "none"}, {"name": "texas chainsaw massacre", "sentiment": "none"}, {"name": "alberta", "sentiment": "none"}, {"name": "iraq", "sentiment": "none"}], "organizations": [{"name": "star", "sentiment": "negative"}, {"name": "netflix", "sentiment": "negative"}, {"name": "hbo", "sentiment": "none"}, {"name": "mj management", "sentiment": "none"}, {"name": "caa", "sentiment": "none"}]}, "highlightText": "", "language": "english", "persons": [], "text": "Sign up for our Newsletters . Daily Edition February 10, 2017 2:40pm PT by Borys Kit Jeffrey Wright, Alexander Skarsgard, James Badge Dale to Star in Netflix Thriller 'Hold the Dark' (Exclusive) Getty Images Jeffrey Wright, Alexander Skarsgaard, James Badge Dale Riley Keough and James Bloor are also cast in Jeremy Saulnier's follow-up to his acclaimed \"Green Room.\" \nJeffrey Wright, Alexander Skarsgard and James Badge Dale will star in Hold the Dark , Netflix’s adventure thriller from director Jeremy Saulnier. \nRiley Keough and James Bloor are also cast in the project, which is Saulnier’s follow-up to his acclaimed Anton Yelchin thriller Green Room . \nDark adapts the book by William Giraldi and is set in a remote Alaskan wilderness in which wolves have taken and killed children. A wolf expert biologist is called in to investigate but finds himself in between in between a secret-harboring mother, who disappears, and her husband, who goes on a maniacal spree when he returns from Iraq and learns of his son’s death. White cold snow runs red with hot blood. \nWright will play the biologist caught up in the spree while Badge Dale is a detective who wants to catch the husband, to be played by Skarsgard. Keough will play the mother and Bloor a creepy drifter. \nThe movie is looking at shooting in Alberta, Canada in March. \nMacon Blair wrote the script. Producing are Russell Ackerman and John Schoenfelder, as well as Eva Maria Daniels, Anish Savjani and Neil Kopp \nCAA-repped Wright is one of the stars of HBO’s Westworld and appeared in The Hunger Games: Mockingjay movies. \nSkarsgard last year starred as Tarzan in The Legend of Tarzan and appears opposite Nicole Kidman and Reese Witherspoon in HBO’s Big Little Lies . He is repped by CAA and Hansen Jacobson. \nBadge Dale was part of Michael Bay’s 13 Hours and recently wrapped The Empty Man , Fox’s adaptation of a Boom! comic. He is repped by CAA and MJ Management. \nKeough, who appeared in Mad Max: Fury Road , has two films recently wrapped: noir thriller Under the Silver Moon by It Follows filmmaker David Robert Mitchell, and Logan Lucky from Steven Soderbergh. She is repped by WME. \nBloor, repped by CAA and Grandview, is a newcomer who will not only be seen in Texas Chainsaw Massacre reboot Leatherface but also in Christopher Nolan’s Dunkirk . Borys Kit", "external_links": [], "published": "2017-02-11T04:32:00.000+02:00", "crawled": "2017-02-11T01:23:41.337+02:00", "highlightTitle": ""}