{"organizations": [], "uuid": "aeab8348601c7d14ce587c596acc0d68c6aa429d", "thread": {"social": {"gplus": {"shares": 0}, "pinterest": {"shares": 0}, "vk": {"shares": 0}, "linkedin": {"shares": 0}, "facebook": {"likes": 289, "shares": 289, "comments": 0}, "stumbledupon": {"shares": 0}}, "site_full": "www.thesun.co.uk", "main_image": "https://www.thesun.co.uk/wp-content/uploads/2017/02/nintchdbpict000302133732.jpg?strip=all&#038;w=1200&#038;h=800&#038;crop=1", "site_section": "https://www.thesun.co.uk/feed", "section_title": "The Sun", "url": "https://www.thesun.co.uk/sport/football/2875071/bayern-munich-5-arsenal-1-ian-wright-foul-mouthed-rant/", "country": "GB", "domain_rank": 2180, "title": "Ian Wright launches foul-mouthed rant at Arsenal following embarrassing 5-1 Bayern Munich defeat", "performance_score": 2, "site": "thesun.co.uk", "participants_count": 1, "title_full": "Ian Wright launches foul-mouthed rant at Arsenal following embarrassing 5-1 Bayern Munich defeat", "spam_score": 0.0, "site_type": "news", "published": "2017-02-16T05:40:00.000+02:00", "replies_count": 0, "uuid": "aeab8348601c7d14ce587c596acc0d68c6aa429d"}, "author": "sstreet", "url": "https://www.thesun.co.uk/sport/football/2875071/bayern-munich-5-arsenal-1-ian-wright-foul-mouthed-rant/", "ord_in_thread": 0, "title": "Ian Wright launches foul-mouthed rant at Arsenal following embarrassing 5-1 Bayern Munich defeat", "locations": [], "entities": {"persons": [{"name": "ian wright", "sentiment": "negative"}, {"name": "wrighty", "sentiment": "none"}, {"name": "thomas muller", "sentiment": "none"}, {"name": "mesut ozil", "sentiment": "none"}, {"name": "rio ferdinand", "sentiment": "none"}, {"name": "gary lineker", "sentiment": "none"}, {"name": "rafa benitez", "sentiment": "none"}, {"name": "thiago", "sentiment": "none"}, {"name": "thiago alcantara", "sentiment": "none"}, {"name": "alexis sanchez", "sentiment": "none"}, {"name": "koscielny", "sentiment": "none"}, {"name": "arjen robben", "sentiment": "none"}, {"name": "martin keown", "sentiment": "none"}, {"name": "keown", "sentiment": "none"}, {"name": "kosc laurent koscielny", "sentiment": "none"}, {"name": "arsene bayern munich", "sentiment": "none"}, {"name": "robert lewandowski", "sentiment": "none"}, {"name": "ray parlour", "sentiment": "none"}, {"name": "arsene wenger", "sentiment": "none"}, {"name": "mccoy", "sentiment": "none"}, {"name": "wenger", "sentiment": "none"}, {"name": "charlie wyett", "sentiment": "none"}, {"name": "â€” piers morgan", "sentiment": "none"}, {"name": "laurent koscielny bay", "sentiment": "none"}, {"name": "carlo ancelotti", "sentiment": "none"}], "locations": [{"name": "emirates", "sentiment": "none"}, {"name": "munich", "sentiment": "none"}], "organizations": [{"name": "arsenal", "sentiment": "negative"}, {"name": "bayern munich", "sentiment": "negative"}, {"name": "munich reuters", "sentiment": "none"}, {"name": "preview sutton united", "sentiment": "none"}, {"name": "press association", "sentiment": "none"}, {"name": "bayern munich getty images arsenal", "sentiment": "none"}, {"name": "sunsport", "sentiment": "none"}, {"name": "champions league", "sentiment": "none"}, {"name": "bayern", "sentiment": "none"}, {"name": "ancelotti", "sentiment": "none"}, {"name": "allianz arena", "sentiment": "none"}, {"name": "facebook", "sentiment": "none"}, {"name": "getty images martin keown", "sentiment": "none"}, {"name": "arsenal champions league", "sentiment": "none"}]}, "highlightText": "", "language": "english", "persons": [], "text": "'A f shambles' Ian Wright launches foul-mouthed rant at Arsenal following embarrassing 5-1 Bayern Munich defeat \nSunSport columnist couldn't believe what he was seeing while Martin Keown suggested Arsene Wenger should consider his future By CHARLIE WYETT Click to share on Facebook (Opens in new window) Comments ARSENAL legend Ian Wright branded Arsene Wengerâ€™s flops a â€œ g shamblesâ€ after last nightâ€™s Champions League humiliation. \nAnd the gutless Gunners were labelled â€œspinelessâ€ and â€œrudderlessâ€ after Bayernâ€™s rampage. We are a g shambles ğŸ˜« \nâ€” Ian Wright (@IanWright0) February 15, 2017 Getty Images Arsenal were humiliated by Bayern Munich at the Allianz Arena \nAnd the gutless Gunners were labelled â€œspinelessâ€ and â€œrudderlessâ€ following Bayernâ€™s rampage. \nWrighty tweeted: â€œWe are a g shambles. At least let it go to the g home leg. **** it !!! Not watching anymore.â€ At least let it go to the g home leg ğŸ™ğŸ™ğŸ™ \nâ€” Ian Wright (@IanWright0) February 15, 2017 **** it !!! Not watching anymore. ğŸ˜¡ \nâ€” Ian Wright (@IanWright0) February 15, 2017 \nBoss Wenger is on the verge of crashing out at the first knockout stage for the SEVENTH YEAR in a row â€” probably ending his 20-year Emirates reign. \nKeep up to date with ALL the ARSENAL news, gossip, transfers and goals on our club pages plus fixtures, results and live match commentary \nFormer Arsenal defender Martin Keown said: â€œI feel for Arsene Wenger, this is obviously his lowest point ever at Arsenal. \nâ€œHe must be seriously considering his future because that was embarrassing.â€ PA:Press Association Ian Wright couldnâ€™t believe Arsenalâ€™s dreadful performance Getty Images The Gunners were put to the sword by Bayern Munich Getty Images Arsenalâ€™s players stand in disbelief PA:Press Association 8 The scoreboard said it all \nKeown, who played in Wengerâ€™s Invincibles side in 2003-04, added: â€œI canâ€™t say Iâ€™d like to see him go when you have won things. Heâ€™s like a footballing father. \nâ€œBut Iâ€™ll be surprised if he is there next season because of the way things are going. It is spiralling down and down and down and out of control.â€ Where's your shame, Wenger? \nâ€” Piers Morgan (@piersmorgan) February 15, 2017 We've collapsed since you left us â€¦â€¦.we've gone from invincible to invisiblesğŸ˜¡ https://t.co/GB0LqeKOet \nâ€” AP McCoy (@AP_McCoy) February 15, 2017 Bad night! freezing my nuts off and we collapse second half. ğŸ˜– Gutted \nâ€” Ray Parlour (@RealRomfordPele) February 15, 2017 Related Stories MARK HALSEY Arsenal can have no complaints with the referee, they were lucky Bayern Munich didn't have a penalty five things WE LEARNT Arjen Robben was brilliant, Mesut Ozil went missing and Arsenal are too reliant on Laurent Koscielny BAY, BYE ARSENE Bayern Munich 5-1 Arsenal: Arsene Wenger's flops cave in at Allianz Arena as they head for seventh straight Champions League last-16 exit after embarrassing defeat Preview Sutton United vs Arsenal: What time does it kick-off, what TV channel is it on, and what is the latest team news? Under the Kosc Laurent Koscielny goes off injured for Arsenal... and Bayern Munich score three in ten minutes RAFA QUELLS ARSENAL TALK Rafa Benitez is focused on Toon despite talk he'll replace Arsene Wenger at Arsenal tweet wars Bayern Munich begin mind games ahead of Champions League clash by tweeting Arsenal team BEFORE Gunners \nGary Lineker added: â€œArsenal have completely disintegrated. An utter shambles and rudderless.â€ \nAnd fellow BT pundit Rio Ferdinand rapped: â€œThey were spineless. Arsenal got dismantled. \nâ€œYou want to see someone with a bit of fire in their belly. I donâ€™t see it in this team.â€ Getty Images Martin Keown says the manager must consider his future AP:Associated Press Arsene Wenger looked crestfallen in Munich Reuters 8 Arjen Robben celebrates his goal \nArjen Robben put Carlo Ancelottiâ€™s side ahead before Alexis Sanchezâ€™s 20th goal of the season gave Gunners hope of ending their Munich hoodoo. \nBut Bayern took 178 seconds to kill off Wenger for the fourth time in 12 years as Robert Lewandowski and Thiago Alcantara scored in a brutal second-half spell. Wenger, Koscielny and Ancelotti pre Bayern Munich v Arsenal Champions League tie \nThiago got Noâ€Š4 six minutes later and Thomas Muller a late fifth to make the return at the Emirates on March 7 a formality. Arsenal have completely disintegrated. An utter shambles and rudderless after koscielny went off. \nâ€” Gary Lineker (@GaryLineker) February 15, 2017 No change there but they may now realise that I was right all along. Arsenal are soft and have been for a long time. https://t.co/4jNEY5yRZQ \nâ€” michael owen (@themichaelowen) February 15, 2017 \nWenger, 67, was back on the touchline for the first time after four-game domestic ban following last monthâ€™s bust-up with the fourth official. \nBut he saw Arsenal became first English side to concede 200 Champions League goals.", "external_links": [], "published": "2017-02-16T05:40:00.000+02:00", "crawled": "2017-02-16T02:58:26.219+02:00", "highlightTitle": ""}