{"organizations": [], "uuid": "f39877cac3718a449fce68b79a98b23ebb746218", "thread": {"social": {"gplus": {"shares": 0}, "pinterest": {"shares": 0}, "vk": {"shares": 0}, "linkedin": {"shares": 0}, "facebook": {"likes": 150, "shares": 150, "comments": 0}, "stumbledupon": {"shares": 0}}, "site_full": "bdnews24.com", "main_image": "http://d30fl32nd2baj9.cloudfront.net/media/2013/08/05/high-court.jpg/ALTERNATES/w640/High+Court.jpg", "site_section": "http://bdnews24.com/?widgetName=rssfeed&widgetId=1150&getXmlFeed=true", "section_title": "wf-escenic-times - Home", "url": "http://bdnews24.com/bangladesh/2017/02/08/8-hc-judges-get-permanent-seats", "country": "US", "domain_rank": 2276, "title": "8 HC judges get permanent seats", "performance_score": 1, "site": "bdnews24.com", "participants_count": 0, "title_full": "8 HC judges get permanent seats", "spam_score": 0.0, "site_type": "news", "published": "2017-02-08T20:30:00.000+02:00", "replies_count": 0, "uuid": "f39877cac3718a449fce68b79a98b23ebb746218"}, "author": "", "url": "http://bdnews24.com/bangladesh/2017/02/08/8-hc-judges-get-permanent-seats", "ord_in_thread": 0, "title": "8 HC judges get permanent seats", "locations": [], "entities": {"persons": [{"name": "mojibur rahman", "sentiment": "none"}, {"name": "sabbir fayez", "sentiment": "none"}, {"name": "iqbal kabir", "sentiment": "none"}, {"name": "khizir ahmed choudhury", "sentiment": "none"}, {"name": "amir hossain", "sentiment": "none"}, {"name": "md farid ahmed shibli", "sentiment": "none"}, {"name": "md salim", "sentiment": "none"}, {"name": "md shohrowardi", "sentiment": "none"}, {"name": "bhishmadev chakrabortty", "sentiment": "none"}, {"name": "mozibur rahman", "sentiment": "none"}, {"name": "jyotirmoy narayan deb choudhury", "sentiment": "none"}, {"name": "khizir ahmed", "sentiment": "none"}], "locations": [{"name": "chittagong", "sentiment": "none"}, {"name": "md selim", "sentiment": "none"}], "organizations": [{"name": "high court division additional registrar (administration and justice", "sentiment": "none"}, {"name": "ministry of law", "sentiment": "none"}, {"name": "justice", "sentiment": "none"}, {"name": "supreme court", "sentiment": "none"}]}, "highlightText": "", "language": "english", "persons": [], "text": "8 HC judges get permanent seats Senior Correspondent, bdnews24.com   13:30:20.0   13:30:20.0 BdST Eight judges who were serving as Additional Justices to the High Court have been made permanent . \nThey are Justice SM Mozibur Rahman, Justice Amir Hossain, Justice Khizir Ahmed Choudhury, Justice Razik-Al-Jalil, Justice Bhishmadev Chakrabortty, Justice Md Iqbal Kabir, Justice Md Salim, and Justice Md Shohrowardi. \nThe Ministry of Law, Justice and Parliamentary Affairs issued a decree appointing the eight judges to permanent positions on Tuesday, High Court Division Additional Registrar (Administration and Justice) Sabbir Fayez told bdnews24.com. \nA total of ten justices, including these eight, were appointed as Additional Justices to the High Court on Feb 9, 2015. \nAmong them Jyotirmoy Narayan Deb Choudhury passed away last December. \nSupreme Court Registrar Md Farid Ahmed Shibli was also appointed as justice, but his name was not on the list of permanent justices. \nBefore coming to the High Court, Justices SM Mozibur Rahman and Amir Hossain served as district judges. Mojibur Rahman was the acting justice who handled the trial of the 2004 10-truck arms haul casein Chittagong. \nJustices Razik-Al-Jalil, Bhishmadev Chakrabortty, Md Selim and Md Shohrowardi served as deputy attorney generals before their appointment. \nJustices Khizir Ahmed and Md Iqbal Kabir were Supreme Court lawyers.", "external_links": [], "published": "2017-02-08T20:30:00.000+02:00", "crawled": "2017-02-08T09:45:24.256+02:00", "highlightTitle": ""}