{"organizations": [], "uuid": "8a925acd71b4f8dc7ea5510ecb65263232741b80", "thread": {"social": {"gplus": {"shares": 0}, "pinterest": {"shares": 0}, "vk": {"shares": 0}, "linkedin": {"shares": 0}, "facebook": {"likes": 621, "shares": 621, "comments": 14}, "stumbledupon": {"shares": 0}}, "site_full": "www.indystar.com", "main_image": "http://www.gannett-cdn.com/-mm-/738a4400cd4caf00a2a912eff210fe61042a2d72/c=0-135-2795-1714&amp;r=x633&amp;c=1200x630/local/-/media/2017/02/16/Indianapolis/B9326273854Z.1_20170216181301_000_GDSHEKM76.1-0.jpg", "site_section": "http://rssfeeds.indystar.com/indystar/allnews", "section_title": "GANNETT Syndication Service", "url": "http://www.indystar.com/story/news/2017/02/16/indy-experiences-day-without-immigrants/98007718/", "country": "US", "domain_rank": 12374, "title": "Indy experiences a 'Day Without Immigrants'", "performance_score": 6, "site": "indystar.com", "participants_count": 1, "title_full": "Indy experiences a 'Day Without Immigrants'", "spam_score": 0.0, "site_type": "news", "published": "2017-02-17T23:44:00.000+02:00", "replies_count": 0, "uuid": "8a925acd71b4f8dc7ea5510ecb65263232741b80"}, "author": "amy.bartner@indystar.com", "url": "http://www.indystar.com/story/news/2017/02/16/indy-experiences-day-without-immigrants/98007718/", "ord_in_thread": 0, "title": "Indy experiences a 'Day Without Immigrants'", "locations": [], "entities": {"persons": [{"name": "amy bartner", "sentiment": "negative"}, {"name": "jenny nunes", "sentiment": "none"}, {"name": "robert", "sentiment": "none"}, {"name": "jesus ramirez", "sentiment": "none"}, {"name": "karla gomez", "sentiment": "none"}, {"name": "robert scheer/indystar fullscreen buy photo rosa angeles", "sentiment": "none"}, {"name": "amy sawyer", "sentiment": "none"}, {"name": "estaban bernal", "sentiment": "none"}, {"name": "luke sandy", "sentiment": "none"}, {"name": "mara candelaria reardon", "sentiment": "none"}, {"name": "alejandra aguilar", "sentiment": "none"}, {"name": "viviana torres", "sentiment": "none"}], "locations": [{"name": "u.s.", "sentiment": "none"}, {"name": "mexico", "sentiment": "none"}, {"name": "garfield park", "sentiment": "none"}, {"name": "east street", "sentiment": "none"}, {"name": "indianapolis", "sentiment": "none"}, {"name": "guanajuato", "sentiment": "none"}], "organizations": [{"name": "indiana house of representatives", "sentiment": "none"}, {"name": "perry meridian high school", "sentiment": "none"}, {"name": "facebook a", "sentiment": "none"}, {"name": "facebook", "sentiment": "none"}, {"name": "statehouse", "sentiment": "none"}]}, "highlightText": "", "language": "english", "persons": [], "text": "Indy experiences a 'Day Without Immigrants' Amy Bartner , amy.bartner@indystar.com Published 6:35 p.m. ET Feb. 16, 2017 | Updated 5 hours ago Facebook A link has been posted to your Facebook feed. Buy Photo Viviana Torres, 6, Indianapolis, during a march and rally today dubbed A Day without Immigrants, that went from Garfield Park to the Statehouse and involved more than 250 people, Indianapolis, Thursday, February 16, 2017. The event mirrored companion events in other cities that invited immigrants to not spend money or participate in work, school or other civic activities for the day. Robert Scheer/IndyStar Fullscreen Buy Photo Jenny Nunes, Indianapolis, an immigrant from Mexico, makes photos during a march and rally today dubbed A Day without Immigrants, that went from Garfield Park to the Statehouse and involved more than 250 people, Indianapolis, Thursday, February 16, 2017. The event mirrored companion events in other cities that invited immigrants to not spend money or participate in work, school or other civic activities for the day. Robert Scheer/IndyStar Fullscreen Buy Photo A march and rally today dubbed A Day without Immigrants, that went from Garfield Park to the Statehouse and involved more than 250 people, Indianapolis, Thursday, February 16, 2017. The event mirrored companion events in other cities that invited immigrants to not spend money or participate in work, school or other civic activities for the day. Robert Scheer/IndyStar Fullscreen Buy Photo A march and rally today dubbed A Day without Immigrants, that went from Garfield Park to the Statehouse and involved more than 250 people, Indianapolis, Thursday, February 16, 2017. The event mirrored companion events in other cities that invited immigrants to not spend money or participate in work, school or other civic activities for the day. Robert Scheer/IndyStar Fullscreen Buy Photo Alejandra Aguilar, 15, who has family from Mexico, and attends Perry Meridian High School, took a day off from school to participate in a march and rally today dubbed A Day without Immigrants, that went from Garfield Park to the Statehouse and involved more than 250 people, Indianapolis, Thursday, February 16, 2017. The event mirrored companion events in other cities that invited immigrants to not spend money or participate in work, school or other civic activities for the day. Robert Scheer/IndyStar Fullscreen Buy Photo Amy Sawyer, who lives on East Street, came out of her house to support passing by participants in a march and rally today dubbed A Day without Immigrants, that went from Garfield Park to the Statehouse and involved more than 250 people, Indianapolis, Thursday, February 16, 2017. The event mirrored companion events in other cities that invited immigrants to not spend money or participate in work, school or other civic activities for the day. Robert Scheer/IndyStar Fullscreen Buy Photo Members of a march and rally today dubbed A Day without Immigrants, that went from Garfield Park to the Statehouse and involved more than 250 people, Indianapolis, Thursday, February 16, 2017. The event mirrored companion events in other cities that invited immigrants to not spend money or participate in work, school or other civic activities for the day. Robert Scheer/IndyStar Fullscreen Buy Photo Members of a march and rally today dubbed A Day without Immigrants, that went from Garfield Park to the Statehouse and involved more than 250 people, Indianapolis, Thursday, February 16, 2017. The event mirrored companion events in other cities that invited immigrants to not spend money or participate in work, school or other civic activities for the day. Robert Scheer/IndyStar Fullscreen Buy Photo Members of a march and rally today dubbed A Day without Immigrants, that went from Garfield Park to the Statehouse and involved more than 250 people, Indianapolis, Thursday, February 16, 2017. The event mirrored companion events in other cities that invited immigrants to not spend money or participate in work, school or other civic activities for the day. Robert Scheer/IndyStar Fullscreen Buy Photo Members of a march and rally today dubbed A Day without Immigrants, that went from Garfield Park to the Statehouse and involved more than 250 people, Indianapolis, Thursday, February 16, 2017. The event mirrored companion events in other cities that invited immigrants to not spend money or participate in work, school or other civic activities for the day. Robert Scheer/IndyStar Fullscreen Buy Photo A march and rally today dubbed A Day without Immigrants, that went from Garfield Park to the Statehouse and involved more than 250 people, Indianapolis, Thursday, February 16, 2017. The event mirrored companion events in other cities that invited immigrants to not spend money or participate in work, school or other civic activities for the day. Robert Scheer/IndyStar Fullscreen Buy Photo Rosa Angeles (left), 18, and Karla Gomez, 17, during a march and rally today dubbed A Day without Immigrants, that went from Garfield Park to the Statehouse and involved more than 250 people, Indianapolis, Thursday, February 16, 2017. The event mirrored companion events in other cities that invited immigrants to not spend money or participate in work, school or other civic activities for the day. Robert Scheer/IndyStar Fullscreen Buy Photo The front door at popular Latino grocery and restaurant Guanajuato, that's closed for the day in observance of A Day without Immigrants, Indianapolis, Thursday, February 16, 2017. The event, mirroring companion events in other cities, invited immigrants to not spend money or participate in work, school or other civic activities for the day. Amy Bartner/IndyStar Fullscreen Buy Photo Participants in a march and rally today dubbed A Day without Immigrants, that went from Garfield Park to the Statehouse and involved more than 250 people, Indianapolis, Thursday, February 16, 2017. The event mirrored companion events in other cities that invited immigrants to not spend money or participate in work, school or other civic activities for the day. Robert Scheer/IndyStar Fullscreen Buy Photo A group of students walk past a march and rally today dubbed A Day without Immigrants, that went from Garfield Park to the Statehouse and involved more than 250 people, Indianapolis, Thursday, February 16, 2017. The event mirrored companion events in other cities that invited immigrants to not spend money or participate in work, school or other civic activities for the day. Robert Scheer/IndyStar Fullscreen Buy Photo Jesus Ramirez gets the crowd going at a march and rally today dubbed A Day without Immigrants, that went from Garfield Park to the Statehouse and involved more than 250 people, Indianapolis, Thursday, February 16, 2017. The event mirrored companion events in other cities that invited immigrants to not spend money or participate in work, school or other civic activities for the day. Robert Scheer/IndyStar Fullscreen Buy Photo Mara Candelaria Reardon, a member of the Indiana House of Representatives, speaks at a march and rally today dubbed A Day without Immigrants, that went from Garfield Park to the Statehouse and involved more than 250 people, Indianapolis, Thursday, February 16, 2017. The event mirrored companion events in other cities that invited immigrants to not spend money or participate in work, school or other civic activities for the day. Robert Scheer/IndyStar Fullscreen Buy Photo Luke Sandy, who'd been shopping for phones with friends, shoots images through a window of a march and rally today dubbed A Day without Immigrants, that went from Garfield Park to the Statehouse and involved more than 250 people, Indianapolis, Thursday, February 16, 2017. The event mirrored companion events in other cities that invited immigrants to not spend money or participate in work, school or other civic activities for the day. Robert Scheer/IndyStar Fullscreen Buy Photo A march and rally today dubbed A Day without Immigrants, that went from Garfield Park to the Statehouse and involved more than 250 people, Indianapolis, Thursday, February 16, 2017. The event mirrored companion events in other cities that invited immigrants to not spend money or participate in work, school or other civic activities for the day. Robert Scheer/IndyStar Fullscreen Buy Photo Estaban Bernal, Indianapolis, leads a march and rally today dubbed A Day without Immigrants, that went from Garfield Park to the Statehouse and involved more than 250 people, Indianapolis, Thursday, February 16, 2017. The event mirrored companion events in other cities that invited immigrants to not spend money or participate in work, school or other civic activities for the day. Robert Scheer/IndyStar Fullscreen Buy Photo A march and rally today dubbed A Day without Immigrants, that went from Garfield Park to the Statehouse and involved more than 250 people, Indianapolis, Thursday, February 16, 2017. The event mirrored companion events in other cities that invited immigrants to not spend money or participate in work, school or other civic activities for the day. Robert Scheer/IndyStar Fullscreen Buy Photo A march and rally dubbed A Day without Immigrants, that went from Garfield Park to the Statehouse and involved more than 250 people, Indianapolis, Thursday, February 16, 2017. The event mirrored companion events in other cities that invited immigrants to not spend money or participate in work, school or other civic activities for the day. Robert Scheer/IndyStar Fullscreen Buy Photo A march and rally dubbed A Day without Immigrants, that went from Garfield Park to the Statehouse and involved more than 250 people, Indianapolis, Thursday, February 16, 2017. The event mirrored companion events in other cities that invited immigrants to not spend money or participate in work, school or other civic activities for the day. Robert Scheer/IndyStar Fullscreen Buy Photo A march and rally dubbed A Day without Immigrants, that went from Garfield Park to the Statehouse and involved more than 250 people, Indianapolis, Thursday, February 16, 2017. The event mirrored companion events in other cities that invited immigrants to not spend money or participate in work, school or other civic activities for the day. Robert Scheer/IndyStar Fullscreen Buy Photo Estaban Bernal, Indianapolis, holds a U.S. flag at a march and rally today dubbed A Day without Immigrants, that went from Garfield Park to the Statehouse and involved more than 250 people, Indianapolis, Thursday, February 16, 2017. The event mirrored companion events in other cities that invited immigrants to not spend money or participate in work, school or other civic activities for the day. Robert Scheer/IndyStar Fullscreen Buy Photo A march and rally dubbed A Day without Immigrants, that went from Garfield Park to the Statehouse and involved more than 250 people, Indianapolis, Thursday, February 16, 2017. The event mirrored companion events in other cities that invited immigrants to not spend money or participate in work, school or other civic activities for the day. Robert Scheer/IndyStar Fullscreen Buy Photo A march and rally dubbed A Day without Immigrants, that went from Garfield Park to the Statehouse and involved more than 250 people, Indianapolis, Thursday, February 16, 2017. The event mirrored companion events in other cities that invited immigrants to not spend money or participate in work, school or other civic activities for the day. Robert Scheer/IndyStar Fullscreen Buy Photo A march and rally dubbed A Day without Immigrants, that went from Garfield Park to the Statehouse and involved more than 250 people, Indianapolis, Thursday, February 16, 2017. The event mirrored companion events in other cities that invited immigrants to not spend money or participate in work, school or other civic activities for the day. Robert Scheer/IndyStar Like this topic? You may also like these photo galleries: Replay", "external_links": [], "published": "2017-02-17T23:44:00.000+02:00", "crawled": "2017-02-18T00:03:13.271+02:00", "highlightTitle": ""}