{"organizations": [], "uuid": "69fa36583d8a5f281b71ea4949b68819b600ac20", "thread": {"social": {"gplus": {"shares": 1}, "pinterest": {"shares": 0}, "vk": {"shares": 0}, "linkedin": {"shares": 0}, "facebook": {"likes": 238, "shares": 238, "comments": 0}, "stumbledupon": {"shares": 0}}, "site_full": "nation.foxnews.com", "main_image": "http://nation.foxnews.com/sites/nation.foxnews.com/files/styles/story_624_300/public/sanctuarycities-reuters.jpg", "site_section": "http://feeds.foxnews.com/foxnews/most-popular", "section_title": "FOX News", "url": "http://nation.foxnews.com/2017/02/10/sanctuary-cities-cave-face-trumps-funding-threats", "country": "US", "domain_rank": 185, "title": "Sanctuary Cities Cave In Face Of Trump's Funding Threats", "performance_score": 2, "site": "foxnews.com", "participants_count": 0, "title_full": "Sanctuary Cities Cave In Face Of Trump's Funding Threats", "spam_score": 0.0, "site_type": "news", "published": "2017-02-11T08:08:00.000+02:00", "replies_count": 0, "uuid": "69fa36583d8a5f281b71ea4949b68819b600ac20"}, "author": "", "url": "http://nation.foxnews.com/2017/02/10/sanctuary-cities-cave-face-trumps-funding-threats", "ord_in_thread": 0, "title": "Sanctuary Cities Cave In Face Of Trump's Funding Threats", "locations": [], "entities": {"persons": [{"name": "eli", "sentiment": "negative"}, {"name": "richard biehl", "sentiment": "none"}, {"name": "trump", "sentiment": "none"}, {"name": "zabeth liorente", "sentiment": "none"}, {"name": "marguerite telford", "sentiment": "none"}], "locations": [{"name": "finney county", "sentiment": "none"}, {"name": "miami-dade", "sentiment": "none"}, {"name": "penn.", "sentiment": "none"}, {"name": "n.y.", "sentiment": "none"}, {"name": "bedford", "sentiment": "none"}, {"name": "dayton", "sentiment": "none"}, {"name": "saratoga", "sentiment": "none"}, {"name": "kan.", "sentiment": "none"}, {"name": "ohio", "sentiment": "none"}], "organizations": [{"name": "sanctuary cities cave in face of trump", "sentiment": "negative"}, {"name": "trump", "sentiment": "negative"}, {"name": "fox news", "sentiment": "none"}, {"name": "center for immigration studies", "sentiment": "none"}, {"name": "customs enforcement", "sentiment": "none"}, {"name": "dayton daily news", "sentiment": "none"}, {"name": "cis", "sentiment": "none"}]}, "highlightText": "", "language": "english", "persons": [], "text": "Sanctuary Cities Cave In Face Of Trump's Funding Threats Published February 10, 2017 reuters \nBy Elizabeth Liorente, Fox News \nSeveral towns, cities and counties around the nation are caving to President Trump's threat to pull funding, and abandoning their \"sanctuary\" pledges to shield illegal immigrants from federal authorities. \nDayton, Ohio, dropped a policy that restricted the city’s cooperation with immigration officials pursuing illegal immigrants arrested for misdemeanors or felony property crimes, according to the Dayton Daily News. Police Chief Richard Biehl said federal authorities will no longer be impeded by the city when pursuing illegal immigrants being held by his department. \nOther communities that have dropped policies of shielding illegal immigrant suspects from Immigration and Customs Enforcement include Miami-Dade and Dayton, are Saratoga, N.Y., Finney County, Kan., and Bedford, Penn., according to The Center for Immigration Studies, which keeps a list of sanctuary communities. \n“We are reviewing policy changes at a multitude of other jurisdictions as well,” said Marguerite Telford, CIS’s director of communications, who said the organization is “being inundated” by officials on its sanctuary map who want to be taken off.", "external_links": [], "published": "2017-02-11T08:08:00.000+02:00", "crawled": "2017-02-11T04:26:19.444+02:00", "highlightTitle": ""}