{"organizations": [], "uuid": "698362a1ff6560c6f4a7623773645cc9b6e3e31e", "thread": {"social": {"gplus": {"shares": 0}, "pinterest": {"shares": 0}, "vk": {"shares": 0}, "linkedin": {"shares": 0}, "facebook": {"likes": 211, "shares": 211, "comments": 0}, "stumbledupon": {"shares": 0}}, "site_full": "bdnews24.com", "main_image": "http://d30fl32nd2baj9.cloudfront.net/media/2015/07/17/burn-unit-dhaka-medical-col.jpg/ALTERNATES/w640/burn-unit-dhaka-medical-col.jpg", "site_section": "http://bdnews24.com/?widgetName=rssfeed&widgetId=1150&getXmlFeed=true#", "section_title": "wf-escenic-times - Home", "url": "http://bdnews24.com/bangladesh/2017/02/25/nine-burnt-in-old-dhaka-gas-cylinder-blast-fire-at-plastic-warehouse-reported", "country": "US", "domain_rank": 2276, "title": "Nine burnt in Old Dhaka gas cylinder blast; fire at plastic warehouse reported", "performance_score": 2, "site": "bdnews24.com", "participants_count": 0, "title_full": "Nine burnt in Old Dhaka gas cylinder blast; fire at plastic warehouse reported", "spam_score": 0.0, "site_type": "news", "published": "2017-02-26T01:46:00.000+02:00", "replies_count": 0, "uuid": "698362a1ff6560c6f4a7623773645cc9b6e3e31e"}, "author": "", "url": "http://bdnews24.com/bangladesh/2017/02/25/nine-burnt-in-old-dhaka-gas-cylinder-blast-fire-at-plastic-warehouse-reported", "ord_in_thread": 0, "title": "Nine burnt in Old Dhaka gas cylinder blast; fire at plastic warehouse reported", "locations": [], "entities": {"persons": [{"name": "maqbul hossain", "sentiment": "none"}, {"name": "sabbir", "sentiment": "none"}, {"name": "sabuj", "sentiment": "none"}, {"name": "maruf hossain", "sentiment": "none"}, {"name": "mithai swad", "sentiment": "none"}, {"name": "hazrat ali", "sentiment": "none"}, {"name": "farzana panna", "sentiment": "none"}, {"name": "ibrahim khan", "sentiment": "none"}, {"name": "ibrahim", "sentiment": "none"}, {"name": "partha shankar paul", "sentiment": "none"}, {"name": "abdullah", "sentiment": "none"}, {"name": "sonam uddin", "sentiment": "none"}, {"name": "mizanur rahman", "sentiment": "none"}], "locations": [{"name": "old dhaka", "sentiment": "none"}, {"name": "islambagh", "sentiment": "none"}, {"name": "lalbagh", "sentiment": "none"}, {"name": "dhaka", "sentiment": "none"}, {"name": "chairmanghat", "sentiment": "none"}], "organizations": [{"name": "dmch burns unit", "sentiment": "none"}, {"name": "dhaka medical college hospital", "sentiment": "none"}]}, "highlightText": "", "language": "english", "persons": [], "text": "Nine burnt in Old Dhaka gas cylinder blast; fire at plastic warehouse reported Senior Correspondent, bdnews24.com Published: 2017-02-25 18:46:52.0 BdST Updated: 2017-02-25 19:43:20.0 BdST Nine people, including a woman, have been admitted to Dhaka Medical College Hospital with burn injuries sustained in a gas cylinder blast at an eatery in Old Dhaka. \nFive of them are in critical condition, doctors say. \nThe incident occurred at food shop 'Mithai Swad' at Lalbagh intersection on Saturday afternoon, Dhaka Metropolitan Police Deputy Commissioner Md Ibrahim Khan said. \nThe victims have been identified as employees of the shop Maruf Hossain, 20, and 'Sabuj', 20, passersby Sabbir, 22, Maqbul Hossain, 35, Farzana Panna, 28, Sonam Uddin, 50, and Hazrat Ali, 45, and rickshaw-puller 'Abdullah', 30. \nDMCH Burns Unit surgeon Partha Shankar Paul told bdnews24.com that five of them were in critical condition. \nDMP DC Ibrahim said the walls, doors, windows, and furniture of the shop were damaged in the blast. \nPolice said a fire incident has also been reported from the same in Old Dhaka area. \nFire Service Control Room office Mizanur Rahman said 12 units of fire crews doused the fire at a plastic warehouse in Islambagh's Chairmanghat area after efforts of one and a half hours in the afternoon. \nHe could not say anything more about the reason behind the fire and the extent of the damage immediately.", "external_links": [], "published": "2017-02-26T01:46:00.000+02:00", "crawled": "2017-02-25T16:22:09.824+02:00", "highlightTitle": ""}