{"organizations": [], "uuid": "4089e542a5c8e35c7a748558bf2e6c78dfea8ed6", "thread": {"social": {"gplus": {"shares": 0}, "pinterest": {"shares": 0}, "vk": {"shares": 0}, "linkedin": {"shares": 0}, "facebook": {"likes": 613, "shares": 613, "comments": 0}, "stumbledupon": {"shares": 0}}, "site_full": "www.financialexpress.com", "main_image": "http://images.financialexpress.com/2017/02/Virat-Kohli1-4.jpg", "site_section": "http://www.financialexpress.com/feed/atom", "section_title": "The Financial Express", "url": "http://www.financialexpress.com/sports/india-vs-australia-after-a-humiliating-loss-against-australia-virat-kohli-finds-solace-in-mountains/568307/", "country": "US", "domain_rank": 4726, "title": "India vs Australia: After a humiliating loss against Australia, Virat Kohli finds solace in mountains", "performance_score": 6, "site": "financialexpress.com", "participants_count": 1, "title_full": "India vs Australia: After a humiliating loss against Australia, Virat Kohli finds solace in mountains", "spam_score": 0.0, "site_type": "news", "published": "2017-02-27T16:57:00.000+02:00", "replies_count": 0, "uuid": "4089e542a5c8e35c7a748558bf2e6c78dfea8ed6"}, "author": "FE Online", "url": "http://www.financialexpress.com/sports/india-vs-australia-after-a-humiliating-loss-against-australia-virat-kohli-finds-solace-in-mountains/568307/", "ord_in_thread": 0, "title": "India vs Australia: After a humiliating loss against Australia, Virat Kohli finds solace in mountains", "locations": [], "entities": {"persons": [{"name": "virat kohli", "sentiment": "negative"}, {"name": "steven smith", "sentiment": "none"}, {"name": "sarfaraz", "sentiment": "none"}, {"name": "steve o’keefe", "sentiment": "none"}, {"name": "nathan lyon", "sentiment": "none"}, {"name": "kl rahul", "sentiment": "none"}, {"name": "khan", "sentiment": "none"}, {"name": "sachin baby", "sentiment": "none"}, {"name": "kohli", "sentiment": "none"}, {"name": "virat", "sentiment": "none"}], "locations": [{"name": "australia", "sentiment": "none"}, {"name": "india", "sentiment": "none"}, {"name": "pune", "sentiment": "none"}, {"name": "england", "sentiment": "none"}, {"name": "new delhi", "sentiment": "none"}, {"name": "bangladesh", "sentiment": "none"}, {"name": "new zealand", "sentiment": "none"}], "organizations": [{"name": "ab de villiers", "sentiment": "none"}, {"name": "bcci", "sentiment": "none"}, {"name": "rcb", "sentiment": "none"}, {"name": "mandeep singh  earlier", "sentiment": "none"}]}, "highlightText": "", "language": "english", "persons": [], "text": "India vs Australia: After a humiliating loss against Australia, Virat Kohli finds solace in mountains India vs Australia: After a humiliating loss against Australia, Virat Kohli finds solace in mountains India vs Australia: In a bid to recover from the humiliating loss against Australia in the first Test match at Pune, Indian cricket team's captain, Virat Kohli is spending time among the mountains. By: FE Online | New Delhi | Published: February 27, 2017 3:27 PM India vs Australia: Indian cricket team’s captain, Virat Kohli is spending time among the mountains. (Source: Twitter) \nIn a bid to recover from the humiliating loss against Australia in the first Test match at Pune, Indian cricket team’s captain, Virat Kohli is spending time among the mountains. The 28-year-old top order batsman posted an image on his Twitter account where he was seen spending some time with the nature. Along with the image, Virat Kohli also posted a message saying, “everyday is a blessing and an opportunity. Be grateful and keep moving ahead.” \nYou may also want to watch: . @klrahul11 brings up his 2nd Test 50 and leads India’s reply. Follow the game here – http://t.co/Px6Gu2Qz1R #INDvAUS pic.twitter.com/5tBPtJR4b4 \n— BCCI (@BCCI) February 24, 2017 \nIndia had enjoyed a good home season in Test cricket leading into this series beating New Zealand, England and Bangladesh so it was obvious that the side was full of confidence but this what Kohli had to say before the beginning of the match, “We are in good space, not bothered about the opposition.” \nHowever, Saturday was one of the worst days in the history of Indian cricket as Virat Kohli and team which was riding high on confidence after being unbeaten for almost 14 months in this formats now, was handed over a crushing defeat of 333 runs by a pumped up young Australian side led by and industrious Steven Smith. Team India was completely outplayed by the visitors who trapped them in their own spin web. Steve O’Keefe and Nathan Lyon shared all the ten wickets amongst themselves in the 2nd innings shattering the confidence of Indian batsmen. \nAlso, Read – IPL 2017: AB De Villiers is a good batsman but Virat Kohli is the best of this generation, says Mandeep Singh \nEarlier in the day, while speaking to the FinancialExpress.com, Kohli’s RCB teammate said, “Both Virat Kohli and AB De Villiers are really good batsmen, but when you consider the current performance, definitely Virat is a better player.” He added there is a lot of competition in the side for places by saying, “Last year I had to miss few matches due to injuries and KL Rahul took his opportunities, Sachin Baby also did well. So, I couldn’t get back into the playing XI and Sarfaraz (Khan) had to sit out as well.” Please Wait while comments are loading...", "external_links": [], "published": "2017-02-27T16:57:00.000+02:00", "crawled": "2017-02-27T12:45:42.231+02:00", "highlightTitle": ""}