{"organizations": [], "uuid": "1ba8a14c6a9b2a2869310976b0137191d997119a", "thread": {"social": {"gplus": {"shares": 0}, "pinterest": {"shares": 0}, "vk": {"shares": 0}, "linkedin": {"shares": 0}, "facebook": {"likes": 112, "shares": 112, "comments": 0}, "stumbledupon": {"shares": 0}}, "site_full": "www.rappler.com", "main_image": "http://rappler-assets.s3-us-west-1.amazonaws.com/612F469A6EA84F6BAE882D2B94A4B421/img/9DC70EA362C840FDBB5D2A8E54AB0EBC/pnp-solano-photo.jpg", "site_section": "http://feeds.rappler.com/rappler/news", "section_title": "Rappler: News", "url": "http://www.rappler.com/nation/160391-nueva-vizcaya-bus-crash", "country": "US", "domain_rank": 1586, "title": "Driver killed, 27 hurt in Nueva Vizcaya bus crash", "performance_score": 1, "site": "rappler.com", "participants_count": 1, "title_full": "Driver killed, 27 hurt in Nueva Vizcaya bus crash", "spam_score": 0.0, "site_type": "news", "published": "2017-02-03T14:39:00.000+02:00", "replies_count": 0, "uuid": "1ba8a14c6a9b2a2869310976b0137191d997119a"}, "author": "Rappler.com", "url": "http://www.rappler.com/nation/160391-nueva-vizcaya-bus-crash", "ord_in_thread": 0, "title": "Driver killed, 27 hurt in Nueva Vizcaya bus crash", "locations": [], "entities": {"persons": [{"name": "paul valino", "sentiment": "none"}, {"name": "arvin jimenez", "sentiment": "none"}, {"name": "carl pagawisan", "sentiment": "none"}, {"name": "diadi", "sentiment": "none"}, {"name": "michael angelo santos", "sentiment": "none"}, {"name": "rubin maranion", "sentiment": "none"}, {"name": "florante abadilla", "sentiment": "none"}, {"name": "noel bareng", "sentiment": "none"}, {"name": "andres cardo", "sentiment": "none"}, {"name": "alyssa ylanan", "sentiment": "none"}, {"name": "glechell gaffud", "sentiment": "none"}, {"name": "jeremy aplasan", "sentiment": "none"}, {"name": "solano", "sentiment": "none"}, {"name": "anila", "sentiment": "none"}, {"name": "marina macadangdang", "sentiment": "none"}, {"name": "rodelyn bello", "sentiment": "none"}, {"name": "elivira tablang", "sentiment": "none"}, {"name": "hilaria narag", "sentiment": "none"}, {"name": "ernesto acierto", "sentiment": "none"}, {"name": "crisanto pagawisan", "sentiment": "none"}, {"name": "maricel abad", "sentiment": "none"}, {"name": "shirlyn del carmen", "sentiment": "none"}, {"name": "joenald agbayani", "sentiment": "none"}, {"name": "reyma molabe", "sentiment": "none"}, {"name": "romulo uy", "sentiment": "none"}, {"name": "tado", "sentiment": "none"}, {"name": "cristopher dias", "sentiment": "none"}, {"name": "danilo nolledo", "sentiment": "none"}, {"name": "jaylord badongen", "sentiment": "none"}, {"name": "justine danao", "sentiment": "none"}, {"name": "kendale gaffud", "sentiment": "none"}, {"name": "billy mangali", "sentiment": "none"}], "locations": [{"name": "philippines", "sentiment": "none"}, {"name": "nueva vizcaya", "sentiment": "none"}, {"name": "sampaloc", "sentiment": "none"}, {"name": "bagabag", "sentiment": "none"}, {"name": "quirino province", "sentiment": "none"}, {"name": "maddela", "sentiment": "none"}, {"name": "solano", "sentiment": "none"}, {"name": "quirino", "sentiment": "none"}, {"name": "bascaran village", "sentiment": "none"}, {"name": "manila", "sentiment": "none"}, {"name": "florida", "sentiment": "none"}, {"name": "pnp-solano  cagayan", "sentiment": "none"}], "organizations": [{"name": "nueva vizcaya electric cooperative", "sentiment": "none"}, {"name": "crytel mae pagawisan", "sentiment": "none"}, {"name": "wilmar ngayan", "sentiment": "none"}]}, "highlightText": "", "language": "english", "persons": [], "text": "Philippines Driver killed, 27 hurt in Nueva Vizcaya bus crash The commuter bus came from Sampaloc, Manila, and was headed to Maddela town in Quirino province, say police Published 4:04   4:04   BUS CRASH. Authorities at the site of a bus crash in Nueva Vizcaya on February 3, 2017. Photo courtesy of PNP-Solano \nCAGAYAN, Philippines – One was killed and 27 others were injured when a bus crashed in Solano town in Nueva Vizcaya Friday morning, February 3. \nPolice Chief Inspector Billy Mangali, Solano town police chief, said in a report that a GV Florida bus crashed in Bascaran village in Solano town on Friday. \nThe driver, Michael Angelo Santos, was declared dead on arrival at a hospital, Mangali said.The Solano police chief said the alternate bus driver, who was on the trip, told authorities that the bus driver allegedly tried to avoid hitting another vehicle but lost control of the wheel. \nThe driver was reportedly driving fast when the crash happened.The commuter bus came from Sampaloc, Manila, and was headed to Maddela town in Quirino province.All 25 passengers, aged 3 to 62, suffered minor injuries and received treatment, Mangali said, along with with two other bus personnel – Danilo Nolledo, the alternate driver; and Wilmar Ngayan, the fare collector.Those injured were Crytel Mae Pagawisan, 23; Crisanto Pagawisan, 26 ; Prince Carl Pagawisan, 3; Ernesto Acierto, 56 ; Elivira Tablang; Maricel Abad, 25; Noel Bareng, 43; Florante Abadilla, 47; Jaylord Badongen, 23; Shirlyn del Carmen, 38; Hilaria Narag, 65; Reyma Molabe, 17; Andres Cardo, 16; Paul Valino, 17; Alyssa Ylanan, 17; Jeremy Aplasan, 18; Kendale Gaffud, 17; Glechell Gaffud, 28 ; Marina Macadangdang, 56; Romulo Uy, 26; Rodelyn Bello, 35 ; Cristopher Dias, 32; Justine Danao, 7; Joenald Agbayani, 46; and Rubin Maranion, 62.Meanwhile, the Nueva Vizcaya Electric Cooperative also reported that the bus hit one of its electric posts, causing power outage in the towns of Solano, Bagabag, and Diadi. Work to restore power would begin once the bus is removed from the site. \nFlorida Bus also figured in an accident in Benguet in 2014 that killed 14 people, including comedian Tado , whose real name is Arvin Jimenez. – Rappler.com  ", "external_links": [], "published": "2017-02-03T14:39:00.000+02:00", "crawled": "2017-02-03T10:54:55.638+02:00", "highlightTitle": ""}