{"organizations": [], "uuid": "5c81710953d921a249d1712274f8b174b4e5b58c", "thread": {"social": {"gplus": {"shares": 0}, "pinterest": {"shares": 0}, "vk": {"shares": 0}, "linkedin": {"shares": 0}, "facebook": {"likes": 122, "shares": 122, "comments": 0}, "stumbledupon": {"shares": 0}}, "site_full": "www.geo.tv", "main_image": "https://www.geo.tv/assets/uploads/updates/2017-02-17/131439_045922_updates.jpg", "site_section": "https://www.geo.tv/rss/1/0", "section_title": "GEO TV - Pakistan", "url": "https://www.geo.tv/latest/131439-Army-intensifies-search-and-combing-operations", "country": "TV", "domain_rank": 8287, "title": "Army intensifies search and combing operations", "performance_score": 1, "site": "geo.tv", "participants_count": 0, "title_full": "Army intensifies search and combing operations", "spam_score": 0.0, "site_type": "news", "published": "2017-02-17T23:47:00.000+02:00", "replies_count": 0, "uuid": "5c81710953d921a249d1712274f8b174b4e5b58c"}, "author": "", "url": "https://www.geo.tv/latest/131439-Army-intensifies-search-and-combing-operations", "ord_in_thread": 0, "title": "Army intensifies search and combing operations", "locations": [], "entities": {"persons": [], "locations": [{"name": "rawalpindi", "sentiment": "none"}, {"name": "pakistan", "sentiment": "none"}, {"name": "orakzai  islamabad", "sentiment": "none"}], "organizations": [{"name": "army", "sentiment": "negative"}, {"name": "army operations", "sentiment": "none"}, {"name": "pakistan army", "sentiment": "none"}, {"name": "army news", "sentiment": "none"}, {"name": "pindi corps", "sentiment": "none"}, {"name": "ispr", "sentiment": "none"}, {"name": "rawalpindi corps", "sentiment": "none"}, {"name": "corps", "sentiment": "none"}, {"name": "inter-services public relations", "sentiment": "none"}]}, "highlightText": "", "language": "english", "persons": [], "text": "Army intensifies search and combing operations | Six terrorists killed after clash between security forces and terrorists in Orakzai \nISLAMABAD: Following the string of terrorist attacks across Pakistan the military apparatus has intensified operations across the country. \nAccording to a statement released by the Inter-Services Public Relations (ISPR) branch of the Pakistan Army, a high-level meeting was held on Friday chaired by the Corps Commander Rawalpindi and attended by senior officials of law enforcement agencies. \nDuring the meeting security forces and intelligence outfits were instructed to further intensify combing and targeted operations with the aim to eliminate terrorists and sleepers cells. \nThe meeting reviewed the response mechanism and take stock of the security situation. 0 0 Army intensifies search and combing operations was posted in pakistan of Geo TV - https://www.geo.tv on February 17, 2017 and was last updated on February 17, 2017. This news story is related to Pakistan News, Army News, Army Operations, Pindi Corps, Rawalpindi Corps. Permanent link to the news story \"Army intensifies search and combing operations\" is https://www.geo.tv/latest/131439-Army-intensifies-search-and-combing-operations . More From Pakistan:", "external_links": [], "published": "2017-02-17T23:47:00.000+02:00", "crawled": "2017-02-17T13:59:57.430+02:00", "highlightTitle": ""}