{"organizations": [], "uuid": "cd2988eeb5c7e278e0384bf380ce00c4a7d56791", "thread": {"social": {"gplus": {"shares": 0}, "pinterest": {"shares": 0}, "vk": {"shares": 0}, "linkedin": {"shares": 1}, "facebook": {"likes": 249, "shares": 249, "comments": 0}, "stumbledupon": {"shares": 0}}, "site_full": "www.geo.tv", "main_image": "https://www.geo.tv/assets/uploads/updates/2017-02-17/131396_075820_updates.jpg", "site_section": "https://www.geo.tv/rss/1/0", "section_title": "GEO TV - Pakistan", "url": "https://www.geo.tv/latest/131396-Terrorists-attack-Pak-Army-checkpost-from-Afghanistan-ISPR", "country": "TV", "domain_rank": 8287, "title": "Terrorists attack Pak Army checkpost from Afghanistan: ISPR", "performance_score": 2, "site": "geo.tv", "participants_count": 0, "title_full": "Terrorists attack Pak Army checkpost from Afghanistan: ISPR", "spam_score": 0.0, "site_type": "news", "published": "2017-02-17T14:57:00.000+02:00", "replies_count": 0, "uuid": "cd2988eeb5c7e278e0384bf380ce00c4a7d56791"}, "author": "", "url": "https://www.geo.tv/latest/131396-Terrorists-attack-Pak-Army-checkpost-from-Afghanistan-ISPR", "ord_in_thread": 0, "title": "Terrorists attack Pak Army checkpost from Afghanistan: ISPR", "locations": [], "entities": {"persons": [{"name": "taimur", "sentiment": "none"}, {"name": "syed abdul nasir yousafi", "sentiment": "none"}, {"name": "geo", "sentiment": "none"}], "locations": [{"name": "mohmand  karachi", "sentiment": "none"}, {"name": "afghanistan", "sentiment": "none"}, {"name": "peshawar", "sentiment": "none"}, {"name": "pakistan", "sentiment": "none"}, {"name": "sehwan", "sentiment": "none"}, {"name": "lahore", "sentiment": "none"}, {"name": "mohmand agency", "sentiment": "none"}, {"name": "pakistan news", "sentiment": "none"}], "organizations": [{"name": "ispr", "sentiment": "negative"}, {"name": "pak army", "sentiment": "negative"}, {"name": "ispr   afghanistan", "sentiment": "none"}, {"name": "foreign office", "sentiment": "none"}, {"name": "khyber agency", "sentiment": "none"}, {"name": "samaa news", "sentiment": "none"}, {"name": "inter services public relations", "sentiment": "none"}, {"name": "dhm", "sentiment": "none"}]}, "highlightText": "", "language": "english", "persons": [], "text": "Terrorist attack from Afghanistan repulsed in Mohmand \nKARACHI: Terrorists from Afghanistan border area opened fire at a Pakistani border post in Khyber Agency on early Friday morning. \nAccording to a press release issued by the military’s media wing, Inter Services Public Relations (ISPR), in reaction to the aggression, Pakistani army effectively responded to the fire. Two FC soldiers received minor injuries, while there were reports of a number of militants killed in the exchange of fire. \nThe Pakistan-Afghanistan border was closed with immediate effect due to security reasons, the Inter Services Public Relations, hours after a bomb ripped through a shrine in interior Sindh leaving over 70 people dead. The border will remain closed until further orders. \nThe move comes amid a wave of terrorist attacks in the country. \nThursday's attack in Sehwan was also part of the same wave in the country, and the fifth blast in less than a week targeting innocent people. \nOn February 12, a cameraman, Taimur from Samaa News was killed when the channel’s DSNG van was attacked. \nOn February 13, a suicide attack in Lahore killed 14 people and wounded over 60 others. \nOn February 15, three suicide bombers targeted Khyber Pakhtunkhwa and the adjoining tribal areas leaving around seven people dead. \nOne of the incidents occurred in Peshawar where a suicide bomber riding a motorbike hit a vehicle carrying civil judges, while two other suicide bombers blew themselves up at separate locations in Mohmand Agency. Terrorist sanctuaries in Afghanistan \nPakistani diplomatic officials on Wednesday summoned the Afghan deputy head of mission to the Foreign Office to convey their concerns over continuing attacks by terrorist outfit Jamaat-ul-Ahrar from its sanctuaries inside Afghanistan. \nAccording to a Foreign Office press statement, Afghan Deputy Head of Mission Syed Abdul Nasir Yousafi was called in to the Foreign Office on Tuesday by the Additional Secretary. \n\"[The] attention of the DHM was also drawn to earlier actionable intelligence shared by our authorities with the Afghan side. Afghanistan was urged to take urgent measures to eliminate the terrorists and their sanctuaries, financiers, and handlers operating from its territory,\" said the press release. \nThe Foreign Office said an aide-memoire containing details of the terrorist attacks and supporting information was also shared with the Afghan deputy head of mission. \n0 0 Terrorists attack Pak Army checkpost from Afghanistan: ISPR   Afghanistan, Pakistan, Khyber Agency, Geo, Geo News, Pakistan, Pakistan News.   \"Terrorists attack Pak Army checkpost from Afghanistan: ISPR\" is https://www.geo.tv/latest/131396-Terrorists-attack-Pak-Army-checkpost-from-Afghanistan-ISPR  ", "external_links": [], "published": "2017-02-17T14:57:00.000+02:00", "crawled": "2017-02-17T05:13:19.580+02:00", "highlightTitle": ""}