{"organizations": [], "uuid": "6d09701436a462f792f17f82c6a38842a8eacf55", "thread": {"social": {"gplus": {"shares": 0}, "pinterest": {"shares": 1}, "vk": {"shares": 0}, "linkedin": {"shares": 0}, "facebook": {"likes": 111, "shares": 111, "comments": 0}, "stumbledupon": {"shares": 0}}, "site_full": "www.boston.com", "main_image": "https://www.boston.com/wp-content/uploads/2017/02/sting-oscars-850x478.jpeg", "site_section": "", "section_title": "", "url": "https://www.boston.com/culture/entertainment/2017/02/26/sting-performs-song-from-film-about-slain-nh-journalist-james-foley-at-oscars", "country": "EU", "domain_rank": 2430, "title": "Sting performs song from film about slain NH journalist James Foley at Oscars", "performance_score": 1, "site": "boston.com", "participants_count": 0, "title_full": "Sting performs song from film about slain NH journalist James Foley at Oscars", "spam_score": 0.001, "site_type": "news", "published": "2017-02-27T06:37:00.000+02:00", "replies_count": 0, "uuid": "6d09701436a462f792f17f82c6a38842a8eacf55"}, "author": "Kevin Slane", "url": "https://www.boston.com/culture/entertainment/2017/02/26/sting-performs-song-from-film-about-slain-nh-journalist-james-foley-at-oscars", "ord_in_thread": 0, "title": "Sting performs song from film about slain NH journalist James Foley at Oscars", "locations": [], "entities": {"persons": [{"name": "james foley", "sentiment": "negative"}, {"name": "kevin slane", "sentiment": "none"}, {"name": "benj pasek", "sentiment": "none"}, {"name": "justin timberlake", "sentiment": "none"}, {"name": "heather macdonald", "sentiment": "none"}, {"name": "oakes", "sentiment": "none"}, {"name": "lin-manuel miranda", "sentiment": "none"}, {"name": "foley", "sentiment": "none"}, {"name": "justin hurwitz", "sentiment": "none"}, {"name": "jim", "sentiment": "none"}, {"name": "–chris", "sentiment": "none"}, {"name": "sting", "sentiment": "none"}, {"name": "justin paul", "sentiment": "none"}, {"name": "brian oakes", "sentiment": "none"}], "locations": [{"name": "new hampshire", "sentiment": "none"}, {"name": "moana", "sentiment": "none"}, {"name": "hollywood", "sentiment": "none"}, {"name": "los angeles", "sentiment": "none"}], "organizations": [{"name": "isis", "sentiment": "none"}, {"name": "boston.com", "sentiment": "none"}]}, "highlightText": "", "language": "english", "persons": [], "text": "Sting performs song from film about slain NH journalist James Foley at Oscars Sting performs song from film about slain NH journalist James Foley at Oscars Sting performs best original song nominee 'The Empty Chair' from 'Jim: The James Foley Story' at the Oscars on Sunday, Feb. 26, 2017, at the Dolby Theatre in Los Angeles. –Chris Pizzello/Invision/AP By Kevin Slane February 26, 2017 \nThroughout Sunday’s Academy Awards ceremony, singers performed portions of the pieces nominated for Best Original Song, including Justin Timberlake opening the show with “Can’t Stop the Feeling!” from the film Trolls and Lin-Manuel Miranda rapping a prologue to “How Far I’ll Go” from Moana . \nRock musician Sting also performed his Oscar-nominated song, “The Empty Chair,” which was written for the movie Jim: The James Foley Story . The film is a documentary about photojournalist James Foley, a New Hampshire native who was killed by members of ISIS in 2014. \nJim was co-written by Foley’s childhood friends Brian Oakes and Heather MacDonald (who is a Boston.com employee), and directed by Oakes. \nWatch the performance below: \n— Hollywood Reporter (@THR) February 27, 2017 \nLater in the broadcast, Justin Hurwitz, Benj Pasek, and Justin Paul won Best Original Song for “City Of Stars” from La La Land . Advertisement ", "external_links": [], "published": "2017-02-27T06:37:00.000+02:00", "crawled": "2017-02-27T08:45:15.271+02:00", "highlightTitle": ""}