{"organizations": [], "uuid": "3f31b14cef2d6dcd288deb3623e3b55732a9dff5", "thread": {"social": {"gplus": {"shares": 0}, "pinterest": {"shares": 0}, "vk": {"shares": 0}, "linkedin": {"shares": 0}, "facebook": {"likes": 215, "shares": 215, "comments": 0}, "stumbledupon": {"shares": 0}}, "site_full": "bdnews24.com", "main_image": "http://d30fl32nd2baj9.cloudfront.net/media/2017/02/22/foreign-minister-ali-takes-eu-heads-of-mission-to-see-the-northern-districts-under-visit-bangladesh-program.jpg/ALTERNATES/w640/Foreign+Minister+Ali+takes+EU+Heads+of+Mission+to+see+the+northern+districts+under+Visit+Bangladesh+program.JPG", "site_section": "http://bdnews24.com/?widgetName=rssfeed&widgetId=1150&getXmlFeed=true", "section_title": "wf-escenic-times - Home", "url": "http://bdnews24.com/bangladesh/2017/02/22/fm-takes-eu-diplomats-to-northern-bangladesh-visit", "country": "US", "domain_rank": 2276, "title": "FM takes EU diplomats to northern Bangladesh visit", "performance_score": 2, "site": "bdnews24.com", "participants_count": 0, "title_full": "FM takes EU diplomats to northern Bangladesh visit", "spam_score": 0.0, "site_type": "news", "published": "2017-02-23T06:18:00.000+02:00", "replies_count": 0, "uuid": "3f31b14cef2d6dcd288deb3623e3b55732a9dff5"}, "author": "", "url": "http://bdnews24.com/bangladesh/2017/02/22/fm-takes-eu-diplomats-to-northern-bangladesh-visit", "ord_in_thread": 0, "title": "FM takes EU diplomats to northern Bangladesh visit", "locations": [], "entities": {"persons": [{"name": "mikael hemniti winther", "sentiment": "none"}, {"name": "leoni margaretha cuelenaere", "sentiment": "none"}, {"name": "pierre mayaudon", "sentiment": "none"}, {"name": "alison blake", "sentiment": "none"}, {"name": "thomas prinz", "sentiment": "none"}, {"name": "mahmood ali", "sentiment": "none"}, {"name": "hasina", "sentiment": "none"}], "locations": [{"name": "eu", "sentiment": "none"}, {"name": "bangladesh", "sentiment": "none"}, {"name": "khansama upazila", "sentiment": "none"}, {"name": "upazila", "sentiment": "none"}, {"name": "denmark", "sentiment": "none"}, {"name": "netherlands", "sentiment": "none"}, {"name": "germany", "sentiment": "none"}, {"name": "dinajpur", "sentiment": "none"}, {"name": "panchagarh", "sentiment": "none"}, {"name": "nilphamari", "sentiment": "none"}], "organizations": [{"name": "eu", "sentiment": "negative"}, {"name": "community health clinic", "sentiment": "none"}, {"name": "epz", "sentiment": "none"}, {"name": "eu delegation", "sentiment": "none"}, {"name": "unesco", "sentiment": "none"}, {"name": "uttara epz", "sentiment": "none"}]}, "highlightText": "", "language": "english", "persons": [], "text": "FM takes EU diplomats to northern Bangladesh visit Senior Correspondent bdnews24.com Previous Next Foreign Minister AH Mahmood Ali has taken five Dhaka-based diplomats of the European countries to the northern districts as part of the foreign ministry’s ‘Visit Bangladesh’ programme. \nHead of EU Delegation Ambassador Pierre Mayaudon is leading the delegation to the northern Bangladesh districts of Nilphamari, Dinajpur and Panchagarh. \nOther members of the delegation include British High Commissioner Alison Blake, Ambassadors of Germany Dr Thomas Prinz, Leoni Margaretha Cuelenaere of the Netherlands and Mikael Hemniti Winther of Denmark. \nThe foreign ministry in a statement on Wednesday said the programme for the diplomats was to see for themselves the changes that the northern districts of the country have undergone in the last seven or more years especially in connectivity including roads, bridges, railways, electricity and socio-economic development. \nThe day one began with, the delegation visiting Uttara EPZ in Nilphamari, one of the growing EPZs. \nThe delegation was briefed by the EPZ authorities about the impact the EPZ is having in socio-economic condition of the area especially uplifting the women through employment. \nAlthough it is situated away from land or sea port the overall cost of doing business is lower in this EPZ. They also took the delegation to visit a leather products factory. The delegation also visited Khansama Upazila complex and met with the Chairmen of Upazila and Union Parishads. Officials of Upazila administration were also present.\nThey visited the \"Haque-er Haat\" Community Health Clinic and saw local level health services delivery- an exemplary health service delivery programme initiated by Prime Minister Sheikh Hasina for the people in rural areas all over Bangladesh. \nThe first day ended with a visit to a Litchi garden which Dinajpur is famous for and historic tourist site \"Ramsagar\". \nThe delegation will visit UNESCO heritage site Kantajew Temple and tea gardens in Panchagarh on Thursday before concluding the visit.", "external_links": [], "published": "2017-02-23T06:18:00.000+02:00", "crawled": "2017-02-22T20:12:52.651+02:00", "highlightTitle": ""}