{"organizations": [], "uuid": "ca3a166bce98cb706a99b0312424209e8a45ce43", "thread": {"social": {"gplus": {"shares": 1}, "pinterest": {"shares": 0}, "vk": {"shares": 0}, "linkedin": {"shares": 3}, "facebook": {"likes": 139, "shares": 139, "comments": 0}, "stumbledupon": {"shares": 0}}, "site_full": "au.be.yahoo.com", "main_image": "https://s.yimg.com/iu/api/res/1.2/sV5fAZlyYRT7C8mimZm.gg--/YXBwaWQ9eXZpZGVvO3E9NzA7bj0xO2ZpbGw7cm90YXRlPWF1dG8-/https://s.yimg.com/ea/img/-/170219/58a8d72069746_28hero_landscape.jpg", "site_section": "", "section_title": "", "url": "https://au.be.yahoo.com/travel/a/34447096/kiwi-films-moment-cruise-ship-crashes-new-zealand-yahooo7-be/", "country": "US", "domain_rank": 5, "title": "Kiwi films moment cruise ship crashes New Zealand Yahooo7 Be - Yahoo7", "performance_score": 1, "site": "yahoo.com", "participants_count": 0, "title_full": "Kiwi films moment cruise ship crashes New Zealand Yahooo7 Be - Yahoo7", "spam_score": 0.183, "site_type": "news", "published": "2017-02-19T11:17:00.000+02:00", "replies_count": 0, "uuid": "ca3a166bce98cb706a99b0312424209e8a45ce43"}, "author": "Aletha Wilkinson", "url": "https://au.be.yahoo.com/travel/a/34447096/kiwi-films-moment-cruise-ship-crashes-new-zealand-yahooo7-be/", "ord_in_thread": 0, "title": "Kiwi films moment cruise ship crashes New Zealand Yahooo7 Be - Yahoo7", "locations": [], "entities": {"persons": [{"name": "milburn", "sentiment": "none"}, {"name": "tumblr", "sentiment": "none"}, {"name": "will martin", "sentiment": "none"}, {"name": "harbour", "sentiment": "none"}, {"name": "jim dilley", "sentiment": "none"}, {"name": "instagram", "sentiment": "none"}], "locations": [{"name": "new zealand", "sentiment": "none"}, {"name": "pinterest", "sentiment": "none"}, {"name": "timaru", "sentiment": "none"}], "organizations": [{"name": "facebook/storyful", "sentiment": "none"}, {"name": "facebook/ will martin new zealander", "sentiment": "none"}, {"name": "new zealand transport accident commission", "sentiment": "none"}, {"name": "facebook", "sentiment": "none"}, {"name": "radio new zealand", "sentiment": "none"}]}, "highlightText": "", "language": "english", "persons": [], "text": "Share Kiwi films moment cruise ship crashes New Zealand Yahooo7 Be - Yahoo7 \nA woman managed to film the dramatic moment that luxury cruise ship Seabourn Encore collided with another vessel, the Milburn Carrier II, in the port of Timaru, New Zealand. Close Cruise Ship Collides With Vessel in Timaru Port UP NEXT VIDEO \n\"Oh, this is not good,\" the woman can be heard exclaiming, as the ship starts to drift and break free of its moorings. Heavy winds blow the ship away from port and its moorings start to snap. Source: Facebook/Storyful \n\"Look at it.\" The ship draws closer to another vessel. Source: Facebook/Storyful \n\"I hope you're getting all this on video,\" the woman's male companion chimes in. \n\"'Course I am,\" she replies. \"I can't stop shaking. He's still got the ladder down... he's going to hit that Milburn. Oh my God!\" The moment of impact. Source: Facebook/Storyful \n\"Where's the blinkin' tugs?\" the woman can be heard asking. \"Look at these guys running on the ship!\" The footage ends with the cruise liner still only partially moored. Source: Facebook/Storyful \nâ€œThere were mooring issues with the ship and a strong southerly wind blew it away from the wharf,\" Harbour master Jim Dilley told Radio New Zealand after the incident. \nBoth ships reportedly sustained damage and an inquiry has been launched by the New Zealand Transport Accident Commission. \nNone of the the more than 600 passengers and crew on board were injured. Close New Zealander films moment woman is saved after falling off cruise ship UP NEXT VIDEO Kiwi musician Will Martin has captured the moment a woman was rescued after falling overboard on the Sun Princess cruise ship. Source: Facebook/ Will Martin New Zealander films moment woman is saved after falling off cruise ship \nWant more celebrity, entertainment and lifestyle news? Follow Be on Facebook , Twitter , Pinterest , Tumblr and Instagram ", "external_links": [], "published": "2017-02-19T11:17:00.000+02:00", "crawled": "2017-02-19T03:08:42.248+02:00", "highlightTitle": ""}