{"organizations": [], "uuid": "e758dc58bf3288eb7ebafcd8a98e448a0faa5f68", "thread": {"social": {"gplus": {"shares": 0}, "pinterest": {"shares": 0}, "vk": {"shares": 0}, "linkedin": {"shares": 0}, "facebook": {"likes": 249, "shares": 249, "comments": 0}, "stumbledupon": {"shares": 0}}, "site_full": "www.telegraph.co.uk", "main_image": "http://www.telegraph.co.uk/content/dam/news/2017/02/24/toke-on-trent-xlarge_trans_NvBQzQNjv4BqqVzuuqpFlyLIwiB6NTmJwfSVWeZ_vEN7c6bHu2jJnT8.jpg", "site_section": "http://www.telegraph.co.uk/news/worldnews/middleeast/jordan/rss", "section_title": "News", "url": "http://www.telegraph.co.uk/news/2017/02/24/labour-fends-ukip-challenge-hold-stoke-on-trent-central-by-election/", "country": "GB", "domain_rank": 317, "title": "Labour fends off Ukip challenge to hold Stoke-on-Trent Central in by-election", "performance_score": 2, "site": "telegraph.co.uk", "participants_count": 1, "title_full": "Labour fends off Ukip challenge to hold Stoke-on-Trent Central in by-election", "spam_score": 0.0, "site_type": "news", "published": "2017-02-24T09:26:00.000+02:00", "replies_count": 0, "uuid": "e758dc58bf3288eb7ebafcd8a98e448a0faa5f68"}, "author": "Press Association", "url": "http://www.telegraph.co.uk/news/2017/02/24/labour-fends-ukip-challenge-hold-stoke-on-trent-central-by-election/", "ord_in_thread": 0, "title": "Labour fends off Ukip challenge to hold Stoke-on-Trent Central in by-election", "locations": [], "entities": {"persons": [{"name": "ukip", "sentiment": "negative"}, {"name": "nuttall", "sentiment": "none"}, {"name": "paul nuttall", "sentiment": "none"}, {"name": "jeremy corbyn", "sentiment": "none"}, {"name": "gareth snell", "sentiment": "none"}, {"name": "corbyn", "sentiment": "none"}, {"name": "brexit", "sentiment": "none"}, {"name": "snell", "sentiment": "none"}, {"name": "sophia", "sentiment": "none"}], "locations": [{"name": "ukip", "sentiment": "none"}, {"name": "britain", "sentiment": "none"}, {"name": "hillsborough", "sentiment": "none"}, {"name": "stoke-on-trent", "sentiment": "none"}, {"name": "fenton sports centre", "sentiment": "none"}], "organizations": [{"name": "news labour", "sentiment": "negative"}, {"name": "labour", "sentiment": "negative"}, {"name": "getty images press association", "sentiment": "none"}, {"name": "stoke-on-trent central", "sentiment": "none"}, {"name": "hamas", "sentiment": "none"}]}, "highlightText": "", "language": "english", "persons": [], "text": "News Labour fends off Ukip challenge to hold Stoke-on-Trent Central in by-election Labour candidate Gareth Snell and wife Sophia at Fenton Sports Centre as votes are counted in the Stoke-On-Trent Central by-election Credit: Getty Images Press Association 24 February 2017 • 2:26am \nL abour has held Stoke-on-Trent Central after Ukip leader Paul Nuttall failed in his bid to take the seat. \nGareth Snell secured a comfortable win of 7,853 to his challenger's 5,233 to be elected as the city's new MP. \nUkip campaigned hard in the constituency in the hope of capitalising on its overwhelming support for Brexit. Stoke on Trent Central: — Britain Elects (@britainelects) 24 February 2017 \nB ut Mr Nuttall's campaign was hit by a series of setbacks, including being forced to apologise for a false claim on his website that he lost \"close friends\" in the Hillsborough disaster. \nMr Snell also faced a rocky campaign after it emerged he had described Jeremy Corbyn as an \"IRA-supporting friend of Hamas\" and called Brexit a \"massive pile of shit\". \nBut the seat has been held by Labour since it was created in 1950 and the party secured a 5,179 majority in 2015. \nThe result will come as a relief to Mr Corbyn, but critics have insisted the result should have never been in doubt. \nLabour secured a 2,620 majority but its vote share fell by around 2%, while Ukip's went up by the same amount.", "external_links": [], "published": "2017-02-24T09:26:00.000+02:00", "crawled": "2017-02-24T04:39:24.805+02:00", "highlightTitle": ""}