{"organizations": [], "uuid": "ae18665caf1cf7b71215872a32083c582b639d90", "thread": {"social": {"gplus": {"shares": 0}, "pinterest": {"shares": 0}, "vk": {"shares": 0}, "linkedin": {"shares": 0}, "facebook": {"likes": 192, "shares": 192, "comments": 0}, "stumbledupon": {"shares": 0}}, "site_full": "bdnews24.com", "main_image": "http://d30fl32nd2baj9.cloudfront.net/media/2017/02/22/washington.jpg/ALTERNATES/w640/Washington.jpg", "site_section": "http://bdnews24.com/?widgetName=rssfeed&widgetId=1150&getXmlFeed=true", "section_title": "wf-escenic-times - Home", "url": "http://bdnews24.com/bangladesh/2017/02/22/bangladesh-missions-observe-martyrs-day", "country": "US", "domain_rank": 2276, "title": "Bangladesh missions observe Martyrs' Day", "performance_score": 1, "site": "bdnews24.com", "participants_count": 0, "title_full": "Bangladesh missions observe Martyrs' Day", "spam_score": 0.0, "site_type": "news", "published": "2017-02-23T04:54:00.000+02:00", "replies_count": 0, "uuid": "ae18665caf1cf7b71215872a32083c582b639d90"}, "author": "", "url": "http://bdnews24.com/bangladesh/2017/02/22/bangladesh-missions-observe-martyrs-day", "ord_in_thread": 0, "title": "Bangladesh missions observe Martyrs' Day", "locations": [], "entities": {"persons": [{"name": "tarik ahsan", "sentiment": "none"}, {"name": "syed muazzem ali", "sentiment": "none"}, {"name": "bangla", "sentiment": "none"}, {"name": "tarana halim", "sentiment": "none"}, {"name": "muhammad a muhith", "sentiment": "none"}, {"name": "mujibur rahman", "sentiment": "none"}, {"name": "mohammad ziauddin", "sentiment": "none"}, {"name": "polina vinogradova", "sentiment": "none"}, {"name": "hasina", "sentiment": "none"}], "locations": [{"name": "bangladesh", "sentiment": "none"}, {"name": "philippines", "sentiment": "none"}, {"name": "ghana", "sentiment": "none"}, {"name": "islamabad", "sentiment": "none"}, {"name": "us", "sentiment": "none"}, {"name": "paraguay", "sentiment": "none"}, {"name": "vienna international centre", "sentiment": "none"}, {"name": "indonesia", "sentiment": "none"}, {"name": "austria", "sentiment": "none"}, {"name": "afghanistan", "sentiment": "none"}, {"name": "sri lanka", "sentiment": "none"}, {"name": "guyana", "sentiment": "none"}, {"name": "india", "sentiment": "none"}, {"name": "mexico", "sentiment": "none"}, {"name": "shaheed minar", "sentiment": "none"}, {"name": "copenhagen", "sentiment": "none"}, {"name": "bosnia", "sentiment": "none"}, {"name": "peru", "sentiment": "none"}, {"name": "east pakistan", "sentiment": "none"}, {"name": "new delhi", "sentiment": "none"}, {"name": "japan", "sentiment": "none"}], "organizations": [{"name": "language movement", "sentiment": "none"}, {"name": "un", "sentiment": "none"}, {"name": "bangladesh high commission", "sentiment": "none"}, {"name": "american university", "sentiment": "none"}, {"name": "unesco", "sentiment": "none"}]}, "highlightText": "", "language": "english", "persons": [], "text": "Bangladesh missions observe Martyrs' Day Senior Correspondent bdnews24.com Previous Next Bangladesh’s missions in different capitals have observed the Feb 21 Shaheed Dibas or Martyrs' Day with due solemnity. \nThe day is also being commemorated worldwide as International Mother Language Day after UNESCO’s recognition in 1999. \nDiscussions, cultural show and reading out of the messages from the president and the prime minister were some of the highlights of the observance. \nNational flag was kept at half-mast and wreaths were placed at the makeshift Shaheed Minars in tribute to the Language Movement martyrs of 1952. Special prayers were also offered for those who lost their life for establishing Bangla as state language in the then East Pakistan, now Bangladesh.\nMembers of expatriate Bangladeshi community, officials and mission staff joined the daylong events. \nState Minister for Post and Telecommunications Tarana Halim who is in New Delhi joined the observance of the day at the Bangladesh High Commission in New Delhi. High Commissioner Syed Muazzem Ali recalled Prime Minister Sheikh Hasina’s special move to get the UNESCO approve a Dhaka-led resolution to declare Feb 21 as the International Mother Language Day.\nBangladesh Ambassador to the US Mohammad Ziauddin led the embassy officials and staff to place wreaths at the altar of Shaheed Minar on the embassy premises. \nDirector TESOL World Language & Culture at American University Polina Vinogradova joined the embassy discussion on the significance of the day. \nCultural troupes from Afghanistan, Indonesia, Japan, the Philippines, Guyana, Ghana, India, Sri Lanka, Paraguay, Mexico, Peru and Bosnia presented songs and dances. The Bangladesh High Commission in Islamabad said the chancery premises were decorated with Martyrs’ Day posters and inscriptions of Bangla alphabets.\nHigh Commissioner Tarik Ahsan paid tribute to the language martyrs and recalled with gratitude the participation by the Father of the Nation Bangabandhu Sheikh Mujibur Rahman and other activists of the progressive political parties and socio-cultural organisations in the Language Movement. \nBangladesh Ambassador in Copenhagen Muhammad A Muhith highlighted the socio-economic progress of Bangladesh while speaking on the significance of the day at a discussion organised by the embassy. He called upon the expatriate Bangladesh community “to educate and enlighten their children with Bangla and Bengali culture so that they don't get detached from their roots”.\nIn Austria, the embassy observed the day at the Vienna International Centre with the participation of UN officials in the capital.", "external_links": [], "published": "2017-02-23T04:54:00.000+02:00", "crawled": "2017-02-22T20:13:21.817+02:00", "highlightTitle": ""}