{"organizations": [], "uuid": "9fc6c2c6ca7a6eb37cebbd3d726b91f6efa257fc", "thread": {"social": {"gplus": {"shares": 2}, "pinterest": {"shares": 0}, "vk": {"shares": 0}, "linkedin": {"shares": 0}, "facebook": {"likes": 379, "shares": 379, "comments": 0}, "stumbledupon": {"shares": 0}}, "site_full": "www.geo.tv", "main_image": "https://www.geo.tv/assets/uploads/updates/2017-02-23/132119_121352_updates.jpg", "site_section": "https://www.geo.tv/rss/1/1", "section_title": "GEO TV - Pakistan", "url": "https://www.geo.tv/latest/132119-Explosion-in-DHA-Lahore-claims-seven-lives", "country": "TV", "domain_rank": 8287, "title": "Blast in DHA Lahore claims seven lives", "performance_score": 3, "site": "geo.tv", "participants_count": 0, "title_full": "Blast in DHA Lahore claims seven lives", "spam_score": 0.0, "site_type": "news", "published": "2017-02-23T18:52:00.000+02:00", "replies_count": 0, "uuid": "9fc6c2c6ca7a6eb37cebbd3d726b91f6efa257fc"}, "author": "", "url": "https://www.geo.tv/latest/132119-Explosion-in-DHA-Lahore-claims-seven-lives", "ord_in_thread": 0, "title": "Blast in DHA Lahore claims seven lives", "locations": [], "entities": {"persons": [{"name": "salman rafiq", "sentiment": "none"}], "locations": [{"name": "lahore", "sentiment": "none"}, {"name": "dha lahore", "sentiment": "none"}, {"name": "lahore blast", "sentiment": "none"}, {"name": "pakistan", "sentiment": "none"}, {"name": "dha lahore", "sentiment": "none"}, {"name": "dha", "sentiment": "none"}, {"name": "punjab assembly", "sentiment": "none"}, {"name": "lahore", "sentiment": "none"}, {"name": "punjab", "sentiment": "none"}], "organizations": [{"name": "dha", "sentiment": "negative"}, {"name": "punjab police", "sentiment": "none"}, {"name": "punjab health", "sentiment": "none"}, {"name": "general hospital", "sentiment": "none"}, {"name": "geo news", "sentiment": "none"}]}, "highlightText": "", "language": "english", "persons": [], "text": "Blast in DHA Lahore claims seven lives | Police officials among 14 martyred in Lahore suicide bombing \nLAHORE: An explosion in Lahore's DHA Y-Block has claimed seven lives while 17 people have been injured, rescue sources informed Geo News. \nHowever speaking to the media, Punjab Health Minister Salman Rafiq claimed 4 people had been killed, 4 were critically and doctors were fighting to save their lives while another 15 injured were under treatment at the General Hospital. \nAfter some conflicting reports, the Punjab Police confirmed the explosion to have been caused by a timed device. \nPanic gripped the area a little before noon when a loud explosion resonated across Y-Block in DHA Lahore. The area is a popular shopping centre in the DHA locality of the city. \nReports state that the explosion took place in an under construction building. Four cars and 12 motorcycles were also damaged as a result of the blast while the windows of nearby buildings were shattered. \nEmergency was declared at the General Hospital following the explosion where the injured are being rushed for treatment. \nAccording to Punjab Police the explosion was caused by a timed device which contained 8-10 kilograms of explosives. \nHowever, earlier the official Punjab government twitter account stated the explosion was the result of a generator explosion. Clarification on Lahore Y block blast: It's a generator blast and rescue team has reached the site. Please spread this. â€” Govt Of The Punjab (@GovtOfPunjab) February 23, 2017 \nEarlier on 13 February, at least 14 people including two senior police officials were killed in a suicide bombing near the Punjab Assembly. \n-This is a developing story and will be updated accordingly. 0 0 Blast in DHA Lahore claims seven lives   Blast In Dha Lahore, Blast In Lahore, Dha Lahore, Explosion In Lahore, Geo News, Lahore Blast, Lahore Explosion, Latest News, Pakistan News, Dha, Dha Lahore, Lahore.   \"Blast in DHA Lahore claims seven lives\" is https://www.geo.tv/latest/132119-Explosion-in-DHA-Lahore-claims-seven-lives  ", "external_links": [], "published": "2017-02-23T18:52:00.000+02:00", "crawled": "2017-02-23T09:59:48.678+02:00", "highlightTitle": ""}