{"organizations": [], "uuid": "d60f5f46b8bc5378a64e09446193fc0f5d2f4915", "thread": {"social": {"gplus": {"shares": 3}, "pinterest": {"shares": 0}, "vk": {"shares": 0}, "linkedin": {"shares": 0}, "facebook": {"likes": 498, "shares": 498, "comments": 0}, "stumbledupon": {"shares": 1}}, "site_full": "www.vulture.com", "main_image": "http://pixel.nymag.com/imgs/daily/vulture/2017/02/20/20-Emma-Watson.w1200.h630.jpg", "site_section": "http://feeds.feedburner.com/nymag/vulture", "section_title": "Vulture", "url": "http://www.vulture.com/2017/02/emma-watson-sings-belle-in-new-beauty-and-the-beast-clip.html?utm_source=feedburner&utm_medium=feed&utm_campaign=Feed%3A+nymag%2Fvulture+%28Vulture+-+nymag.com%27s+Entertainment+and+Culture+Blog%29", "country": "US", "domain_rank": 2191, "title": "Emma Watson Sings ‘Belle’ in New Beauty and the Beast Clip", "performance_score": 4, "site": "vulture.com", "participants_count": 1, "title_full": "Emma Watson Sings ‘Belle’ in New Beauty and the Beast Clip", "spam_score": 0.0, "site_type": "news", "published": "2017-02-21T00:15:00.000+02:00", "replies_count": 0, "uuid": "5c6f4744e3951d4d26b81b40f4e502d77f0d0f44"}, "author": "", "url": "http://www.vulture.com/2017/02/emma-watson-sings-belle-in-new-beauty-and-the-beast-clip.html", "ord_in_thread": 0, "title": "Emma Watson Sings ‘Belle’ in New Beauty and the Beast Clip", "locations": [], "entities": {"persons": [{"name": "emma watson", "sentiment": "negative"}, {"name": "belle", "sentiment": "negative"}, {"name": "donald trump", "sentiment": "none"}, {"name": "russell simmons protested trump", "sentiment": "none"}, {"name": "john oliver rifles through", "sentiment": "none"}, {"name": "guillermo", "sentiment": "none"}, {"name": "lana del rey", "sentiment": "none"}, {"name": "charlie hunnam", "sentiment": "none"}, {"name": "shane black", "sentiment": "none"}, {"name": "karyn kusama", "sentiment": "none"}, {"name": "k. brown", "sentiment": "none"}, {"name": "shoshanna", "sentiment": "none"}, {"name": "stanley tucci", "sentiment": "none"}, {"name": "patton oswalt", "sentiment": "none"}, {"name": "mykki blanco", "sentiment": "none"}, {"name": "dunham", "sentiment": "none"}, {"name": "beyoncé", "sentiment": "none"}, {"name": "trump", "sentiment": "none"}, {"name": "james woods", "sentiment": "none"}, {"name": "mcdaniels", "sentiment": "none"}, {"name": "michael b. jordan", "sentiment": "none"}, {"name": "keanu reeves", "sentiment": "none"}, {"name": "darryl", "sentiment": "none"}, {"name": "oswalt", "sentiment": "none"}, {"name": "drake", "sentiment": "none"}, {"name": "lin-manuel miranda", "sentiment": "none"}, {"name": "micah fowler", "sentiment": "none"}, {"name": "daveed diggs", "sentiment": "none"}, {"name": "lena dunham", "sentiment": "none"}, {"name": "audrey gelman", "sentiment": "none"}, {"name": "snowden", "sentiment": "none"}, {"name": "mike pence", "sentiment": "none"}, {"name": "selina meyer", "sentiment": "none"}, {"name": "mariah carey", "sentiment": "none"}], "locations": [{"name": "america", "sentiment": "none"}, {"name": "monterey homeland recap", "sentiment": "none"}, {"name": "russia", "sentiment": "none"}, {"name": "hulu", "sentiment": "none"}], "organizations": [{"name": "facebook tweet", "sentiment": "none"}, {"name": "hbo", "sentiment": "none"}, {"name": "new bestie vladimir putin slip", "sentiment": "none"}, {"name": "wachowskis", "sentiment": "none"}, {"name": "nba", "sentiment": "none"}, {"name": "kid played onstage with bruce springsteen twice once", "sentiment": "none"}, {"name": "netflix", "sentiment": "none"}, {"name": "amazon", "sentiment": "none"}, {"name": "wga", "sentiment": "none"}, {"name": "lewis black dumps on trump", "sentiment": "none"}]}, "highlightText": "", "language": "english", "persons": [], "text": "The grass is always greener, isn’t it? Emma Watson’s Beauty and the Beast heroine longs to escape her small, boring French village in the film’s new “Belle” clip. You spend upwards of nine hours a day daydreaming about feeding a cute donkey an apple. Even being mocked by adorable schoolchildren in song beats being mocked by just-some-random-guy on Twitter. At least there’s one fantasy we can all agree on: Stanley Tucci as a neurotic grand piano .\nTags: emma watson beauty and the beast movies marie! the baguettes! Emma Watson Sings ‘Belle’ in New Beauty and the Beast Clip Share on Facebook Tweet this Story Top Stories Bono Praises Mike Pence for His Commitment to AIDS Relief Drake on Grammy Wins: ‘I Don’t Even Want Them’ Mariah Carey Is Still Feeling ‘Victimized’ by Her New Year’s Eve Performance Most Viewed Stories Airplane Passenger Reportedly Called Police After Feeling ‘Not Comfortable’ Sitting Next to Mykki Blanco For a Black Artist to Win Album of the Year, They Have to Make an Album of the Decade The Walking Dead Recap: Meet the Vulcans Girls Recap: The Third Wheel Micah Fowler on Booking His Speechless Role and Playing a Character With More Severe Cerebral Palsy Than Himself What to Stream Now See what's new and notable on Netflix, Amazon, Hulu, and HBO Big Little Lies Season-Premiere Recap: Murder, Mean Girls, and Monterey Homeland Recap: Hostage Situation What’s New on Netflix: February 2017 Big Little Lies Has the Best Real-Estate Porn on Television Late Night’s Best Jokes About Trump’s Instantly Infamous Press Conference Most Popular Video On Vulture An Evolution of Beyoncé’s Grammy Performances Latest News from Vulture 5:15 p.m. Emma Watson Sings ‘Belle’ in New Beauty and the Beast Clip Who needs new bread and rolls all the time?\n4:32 p.m. Lewis Black Dumps on Trump’s Administration at WGA Awards “What the hell is fiction anymore, when our reality comes off as fiction?”\n4:24 p.m. Sterling K. Brown Joins Shane Black’s Predator Reboot We almost have a full cast now.\n3:58 p.m. New King Arthur: Legend of the Sword Trailer: All Hail King RocknRolla Charlie Hunnam is ready to (pull a sword out of a) rock.\n3:02 p.m. Float Into Space with Lana Del Rey’s New Music Video for ‘Love’ The cosmic, vintage-inspired video is an ode to love that’s “out of this world.”\n2:38 p.m. HBO to Release New Girls , Big Little Lies , Crashing Early, Ahead of the Oscars How big are this week’s little lies? You can find out on Friday.\n1:32 p.m. This Kid Played Onstage With Bruce Springsteen Twice Once in 2013 and again last week.\n1:11 p.m. Veep Season 6 Promo: Selina Meyer Wants to Start a Pandemic (of Democracy) Sometimes a person’s second act takes a whole season.\n12:31 p.m. Future Drops a New Music Video for ‘Super Trapper’ With a gigantic shark tank, stacks of cash, a row of low riders, and half-naked women rolling around a mansion.\n12:06 p.m. Keanu Reeves Is Open to Another Matrix Movie: ‘That’d Be Weird, But Why Not?’ Provided the Wachowskis are involved.\n11:02 a.m. Lin-Manuel Miranda Predicts the Oscars Will Look Exactly Like Your Facebook Feed “Why should we ignore for three hours what we’re talking about 24 hours a day?”\n10:29 a.m. John Oliver Rifles Through the Dossier on America’s New Bestie Vladimir Putin Slip into your $3,000 tracksuit and take a look.\n10:17 a.m. Did Lena Dunham Shade the Wing on Girls ? On tonight’s episode, Shoshanna joins an all-women’s networking club that has a lot in common with the one founded by Dunham’s friend Audrey Gelman.\n9:52 a.m. Guillermo del Toro Blasts ‘Barriers That People Are Trying to Erect Between Us’ In accepting the Filmmaker Award at the 64th Motion Picture Sound Editors Golden Reel Awards.\n9:00 a.m. Director Karyn Kusama Will Make You a Believer in the Power of Genre Cinema The director contributed a vignette to the horror anthology XX , but it’s just her latest move in 20 years of horror and science fiction.\n8:30 a.m. Planet Earth II Is the Rare Story to Show the Individual and the Universal It’s our favorite way to try to see ourselves: As distinct individuals and members of universalized masses.\n2:10 a.m. Russell Simmons Protested Trump’s Travel Ban at We Are Muslim Too Rally “We are here unified because of Donald Trump. We want to thank him for bringing us together.”\n1:24 a.m. Watch the Roots New Musical on NBA History ‘The Evolution of Greatness’ Starring Daveed Diggs, Michael B. Jordan, and Darryl “DMC” McDaniels\nYesterday at 11:58 p.m. Oliver Stone Calls News Story That Russia Might Extradite Snowden ‘Ridiculous’ “Let’s not indulge in fake news.”\nYesterday at 11:52 p.m. James Woods Stole Patton Oswalt’s Shoe at the WGA Awards, Quite a Feat Oswalt promises it was not staged.", "external_links": [], "published": "2017-02-21T00:15:00.000+02:00", "crawled": "2017-02-21T05:59:52.354+02:00", "highlightTitle": ""}