{"organizations": [], "uuid": "9815c4c41d0ae326db3dbbbbb2ae840b4ce58673", "thread": {"social": {"gplus": {"shares": 0}, "pinterest": {"shares": 1}, "vk": {"shares": 0}, "linkedin": {"shares": 0}, "facebook": {"likes": 259, "shares": 259, "comments": 0}, "stumbledupon": {"shares": 0}}, "site_full": "www.rappler.com", "main_image": "http://rappler-assets.s3-us-west-1.amazonaws.com/612F469A6EA84F6BAE882D2B94A4B421/img/25E685CFC74245558450732526FE17C6/weather-image-20170203-5pm.jpg", "site_section": "http://feeds.feedburner.com/rappler", "section_title": "RAPPLER", "url": "http://www.rappler.com/nation/special-coverage/weather-alert/160404-20170203-pagasa-weather-forecast-5pm", "country": "US", "domain_rank": 1586, "title": "Tropical Depression Bising set to bring moderate to heavy rain", "performance_score": 2, "site": "rappler.com", "participants_count": 1, "title_full": "Tropical Depression Bising set to bring moderate to heavy rain", "spam_score": 0.0, "site_type": "news", "published": "2017-02-03T16:22:00.000+02:00", "replies_count": 0, "uuid": "9815c4c41d0ae326db3dbbbbb2ae840b4ce58673"}, "author": "Rappler.com", "url": "http://www.rappler.com/nation/special-coverage/weather-alert/160404-20170203-pagasa-weather-forecast-5pm", "ord_in_thread": 0, "title": "Tropical Depression Bising set to bring moderate to heavy rain", "locations": [], "entities": {"persons": [{"name": "bising", "sentiment": "negative"}, {"name": "rappler", "sentiment": "none"}, {"name": "pagasa", "sentiment": "none"}], "locations": [{"name": "quezon province", "sentiment": "none"}, {"name": "central luzon", "sentiment": "none"}, {"name": "central visayas", "sentiment": "none"}, {"name": "philippines", "sentiment": "none"}, {"name": "hinatuan", "sentiment": "none"}, {"name": "mindanao bicol", "sentiment": "none"}, {"name": "luzon", "sentiment": "none"}, {"name": "metro manila", "sentiment": "none"}, {"name": "manila", "sentiment": "none"}, {"name": "visayas", "sentiment": "none"}, {"name": "quezon", "sentiment": "none"}, {"name": "aurora", "sentiment": "none"}, {"name": "agos", "sentiment": "none"}, {"name": "bicol", "sentiment": "none"}, {"name": "cordillera", "sentiment": "none"}, {"name": "mindanao", "sentiment": "none"}, {"name": "cagayan valley region", "sentiment": "none"}], "organizations": [{"name": "pagasa", "sentiment": "negative"}]}, "highlightText": "", "language": "english", "persons": [], "text": "#WeatherAlert Tropical Depression Bising set to bring moderate to heavy rain Pagasa says cloudy skies with light to moderate rains are expected over Mindanao, the Bicol, Eastern and Central Visayas regions, and the provinces of Aurora and Quezon. Moderate to heavy rain is expected within the 300 km diameter of the tropical depression, however. Published 5:27 PM, February 03, 2017 Updated 5:59 PM, February 03, 2017 \nWhat's the weather like in your area? Report the situation through Rappler's Agos or tweet us at @rapplerdotcom . \nMANILA, Philippines – State weather bureau Pagasa said on Friday afternoon, February 3, that the low pressure area east of Mindanao has developed into a tropical depression. Tropical Depression Bising was estimated to be some 735 kilometers east of Hinatuan, Surigao del Sur. \nThe tropical depression is said to have maximum sustained winds of 45 km/h near the center and a gustiness of up to 55 km/h. Bising is currently forecast to move west-northwest at a rate of 13 km/h. \nPagasa added the estimated rainfall amount is set to be anywhere from moderate to occasionally heavy within the 300 km diameter of the tropical depression. \nA northeast monsoon is also affecting Luzon. \nPagasa's forecast notes cloudy skies with light to moderate rains and isolated thunderstorms in the following areas: Mindanao Bicol, Eastern and Central Visayas regions Quezon province, Aurora province \nCloudy skies with light rains are expected to prevail over the Cagayan Valley Region, while partly cloudy to cloudy skies with isolated light rains is set to prevail over Metro Manila, the Ilocos and Cordillera regions, and the rest of Central Luzon. \nPartly cloudy to cloudy skies, along with isolated rainshowers or thunderstorms will be experienced over the rest of the country. \nPagasa also warned of moderate to rough coastal waters over Luzon and Visayas, and slight to moderate seas elsewhere. \nAnother weather bulletin in set to be issued at 11:00 pm today. – Rappler.com HOW DOES THIS STORY MAKE YOU FEEL? Happy", "external_links": [], "published": "2017-02-03T16:22:00.000+02:00", "crawled": "2017-02-03T13:23:59.139+02:00", "highlightTitle": ""}