{"organizations": [], "uuid": "d3d14c388926e4052ff6a273c4fa647e0eb60d48", "thread": {"social": {"gplus": {"shares": 0}, "pinterest": {"shares": 0}, "vk": {"shares": 0}, "linkedin": {"shares": 0}, "facebook": {"likes": 187, "shares": 187, "comments": 0}, "stumbledupon": {"shares": 0}}, "site_full": "www.geo.tv", "main_image": "https://www.geo.tv/assets/uploads/updates/2017-02-11/130706_112314_updates.jpg", "site_section": "https://www.geo.tv/rss/1/1", "section_title": "GEO TV - Pakistan", "url": "https://www.geo.tv/latest/130706-Pakistani-fishermen-locked-in-Yemen-jail-return-home-after-a-decade", "country": "TV", "domain_rank": 8287, "title": "Pakistani fishermen locked in Yemen jail return home after a decade", "performance_score": 1, "site": "geo.tv", "participants_count": 0, "title_full": "Pakistani fishermen locked in Yemen jail return home after a decade", "spam_score": 0.0, "site_type": "news", "published": "2017-02-11T18:22:00.000+02:00", "replies_count": 0, "uuid": "d3d14c388926e4052ff6a273c4fa647e0eb60d48"}, "author": "", "url": "https://www.geo.tv/latest/130706-Pakistani-fishermen-locked-in-Yemen-jail-return-home-after-a-decade", "ord_in_thread": 0, "title": "Pakistani fishermen locked in Yemen jail return home after a decade", "locations": [], "entities": {"persons": [{"name": "geo", "sentiment": "none"}], "locations": [{"name": "iran", "sentiment": "none"}, {"name": "yemen", "sentiment": "none"}, {"name": "islamabad", "sentiment": "none"}, {"name": "sana'a", "sentiment": "none"}, {"name": "central jail sana'a", "sentiment": "none"}, {"name": "balochistan", "sentiment": "none"}, {"name": "karachi", "sentiment": "none"}, {"name": "islamabad", "sentiment": "none"}, {"name": "islamabad airport", "sentiment": "none"}], "organizations": [{"name": "foreign office and international committee of the red cross", "sentiment": "none"}, {"name": "foreign office", "sentiment": "none"}, {"name": "icrc", "sentiment": "none"}, {"name": "icrc", "sentiment": "none"}, {"name": "red cross", "sentiment": "none"}, {"name": "geo news", "sentiment": "none"}, {"name": "international committee", "sentiment": "none"}]}, "highlightText": "", "language": "english", "persons": [], "text": "Pakistani fishermen locked in Yemen jail return home after a decade | Iran releases 18 Pakistani fishermen \nISLAMABAD: Seven fishermen, stranded in Yemen for almost a decade, returned home to their families on Friday. \n10 years ago, fishermen from Karachi and Balochistan coastline went out fishing, but lost their way. Unable to return, they found themselves in international waters, from where they were taken into custody and locked in the central jail of Yemenâ€™s capital Sana'a. \nHowever, following tireless efforts of the Foreign Office and International Committee of the Red Cross (ICRC), the nearly-hopeless men arrived in Islamabad after ages. \nFishermen greeted and hugged by their loving families in Islamabad \n\nThey were greeted at the airport by their loving families, whom they missed dearly over this 10-year period of no communication. Foreign Office and ICRC representatives accompanied the welcoming group. 0 0 Pakistani fishermen locked in Yemen jail return home after a decade   Fishermen Stranded, Fishing, Geo, Geo News, International Waters, Pakistani Fishermen, Pakistani Fishermen In Yemen, Pakistani Fishermen Return, Pakistani Fishermen Return, Balochistan, Central Jail Sana'a, Islamabad, Islamabad Airport, Karachi, Sana'a, Yemen, Foreign Office, Icrc, International Committee Of The Red Cross.   \"Pakistani fishermen locked in Yemen jail return home after a decade\" is https://www.geo.tv/latest/130706-Pakistani-fishermen-locked-in-Yemen-jail-return-home-after-a-decade  ", "external_links": [], "published": "2017-02-11T18:22:00.000+02:00", "crawled": "2017-02-11T08:45:21.649+02:00", "highlightTitle": ""}