{"organizations": [], "uuid": "0cbd704605c37cb1c7995f4adc9148b0c0f3c0d2", "thread": {"social": {"gplus": {"shares": 0}, "pinterest": {"shares": 0}, "vk": {"shares": 0}, "linkedin": {"shares": 0}, "facebook": {"likes": 132, "shares": 132, "comments": 0}, "stumbledupon": {"shares": 0}}, "site_full": "www.thesun.co.uk", "main_image": "https://i1.wp.com/www.thesun.co.uk/wp-content/uploads/2017/02/sport-preview-police-trolling-manchester-city.jpg?crop=0px%2C0px%2C1500px%2C1000px&#038;resize=1200%2C800&#038;ssl=1", "site_section": "https://www.thesun.co.uk/feed", "section_title": "The Sun", "url": "https://www.thesun.co.uk/sport/football/2895412/greater-manchester-police-forced-to-deny-they-trolled-manchester-city-fans-ahead-of-their-champions-league-clash-with-monaco/", "country": "GB", "domain_rank": 2180, "title": "Greater Manchester Police forced to deny they trolled Manchester City fans ahead of their Champions League clash with Monaco", "performance_score": 1, "site": "thesun.co.uk", "participants_count": 1, "title_full": "Greater Manchester Police forced to deny they trolled Manchester City fans ahead of their Champions League clash with Monaco", "spam_score": 0.0, "site_type": "news", "published": "2017-02-18T18:34:00.000+02:00", "replies_count": 0, "uuid": "0cbd704605c37cb1c7995f4adc9148b0c0f3c0d2"}, "author": "rforrester", "url": "https://www.thesun.co.uk/sport/football/2895412/greater-manchester-police-forced-to-deny-they-trolled-manchester-city-fans-ahead-of-their-champions-league-clash-with-monaco/", "ord_in_thread": 0, "title": "Greater Manchester Police forced to deny they trolled Manchester City fans ahead of their Champions League clash with Monaco", "locations": [], "entities": {"persons": [{"name": "michael keane", "sentiment": "none"}, {"name": "sutton", "sentiment": "none"}, {"name": "vincent janssen", "sentiment": "none"}, {"name": "john terry", "sentiment": "none"}, {"name": "mark clattenburg", "sentiment": "none"}, {"name": "arsene wenger", "sentiment": "none"}, {"name": "richard forrester click", "sentiment": "none"}, {"name": "rachel", "sentiment": "none"}, {"name": "richard keys", "sentiment": "none"}, {"name": "max allegri", "sentiment": "none"}, {"name": "st etienne", "sentiment": "none"}, {"name": "etienne", "sentiment": "none"}, {"name": "rio ferdinand", "sentiment": "none"}, {"name": "clatt", "sentiment": "none"}, {"name": "harry arter", "sentiment": "none"}, {"name": "pep guardiola", "sentiment": "none"}, {"name": "paul pogba", "sentiment": "none"}, {"name": "mauricio pochettino", "sentiment": "none"}], "locations": [{"name": "manchester city", "sentiment": "none"}, {"name": "salford", "sentiment": "none"}, {"name": "burnley", "sentiment": "none"}, {"name": "man city", "sentiment": "none"}, {"name": "minnows lincoln city", "sentiment": "none"}, {"name": "old trafford", "sentiment": "none"}, {"name": "leicester city", "sentiment": "none"}, {"name": "leicester", "sentiment": "none"}, {"name": "bournemouth", "sentiment": "none"}, {"name": "manchester", "sentiment": "none"}], "organizations": [{"name": "manchester police", "sentiment": "negative"}, {"name": "greater manchester police", "sentiment": "negative"}, {"name": "monaco efl", "sentiment": "negative"}, {"name": "manchester city", "sentiment": "negative"}, {"name": "press association", "sentiment": "none"}, {"name": "tottenham", "sentiment": "none"}, {"name": "preview fulham", "sentiment": "none"}, {"name": "preview millwall", "sentiment": "none"}, {"name": "monaco", "sentiment": "none"}, {"name": "facebook", "sentiment": "none"}, {"name": "premier league", "sentiment": "none"}, {"name": "city", "sentiment": "none"}, {"name": "chelsea", "sentiment": "none"}, {"name": "huddersfield", "sentiment": "none"}, {"name": "saint-etienne", "sentiment": "none"}, {"name": "manchester united", "sentiment": "none"}, {"name": "monaco  police", "sentiment": "none"}, {"name": "europa league", "sentiment": "none"}, {"name": "team news millwall", "sentiment": "none"}, {"name": "united", "sentiment": "none"}]}, "highlightText": "", "language": "english", "persons": [], "text": "EFL Cop a load of this Greater Manchester Police forced to deny they trolled Manchester City fans ahead of their Champions League clash with Monaco \nPolice hinted that Manchester United were the bigger club after their recent Europa League match set to attract more crowds By Richard Forrester Click to share on Facebook (Opens in new window) Comments GREATER Manchester Police have been forced to deny that they purposely trolled Manchester City fans on social media. \nPep Guardiola’s side host AS Monaco in the first-leg of their Champions League last-16 encounter on Tuesday night. AS Monaco at Man City on Tues night for those who need a bit more time to plan. Not expected to be as busy as St Etienne, but you never know \n— GMP City Centre (@GMPCityCentre) February 17, 2017 PA:Press Association 2 Saint-Etienne’s supporters created an unbelievable atmosphere at Old Trafford \nIt will be the second time in less than a week that Manchester has welcomed thousands of visitors after United hosted Saint Etienne for their Europa League clash on Thursday. \nKeep up to date with ALL the Manchester City news, gossip, transfers and goals on our club page plus fixtures, results and live match commentary. \nThe rowdy French visitors were given a police escort through the city meaning all main roads through the city centre and Salford were shut. \nAnd ahead of City’s upcoming clash, Manchester Police took to Twitter to warn the public of further travelling issues whilst hinting that City won’t attract as many fans as their fierce rivals. \nThey wrote: “AS Monaco at Man City on Tues night for those who need a bit more time to plan. \n“Not expected to be as bust as St Etienne, but you never know.” \nUnited fans took this as the perfect opportunity to poke fun at their noisy neighbours which one user commenting, “will be more Monaco fans than city fans anyway.” French supporters flooded the streets of Manchester before the game related articles Preview Fulham vs Tottenham: When is the FA Cup game on, what TV channel is it on and what is the latest team news? Back to the Future Michael Keane can be like Paul Pogba at Manchester United, says Rio Ferdinand 'He needs to show more' Spurs boss Mauricio Pochettino tells Vincent Janssen to get his act together or become a flop Team News Wolves vs Chelsea team news: John Terry set for Blues return Team News Millwall vs Leicester City team news: Leicester to rest big guns with one eye on the Champions League 'How's my English?' Juventus boss Max Allegri stokes flames that he is in line to replace Arsenal boss Arsene Wenger Preview Wolves vs Chelsea: When is the FA Cup game on, what TV channel is it on and what is the latest team news? Clatt's a problem Mark Clattenburg will not be the only referee to leave the Premier League, claims Richard Keys 'Artwarming Joy for Bournemouth star Harry Arter and partner Rachel as they welcome baby after stillbirth tragedy that made him the target of troll Preview Millwall vs Leicester: When is the FA Cup game on, what TV channel is it on and what is the latest team news? MARK UP! Sutton warn touts trading in gold-dust £600 Arsenal cup tickets that cards are marked and police involved Up for the Cup FA Cup fifth round LIVE - Minnows Lincoln City travel to Burnley before Huddersfield host Man City Insp S – you may not believe me, but I absolutely wasn't trolling City fans! It was about fewer away fans expected to travel…honestly!! \n— GMP City Centre (@GMPCityCentre) February 17, 2017 \nAnother wrote: “A red copper having a sly dig at the city fans, that’s what I like to see.” \nHowever three hours later the police insisted their tweet was aimed at trolling City fans. \nThe twitter account with 88,000 followers added: “you may not believe me, but I absolutely wasn’t trolling City fans! It was about fewer away fans expected to travel… honestly!!”. St Etienne fans light and throw flares onto the pitch against Manchester United", "external_links": [], "published": "2017-02-18T18:34:00.000+02:00", "crawled": "2017-02-18T13:40:57.964+02:00", "highlightTitle": ""}