{"organizations": [], "uuid": "f81a9f816d4f043a91048d90dc13187cb260bb98", "thread": {"social": {"gplus": {"shares": 0}, "pinterest": {"shares": 0}, "vk": {"shares": 0}, "linkedin": {"shares": 0}, "facebook": {"likes": 741, "shares": 741, "comments": 0}, "stumbledupon": {"shares": 0}}, "site_full": "indianexpress.com", "main_image": "http://images.indianexpress.com/2017/02/vikkas2.jpg?w=480", "site_section": "http://indianexpress.com/section/entertainment/feed/", "section_title": "Entertainment – The Indian Express", "url": "http://indianexpress.com/article/entertainment/television/vikkas-manaktala-nach-baliye-8-will-showcase-my-personal-side-to-the-audience-4537697/", "country": "IN", "domain_rank": 598, "title": "Vikkas Manaktala: Nach Baliye 8 will showcase my personal side to the audience", "performance_score": 7, "site": "indianexpress.com", "participants_count": 1, "title_full": "Vikkas Manaktala: Nach Baliye 8 will showcase my personal side to the audience", "spam_score": 0.0, "site_type": "news", "published": "2017-02-22T19:18:00.000+02:00", "replies_count": 0, "uuid": "f81a9f816d4f043a91048d90dc13187cb260bb98"}, "author": "Priyanka Sharma", "url": "http://indianexpress.com/article/entertainment/television/vikkas-manaktala-nach-baliye-8-will-showcase-my-personal-side-to-the-audience-4537697/", "ord_in_thread": 0, "title": "Vikkas Manaktala: Nach Baliye 8 will showcase my personal side to the audience", "locations": [], "entities": {"persons": [{"name": "nach baliye", "sentiment": "negative"}, {"name": "karan singh grover", "sentiment": "none"}, {"name": "amardeep huda", "sentiment": "none"}, {"name": "rochelle rao", "sentiment": "none"}, {"name": "keith sequeira", "sentiment": "none"}, {"name": "baliye", "sentiment": "none"}, {"name": "vikkas manaktala", "sentiment": "none"}, {"name": "gunjun walia", "sentiment": "none"}, {"name": "terence lewis", "sentiment": "none"}, {"name": "sonakshi sinha", "sentiment": "none"}, {"name": "gunjun", "sentiment": "none"}, {"name": "vikkas", "sentiment": "none"}, {"name": "keith", "sentiment": "none"}, {"name": "parineeti chopra", "sentiment": "none"}, {"name": "priyanka sharma", "sentiment": "none"}], "locations": [{"name": "mumbai", "sentiment": "none"}], "organizations": []}, "highlightText": "", "language": "english", "persons": [], "text": "Vikkas Manaktala: Nach Baliye 8 will showcase my personal side to the audience Vikkas Manaktala: Nach Baliye 8 will showcase my personal side to the audience Ghulaam actor Vikkas Manaktala and wife Gunjun are currently in talks to participate on Nach Baliye 8. Written by Priyanka Sharma | Mumbai   5:48 pm Vikkas Manaktala and wife Gunjun Walia are among the probable contestants on Nach Baliye 8. \nCurrently seen as the bad guy on Life Ok’s Ghulaam, actor Vikkas Manaktala is ready to don his dancing shoes for Nach Baliye 8 and is already in negotiations with the makers. Vikkas and his actor wife Gunjun have been approached for the celebrity dance show and the couple is counting days to go on the stage and impress the audience with their dancing skills. \nTalking about his plans, Vikkas told indianexpress.com, “The negotiations are still on and we haven’t signed on the dotted line. But hoping that it will work out.” This will be the first reality show for the actor and also for Gunjun, whom he married two years ago. \nMore from the world of Entertainment: \n\nVikkas, who is till date remembered for playing Amardeep Huda on Left Right Left, is excited about showing his real self to his fans through Nach Baliye.”If it works out, which I believe it will, then the audience will get to see a different and personal me. Gunjun and I are extremely excited for Nach Baliye.” \nAlso read | Keith Sequeira, Rochelle Rao not part of Nach Baliye 8. Here’s how Keith is making his TV comeback \nWhen asked if there is a certain nervousness about appearing on Nach Baliye, considering reality shows are synonymous with controversies, Vikkas laughed it off, saying, “I don’t have much time to think about anything else but focus on preparing for it. But I guess all those feelings might surface after signing.” \nThe upcoming season of Nach Baliye has been making news, two months before its premiere, for the probable contestants and judges. It has been learnt that besides Terence Lewis, the judges’ panel will see either Sonakshi Sinha or Parineeti Chopra , and actor Karan Singh Grover will host the series. Confirmation on the names of the celebrity couples and judges are awaited.   Tags:", "external_links": [], "published": "2017-02-22T19:18:00.000+02:00", "crawled": "2017-02-22T15:18:51.538+02:00", "highlightTitle": ""}