{"organizations": [], "uuid": "4a3cc96a9eefbfe843d2eab74a217a69485e4848", "thread": {"social": {"gplus": {"shares": 1}, "pinterest": {"shares": 0}, "vk": {"shares": 0}, "linkedin": {"shares": 0}, "facebook": {"likes": 228, "shares": 228, "comments": 0}, "stumbledupon": {"shares": 1}}, "site_full": "www.vulture.com", "main_image": "http://pixel.nymag.com/imgs/daily/vulture/2017/02/22/22-seth-meyers.w1200.h630.JPG", "site_section": "http://feeds.feedburner.com/nymag/vulture", "section_title": "Vulture", "url": "http://www.vulture.com/2017/02/seth-meyers-pokes-holes-in-trumps-not-so-impenetrable-wall.html?utm_source=feedburner&utm_medium=feed&utm_campaign=Feed%3A+nymag%2Fvulture+%28Vulture+-+nymag.com%27s+Entertainment+and+Culture+Blog%29", "country": "US", "domain_rank": 2191, "title": "Seth Meyers Pokes Holes in Trump’s Not-So-Impenetrable Wall", "performance_score": 2, "site": "vulture.com", "participants_count": 1, "title_full": "Seth Meyers Pokes Holes in Trump’s Not-So-Impenetrable Wall", "spam_score": 0.0, "site_type": "news", "published": "2017-02-23T06:41:00.000+02:00", "replies_count": 0, "uuid": "fe9e62afbc429428589374447bdb9153f96a494c"}, "author": "", "url": "http://www.vulture.com/2017/02/seth-meyers-pokes-holes-in-trumps-not-so-impenetrable-wall.html", "ord_in_thread": 0, "title": "Seth Meyers Pokes Holes in Trump’s Not-So-Impenetrable Wall", "locations": [], "entities": {"persons": [{"name": "seth meyers pokes holes", "sentiment": "negative"}, {"name": "donald trump", "sentiment": "negative"}, {"name": "trump", "sentiment": "negative"}, {"name": "william", "sentiment": "none"}, {"name": "reese witherspoon", "sentiment": "none"}, {"name": "sinead o’connor", "sentiment": "none"}, {"name": "milo yiannopoulos brian tyree henry", "sentiment": "none"}, {"name": "george clooney", "sentiment": "none"}, {"name": "adam pally will star", "sentiment": "none"}, {"name": "not-so-impenetrable wall", "sentiment": "none"}, {"name": "bellamy", "sentiment": "none"}, {"name": "steve bannon", "sentiment": "none"}, {"name": "jermel nakia", "sentiment": "none"}, {"name": "charles isherwood", "sentiment": "none"}, {"name": "jackie evancho", "sentiment": "none"}, {"name": "george michael", "sentiment": "none"}, {"name": "paula abdul", "sentiment": "none"}, {"name": "cate blanchett", "sentiment": "none"}, {"name": "katy perry", "sentiment": "none"}, {"name": "o’connor", "sentiment": "none"}, {"name": "allison williams", "sentiment": "none"}, {"name": "gina torres", "sentiment": "none"}, {"name": "emma stone", "sentiment": "none"}, {"name": "joe carnahan", "sentiment": "none"}, {"name": "chris martin", "sentiment": "none"}, {"name": "david bowie", "sentiment": "none"}, {"name": "seth meyers", "sentiment": "none"}], "locations": [{"name": "la la land", "sentiment": "none"}, {"name": "america", "sentiment": "none"}, {"name": "u.s.", "sentiment": "none"}, {"name": "mexico", "sentiment": "none"}, {"name": "arsenio hall of giving prince drugs hall", "sentiment": "none"}, {"name": "philadelphia", "sentiment": "none"}, {"name": "hulu", "sentiment": "none"}], "organizations": [{"name": "national anthem", "sentiment": "none"}, {"name": "facebook tweet", "sentiment": "none"}, {"name": "lgbtq charity grace slick", "sentiment": "none"}, {"name": "bannon are hollywood elitists rachel bloom", "sentiment": "none"}, {"name": "nbc", "sentiment": "none"}, {"name": "lambda legal", "sentiment": "none"}, {"name": "better than real life george clooney wants you", "sentiment": "none"}, {"name": "netflix", "sentiment": "none"}, {"name": "hbo the real housewives of beverly hills recap", "sentiment": "none"}, {"name": "amazon", "sentiment": "none"}, {"name": "hollywood elitists", "sentiment": "none"}]}, "highlightText": "", "language": "english", "persons": [], "text": "From the very dawn of Donald Trump’s presidential campaign, he remained clear about one platform: The man wants a wall. But if the devil is in the details, well then, there must be two of them, because as Seth Meyers points out on Wednesday’s “A Closer Look,” Trump seemingly has no idea as to how a border wall between Mexico and the U.S. would actually work. Will the wall be physical? See-through? Metaphorical? Magical? The Chris Hardwick-hosted NBC game show called The Wall ? Wait, wait, yeah, pick the TV show, it’s definitely that last one.\nTags: late night with seth meyers seth meyers a closer look last night on late night Seth Meyers Pokes Holes in Trump’s Not-So-Impenetrable Wall Share on Facebook Tweet this Story Top Stories David Bowie’s Son Dedicates Brit Album of the Year Award to ‘All the Kooks’ George Clooney Wants to Remind You That Trump and Bannon Are Hollywood Elitists Rachel Bloom and Adam Pally Will Star in a ‘ Rear Window for Stoners’ Comedy Most Viewed Stories Why Was Times Theater Critic Charles Isherwood Fired? This Is Us Recap: The First and the Last Cate Blanchett Lip-Synced ‘You Don’t Own Me’ at a Drag Show, Giving the People Exactly What They Want In Get Out , Allison Williams Makes the ‘Good White Person’ Terrifying 15 Stars Reminisce About the Actors Who Used to Beat Them Out for Roles What to Stream Now See what's new and notable on Netflix, Amazon, Hulu, and HBO The Real Housewives of Beverly Hills Recap: Volunteering Information Bill Maher Thinks His Real Time Interview Brought Down Milo Yiannopoulos Brian Tyree Henry on This Is Us , That Heartbreaking Episode, and Working With His BFF Sterling K. Brown Video Games Are Better Than Real Life George Clooney Wants You to Remember That Donald Trump and Steve Bannon Are Hypocritical ‘Hollywood Elitists’ Latest News from Vulture 17 mins ago America’s Next Top Model Recap: Act Like a Model We’ve reached the Final Five of VH1’s Little ANTM That Could. \n11:41 p.m. Seth Meyers Pokes Some Gaping Holes in Donald Trump’s Not-So-Impenetrable Wall “You’re all the wall.”\n11:11 p.m. Sinead O’Connor Apologizes for Accusing Arsenio Hall of Giving Prince Drugs Hall had sued O’Connor for defamation.\n11:00 p.m. Legion Recap: Nightmare On Memory Lane “Chapter Three” offers a simplified version of Legion ’s challenging premise.\n10:30 p.m. It’s Always Sunny in Philadelphia Recap: Just Another Day at the Bar “The Gang Tends Bar” pretends this is a show about normal people.\n10:28 p.m. Paula Abdul to Star As Paula Abdul in NBC Comedy From the Fresh Off the Boat hive mind.\n10:00 p.m. The 100 Recap: Death From Above A major “death” leads to a huge moment for Bellamy.\n9:49 p.m. Gina Torres’ Impeccable Side-Eye May Return With Potential Suits Spinoff Bring on the pristine business wear and thinly veiled contempt.\n8:36 p.m. Jackie Evancho Not Singing The Praises of Donald Trump’s Stance On Trans Rights The President’s National Anthem singer does not share his politics on queer issues.\n7:31 p.m. Joe Carnahan’s ‘Re-Imagining’ of The Raid Sounds Very Different From The Raid But it does sound very cool.\n6:19 p.m. Watching Katy Perry’s House Fall Offstage at the Brits Will Teach You Economics We’re all chaaaained to a failing system.\n6:04 p.m. Grace Slick Licenses Starship Song to Chick-fil-A, Donates Fees to LGBTQ Charity Grace Slick let “Nothing’s Gonna Stop Us Now” appear in an ad, then gave the licensing fee to Lambda Legal.\n5:55 p.m. David Bowie’s Son Dedicates Brit Album of the Year Award to ‘All the Kooks’ “He’s always been there supporting people who think they’re a little bit weird or a little bit strange, a little bit different.”\n5:48 p.m. TV’s Newest Genre: Beautiful People Behaving Badly by the Sea Why Big Little Lies is the latest and greatest example.\n5:39 p.m. 15 Stars Reminisce About the Actors Who Used to Beat Them Out for Roles Even highly successful actors can relate to Emma Stone in La La Land .\n5:29 p.m. Watch Amandla Stenberg Discover Porn on VHS in This Clip From As You Are The 1990s: When porn was still circulated on VHS tapes.\n4:38 p.m. Watch Chris Martin ‘Duet’ With George Michael in Emotional Brit Awards Tribute Wham! introduced a performance of “A Different Corner.”\n4:37 p.m. This Is Us ’ Jermel Nakia on Playing the Younger William “For me, it was one of the most powerful episodes.”\n4:29 p.m. Reese Witherspoon Is the Type-A Hero of Big Little Lies She gives try-hard overachievers someone to root for.\n4:22 p.m. In Get Out , Allison Williams Makes ‘Good White People’ Terrifying In her first film role, the Girls actress plays with her impossibly Caucasian star image.", "external_links": [], "published": "2017-02-23T06:41:00.000+02:00", "crawled": "2017-02-23T07:18:50.756+02:00", "highlightTitle": ""}