{"organizations": [], "uuid": "f161ed0af59d6a5ab6367e13aa76be018ce31fad", "thread": {"social": {"gplus": {"shares": 0}, "pinterest": {"shares": 0}, "vk": {"shares": 0}, "linkedin": {"shares": 0}, "facebook": {"likes": 238, "shares": 238, "comments": 0}, "stumbledupon": {"shares": 0}}, "site_full": "www.latimes.com", "main_image": "http://www.trbimg.com/img-58ae30a9/turbine/la-ed-endorsements-list-20170223", "site_section": "http://www.latimes.com/sports/dodgersnow/rss2.0.xml\r", "section_title": "latimes.com - Los Angeles Times", "url": "http://www.latimes.com/opinion/endorsements/la-ed-endorsements-list-20170223-story.html", "country": "US", "domain_rank": 609, "title": "The Times' picks for the March 7 election", "performance_score": 2, "site": "latimes.com", "participants_count": 1, "title_full": "The Times' picks for the March 7 election", "spam_score": 0.0, "site_type": "news", "published": "2017-02-23T20:00:00.000+02:00", "replies_count": 0, "uuid": "f161ed0af59d6a5ab6367e13aa76be018ce31fad"}, "author": "The Times Editorial Board", "url": "http://www.latimes.com/opinion/endorsements/la-ed-endorsements-list-20170223-story.html", "ord_in_thread": 0, "title": "The Times' picks for the March 7 election", "locations": [], "entities": {"persons": [{"name": "rex tillerson", "sentiment": "none"}, {"name": "magic johnson", "sentiment": "none"}, {"name": "joe buscaino", "sentiment": "none"}, {"name": "john kelly", "sentiment": "none"}, {"name": "elor azaria", "sentiment": "none"}], "locations": [{"name": "port of los angeles", "sentiment": "none"}, {"name": "pomona", "sentiment": "none"}, {"name": "mexico", "sentiment": "none"}, {"name": "whittier", "sentiment": "none"}, {"name": "inglewood", "sentiment": "none"}, {"name": "los angeles county", "sentiment": "none"}, {"name": "chino hills", "sentiment": "none"}, {"name": "mosul", "sentiment": "none"}, {"name": "los angeles", "sentiment": "none"}], "organizations": [{"name": "times", "sentiment": "negative"}, {"name": "the times", "sentiment": "negative"}, {"name": "islamic state", "sentiment": "none"}, {"name": "state", "sentiment": "none"}, {"name": "the times editorial board  los angeles", "sentiment": "none"}, {"name": "homeland security", "sentiment": "none"}, {"name": "lakers", "sentiment": "none"}, {"name": "los angeles times", "sentiment": "none"}, {"name": "long beach poly  huskies", "sentiment": "none"}, {"name": "build better l.a. coalition", "sentiment": "none"}, {"name": "facebook", "sentiment": "none"}, {"name": "huskies", "sentiment": "none"}]}, "highlightText": "", "language": "english", "persons": [], "text": "The Times' picks for the March 7 election 2503624_ME_0209_Measure_S_IK Los Angeles Times Attendees at a Build Better L.A. Coalition news conference on Feb. 9 let express their views on Measure S, a city ballot measure that would impose a two-year moratorium on developments that need exemptions from land-use rules. Attendees at a Build Better L.A. Coalition news conference on Feb. 9 let express their views on Measure S, a city ballot measure that would impose a two-year moratorium on developments that need exemptions from land-use rules. (Los Angeles Times) The Times Editorial Board \nLos Angeles voters head to the polls on March 7 for the city’s last stand-alone local election. Starting in 2020, city and school board elections will be held in June and November during even-numbered years, together with gubernatorial and presidential elections. \nHere are The Times’ picks for March 7: Los Angeles County ballot measure \nMeasure H . A quarter-cent sales tax to fund homeless services: Yes Los Angeles city ballot measures \nMeasure M . A city-sponsored plan to tax and regulate marijuana: Yes \nMeasure N . An industry-sponsored plan to tax and regulate marijuana: No \nMeasure P. Allow 66-year leases, instead of 50-year deals, at the Port of Los Angeles: Yes \nMeasure S . Impose a two-year moratorium on developments that need exemptions from land-use rules: No Los Angeles city offices \nCouncil District 15 : Joe Buscaino Los Angeles Unified School District \nCaption 90 seconds: 4 stories you can't miss \nPolice say suspect accused in Whittier officer killing is a poster boy for criminal justice reform , Secretary of State Rex Tillerson and Homeland Security chief John Kelly fly to Mexico , Magic Johnson is now in charge of the Lakers , and the Iraqi government's drive to retake Mosul from Islamic State continues . Caption 90 seconds: 4 stories you can't miss \nPolice say suspect accused in Whittier officer killing is a poster boy for criminal justice reform , Secretary of State Rex Tillerson and Homeland Security chief John Kelly fly to Mexico , Magic Johnson is now in charge of the Lakers , and the Iraqi government's drive to retake Mosul from Islamic State continues . Caption Protests follow the sentencing of Israeli soldier convicted for killing Palestinian \nA crowd shouts, \"if you don't return the boy, we will turn the country upside down, \" in protest of the sentencing of Sgt. Elor Azaria who was convicted for fatally shooting Palestinian knife assailant. \nA crowd shouts, \"if you don't return the boy, we will turn the country upside down, \" in protest of the sentencing of Sgt. Elor Azaria who was convicted for fatally shooting Palestinian knife assailant. Caption Pomona boy dies after being shot while inside home \nAn 8-year-old boy is dead after being shot while inside a Pomona residence. The gunfire came from outside the home striking the boy in the head. \nAn 8-year-old boy is dead after being shot while inside a Pomona residence. The gunfire came from outside the home striking the boy in the head. Caption Chino Hills defeats Long Beach Poly \nHuskies entertain and move on \nHuskies entertain and move on Caption A year after 20 bullets strike couple in fatal Inglewood police shooting, questions remain \nFamily members, activists and clergy march to express their frustration about a shooting still shrouded in mystery. \nFamily members, activists and clergy march to express their frustration about a shooting still shrouded in mystery. \nFollow the Opinion section on Twitter @latimesopinion and Facebook", "external_links": [], "published": "2017-02-23T20:00:00.000+02:00", "crawled": "2017-02-23T15:25:36.226+02:00", "highlightTitle": ""}