{"organizations": [], "uuid": "842404119c23ce13c855279edc2c588ca4db0496", "thread": {"social": {"gplus": {"shares": 0}, "pinterest": {"shares": 0}, "vk": {"shares": 0}, "linkedin": {"shares": 7}, "facebook": {"likes": 293, "shares": 293, "comments": 0}, "stumbledupon": {"shares": 0}}, "site_full": "www.indystar.com", "main_image": "http://www.gannett-cdn.com/-mm-/1685d2c975ed808b071b7bf3996a153cb8633f5c/c=0-99-2396-1452&amp;r=x633&amp;c=1200x630/local/-/media/2017/02/13/INGroup/Indianapolis/636226041466722288-prontox.720736.jpg", "site_section": "http://rssfeeds.indystar.com/indystar/allthingstodo", "section_title": "GANNETT Syndication Service", "url": "http://www.indystar.com/story/entertainment/dining/2017/02/23/march-food-events/97870658/", "country": "US", "domain_rank": 12374, "title": "Liz Biro: 6 must-do March food events", "performance_score": 2, "site": "indystar.com", "participants_count": 1, "title_full": "Liz Biro: 6 must-do March food events", "spam_score": 0.0, "site_type": "news", "published": "2017-02-24T00:59:00.000+02:00", "replies_count": 0, "uuid": "842404119c23ce13c855279edc2c588ca4db0496"}, "author": "liz.biro@indystar.com", "url": "http://www.indystar.com/story/entertainment/dining/2017/02/23/march-food-events/97870658/", "ord_in_thread": 0, "title": "Liz Biro: 6 must-do March food events", "locations": [], "entities": {"persons": [{"name": "liz biro", "sentiment": "negative"}, {"name": "e. thompson road", "sentiment": "none"}, {"name": "russell", "sentiment": "none"}, {"name": "bernheim", "sentiment": "none"}, {"name": "craig baker", "sentiment": "none"}, {"name": "s. morton st.", "sentiment": "none"}, {"name": "david tallent", "sentiment": "none"}, {"name": "frank espich/indystar", "sentiment": "none"}, {"name": "eric ripert", "sentiment": "none"}, {"name": "lior lev sercarz", "sentiment": "none"}, {"name": "baker", "sentiment": "none"}, {"name": "evan williams", "sentiment": "none"}, {"name": "lev sercarz", "sentiment": "none"}], "locations": [{"name": "new york city", "sentiment": "none"}, {"name": "carmel", "sentiment": "none"}, {"name": "ditch road", "sentiment": "none"}, {"name": "indiana", "sentiment": "none"}, {"name": "kentucky", "sentiment": "none"}, {"name": "turkey", "sentiment": "none"}, {"name": "bloomington", "sentiment": "none"}, {"name": "indianapolis", "sentiment": "none"}, {"name": "pennsylvania", "sentiment": "none"}], "organizations": [{"name": "plow & anchor", "sentiment": "none"}, {"name": "corks & forks", "sentiment": "none"}, {"name": "east carmel drive", "sentiment": "none"}, {"name": "st. illusions", "sentiment": "none"}, {"name": "facebook", "sentiment": "none"}, {"name": "orchard park elementary school", "sentiment": "none"}, {"name": "sofi b. estate", "sentiment": "none"}, {"name": "bankers life fieldhouse", "sentiment": "none"}, {"name": "la boîte", "sentiment": "none"}, {"name": "illusions restaurant", "sentiment": "none"}, {"name": "cardinal spirits", "sentiment": "none"}, {"name": "cardinal spirits' terra botanical gin", "sentiment": "none"}, {"name": "spice camp", "sentiment": "none"}, {"name": "devault alumni center", "sentiment": "none"}]}, "highlightText": "", "language": "english", "persons": [], "text": "Liz Biro: 6 must-do March food events Liz Biro , liz.biro@indystar.com 12:59 p.m. ET Feb. 23, 2017 Meet the American spice blend master, sip some bourbon and get a magic show with dinner Buy Photo Get started on learning how to make charcuterie like the pros at a dry-aged sausage-making class 10 a.m. March 11, 2017, at Final Gravity Homebrew Supply, 3131 E. Thompson Road, Indianapolis. (Photo: Frank Espich/IndyStar) Buy Photo 285 CONNECT COMMENT EMAIL MORE \n1. The spice whisperer \nWhen big-time chef Eric Ripert needs spice advice, he taps Lior Lev Sercarz . The master spice blender and owner of New York City’s legendary La Boîte spice company is the go-to guy for all things spice. Cardinal Spirits in Bloomington hosts Lev Sercarz for Spice Camp 2017. First up is a spice dinner at 7 p.m. March 1 at DeVault Alumni Center, 1000 E. 17th St., Bloomington. Top Indiana chef David Tallent features Lev Sercarz’s spice blends throughout the meal ($79), with optional paired cocktails by Cardinal Spirits ($99). Lev Sercarz created the botanical blend for Cardinal Spirits' Terra Botanical Gin. Attend a spice blending workshop ($50 including small plates and cocktails) 7-9 p.m. March 2 at Cardinal Spirits headquarters, 922 S. Morton St., Bloomington. A workshop for food and beverage professionals ($10 including lunch) is scheduled noon to 2 p.m. March 1 at Cardinal Spirits. Find tickets at cardinalspirits.com/events/ or call (812) 202-6789. \n2. Tableside magic \nWhen someone at this dinner says “Watch me pull a rabbit out of my hat,” you just might get fricassee. Chefs Night Off Indy conjures Indianapolis’ late magic-themed restaurant Illusions at an April pop-up dinner you'll need to book in March. Don't delay. Chefs Night Off events sell out quickly. The featured chef is Craig Baker. The dinner happens 6 p.m. April 2 at Baker's former Plow & Anchor restaurant, 43 9th St. Illusions was a Carmel restaurant famous for tableside magic acts. The place closed in 2003. The pop-up features magicians who performed at Illusions. Baker has not yet revealed what's up his sleeve. Tickets cost $85 at eventbrite.com . \n\"Glamente\" the magician performs a fire-to-live dove trick at Illusions Restaurant in Carmel before it closed in 2003. (Photo: JAMES YEE/TOPICS NEWSPAPERS) \n3. Every significant chef \nCorks & Forks features Indy's finest chefs and mixologists at an evening full of tastings, fine wines, craft cocktails and local, craft beers. Join around 800 guests 7-10 p.m. March 9 at Downtown’s Bankers Life Fieldhouse, 125 S. Pennsylvania St. Tickets cost $150 and proceeds benefit Second Helpings’ food rescue, hunger relief and culinary job training efforts. Visit secondhelpings.org/corks-forks-2017-tickets/ . \n4. All the Carmel restaurants \nTaste of Carmel showcases tastings from 40 area restaurants, caterers, wineries and breweries 6-9:30 p.m. March 2 at 502 East Event Centre, 502 East Carmel Drive, Carmel. Tickets cost $30 to $75. Proceeds benefit Orchard Park Elementary School. Visit TasteOfCarmelOPE.com . \n5. Bourbon Fest \nThis party pairs select bourbons with food samplings from some of the Indy area’s best restaurants 6:30-9:30 p.m. March 11 at Sofi B. Estate, 9999 Ditch Road, Carmel. Sip Wild Turkey, Wild Turkey 101, Russell's Reserve 10-year-old bourbon, Russell's Reserve 6-year-old bourbon, Wild Turkey Rare Breed, Mellow Corn Kentucky corn whiskey, Evan Williams single barrel, Larceny Bourbon, Rittenhouse rye and Bernheim wheat whiskey. VIP tickets get you even more. Cigars and live music are on the agenda, too. Tickets cost $40 to $75 at eventbrite.com . \n6. Make your own charcuterie \nLearn the basics of making dry, aged sausage at home at a 10 a.m. March 11 class at Final Gravity Homebrew Supply, 3131 E. Thompson Road. The $20 class covers equipment, ingredients, grinding meat, stuffing casings, aging and curing. They’re all basics you may apply to making salami, soppressata, capocolla, pepperoni, bresaola and more. Having some fresh-sausage-making experience helps with this class. Registration is required. Find tickets at finalgravityhs.com . \nFollow IndyStar food writer Liz Biro on Twitter: @lizbiro , Instagram: @lizbiro , Facebook and Pinterest . Call her at (317) 444-6264. 285 CONNECT COMMENT EMAIL MORE Read or Share this story: http://indy.st/2mc2fnB NEVER MISS OUT", "external_links": [], "published": "2017-02-24T00:59:00.000+02:00", "crawled": "2017-02-26T00:51:31.107+02:00", "highlightTitle": ""}