{"organizations": [], "uuid": "f32b40b758d9491d90316c5b55c126bd4426616e", "thread": {"social": {"gplus": {"shares": 0}, "pinterest": {"shares": 0}, "vk": {"shares": 0}, "linkedin": {"shares": 0}, "facebook": {"likes": 597, "shares": 597, "comments": 0}, "stumbledupon": {"shares": 0}}, "site_full": "thenationonlineng.net", "main_image": "http://thenationonlineng.net/wp-content/uploads/2017/02/buhari..jpg", "site_section": "http://thenationonlineng.net/feed/", "section_title": "The Nation Nigeria", "url": "http://thenationonlineng.net/kano-holds-prayer-session-buhari/", "country": "US", "domain_rank": 6634, "title": "Kano holds prayer session for Buhari", "performance_score": 5, "site": "thenationonlineng.net", "participants_count": 1, "title_full": "Kano holds prayer session for Buhari", "spam_score": 0.0, "site_type": "news", "published": "2017-02-23T02:06:00.000+02:00", "replies_count": 0, "uuid": "f32b40b758d9491d90316c5b55c126bd4426616e"}, "author": "NAN", "url": "http://thenationonlineng.net/kano-holds-prayer-session-buhari/", "ord_in_thread": 0, "title": "Kano holds prayer session for Buhari", "locations": [], "entities": {"persons": [{"name": "buhari kano", "sentiment": "negative"}, {"name": "buhari", "sentiment": "negative"}, {"name": "abdullahi ganduje", "sentiment": "none"}, {"name": "sheik muhammad nasir adam", "sentiment": "none"}, {"name": "sheik isiyaku rabi’u", "sentiment": "none"}, {"name": "sheik ahmed sulaiman", "sentiment": "none"}, {"name": "hafiz abubakar", "sentiment": "none"}, {"name": "alhaji ali baba", "sentiment": "none"}, {"name": "muhammadu buhari", "sentiment": "none"}, {"name": "sheik aminu daurawa", "sentiment": "none"}, {"name": "daurawa", "sentiment": "none"}], "locations": [{"name": "kano", "sentiment": "none"}, {"name": "nigeria", "sentiment": "none"}], "organizations": [{"name": "buhari home news update kano", "sentiment": "negative"}, {"name": "state house of assembly", "sentiment": "none"}, {"name": "state executive council", "sentiment": "none"}, {"name": "kano emirate council", "sentiment": "none"}, {"name": "news agency of nigeria", "sentiment": "none"}, {"name": "government house", "sentiment": "none"}, {"name": "africa house", "sentiment": "none"}, {"name": "hisbah board", "sentiment": "none"}, {"name": "nan", "sentiment": "none"}]}, "highlightText": "", "language": "english", "persons": [], "text": "Home News Update Kano holds prayer session for Buhari Kano holds prayer session for Buhari Posted By: NAN on: Tweet 0 •President Buhari \nThe Kano State Government on Wednesday organised a special prayer for quick recovery and safe return of President Muhammadu Buhari to the country. \nThe News Agency of Nigeria (NAN) reports that among those that attended the prayer session were Gov. Abdullahi Ganduje and his Deputy, Prof. Hafiz Abubakar, as well as members of the State Executive Council. \nOthers were, members of the State House of Assembly, Chairmen of the 44 local governments in the state and members of the Kano Emirate Council. \nAlso in attendance were Islamic Scholars, including the Commander-General of the state Hisbah Board, Sheik Aminu Daurawa, Sheik Ahmed Sulaiman, Sheik Muhammad Nasir Adam and the Kano-based business mogul, Sheik Isiyaku Rabi’u. \nNAN reports that various verses from the Holy Qur’an were recited during the prayer session which was conducted at the Africa House, Government House. \nIn his remarks, Sheik Aminu Daurawa said the President needed prayers not only for his speedy recovery, but also divine guidance to lead Nigeria to greatness. \n“He needs our encouragement, support and prayers for him to succeed and build a better Nigeria,” Daurawa said. \nThe Special Adviser to the Governor on Religious Affairs, Alhaji Ali Baba, said the prayer was organised to invoke Allah’s protection and good health for the President. \nHe said the prayer was also offered for the sustenance of peace and unity as well economic growth and prosperity of the country.(NAN).", "external_links": [], "published": "2017-02-23T02:06:00.000+02:00", "crawled": "2017-02-22T22:20:19.720+02:00", "highlightTitle": ""}