{"organizations": [], "uuid": "7a77f7e6f9b4e4845f512b8300ffcd346f03c26e", "thread": {"social": {"gplus": {"shares": 0}, "pinterest": {"shares": 0}, "vk": {"shares": 0}, "linkedin": {"shares": 0}, "facebook": {"likes": 287, "shares": 287, "comments": 0}, "stumbledupon": {"shares": 0}}, "site_full": "ftw.usatoday.com", "main_image": "http://www.gannett-cdn.com/-mm-/4b77887a6972052144d603f30d7f58bbe2d4d9aa/c=0-11-3593-2041&amp;r=x1683&amp;c=3200x1680/local/-/media/2017/02/04/USATODAY/usatsports/ap_britain_soccer_premier_league_88532462.jpg", "site_section": "http://rssfeeds.usatoday.com/_/20/109654670/all-nationnow", "section_title": "GANNETT Syndication Service", "url": "http://ftw.usatoday.com/2017/02/chelsea-eden-hazard-amazing-goal-arsenal-antonio-conte-reaction-epl-video", "country": "US", "domain_rank": 313, "title": "Chelsea's Eden Hazard scoresr stunning goal", "performance_score": 2, "site": "usatoday.com", "participants_count": 1, "title_full": "Chelsea's Eden Hazard scoresr stunning goal", "spam_score": 0.0, "site_type": "news", "published": "2017-02-04T21:58:00.000+02:00", "replies_count": 0, "uuid": "7a77f7e6f9b4e4845f512b8300ffcd346f03c26e"}, "author": "USA TODAY", "url": "http://ftw.usatoday.com/2017/02/chelsea-eden-hazard-amazing-goal-arsenal-antonio-conte-reaction-epl-video", "ord_in_thread": 0, "title": "Chelsea's Eden Hazard scoresr stunning goal", "locations": [], "entities": {"persons": [{"name": "chelsea", "sentiment": "neutral"}, {"name": "antonio conte", "sentiment": "none"}, {"name": "wigglesworth", "sentiment": "none"}, {"name": "charles curtis", "sentiment": "none"}, {"name": "shkodran mustafi", "sentiment": "none"}], "locations": [{"name": "chelsea", "sentiment": "none"}, {"name": "usa", "sentiment": "none"}, {"name": "stamford bridge", "sentiment": "none"}, {"name": "london", "sentiment": "none"}], "organizations": [{"name": "eden hazard", "sentiment": "neutral"}, {"name": "chelsea", "sentiment": "neutral"}, {"name": "facebook chelsea", "sentiment": "none"}, {"name": "nbc sports soccer", "sentiment": "none"}, {"name": "ap", "sentiment": "none"}, {"name": "arsenal", "sentiment": "none"}]}, "highlightText": "", "language": "english", "persons": [], "text": "  Chelsea's Eden Hazard scoresr stunning goal Eden Hazard did it all on his own on Saturday. Just look at this insane potential Goal of the... Post to Facebook Chelsea's Eden Hazard scoresr stunning goal Eden Hazard did it all on his own on Saturday. Just look at this insane potential Goal of the...  //ftw.usatoday.com/2017/02/chelsea-eden-hazard-amazing-goal-arsenal-antonio-conte-reaction-epl-video/   Chelsea's Eden Hazard scoresr stunning goal Charles Curtis , USA TODAY 9:58   \nChelsea's Eden Hazard, right avoids a tackle by Arsenal's Shkodran Mustafi during the English Premier League soccer match between Chelsea and Arsenal at Stamford Bridge stadium in London, Saturday, Feb. 4, 2017. (AP Photo/Kirsty Wigglesworth) ORG XMIT: XAG144 (Photo: AP) \nEden Hazard did it all on his own on Saturday. \nJust look at this insane potential Goal of the Year, thanks to the Chelsea midfielder, who just ran circles around Arsenal defenders before putting up his squad 2-0: IT'S A WONDER GOAL from Eden Hazard! The Belgian can't be stopped on his way to doubling @ChelseaFC 's lead vs. Arsenal. #PLonNBC pic.twitter.com/I8rNJZXYrr â€” NBC Sports Soccer (@NBCSportsSoccer) February 4, 2017 \nHow incredible was it? Manager Antonio Conte ran into the crowd to celebrate gleefully. When your manager celebrates like this, you know you did a GREAT job. #Chelsea #PLonNBC pic.twitter.com/m7jfsvTAp9 \nIt totally deserved that reaction.  //ftw.usatoday.com/2017/02/chelsea-eden-hazard-amazing-goal-arsenal-antonio-conte-reaction-epl-video/ Most Popular", "external_links": [], "published": "2017-02-04T21:58:00.000+02:00", "crawled": "2017-02-04T17:09:23.469+02:00", "highlightTitle": ""}