{"organizations": [], "uuid": "08afbca0c200268d5c42cdcc2f588456f9123770", "thread": {"social": {"gplus": {"shares": 0}, "pinterest": {"shares": 0}, "vk": {"shares": 0}, "linkedin": {"shares": 0}, "facebook": {"likes": 603, "shares": 603, "comments": 0}, "stumbledupon": {"shares": 0}}, "site_full": "metro.co.uk", "main_image": "", "site_section": "", "section_title": "", "url": "http://metro.co.uk/2017/02/26/arsenal-on-alert-as-adrien-rabiot-admits-hes-open-to-offers-ahead-of-summer-transfer-window-6473649/", "country": "US", "domain_rank": 1779, "title": "Arsenal transfer news: Adrien Rabiot puts Gunners on alert after major revelation | Metro News", "performance_score": 6, "site": "metro.co.uk", "participants_count": 0, "title_full": "Arsenal transfer news: Adrien Rabiot puts Gunners on alert after major revelation | Metro News", "spam_score": 0.446, "site_type": "news", "published": "2017-02-26T19:07:00.000+02:00", "replies_count": 0, "uuid": "08afbca0c200268d5c42cdcc2f588456f9123770"}, "author": "Tom Olver For Metro.Co.Uk", "url": "http://metro.co.uk/2017/02/26/arsenal-on-alert-as-adrien-rabiot-admits-hes-open-to-offers-ahead-of-summer-transfer-window-6473649/", "ord_in_thread": 0, "title": "Arsenal transfer news: Adrien Rabiot puts Gunners on alert after major revelation | Metro News", "locations": [], "entities": {"persons": [{"name": "adrien rabiot", "sentiment": "positive"}, {"name": "arsene wenger", "sentiment": "none"}, {"name": "getty", "sentiment": "none"}, {"name": "rabiot", "sentiment": "none"}, {"name": "tom olver", "sentiment": "none"}, {"name": "jurgen klopp", "sentiment": "none"}], "locations": [{"name": "france", "sentiment": "none"}, {"name": "leicester", "sentiment": "none"}, {"name": "parc des princes", "sentiment": "none"}], "organizations": [{"name": "metro news follow us arsenal", "sentiment": "positive"}, {"name": "psg", "sentiment": "none"}, {"name": "paris saint-germain", "sentiment": "none"}, {"name": "liverpool", "sentiment": "none"}, {"name": "europe", "sentiment": "none"}, {"name": "ligue", "sentiment": "none"}, {"name": "arsenal", "sentiment": "none"}, {"name": "real madrid", "sentiment": "none"}]}, "highlightText": "", "language": "english", "persons": [], "text": "Follow us Arsenal on alert as Adrien Rabiot admits he’s open to offers ahead of summer transfer window Tom Olver for Metro.co.uk Sunday 26 Feb 2017 12:07 pm Arsenal are tracking PSG star Adrien Rabiot (Picture: Getty) \nParis Saint-Germain ace Adrien Rabiot has put Arsenal on red alert after revealing that he’s open to offers ahead of the summer transfer window. Jurgen Klopp sends warning to his Liverpool flops after Leicester loss \nThe 21-year-old midfielder has scored eight goals in 91 Ligue 1 appearances for PSG since making his debut for the French giants in 2012 but is being linked with a move away from the Parc des Princes at the end of the season. \nGet French Football News suggest the Gunners are monitoring Rabiot’s contract situation at PSG and the France international has welcomed interest from other clubs before the 2017/18 campaign. \n‘I am under contract until 2019 and I do not think that I am in a rush,’ he told Europe 1. Will Arsene Wenger move for Adrien Rabiot in the summer? (Picture: Getty) \n‘Honestly, I am nothing thinking about that. If there are offers from big clubs, that obviously demands that they are considered. \n‘Clubs like Real Madrid, they are great clubs but, truly, the most important thing is the present. ", "external_links": [], "published": "2017-02-26T19:07:00.000+02:00", "crawled": "2017-02-28T04:55:14.901+02:00", "highlightTitle": ""}