{"organizations": [], "uuid": "827f6d33a7b7c4f80e2d72e21530cba40a052ea9", "thread": {"social": {"gplus": {"shares": 0}, "pinterest": {"shares": 0}, "vk": {"shares": 0}, "linkedin": {"shares": 0}, "facebook": {"likes": 205, "shares": 205, "comments": 0}, "stumbledupon": {"shares": 0}}, "site_full": "au.news.yahoo.com", "main_image": "https://s.yimg.com/iu/api/res/1.2/XVwSfLuQkQ.TfgCH9Vcr.w--/YXBwaWQ9eXZpZGVvO3c9NjMxO2g9MzU0O2R4PTE7ZHk9MTtjdz05Nzc7Y2g9NTQ4O3E9NzA7bj0xO3VsY3JvcDtyb3RhdGU9YXV0bw--/https://s.yimg.com/ea/img/-/170228/58b5382d4b202_875in_murdewr.jpg", "site_section": "", "section_title": "", "url": "https://au.news.yahoo.com/vic/a/34523001/jealous-killer-sigaragh-steve-baea-who-stabbed-prasad-somawansa-38-times-jailed-for-22-years/", "country": "AU", "domain_rank": 5, "title": "Jealous killer Sigaragh Steve Baea who stabbed Prasad Somawansa 38 times jailed for 22 years - Yahoo7", "performance_score": 2, "site": "yahoo.com", "participants_count": 0, "title_full": "Jealous killer Sigaragh Steve Baea who stabbed Prasad Somawansa 38 times jailed for 22 years - Yahoo7", "spam_score": 0.004, "site_type": "news", "published": "2017-02-28T18:02:00.000+02:00", "replies_count": 0, "uuid": "827f6d33a7b7c4f80e2d72e21530cba40a052ea9"}, "author": "Yahoo", "url": "https://au.news.yahoo.com/vic/a/34523001/jealous-killer-sigaragh-steve-baea-who-stabbed-prasad-somawansa-38-times-jailed-for-22-years/", "ord_in_thread": 0, "title": "Jealous killer Sigaragh Steve Baea who stabbed Prasad Somawansa 38 times jailed for 22 years - Yahoo7", "locations": [], "entities": {"persons": [{"name": "prasad somawansa", "sentiment": "negative"}, {"name": "steve baea", "sentiment": "negative"}, {"name": "sigaragh steve baea", "sentiment": "negative"}, {"name": "baea", "sentiment": "none"}, {"name": "wishhasad", "sentiment": "none"}, {"name": "elliott", "sentiment": "none"}, {"name": "mrs somawansa", "sentiment": "none"}, {"name": "steve", "sentiment": "none"}, {"name": "priyantha hewage", "sentiment": "none"}, {"name": "wishhasad somawansa", "sentiment": "none"}, {"name": "somawansa", "sentiment": "none"}, {"name": "james elliott", "sentiment": "none"}, {"name": "sigaragh", "sentiment": "none"}], "locations": [{"name": "papua new guinea", "sentiment": "none"}, {"name": "australia", "sentiment": "none"}, {"name": "werribee plaza", "sentiment": "none"}], "organizations": [{"name": "ses", "sentiment": "none"}, {"name": "victorian supreme court", "sentiment": "none"}]}, "highlightText": "", "language": "english", "persons": [], "text": "Share Jealous killer Sigaragh Steve Baea who stabbed Prasad Somawansa 38 times jailed for 22 years - Yahoo7 A man who stabbed the mother of his childhood friend to death because he was jealous of their loving family life, has been jailed for 22 years. Close Jealous man who murdered mother of childhood friend jailed for 22 years UP NEXT VIDEO Jealous man who murdered mother of childhood friend jailed for 22 years \nSri-Lankan born Prasad Somawansa, was stabbed 38 times by her son's former school friend, after he was invited to her family's Hoppers Crossing home in February last year. \nBy chance, the woman's son Wishhasad had crossed paths with the killer Sigaragh \"Steve\" Baea, in the weeks prior to the murder. Sri-Lankan born mother Prasad Somawansa, was stabbed 38 times by her son's former school friend, after he was invited to her family's Hoppers Crossing home. Picture: Supplied \nWishhasad went to primary school with the 22-year-old Papua New Guinea national before his family moved away from Australia. \nThe pair had not seen each other for 10 years when they reconnected in January 2016. On that occasion, Baea was invited to dinner at the family home, prepared by Mrs Somawansa. \nThe Victorian Supreme Court on Tuesday heard Baea became jealous of the family's closeness, which was in contrast to his own troubled family life. Sigaragh \"Steve\" Baea pleaded guilty to the murder and was sentenced to 22 years behind bars. Picture: 7 News \nA few weeks later, on February 18, Baea turned up unannounced at his friend's home. He was invited inside and Mrs Somawansa made him coffee as the young man chatted to her son. \nWhen Wishhasad was called away in his role as an SES volunteer, he dropped his friend off at Werribee Plaza at 8.30pm. \nBut Baea returned to his friend's home on foot claiming he had left his Myki transport card behind. The 48-year-old woman was alone, and he stabbed her to death. Prasad Somawansa was home alone when her killer returned, claiming he forgot his Myki travel card. Picture: Supplied \nHer last moments were heard by her husband, Priyantha Hewage, after the interstate truck driver received a call from his wife's phone at 8.52pm. \nAll he heard was her shouting \"you go out\" three times, followed by \"Dos, Dos, Dos\", which was her name for her husband, and loud, deep breathing noises. \nThe 48-year-old had multiple injuries to her head, chest, arms, wrists and hands. \nIn his sentencing submissions Victorian Supreme Court Justice James Elliott called the attack \"vicious\" and \"cowardly\" and said Baea was jealous of his friend's happiness. Baea became jealous of the his friend's family's closeness, which was in contrast to his own troubled family life, the court heard. Picture: Supplied \n\"You found the experience of watching two loving parents supporting their son in his life and studies quite confronting. \n\"It was a vicious, gruesome and cowardly attack. You stabbed this defenceless woman in her own home violently and repeatedly.\" \nJustice Elliott said Baea attacked the woman, even though she had shown him kindness. \n\"Even though Ms Somawansa had only shown you hospitality and courtesy in the past, you took to her with a knife, which you carried in your trousers, and you stabbed her at least 38 times.\" Wishhasad Somawansa said the sentencing of his mother's killer would not compensate for his family's loss. Photo: 7 News. \nThe 22-year sentence handed to her killer offered no comfort to the family. \nOutside court, the victim's son said no sentence could make up for the loss of the woman who cared for everyone in her life, including her killer. \n\"It will never compensate for the loss of my mother. She was a beautiful person, she was loving, she was caring and she always wanted to do good for everyone else.\" \nBaea was not found to be suffering from any psychiatric illness and never identified a motive for the murder. Justice Elliott described Baea's attack as vicious, gruesome and cowardly. Picture: 7 News \nIn court he showed no sign of remorse over Mrs Somawansa's murder, other than by way of his guilty plea.He will be eligible for parole in 17 years. ", "external_links": [], "published": "2017-02-28T18:02:00.000+02:00", "crawled": "2017-02-28T13:56:47.719+02:00", "highlightTitle": ""}