{"organizations": [], "uuid": "2f46e01b013024032e1d78475adcc815a6d216be", "thread": {"social": {"gplus": {"shares": 0}, "pinterest": {"shares": 0}, "vk": {"shares": 0}, "linkedin": {"shares": 0}, "facebook": {"likes": 341, "shares": 341, "comments": 0}, "stumbledupon": {"shares": 0}}, "site_full": "www.thesun.co.uk", "main_image": "https://www.thesun.co.uk/wp-content/uploads/2017/02/sport-preview-gabriel-jesus3.jpg?strip=all&#038;w=1200&#038;h=800&#038;crop=1", "site_section": "https://www.thesun.co.uk/feed", "section_title": "The Sun", "url": "https://www.thesun.co.uk/sport/football/2887020/gabriel-jesus-has-surgery-in-barcelona-to-repair-fractured-metatarsal-and-faces-eight-weeks-out/", "country": "GB", "domain_rank": 2180, "title": "Gabriel Jesus has surgery in Barcelona to repair fractured metatarsal and faces eight weeks out", "performance_score": 3, "site": "thesun.co.uk", "participants_count": 1, "title_full": "Gabriel Jesus has surgery in Barcelona to repair fractured metatarsal and faces eight weeks out", "spam_score": 0.0, "site_type": "news", "published": "2017-02-17T17:29:00.000+02:00", "replies_count": 0, "uuid": "2f46e01b013024032e1d78475adcc815a6d216be"}, "author": "gsweet", "url": "https://www.thesun.co.uk/sport/football/2887020/gabriel-jesus-has-surgery-in-barcelona-to-repair-fractured-metatarsal-and-faces-eight-weeks-out/", "ord_in_thread": 0, "title": "Gabriel Jesus has surgery in Barcelona to repair fractured metatarsal and faces eight weeks out", "locations": [], "entities": {"persons": [{"name": "gabriel jesus", "sentiment": "negative"}, {"name": "paul", "sentiment": "none"}, {"name": "sergio aguero", "sentiment": "none"}, {"name": "arsene wenger", "sentiment": "none"}, {"name": "pochettino", "sentiment": "none"}, {"name": "jesus", "sentiment": "none"}, {"name": "dominic solanke", "sentiment": "none"}, {"name": "florentin pogba", "sentiment": "none"}, {"name": "vincent kompany", "sentiment": "none"}, {"name": "pep guardiola", "sentiment": "none"}, {"name": "lassana diarra", "sentiment": "none"}, {"name": "ramon cugat", "sentiment": "none"}], "locations": [{"name": "barcelona", "sentiment": "none"}, {"name": "abu dhabi", "sentiment": "none"}, {"name": "palmeiras", "sentiment": "none"}, {"name": "spain", "sentiment": "none"}, {"name": "manchester city", "sentiment": "none"}, {"name": "england", "sentiment": "none"}, {"name": "kevun de bruyne", "sentiment": "none"}, {"name": "bournemouth", "sentiment": "none"}], "organizations": [{"name": "chelsea", "sentiment": "none"}, {"name": "manchester city", "sentiment": "none"}, {"name": "bayern munich", "sentiment": "none"}, {"name": "press association", "sentiment": "none"}, {"name": "chinese super league", "sentiment": "none"}, {"name": "reuters", "sentiment": "none"}, {"name": "manchester city", "sentiment": "none"}, {"name": "sutton united", "sentiment": "none"}, {"name": "liverpool", "sentiment": "none"}, {"name": "etihad", "sentiment": "none"}, {"name": "juventus", "sentiment": "none"}, {"name": "arsenal", "sentiment": "none"}, {"name": "real madrid", "sentiment": "none"}]}, "highlightText": "", "language": "english", "persons": [], "text": "JESUS UNDER KNIFE Gabriel Jesus has surgery in Barcelona to repair fractured metatarsal and faces eight weeks out \nManchester City whizkid to remain in Spain for 48 hours - but he could rejoin squad in Abu Dhabi next week By GEOFF SWEET Comments GABRIEL JESUS has gone under the knife to have his broken metatarsal repaired. \nThe young Manchester City striker had an operation in Barcelona and will spend 48 hours in hospital before flying back to England. Reuters Ouch! Gabriel Jesus is hurt at Bournemouth \nDr Ramon Cugat,a trusted medical contact of City boss Pep Guardiola, performed the surgery. \nHe has previously treated Vincent Kompany and Kevun De Bruyne this season. \nKeep up to date with ALL the MANCHESTER CITY news, gossip, transfers and goals on our club page plus fixtures, results and live match commentary \nJesus could be allowed to join rest of squad in Abu Dhabi next week for some sun and rest but he will be out for at least eight weeks. Related Stories Ars out? Arsene Wenger finally admits he could leave Arsenal THIS season as he faces decision over future GENT OUT OF SHAPE Pochettino watches stuttering Spurs slump to another loss and moans: We’re in a bad way SHINDIG Florentin Pogba shows off his custom shinpads with brother Paul's face... but he's still wearing a Juventus shirt I'M IN THE MONEY Former Arsenal and Real Madrid star Lassana Diarra is heading to the Chinese Super League i'M JUR MAN Chelsea wonderkid Dominic Solanke is ready to join Liverpool in a stunning summer switch Sutt get tough Sutton United will give Arsenal flops more to wine about following Bayern Munich humiliation \nJesus was hurt at Bournemouth on Monday and the news of his injury came as a bitter blow after the 19-year-old Brazilian made such a blistering start to his career at the Etihad. Reuters It looks bad…and it turned out to be a broken metatarsal PA:Press Association 3 Medics comfort the injured Brazilian kid \nJesus has scored three goals in five appearances for City since his £26.8million move from Palmeiras was rubber-stamped in January and has received widespread praise for the way he has adapted to English football. \nHis absence opens the door for Sergio Aguero to restablish his presence in the City front line.", "external_links": [], "published": "2017-02-17T17:29:00.000+02:00", "crawled": "2017-02-17T12:36:51.935+02:00", "highlightTitle": ""}