{"organizations": [], "uuid": "4fca3ca96a75e0921e8957f784441c2f039ce24d", "thread": {"social": {"gplus": {"shares": 0}, "pinterest": {"shares": 0}, "vk": {"shares": 0}, "linkedin": {"shares": 0}, "facebook": {"likes": 665, "shares": 665, "comments": 0}, "stumbledupon": {"shares": 0}}, "site_full": "www.boston.com", "main_image": "https://www.boston.com/wp-content/uploads/2017/02/TITANS-PATRIOTS-747990-850x478.jpg", "site_section": "", "section_title": "", "url": "https://www.boston.com/sports/new-england-patriots/2017/02/01/some-patriots-fans-are-wavering-because-of-trump", "country": "EU", "domain_rank": 2430, "title": "Some Patriots fans are wavering because of Trump", "performance_score": 6, "site": "boston.com", "participants_count": 0, "title_full": "Some Patriots fans are wavering because of Trump", "spam_score": 0.006, "site_type": "news", "published": "2017-02-02T05:20:00.000+02:00", "replies_count": 0, "uuid": "4fca3ca96a75e0921e8957f784441c2f039ce24d"}, "author": "", "url": "https://www.boston.com/sports/new-england-patriots/2017/02/01/some-patriots-fans-are-wavering-because-of-trump", "ord_in_thread": 0, "title": "Some Patriots fans are wavering because of Trump", "locations": [], "entities": {"persons": [{"name": "brady", "sentiment": "none"}, {"name": "–elise amendola", "sentiment": "none"}, {"name": "daly", "sentiment": "none"}, {"name": "bill belichick", "sentiment": "none"}, {"name": "donald trump", "sentiment": "none"}, {"name": "trump", "sentiment": "none"}, {"name": "chuck daly", "sentiment": "none"}, {"name": "tom brady", "sentiment": "none"}, {"name": "robert kraft", "sentiment": "none"}], "locations": [{"name": "new york", "sentiment": "none"}], "organizations": [{"name": "the boston globe", "sentiment": "none"}, {"name": "boston.com", "sentiment": "none"}, {"name": "bostonglobe.com", "sentiment": "none"}, {"name": "tennessee titans", "sentiment": "none"}, {"name": "gillette stadium", "sentiment": "none"}, {"name": "hall of fame", "sentiment": "none"}, {"name": "globe", "sentiment": "none"}]}, "highlightText": "", "language": "english", "persons": [], "text": "Some Patriots fans are wavering because of Trump Some Patriots fans are wavering because of Trump Donald Trump (left) talked with Tom Brady at Gillette Stadium prior to the team’s playoff game against the Tennessee Titans in January of 2004. –Elise Amendola / AP By The Boston Globe February 1, 2017 \nGet Patriots game stats and the inside scoop on the season with The Boston Globe's Point After newsletter delivered for free to your inbox. \nFor years, Chuck Daly served as a dedicated and unflinching New England Patriots supporter. \nWhen his New York friends poked fun at Tom Brady, he extolled the virtues of the future Hall of Fame quarterback. When the Deflategate scandal painted the team as a less-than-upstanding organization, he wrote it off the way most fans did: as an anti-Patriots conspiracy. \nBut then came a development that even Daly felt he couldn’t defend. In the midst of a contentious presidential election, the three figures most commonly credited with the Patriots’ success — Brady, head coach Bill Belichick, and owner Robert Kraft — all expressed support for their friend Donald Trump, despite many divisive and polarizing statements made by the then candidate. Read the complete story at BostonGlobe.com . Don’t have a Globe subscription? Boston.com readers get a 2-week free trial . Advertisement ", "external_links": [], "published": "2017-02-02T05:20:00.000+02:00", "crawled": "2017-02-02T05:37:48.639+02:00", "highlightTitle": ""}