{"organizations": [], "uuid": "01d6294bbad742705b2d974adbdcb346c88eb22f", "thread": {"social": {"gplus": {"shares": 0}, "pinterest": {"shares": 0}, "vk": {"shares": 0}, "linkedin": {"shares": 0}, "facebook": {"likes": 141, "shares": 141, "comments": 0}, "stumbledupon": {"shares": 0}}, "site_full": "www.thesun.co.uk", "main_image": "https://www.thesun.co.uk/wp-content/uploads/2017/02/sport-preview-guardiola-serio-jesus.jpg?strip=all&#038;w=620&#038;h=413&#038;crop=1", "site_section": "https://www.thesun.co.uk/feed", "section_title": "The Sun", "url": "https://www.thesun.co.uk/sport/football/2780767/sergio-aguero-gabriel-jesus-manchester-city-pep-guardiola/", "country": "GB", "domain_rank": 2180, "title": "Sergio Aguero can partner Gabriel Jesus up front at Manchester City, says Pep Guardiola", "performance_score": 1, "site": "thesun.co.uk", "participants_count": 1, "title_full": "Sergio Aguero can partner Gabriel Jesus up front at Manchester City, says Pep Guardiola", "spam_score": 0.0, "site_type": "news", "published": "2017-02-04T05:30:00.000+02:00", "replies_count": 0, "uuid": "01d6294bbad742705b2d974adbdcb346c88eb22f"}, "author": "sstreet", "url": "https://www.thesun.co.uk/sport/football/2780767/sergio-aguero-gabriel-jesus-manchester-city-pep-guardiola/", "ord_in_thread": 0, "title": "Sergio Aguero can partner Gabriel Jesus up front at Manchester City, says Pep Guardiola", "locations": [], "entities": {"persons": [{"name": "pep guardiola", "sentiment": "negative"}, {"name": "gabriel jesus", "sentiment": "negative"}, {"name": "sergio aguero", "sentiment": "negative"}, {"name": "wayne rooney  guardiola", "sentiment": "none"}, {"name": "guardiola", "sentiment": "none"}, {"name": "martin blackburn click", "sentiment": "none"}, {"name": "sergio", "sentiment": "none"}, {"name": "gabriel jesus city", "sentiment": "none"}, {"name": "edin dzeko", "sentiment": "none"}, {"name": "guardiola", "sentiment": "none"}, {"name": "getty images pep guardiola", "sentiment": "none"}, {"name": "jesus", "sentiment": "none"}, {"name": "leroy sane", "sentiment": "none"}, {"name": "raheem sterling", "sentiment": "none"}, {"name": "carlos tevez", "sentiment": "none"}, {"name": "mario balotelli", "sentiment": "none"}, {"name": "gabriel", "sentiment": "none"}, {"name": "claudio", "sentiment": "none"}, {"name": "willy caballero", "sentiment": "none"}, {"name": "pep", "sentiment": "none"}, {"name": "claudio bravo", "sentiment": "none"}, {"name": "gabriel jesus jesus", "sentiment": "none"}, {"name": "yaya toure", "sentiment": "none"}, {"name": "aguero", "sentiment": "none"}], "locations": [{"name": "manchester city", "sentiment": "none"}, {"name": "man city richard pelham city", "sentiment": "none"}, {"name": "man city", "sentiment": "none"}, {"name": "west ham  aguero", "sentiment": "none"}, {"name": "new man city", "sentiment": "none"}, {"name": "barcelona", "sentiment": "none"}, {"name": "europe", "sentiment": "none"}, {"name": "buenos aires", "sentiment": "none"}, {"name": "west ham", "sentiment": "none"}, {"name": "swansea", "sentiment": "none"}, {"name": "argentina", "sentiment": "none"}, {"name": "brazil", "sentiment": "none"}, {"name": "new manchester city", "sentiment": "none"}], "organizations": [{"name": "news group newspapers ltd", "sentiment": "none"}, {"name": "palmeiras", "sentiment": "none"}, {"name": "atletico madrid", "sentiment": "none"}, {"name": "reuters", "sentiment": "none"}, {"name": "etihad", "sentiment": "none"}, {"name": "facebook", "sentiment": "none"}, {"name": "manchester city's champions league", "sentiment": "none"}, {"name": "real madrid", "sentiment": "none"}]}, "highlightText": "", "language": "english", "persons": [], "text": "It takes two Sergio Aguero can partner Gabriel Jesus up front at Manchester City, says Pep Guardiola \nCity boss scoffs at rumours that Brazilian star's arrival will force Aguero to look for a new club By MARTIN BLACKBURN Click to share on Facebook (Opens in new window) Comments PEP GUARDIOLA is still convinced Sergio Aguero can be a perfect match for Manchester City new-boy Gabriel Jesus. \nThe sensational start made by the Brazilian teenager has led to question marks over the future of City’s top scorer. Reuters 7 The arrival of Gabriel Jesus had led to question marks over Sergio Aguero’s future \nAguero, 28, was left on the bench on Wednesday while Jesus teamed up with Raheem Sterling and Leroy Sane to run West Ham ragged. \nKeep up to date with ALL the Manchester City news, gossip, transfers and goals on our club page plus fixtures, results and live match commentary \nBut Guardiola assured Aguero he remains pretty much the most important player at the Etihad. \nAnd Pep plans to shift Jesus out wide — a role his old club Palmeiras regularly used him in — to allow the Argentine to play down the middle. \nSources close to Aguero indicated he is keen to stay at City and fight for his place, so Guardiola’s words will be encouraging. \nHe said: “ Gabriel arrives, he played well and that’s why he was used at West Ham. But they can play together. New Man City star Gabriel Jesus shows off his dance moves in the snow \n“Individually, Gabriel can play on the left. Now I have many options. \n“In Brazil, Gabriel played on the left side — he likes to play on the left with the movement in diagonals — like he was doing in the last games. \n“Both can play together because Gabriel is not just one in behind, he is good in the box, he is a fighter. \n“His back-tracking is really good, that’s why he can help a lot.” Getty Images But Aguero is believed to want to stay at the Etihad and fight for his place Getty Images Pep Guardiola says there is room for both players in his team News Group Newspapers Ltd 7 The pair approach the ball at West Ham \nAguero has 18 goals overall this season and has risen to third on the club’s all-time leading scorers list. \nAnd that comes less than six years after his arrival. \nThe feeling persists that Guardiola wants more from the him but City’s boss insists the former Atletico Madrid forward is still a vital player in his plans. \nGuardiola added: “Sergio remains the squad’s most, or one of the most, important players. Related Stories mummy's boy Man City have their guardian angel in Gabriel Jesus... but he still needs his mum to help out GRAM A GRANNY Manchester City star Sergio Aguero's granny caught up in Buenos Aires drugs bust storm God's gift Gabriel Jesus' tattoo reminds Brazilian of amazing journey from the slums to Premier League sergi-off? Real Madrid in stunning plot to sign Manchester City's out-of-favour striker Sergio Aguero this summer Toure on Tour Yaya Toure added to Manchester City's Champions League squad along with new signing Gabriel Jesus Jesus fight Sergio Aguero vows to stay and battle for his place alongside new City hero Gabriel Jesus City slickers Gabriel Jesus and jubilant Manchester City team-mates laugh and hug each other in training after returning from 4-0 drubbing of West Ham \n“I understand the debate. But there is no doubt about Sergio’s quality. \n“Without him it will not be possible to achieve what we want. I can say how happy I am with what he did — except the seven games when he was banned. \n“The big clubs in Europe always have a lot of strikers — here there was Mario Balotelli, Carlos Tevez, Sergio and Edin Dzeko all together. \n“Sergio has played all the games except one in Barcelona for a tactical decision and one when he had come back from Argentina. \n“The others — when he was not banned — he always played good.” News Group Newspapers Ltd Edin Dzeko, Mario Balotelli and Carlos Tevez played together at Man City Richard Pelham City demolished West Ham in midweek Sportimage But goalkeeper Claudio Bravo was dropped to the bench \nJesus has only played two full games for City but his enthusiasm has already impressed his boss. \nPep said: “He’s 19 but he’s settled quickly. He speaks enough English words to understand us. He’s taking lessons every day. That means a lot. \n“In his three appearances he’s shown a lot in terms of desire, helped us with high-pressing intensity, his movement in the box.” New Manchester City chant about Gabriel Jesus takes a dig at Wayne Rooney \nGuardiola has another big call to make ahead of tomorrow’s clash with Swansea — but is expected to keep faith with Willy Caballero in goal. \nHe axed Claudio Bravo, 33, after a difficult run but urges the Chilean not to give up on his City career. \nHe said: “It depends on what I see. I am not a guy who plays the same 11 all the time for two months. \n“Claudio’s a huge professional with a lot of experience. I explained and he understood. He’s strong enough.”", "external_links": [], "published": "2017-02-04T05:30:00.000+02:00", "crawled": "2017-02-04T05:54:51.718+02:00", "highlightTitle": ""}