{"organizations": [], "uuid": "4a99e59844e11452e6ac724365a8a61a6f84cd48", "thread": {"social": {"gplus": {"shares": 0}, "pinterest": {"shares": 0}, "vk": {"shares": 0}, "linkedin": {"shares": 0}, "facebook": {"likes": 229, "shares": 229, "comments": 0}, "stumbledupon": {"shares": 0}}, "site_full": "www.indystar.com", "main_image": "http://www.gannett-cdn.com/-mm-/9233115f8bbb3a6166d9baa09d7423bea49a1110/c=0-0-1997-1128&amp;r=x633&amp;c=1200x630/local/-/media/2017/02/04/INGroup/Indianapolis/636218368830352791-COLTS-JAGS-2ndHalf-MM-001.JPG", "site_section": "http://rssfeeds.indystar.com/indystar/colts", "section_title": "GANNETT Syndication Service", "url": "http://www.indystar.com/story/sports/nfl/colts/2017/02/04/frank-gore-wins-art-rooney-sportsmanship-award/97507666/", "country": "US", "domain_rank": 12374, "title": "Frank Gore wins Art Rooney Sportsmanship Award", "performance_score": 2, "site": "indystar.com", "participants_count": 1, "title_full": "Frank Gore wins Art Rooney Sportsmanship Award", "spam_score": 0.0, "site_type": "news", "published": "2017-02-05T09:29:00.000+02:00", "replies_count": 0, "uuid": "4a99e59844e11452e6ac724365a8a61a6f84cd48"}, "author": "sports@indystar.com", "url": "http://www.indystar.com/story/sports/nfl/colts/2017/02/04/frank-gore-wins-art-rooney-sportsmanship-award/97507666/", "ord_in_thread": 0, "title": "Frank Gore wins Art Rooney Sportsmanship Award", "locations": [], "entities": {"persons": [{"name": "frank gore", "sentiment": "negative"}, {"name": "larry fitzgerald", "sentiment": "none"}, {"name": "charles woodson", "sentiment": "none"}, {"name": "gore", "sentiment": "none"}, {"name": "andrew luck", "sentiment": "none"}], "locations": [{"name": "lucas oil stadium", "sentiment": "none"}], "organizations": [{"name": "indianapolis colts", "sentiment": "none"}, {"name": "arizona cardinals", "sentiment": "none"}, {"name": "nfl", "sentiment": "none"}, {"name": "oakland raiders", "sentiment": "none"}, {"name": "nfl legends community", "sentiment": "none"}, {"name": "colts", "sentiment": "none"}, {"name": "jacksonville jaguars", "sentiment": "none"}, {"name": "nfl foundation", "sentiment": "none"}]}, "highlightText": "", "language": "english", "persons": [], "text": "Frank Gore wins Art Rooney Sportsmanship Award IndyStar Sports , sports@indystar.com Published 8:37   | Updated 34 minutes ago Indianapolis Colts quarterback Andrew Luck (12) gives a hug to Colts running back Frank Gore (23) after the team's 24-20 victory over the Jacksonville Jaguars at Lucas Oil Stadium on Jan. 1, 2017. Gore ended his season with more than 1000 rushing yards. (Photo: Mykal_McEldowney/Indy_Star) \nIndianapolis Colts running back Frank Gore has been named the NFL's 2016 Art Rooney Sportsmanship Award winner. \nThe prestigious award is given to the player who \" best demonstrates the qualities of outstanding sportsmanship on the playing field, including fair play, respect for opponents and integrity in competition,\" a Colts news release said. \nGore was honored awarded during NFL Honors, the NFL's annual award show. \nThe NFL Foundation will award Gore $25,000 to be donated to the charity of his choice. \nEach team nominated a player for the sportsmanship award, and that list of 32 was eventually cut down to eight finalists. Gore was chosen among those eight by the NFL Legends Community. \nPrevious winners of the award are the Oakland Raiders' Charles Woodson (2015) and the Arizona Cardinals' Larry Fitzgerald (2014).", "external_links": [], "published": "2017-02-05T09:29:00.000+02:00", "crawled": "2017-02-05T05:04:52.840+02:00", "highlightTitle": ""}