{"organizations": [], "uuid": "3dce4cbb6b09f83dd72314511567184a3583d0b5", "thread": {"social": {"gplus": {"shares": 0}, "pinterest": {"shares": 0}, "vk": {"shares": 0}, "linkedin": {"shares": 0}, "facebook": {"likes": 359, "shares": 359, "comments": 0}, "stumbledupon": {"shares": 0}}, "site_full": "www.thesun.co.uk", "main_image": "https://www.thesun.co.uk/wp-content/uploads/2017/02/nintchdbpict000299042180.jpg?strip=all&#038;w=1200&#038;h=800&#038;crop=1", "site_section": "https://www.thesun.co.uk/feed", "section_title": "The Sun", "url": "https://www.thesun.co.uk/news/2777817/met-police-officer-forced-14-year-old-girls-to-carry-out-sick-sex-acts-while-he-watched-over-skype/", "country": "GB", "domain_rank": 2180, "title": "Met police officer forced 14-year-old girls to carry out sick sex acts while he watched over Skype", "performance_score": 3, "site": "thesun.co.uk", "participants_count": 1, "title_full": "Met police officer forced 14-year-old girls to carry out sick sex acts while he watched over Skype", "spam_score": 0.0, "site_type": "news", "published": "2017-02-03T20:05:00.000+02:00", "replies_count": 0, "uuid": "3dce4cbb6b09f83dd72314511567184a3583d0b5"}, "author": "fallen", "url": "https://www.thesun.co.uk/news/2777817/met-police-officer-forced-14-year-old-girls-to-carry-out-sick-sex-acts-while-he-watched-over-skype/", "ord_in_thread": 0, "title": "Met police officer forced 14-year-old girls to carry out sick sex acts while he watched over Skype", "locations": [], "entities": {"persons": [{"name": "alistair leiper", "sentiment": "none"}, {"name": "leiper", "sentiment": "none"}, {"name": "james couper", "sentiment": "none"}, {"name": "joanna korner", "sentiment": "none"}, {"name": "felix allen", "sentiment": "none"}, {"name": "greenock", "sentiment": "none"}, {"name": "edmund gritt", "sentiment": "none"}], "locations": [{"name": "streatham", "sentiment": "none"}, {"name": "jordan", "sentiment": "none"}, {"name": "spain", "sentiment": "none"}, {"name": "paris", "sentiment": "none"}, {"name": "south london", "sentiment": "none"}, {"name": "eu", "sentiment": "none"}, {"name": "malta", "sentiment": "none"}, {"name": "westminster", "sentiment": "none"}], "organizations": [{"name": "skype", "sentiment": "negative"}, {"name": "isis", "sentiment": "none"}, {"name": "central news", "sentiment": "none"}, {"name": "southwark crown court", "sentiment": "none"}, {"name": "facebook", "sentiment": "none"}]}, "highlightText": "", "language": "english", "persons": [], "text": "PAEDO COP Met police officer forced 14-year-old girls to carry out sick sex acts while he watched over Skype \nPC Alistair Leiper, 37, is facing jail after his colleagues found recordings of Skype chats on his computer By FELIX ALLEN Click to share on Facebook (Opens in new window) Comments A PAEDO police officer is facing jail for making two 14-year-old carry out sex acts while he watched on Skype. \nPC Alistair Leiper, 37, also filmed another teenage girl performing a sex act, a court heard. Central News 1 PC Alistair Leiper faces jail after making girls aged 14 perform sex acts while he watched over Skype \nThe Met officer’s colleagues discovered three sex tapes on his computer when they raided his home in Streatham, South London. \nLeiper has been suspended from duty at the Westminster borough since his arrest in August 2015 and will now be thrown out of the force. \nHe admitted three charges attempting to engage in a sexual activity in the presence of a child and one count of causing or inciting a child to engage in sexual activity. \nA further count of making indecent photos of a child and one count of attempting to engage in a sexual activity in the presence of a child will lie on file. RELATED STORIES Yazidi woman reveals she was raped by 12 men while being held captive by ISIS PANIC IN PARIS Everything we know about the Louvre art gallery shooting as armed soldier opens fire BODY BREAKTHROUGH Police say remains could 'possibly' be woman murdered by jealous husband 20 years ago INSTA-SCAM Brazen thieves post pictures of over 100 stolen motorbikes - including a Domino's bike - on Instagram account 'Bristolbiketaker' HAIR WE GO! Windswept Theresa May offers hope for 300,000 British expats in Spain during EU talks in Malta UGLY MUG...SHOT Cops release wild-eyed mugshot of nuisance woman banned from restaurants for throwing things TO HAVE AND TO OLD Pensioner gets engaged at 106 to a man 40 YEARS her junior and walks down aisle in rose-covered zimmerframe during romantic ceremony JAMES' JACKPOT! Mystery Greenock man who scooped over £4m in the lottery named as ferry port assistant James Couper GRIM DISCOVERY Human SKULL found on beach by horrified dog walker could be remains of shipwrecked sailor SHOCK TOT DEATH First picture of tragic three-month-old baby Jordan found dead with cocaine in his bloodstream SCHOOL TRIP TERROR Brit students trapped inside Louvre are 'safe', school confirms in message to terrified parents NOT FARE Commuter is wrongly stopped by cops after he used legal loophole to save £260 on Virgin train tickets \nEdmund Gritt, defending, said: “There are three Skype chat logs that have been found between Mr Leiper and two 14-year-old girls dating back to about ten months before the search in his flat. \n“The most serious log, which relates to counts two and three, is just under one and a half hours.” \nThe court heard Leiper has signed up to the Stop It Now programme which provides “counselling to enable individuals to address this sort of behaviour to prevent it in the future”. \nJudge Joanna Korner said: “With something as serious as this I would need, any judge would need, to know whether he is dangerous. \n“I’m going to order a pre-sentence report purely from the point of view of whether or not he is dangerous. \n“There doesn’t appear to be any other proposal than a sentence of imprisonment.” \nLeiper was released on conditional bail until sentencing next month at Southwark Crown Court. \nWe pay for your stories! Do you have a story for The Sun Online news team? Email us at tips@the-sun.co.uk or call 0207 782 4368", "external_links": [], "published": "2017-02-03T20:05:00.000+02:00", "crawled": "2017-02-03T15:18:17.456+02:00", "highlightTitle": ""}