{"organizations": [], "uuid": "96f72c75f8a7135665626d17e62228c4ab62f3cf", "thread": {"social": {"gplus": {"shares": 0}, "pinterest": {"shares": 0}, "vk": {"shares": 0}, "linkedin": {"shares": 0}, "facebook": {"likes": 164, "shares": 164, "comments": 0}, "stumbledupon": {"shares": 0}}, "site_full": "www.orlandosentinel.com", "main_image": "http://www.trbimg.com/img-58ac1c84/turbine/os-fatal-hit-and-run-pine-hills-road-20170221", "site_section": "http://feeds2.feedburner.com/orlandosentinelbreakingnews", "section_title": "Breaking News - Orlando Sentinel", "url": "http://www.orlandosentinel.com/news/traffic/os-fatal-hit-and-run-pine-hills-road-20170221-story.html", "country": "US", "domain_rank": 8952, "title": "Troopers searching for driver after pedestrian hit, killed crossing Pine Hills Road", "performance_score": 1, "site": "orlandosentinel.com", "participants_count": 1, "title_full": "Troopers searching for driver after pedestrian hit, killed crossing Pine Hills Road", "spam_score": 0.0, "site_type": "news", "published": "2017-02-21T17:50:00.000+02:00", "replies_count": 0, "uuid": "96f72c75f8a7135665626d17e62228c4ab62f3cf"}, "author": "Stephanie Allen", "url": "http://www.orlandosentinel.com/news/traffic/os-fatal-hit-and-run-pine-hills-road-20170221-story.html", "ord_in_thread": 0, "title": "Troopers searching for driver after pedestrian hit, killed crossing Pine Hills Road", "locations": [], "entities": {"persons": [{"name": "orlando sentinel stephanie allen", "sentiment": "none"}, {"name": "teresa jacobs", "sentiment": "none"}, {"name": "steven montiero", "sentiment": "none"}], "locations": [{"name": "pine hills", "sentiment": "none"}, {"name": "central florida expressway authority", "sentiment": "none"}, {"name": "altamonte springs", "sentiment": "none"}, {"name": "seminole county", "sentiment": "none"}, {"name": "florida expressway authority", "sentiment": "none"}, {"name": "orange county", "sentiment": "none"}, {"name": "pine hills road", "sentiment": "none"}, {"name": "florida", "sentiment": "none"}, {"name": "caption orange county", "sentiment": "none"}], "organizations": [{"name": "central florida expressway authority", "sentiment": "none"}, {"name": "nasa", "sentiment": "none"}, {"name": "department of transportation", "sentiment": "none"}, {"name": "orange county mayor teresa jacobs", "sentiment": "none"}, {"name": "orlando sentinel", "sentiment": "none"}]}, "highlightText": "", "language": "english", "persons": [], "text": "Troopers searching for driver after pedestrian hit, killed crossing Pine Hills Road Fatal hit and run crash Orlando Sentinel Stephanie Allen .\nTroopers said the person was first struck by a vehicle heading south on Pine Hills Road. That vehicle stopped at the scene. \nA second vehicle, described as a dark grey sport utility vehicle, then ran over the person who was lying in the street. \nTrooper Steven Montiero said the SUV immediately “left the scene.” The pedestrian died from the injuries. \nNo other details about the crash have been released. \nTroopers were asking anyone with information to call Crimeline at 407-4236-8477. \nThis is a breaking news story. Check back with the Orlando Sentinel for updates. \nsallen@orlandosentinel.com or 407-420-5417 Caption Two proposed toll roads would extend access into east Orange County \nPlans are in the works to extend state road 408 and insert toll lanes on state road 50, leading into east Orange County. \nPlans are in the works to extend state road 408 and insert toll lanes on state road 50, leading into east Orange County. Caption Two proposed toll roads would extend access into east Orange County \nPlans are in the works to extend state road 408 and insert toll lanes on state road 50, leading into east Orange County. \nPlans are in the works to extend state road 408 and insert toll lanes on state road 50, leading into east Orange County. Caption Seminole County residents meet to discuss upcoming I-4 construction \nThe Department of Transportation held a meeting to discuss the Interstate 4 Ultimate project as work ramps up in the Altamonte Springs area. \nThe Department of Transportation held a meeting to discuss the Interstate 4 Ultimate project as work ramps up in the Altamonte Springs area. Caption The sonic boom problem with supersonic flights \nNASA’s Quiet Supersonic Technology X-plane project aims to solve the problem of sonic booms. (Feb. 2, 2017) \nNASA’s Quiet Supersonic Technology X-plane project aims to solve the problem of sonic booms. (Feb. 2, 2017) Caption Central Florida toll hike has been stopped - Orlando News Now \nThe Central Florida Expressway Authority has voted not to increase tolls 15-percent. \nThe Central Florida Expressway Authority has voted not to increase tolls 15-percent. Caption Orange County mayor comments on not raising tolls \nOrange County Mayor Teresa Jacobs comments on the Central Florida Expressway Authority's decision not to hike tolls 15-percent. \nOrange County Mayor Teresa Jacobs comments on the Central Florida Expressway Authority's decision not to hike tolls 15-percent.", "external_links": [], "published": "2017-02-21T17:50:00.000+02:00", "crawled": "2017-02-21T13:14:10.026+02:00", "highlightTitle": ""}