{"organizations": [], "uuid": "122bcf4cac68a82a5f9070490cab12e9a07b36ee", "thread": {"social": {"gplus": {"shares": 0}, "pinterest": {"shares": 0}, "vk": {"shares": 0}, "linkedin": {"shares": 0}, "facebook": {"likes": 440, "shares": 440, "comments": 183}, "stumbledupon": {"shares": 0}}, "site_full": "www.huffingtonpost.com", "main_image": "http://img.huffingtonpost.com/asset/2000_1000/58a496c125000017600b9329.jpeg", "site_section": "http://www.huffingtonpost.com/feeds/verticals/politics/news.xml", "section_title": "Politics News on The Huffington Post", "url": "http://www.huffingtonpost.com/entry/trump-russia-ties_us_58a494e8e4b0ab2d2b1b588c", "country": "US", "domain_rank": 139, "title": "Donald Trump Ducks Questions About Administration's Ties To Russia", "performance_score": 4, "site": "huffingtonpost.com", "participants_count": 1, "title_full": "Donald Trump Ducks Questions About Administration's Ties To Russia", "spam_score": 0.0, "site_type": "news", "published": "2017-02-16T01:32:00.000+02:00", "replies_count": 0, "uuid": "122bcf4cac68a82a5f9070490cab12e9a07b36ee"}, "author": "Igor Bobic", "url": "http://www.huffingtonpost.com/entry/trump-russia-ties_us_58a494e8e4b0ab2d2b1b588c", "ord_in_thread": 0, "title": "Donald Trump Ducks Questions About Administration's Ties To Russia", "locations": [], "entities": {"persons": [{"name": "trump", "sentiment": "none"}, {"name": "donald trump", "sentiment": "none"}, {"name": "jim acosta", "sentiment": "none"}, {"name": "colin jones", "sentiment": "none"}, {"name": "michael flynn", "sentiment": "none"}, {"name": "flynn", "sentiment": "none"}, {"name": "benjamin netanyahu", "sentiment": "none"}, {"name": "sinclair", "sentiment": "none"}], "locations": [{"name": "russia", "sentiment": "none"}, {"name": "iran", "sentiment": "none"}, {"name": "u.s.", "sentiment": "none"}, {"name": "white house", "sentiment": "none"}], "organizations": [{"name": "donald trump ducks questions about administration", "sentiment": "negative"}, {"name": "msnbc", "sentiment": "none"}, {"name": "fox news", "sentiment": "none"}, {"name": "new york post", "sentiment": "none"}, {"name": "senate intelligence committee vice chair mark warner", "sentiment": "none"}, {"name": "huffington post", "sentiment": "none"}, {"name": "christian broadcasting network", "sentiment": "none"}, {"name": "cnn", "sentiment": "none"}, {"name": "trump’s national security", "sentiment": "none"}]}, "highlightText": "", "language": "english", "persons": [], "text": "Donald Trump Ducks Questions About Administration's Ties To Russia The president smiled and walked away in response to a question from CNN's Jim Acosta. 02/15/2017 01:32 pm ET Igor Bobic Associate Politics Editor, The Huffington Post \nPresident Donald Trump on Wednesday ignored shouted questions about his administration’s reported ties to Russia . \nDuring a joint press conference with Israeli Prime Minister Benjamin Netanyahu at the White House, Trump took two questions from U.S. media outlets about the Israeli-Palestinian peace process and the Iran nuclear deal. \nNeither of those questions centered on Russia ― the biggest issue this week that ultimately led to the resignation of Trump’s National Security Adviser Michael Flynn, who served less than 30 days at the post. \nWhen CNN’s Jim Acosta tried to ask Trump about Flynn, the president smiled, thanked the audience and walked away. Here's @Acosta trying to get Trump to answer a question on the campaign's contact with Russia. He doesn't answer. pic.twitter.com/qJbCOwI7zm — Colin Jones (@colinjones) February 15, 2017 \nWednesday’s event marked the third straight press conference where reporters were not able to ask the president about the biggest issue of the day. Trump has mostly called on friendlier outlets in the conservative space: The New York Post, Fox News, Sinclair’s ABC7, The Daily Caller, Christian Broadcasting Network and Townhall.com. \nAppearing on MSNBC after the press conference, Senate Intelligence Committee Vice Chair Mark Warner (D-Va.) said the public remained in the dark about Trump’s administration and Russia. “We don’t know what the president knew and when he knew it,” he said. Do you have information you want to share with the Huffington Post? Here’s how. More:", "external_links": [], "published": "2017-02-16T01:32:00.000+02:00", "crawled": "2017-02-15T20:52:18.212+02:00", "highlightTitle": ""}