{"organizations": [], "uuid": "d10aab434171d4149fe23ea2102a9e95455cbbf8", "thread": {"social": {"gplus": {"shares": 1}, "pinterest": {"shares": 0}, "vk": {"shares": 0}, "linkedin": {"shares": 0}, "facebook": {"likes": 846, "shares": 846, "comments": 0}, "stumbledupon": {"shares": 0}}, "site_full": "www.mirror.co.uk", "main_image": "http://i1.mirror.co.uk/incoming/article9797355.ece/ALTERNATES/s1200/Iffy-Guj.jpg", "site_section": "http://www.mirror.co.uk/rss.xml", "section_title": "mirror - Home", "url": "http://www.mirror.co.uk/news/uk-news/first-picture-boy-16-stabbed-9796526", "country": "GB", "domain_rank": 804, "title": "First picture of boy, 16, 'stabbed in heart' on way home from school in attack 'caught on camera'", "performance_score": 8, "site": "mirror.co.uk", "participants_count": 1, "title_full": "First picture of boy, 16, 'stabbed in heart' on way home from school in attack 'caught on camera'", "spam_score": 0.0, "site_type": "news", "published": "2017-02-11T22:59:00.000+02:00", "replies_count": 0, "uuid": "d10aab434171d4149fe23ea2102a9e95455cbbf8"}, "author": "Steve Robson", "url": "http://www.mirror.co.uk/news/uk-news/first-picture-boy-16-stabbed-9796526", "ord_in_thread": 0, "title": "First picture of boy, 16, 'stabbed in heart' on way home from school in attack 'caught on camera'", "locations": [], "entities": {"persons": [{"name": "irfan", "sentiment": "none"}, {"name": "pat twiggs", "sentiment": "none"}, {"name": "abid kotia", "sentiment": "none"}, {"name": "iffy", "sentiment": "none"}, {"name": "irfan fazil", "sentiment": "none"}, {"name": "waheid fazil", "sentiment": "none"}, {"name": "mark readman", "sentiment": "none"}, {"name": "steve robson stephen jones", "sentiment": "none"}, {"name": "cheyanne", "sentiment": "none"}, {"name": "tahir fazil", "sentiment": "none"}, {"name": "mirroronline", "sentiment": "none"}, {"name": "mohammed ilyas", "sentiment": "none"}, {"name": "shaista khan", "sentiment": "none"}], "locations": [{"name": "bilal mosque", "sentiment": "none"}, {"name": "waheid", "sentiment": "none"}, {"name": "harehills lane", "sentiment": "none"}, {"name": "leeds", "sentiment": "none"}], "organizations": [{"name": "home office", "sentiment": "none"}, {"name": "west yorkshire police", "sentiment": "none"}, {"name": "facebook", "sentiment": "none"}, {"name": "carr manor community school", "sentiment": "none"}]}, "highlightText": "", "language": "english", "persons": [], "text": "News First picture of boy, 16, 'stabbed in heart' on way home from school in attack 'caught on camera' The victim has been named locally as a 16-year-old boy called Irfan Fazil - known as Iffy to friends - who was reportedly 'knifed' after getting off a bus Share By Steve Robson Stephen Jones 15:59, 11 FEB 2017 The 16-year-old boy stabbed to death in Leeds has been named as Irfan Fazil - son of Waheid - known as Iffy to friends (Photo: Facebook) Share Get daily   Thank you for subscribing!   \nThis is the first picture of the tragic boy stabbed to death on his way home from school in Leeds. \nThe victim has been named by relatives as a 16-year-old boy called Irfan Fazil - son of Waheid Fazil - known as Iffy to his friends. \nTributes posted online describe him as a \"good lad\" who had \"a bright future ahead of him\". \nLaunching a murder inquiry, police said the attack may have been caught on film - as Irfan's devastated uncle Tahir Fazil said his nephew was \"brutally stabbed... in the heart\". \nTahir Fazil posted on Facebook: \"Not easy for us at this time not a nice way to watch a son/brother/friend/nephew to go.\" \nFriends are organising a 'Dua' - a prayer vigil - at the local Bilal Mosque today when people of all faiths are being invited to \"show love and respect\" for Irfan. \nA close family friend, Mohammed Ilyas, 39, who works for the Home Office, told MirrorOnline that \"everyone loved\" Irfan. \n\"He was a funny guy. He'd always find a minutes to talk to you. He was there for everyone,\" he added. \nThe tragic incident occurred on a busy street in Leeds just after school finished at 3.42pm on Friday - after pupils had broken up for half-term holidays. \nPolice were called to a stabbing and discovered Iffy lying injured at the scene on Harehills Lane in Leeds. The scene in Leeds where Iffy was stabbed to death (Photo: Mark Readman) \nHe was rushed to hospital but died a short time later. His family are understood to be waiting for his body to be released by the coroner for burial after a post-mortem is carried out. \nWest Yorkshire Police have launched a murder inquiry and have arrested a 15-year-old boy. \nHe remains in custody after being held overnight for questioning on suspicion of murder. \nLast night one of Irfan's best friends posted online: \"No words can explain.. us 2 were brothers. \n\"He was humble and loyal and my close boy. \n\"My brother no matter what. The love will never go. Always in my heart.\" Police have arrested a 15-year-old boy on suspicion of murder (Photo: Mark Readman) \nDozens of family and friends took to social media to pay tribute to Iffy as news of the tragedy filtered through the local community. \nPosting a picture of smiling Iffy, Abid Kotia wrote: \"So sad on this sad news of this 16-yr-old Irfan his has died in a stabbing on harehills Lane Compton.... just left school and caught bus home.... prayers for his family another life lost\". \nShaista Khan commented: \"He was a good lad had a bright future ahead of him. \n\"So sad and heart felt condolences to the family.\" The stabbing happened shortly after local schools finished for half-term on Friday (Photo: Mark Readman) \nA fellow pupil at Carr Manor Community School added: \"Rest In Peace brother man is going to miss you like mad\". \nAnother friend Cheyanne wrote on Facebook: \"RIP Iffy. Taken way too soon\". \nDetective Superintendent Pat Twiggs appealed for anyone who witnessed the event to come forward. \nHe said: \"This tragic incident happened in a busy area at a busy time of day with large numbers of people going about their daily business. \n\"I am appealing directly to anyone who witnessed the incident or has information that could help our enquiries to come forward. \n\"We are particularly keen to speak to anyone who witnessed anyone running in the area to come forward. \n\"It is also possible that people may have recorded footage on their mobile phones and I would again encourage those people to come forward.\" \nAnyone with information should ring the police on 101 regarding log 1017 of 10th or ring Crimestoppers on 0800 555111. Like us on Facebook", "external_links": [], "published": "2017-02-11T22:59:00.000+02:00", "crawled": "2017-02-11T18:25:05.269+02:00", "highlightTitle": ""}