{"organizations": [], "uuid": "88fb31675e24beb3b93833c746281f21c07fb55e", "thread": {"social": {"gplus": {"shares": 0}, "pinterest": {"shares": 0}, "vk": {"shares": 0}, "linkedin": {"shares": 0}, "facebook": {"likes": 209, "shares": 209, "comments": 0}, "stumbledupon": {"shares": 0}}, "site_full": "www.financialexpress.com", "main_image": "http://images.financialexpress.com/2017/02/warren-buffett.jpg", "site_section": "http://www.financialexpress.com/feed/rss", "section_title": "The Financial ExpressThe Financial Express", "url": "http://www.financialexpress.com/market/warren-buffett-oracle-of-omaha-has-bought-133-million-apple-shares-in-2017-heres-why/568345/", "country": "US", "domain_rank": 4726, "title": "Warren Buffett, Oracle of Omaha, has bought 133 million Apple shares in 2017. Here’s why!", "performance_score": 2, "site": "financialexpress.com", "participants_count": 1, "title_full": "Warren Buffett, Oracle of Omaha, has bought 133 million Apple shares in 2017. Here’s why!", "spam_score": 0.0, "site_type": "news", "published": "2017-02-28T00:20:00.000+02:00", "replies_count": 0, "uuid": "88fb31675e24beb3b93833c746281f21c07fb55e"}, "author": "FE Online", "url": "http://www.financialexpress.com/market/warren-buffett-oracle-of-omaha-has-bought-133-million-apple-shares-in-2017-heres-why/568345/", "ord_in_thread": 0, "title": "Warren Buffett, Oracle of Omaha, has bought 133 million Apple shares in 2017. Here’s why!", "locations": [], "entities": {"persons": [{"name": "warren buffett", "sentiment": "negative"}, {"name": "warren buf", "sentiment": "negative"}, {"name": "buffett", "sentiment": "none"}, {"name": "donald trump", "sentiment": "none"}, {"name": "tim cook", "sentiment": "none"}], "locations": [{"name": "omaha", "sentiment": "none"}, {"name": "us", "sentiment": "none"}], "organizations": [{"name": "apple", "sentiment": "negative"}, {"name": "delta air lines inc.", "sentiment": "none"}, {"name": "southwest airlines co.", "sentiment": "none"}, {"name": "fed", "sentiment": "none"}, {"name": "cnbc", "sentiment": "none"}, {"name": "berkshire hathaway inc.", "sentiment": "none"}, {"name": "berkshire", "sentiment": "none"}, {"name": "bloomberg", "sentiment": "none"}, {"name": "monsanto co", "sentiment": "none"}, {"name": "apple inc.", "sentiment": "none"}, {"name": "berkshire hathaway", "sentiment": "none"}, {"name": "united continental holdings inc.", "sentiment": "none"}, {"name": "american airlines group inc.", "sentiment": "none"}]}, "highlightText": "", "language": "english", "persons": [], "text": "Warren Buffett, Oracle of Omaha, has bought 133 million Apple shares in 2017. Here’s why! Warren Buffett, Oracle of Omaha, has bought 133 million Apple shares in 2017. Here’s why! Warren Buffett also known as Oracle as Omaha on Monday told CNBC TV18 that he has bought 133 million Apple shares in 2017 because he likes the business. By: FE Online | Updated: February 27, 2017 5:25 PM “Tim Cook has been extremely intelligent about using the capital,” he added. \nWarren Buffett also known as Oracle as Omaha on Monday told CNBC TV18 that he has bought 133 million Apple shares in 2017 because he likes the business. Speaking with the news channel he further said, “Apple has a lot of technology but it is a consumer company”. “Tim Cook has been extremely intelligent about using the capital,” he added. Stating that Apple might pip Berkshire to a trillion dollar valuation, Buffett said continuity of the iPhone among consumers is ‘huge’. “I see kids sticking to the iPhone and upgrading to newer models”. \nWhen asked about markets, Buffett said, “I don’t know anyone who’s been able to time markets over the years. You never know what markets will do tomorrow, you generally know what markets will do 10-20 years from now”. “We are not in a bubble territory now,” he quipped. \nAccording to Bloomberg, Warren Buffett’s Berkshire Hathaway Inc. has sharply increased bets on airlines and iPhone maker Apple Inc. in the fourth quarter, while taking a stake in seed company Monsanto Co. Berkshire’s investments in American Airlines Group Inc., Delta Air Lines Inc. and United Continental Holdings Inc. climbed to more than $2 billion each, according to a regulatory filing from Buffett’s Omaha, Nebraska-based company. It also disclosed a stake in Southwest Airlines Co. valued at about $2.2 billion as of Dec. 31. \nThe billionaire investor recently used his annual letter to laud immigrants and their contribution to the growth of the US economy amid President Donald Trump’s anti-immigrant stance. “Americans have combined human ingenuity, a market system, a tide of talented and ambitious immigrants, and the rule of law to deliver abundance beyond any dreams of our forefathers,” he wrote in the letter to shareholders of his massive Berkshire Hathaway conglomerate. \nYou may also like to watch: \nMeanwhile, when asked about US, the world’s third wealthiest person said, “American dynamism has been my theme for decades. My stock purchases have nothing to do with the Fed or the US elections”. Talking about the US market rally he said, “Staying out of the game may be a terrible mistake”. Please Wait while comments are loading...", "external_links": [], "published": "2017-02-28T00:20:00.000+02:00", "crawled": "2017-02-27T14:08:17.916+02:00", "highlightTitle": ""}