{"organizations": [], "uuid": "b0ba497acd96d225d8e4beebcfb7d07558041b7a", "thread": {"social": {"gplus": {"shares": 2}, "pinterest": {"shares": 0}, "vk": {"shares": 0}, "linkedin": {"shares": 0}, "facebook": {"likes": 285, "shares": 285, "comments": 10}, "stumbledupon": {"shares": 0}}, "site_full": "www.usatoday.com", "main_image": "http://www.gannett-cdn.com/-mm-/e8ce761d9bf88c572c476c59db3b621d47ab7339/c=0-68-2000-1198&amp;r=x633&amp;c=1200x630/local/-/media/2017/02/10/USATODAY/USATODAY/636223277382972099-AP-Clippers-Knicks-Basketball.jpg", "site_section": "http://rssfeeds.htrnews.com/manitowoc/sports", "section_title": "GANNETT Syndication Service", "url": "http://www.usatoday.com/story/sports/nba/knicks/2017/02/10/new-york-knicks-security-chief-fired-charles-oakley-james-dolan/97746278/", "country": "US", "domain_rank": 313, "title": "Report: Knicks owner James Dolan fires MSG security chief after Charles Oakley incident", "performance_score": 2, "site": "usatoday.com", "participants_count": 1, "title_full": "Report: Knicks owner James Dolan fires MSG security chief after Charles Oakley incident", "spam_score": 0.0, "site_type": "news", "published": "2017-02-11T01:03:00.000+02:00", "replies_count": 0, "uuid": "b0ba497acd96d225d8e4beebcfb7d07558041b7a"}, "author": "USA TODAY", "url": "http://www.usatoday.com/story/sports/nba/knicks/2017/02/10/new-york-knicks-security-chief-fired-charles-oakley-james-dolan/97746278/", "ord_in_thread": 0, "title": "Report: Knicks owner James Dolan fires MSG security chief after Charles Oakley incident", "locations": [], "entities": {"persons": [{"name": "charles oakley", "sentiment": "neutral"}, {"name": "james dolan", "sentiment": "neutral"}, {"name": "barack obama", "sentiment": "none"}, {"name": "lamar odam", "sentiment": "none"}, {"name": "george w. bush", "sentiment": "none"}, {"name": "porter binks", "sentiment": "none"}, {"name": "anne ryan", "sentiment": "none"}, {"name": "kevin frayer", "sentiment": "none"}, {"name": "robert deutsch", "sentiment": "none"}, {"name": "sam cassell", "sentiment": "none"}, {"name": "benedetto", "sentiment": "none"}, {"name": "kevin larkin", "sentiment": "none"}, {"name": "jonathan supranowitz", "sentiment": "none"}, {"name": "fred jewell", "sentiment": "none"}, {"name": "isaac austin", "sentiment": "none"}, {"name": "gary grant", "sentiment": "none"}, {"name": "dale davis", "sentiment": "none"}, {"name": "dolan", "sentiment": "none"}, {"name": "bill kostroun", "sentiment": "none"}, {"name": "eileen blass", "sentiment": "none"}, {"name": "robert hanashiro", "sentiment": "none"}, {"name": "dennis rodman", "sentiment": "none"}, {"name": "dickey simpkins", "sentiment": "none"}, {"name": "frank franklin ii", "sentiment": "none"}, {"name": "michael jordan", "sentiment": "none"}, {"name": "oakley", "sentiment": "none"}, {"name": "mike conroy", "sentiment": "none"}, {"name": "steve kerr", "sentiment": "none"}, {"name": "tyrone hill", "sentiment": "none"}, {"name": "mike coppinger", "sentiment": "none"}, {"name": "patrick ewing", "sentiment": "none"}, {"name": "shawn bradley", "sentiment": "none"}, {"name": "adam nadel", "sentiment": "none"}, {"name": "jamal crawford", "sentiment": "none"}, {"name": "darius miles", "sentiment": "none"}, {"name": "frank benedetto", "sentiment": "none"}, {"name": "harvey grant", "sentiment": "none"}], "locations": [{"name": "new york", "sentiment": "none"}, {"name": "usa", "sentiment": "none"}, {"name": "washington", "sentiment": "none"}, {"name": "chicago", "sentiment": "none"}, {"name": "madison square garden", "sentiment": "none"}], "organizations": [{"name": "knicks", "sentiment": "neutral"}, {"name": "msg", "sentiment": "neutral"}, {"name": "facebook report", "sentiment": "none"}, {"name": "usat chicago bulls", "sentiment": "none"}, {"name": "u.s. secret service", "sentiment": "none"}, {"name": "toronto raptors", "sentiment": "none"}, {"name": "usa today knicks", "sentiment": "none"}, {"name": "usat bulls", "sentiment": "none"}, {"name": "philadelphia 76ers", "sentiment": "none"}, {"name": "new jersey nets", "sentiment": "none"}, {"name": "nba all-star", "sentiment": "none"}, {"name": "espn radio", "sentiment": "none"}, {"name": "new york knicks", "sentiment": "none"}, {"name": "nba", "sentiment": "none"}, {"name": "indiana pacers", "sentiment": "none"}, {"name": "rk knicks", "sentiment": "none"}, {"name": "chicago bulls", "sentiment": "none"}, {"name": "los angeles clippers", "sentiment": "none"}, {"name": "bulls", "sentiment": "none"}, {"name": "facebook", "sentiment": "none"}, {"name": "usa today sports former new york knicks", "sentiment": "none"}, {"name": "raptors", "sentiment": "none"}, {"name": "associated press new york knicks", "sentiment": "none"}, {"name": "associated press", "sentiment": "none"}, {"name": "usa today sports", "sentiment": "none"}, {"name": "usat", "sentiment": "none"}, {"name": "ap", "sentiment": "none"}, {"name": "usat new york knicks", "sentiment": "none"}, {"name": "twitter", "sentiment": "none"}]}, "highlightText": "", "language": "english", "persons": [], "text": "  Report: Knicks owner James Dolan fires MSG security chief after Charles Oakley incident The New York Knicks are mired in turmoil following an incident involving beloved former player Charles Oakley, and now, James Dolan is doing something to remedy the situation. Post to Facebook Report: Knicks owner James Dolan fires MSG security chief after Charles Oakley incident The New York Knicks are mired in turmoil following an incident involving beloved former player Charles Oakley, and now, James Dolan is doing something to remedy the situation.  //usat.ly/2kurVaf   8   Report: Knicks owner James Dolan fires MSG security chief after Charles Oakley incident Mike Coppinger , USA TODAY Published 12:55   2 hours ago CLOSE x Share Charles Oakley, the former Knicks great and frequent outspoken critic of team owner James Dolan, was involved in an ugly incident at Wednesday night's game and the Twitter response was immediate. USA TODAY Sports Former New York Knicks player Charles Oakley exchanges words with security guards during the Knicks game on Wednesday. (Photo: Frank Franklin II, AP) 173 CONNECT 8 COMMENT EMAIL MORE \nThe New York Knicks are mired in turmoil following an incident involving beloved former player Charles Oakley, and now, James Dolan is doing something to remedy the situation. \nThe owner of the Knicks and Madison Square Garden fired the arena's top security chief, Frank Benedetto, DNAInfo reported Friday . \nJonathan Supranowitz, the vice president of public relations for the Knicks, told USA TODAY Sports, \"We donâ€™t comment on employees leaving the company.\" \nOakley, the tough-as-nails big man who played 10 seasons in New York, got into a shoving match with security guards during the Knicks' loss to the Los Angeles Clippers on Wednesday. \nThe 53-year-old was escorted from the World's Most Famous Arena in handcuffs by the NYPD and he subsequently was charged with three counts of assault and one count of criminal trespass. \nOakley was accused of shouting unpleasantries Dolan's way, a charge the former NBA All-Star denied during a Thursday appearance on ESPN Radio. \n\"I'm (not going to) walk into a place and just start hollering out, 'James Dolan, James Dolan,'\" said Oakley, who has been at odds with Dolan for years. \"That's embarrassing, man. I did not do none of that. I didn't know (Dolan) was sitting in front of me at first until (the security guards) walked over there.\" Charles Oakley shares his side of story after arrest at Knicks game \nOakley was accused of shouting unpleasantries Dolan's way, a charge the former NBA All-Star denied. \nThe team called Oakley's remarks \"pure fiction\" and released a statement that drew the ire of Knicks fans everywhere with the line \"we hope he gets some help soon.\" \nBenedetto became security director after a career with the U.S. Secret Service, where he oversaw security for Presidents Barack Obama and George W. Bush. Facebook A link has been posted to your Facebook feed. 1994-95 file photo, the New York Knicks' Charles Oakley. NBA Charles Oakley of the New York Knicks during a game against the Washington Bullets. Porter Binks, USAT Bulls' Michael Jordan drives on Knicks' Charles Oakley. Robert Deutsch, USA TODAY Knicks' Charles Oakley jumps on the back of teammate Gary Grant. Robert Deutsch, USA TODAY Chicago's Dennis Rodman (91) gets ready to shoot. At left is New York's Patrick Ewing (33) and at right is New York's Charles Oakley. Anne Ryan, USA TODAY Knicks' Charles Oakley and Bulls' Steve Kerr fight for the ball in the 4th quarter. Robert Deutsch, USAT New York Knicks' Charles Oakley, right, looks up to see he is closely guarded by New Jersey Nets' Shawn Bradley. Bill Kostroun, AP Charles Oakley (34) goes to the basket against Harvey Grant (44). Porter Binks, USAT New York Knicks' Charles Oakley, left, and New Jersey Nets' Sam Cassell, right, look to see who has possession. Adam Nadel, Associated Press Charles Oakley (34) goes for the hoop against Isaac Austin (8). Kevin Larkin, Associated Press New York Knicks' Charles Oakley, left, reaches in on Indiana Pacers' Dale Davis. Mike Conroy, Associated Press Charles Oakley, right, goes over Chicago Bulls' Dickey Simpkins. Kevin Frayer, Associated Press Tyrone Hill and Charles Oakley battle for a rebound as the Philadelphia 76ers host the Toronto Raptors. Eileen Blass, USAT The Raptors' Charles Oakley fakes Lamar Odam and Darius Miles in the air. Robert Hanashiro, USAT Chicago Bulls' Jamal Crawford, left, and Charles Oakley chat as they wait for their picture session at the Bulls' media day. Fred Jewell, Associated Press Like this topic? You may also like these photo galleries: Replay", "external_links": [], "published": "2017-02-11T01:03:00.000+02:00", "crawled": "2017-02-10T21:58:41.526+02:00", "highlightTitle": ""}