{"organizations": [], "uuid": "b0b2e0dd714201e835872107757d4b98d349eaf4", "thread": {"social": {"gplus": {"shares": 3}, "pinterest": {"shares": 0}, "vk": {"shares": 0}, "linkedin": {"shares": 0}, "facebook": {"likes": 882, "shares": 882, "comments": 0}, "stumbledupon": {"shares": 0}}, "site_full": "www.chron.com", "main_image": "http://ww4.hdnux.com/photos/57/30/77/12423151/3/rawImage.jpg", "site_section": "http://www.chron.com/rss/feed/News-270.php\r", "section_title": "News", "url": "http://www.chron.com/news/houston-texas/texas/article/Police-Texas-vet-save-puppy-heroin-overdose-10948846.php", "country": "US", "domain_rank": 773, "title": "Police, Texas vet save puppy from heroin overdose, owners arrested", "performance_score": 8, "site": "chron.com", "participants_count": 1, "title_full": "Police, Texas vet save puppy from heroin overdose, owners arrested", "spam_score": 0.0, "site_type": "news", "published": "2017-02-22T04:15:00.000+02:00", "replies_count": 0, "uuid": "b0b2e0dd714201e835872107757d4b98d349eaf4"}, "author": "Heather Leighton, Houston Chronicle", "url": "http://www.chron.com/news/houston-texas/texas/article/Police-Texas-vet-save-puppy-heroin-overdose-10948846.php", "ord_in_thread": 0, "title": "Police, Texas vet save puppy from heroin overdose, owners arrested", "locations": [], "entities": {"persons": [{"name": "nina crawford", "sentiment": "none"}, {"name": "bird johnson", "sentiment": "none"}, {"name": "stacie fowler", "sentiment": "none"}, {"name": "thomas romero", "sentiment": "none"}, {"name": "leslloyd f. alleyne", "sentiment": "none"}, {"name": "willie nelson", "sentiment": "none"}, {"name": "fowler", "sentiment": "none"}], "locations": [{"name": "lone star state", "sentiment": "none"}, {"name": "texas", "sentiment": "none"}, {"name": "houston", "sentiment": "none"}, {"name": "dallas", "sentiment": "none"}, {"name": "carrollton", "sentiment": "none"}], "organizations": [{"name": "saint arnold", "sentiment": "none"}, {"name": "chron.com homepage click", "sentiment": "none"}, {"name": "carrollton animal control", "sentiment": "none"}, {"name": "carrollton police department", "sentiment": "none"}, {"name": "north texas emergency pet clinic", "sentiment": "none"}, {"name": "katherine via flickr police", "sentiment": "none"}, {"name": "home depot", "sentiment": "none"}, {"name": "mbo", "sentiment": "none"}]}, "highlightText": "", "language": "english", "persons": [], "text": "It's the Lone Star State. It's only natural that we love stars. 20) Star It's the Lone Star State. It's only natural that we love stars. Image 25 of 28 In honor of the Texas-born Lady Bird Johnson, of course. 21) Ladybird In honor of the Texas-born Lady Bird Johnson, of course. Image 26 of 28 Who, in Texas, doesn't love a little Willie Nelson? 22) Willie Who, in Texas, doesn't love a little Willie Nelson? Photo: Leslloyd F. Alleyne, MBO Image 27 of 28 Or any other major city name, for that matter. 23) Dallas Or any other major city name, for that matter. Photo: Katherine Via Flickr Police, Texas vet save puppy from heroin overdose, owners arrested 1 / 28 Back to Gallery \nMeet the Chihuahua mix that was lucky enough to be saved by a Texas police officer and veterinarian after suffering from a heroin overdose. \nAppropriately, the pooch was named \"Lucky.\" A Carrollton Police Department officer spotted the dog on the floorboard of a parked truck at a local Home Depot parking lot. The pooch was suffering from a heroin overdose while police say its humans were busy inside the home-improvement store switching price tags. \nHAPPY DOG STORY: Thanks to community, stray dog finds home with Saint Arnold co-founder \nLucky the puppy was taken by the police and the folks at the North Texas Emergency Pet Clinic in Carrollton were able to nurture the pup back to health. \nDr. Stacie Fowler (DVM) works at the clinic and told Chron.com the 4-month-old dog was nearly comatose and \"was pretty close to checking out.\" Through a series of medications administered to Lucky, he was able to recover from the overdose in 24 hours. An employee at the clinic told Chron.com that the pooch is now with Carrollton Animal Control, but they keep receiving calls for information about adopting the young dog. \nThinking of getting a new furry friend in the coming year? Stumped on a name? Here are the top male and female dog names of 2016 to make your decision easier! Media: WochIt Media \n\"He is adorable. He is a tiny little thing. probably only 4 months old and loves to give kisses and is wiggly and wags and is very, very sweet,\" Dr. Fowler told Chron.com. \"He's recovered from something that could have been fatal and thanks to the police staff and the staff here he was able to come out of it.\" \nHOMEGROWN TEXAN: Dog names that define what it means to be from Texas \nThe owners, on the other hand, weren't able to come out of the situation as luck as Lucky. Thomas Romero, 46, and Nina Crawford, 38, face charges of possession of a controlled substance/heroin and fraudulent destruction, removal or concealment of writing, according to the Star-Telegram . Latest from the Chron.com Homepage Click below for the top news from around the Houston area and beyond. Sign up for our newsletters to be the first to learn about breaking news and more. Go to 'Sign In' and 'Manage Profile' at the top of the page. Need to Know", "external_links": [], "published": "2017-02-22T04:15:00.000+02:00", "crawled": "2017-02-22T01:39:57.966+02:00", "highlightTitle": ""}