{"organizations": [], "uuid": "d2449fe82cd23d8a02e875b1a0a0ad32257b0bc2", "thread": {"social": {"gplus": {"shares": 1}, "pinterest": {"shares": 0}, "vk": {"shares": 0}, "linkedin": {"shares": 0}, "facebook": {"likes": 594, "shares": 594, "comments": 2}, "stumbledupon": {"shares": 0}}, "site_full": "www.freep.com", "main_image": "http://www.gannett-cdn.com/-mm-/0bf8b3b8d90d4cb01493886efec89be0a622623d/c=0-343-2448-1726&amp;r=x633&amp;c=1200x630/local/-/media/2017/02/11/DetroitFreePress/DetroitFreePress/636224349822898269-letter.jpg", "site_section": "http://rssfeeds.freep.com/freep/sports", "section_title": "GANNETT Syndication Service", "url": "http://www.freep.com/story/sports/mlb/tigers/2017/02/11/detroit-tigers-mike-ilitch/97802040/", "country": "US", "domain_rank": 2980, "title": "My 4-year-old self received a letter from Mike Ilitch", "performance_score": 5, "site": "freep.com", "participants_count": 1, "title_full": "My 4-year-old self received a letter from Mike Ilitch", "spam_score": 0.0, "site_type": "news", "published": "2017-02-12T11:29:00.000+02:00", "replies_count": 0, "uuid": "d2449fe82cd23d8a02e875b1a0a0ad32257b0bc2"}, "author": "Detroit Free Press", "url": "http://www.freep.com/story/sports/mlb/tigers/2017/02/11/detroit-tigers-mike-ilitch/97802040/", "ord_in_thread": 0, "title": "My 4-year-old self received a letter from Mike Ilitch", "locations": [], "entities": {"persons": [{"name": "mike ilitch", "sentiment": "neutral"}, {"name": "anthony fenech", "sentiment": "neutral"}, {"name": "julian h. gonzalez  fullscreen", "sentiment": "none"}, {"name": "marian illitch", "sentiment": "none"}, {"name": "marian", "sentiment": "none"}, {"name": "vyacheslav kozlov", "sentiment": "none"}, {"name": "patricia beck  mike ilitch", "sentiment": "none"}, {"name": "elaine cromie  mike ilitch", "sentiment": "none"}, {"name": "gabriel b. tait", "sentiment": "none"}, {"name": "julian h. gonzalez", "sentiment": "none"}, {"name": "mike", "sentiment": "none"}, {"name": "joe", "sentiment": "none"}, {"name": "fred press", "sentiment": "none"}, {"name": "john collier  fullscreen", "sentiment": "none"}, {"name": "jim lites", "sentiment": "none"}, {"name": "marian ilitch", "sentiment": "none"}, {"name": "scotty bowman", "sentiment": "none"}, {"name": "scotty bowman", "sentiment": "none"}, {"name": "marian", "sentiment": "none"}, {"name": "caesar", "sentiment": "none"}, {"name": "fox", "sentiment": "none"}, {"name": "little caesars mike ilitch", "sentiment": "none"}, {"name": "julian h. gonzalez  fullscreen", "sentiment": "none"}, {"name": "darren mccarty", "sentiment": "none"}, {"name": "caesars mike ilitch", "sentiment": "none"}, {"name": "woodward", "sentiment": "none"}, {"name": "ilitch", "sentiment": "none"}, {"name": "joe louis arena", "sentiment": "none"}, {"name": "bert emanuele  fullscreen", "sentiment": "none"}, {"name": "sergei fedorov", "sentiment": "none"}, {"name": "william archie  fullscreen", "sentiment": "none"}, {"name": "amy leang", "sentiment": "none"}, {"name": "steve yzerman", "sentiment": "none"}, {"name": "yzerman", "sentiment": "none"}, {"name": "julian h. gonzalez", "sentiment": "none"}, {"name": "john luke  fullscreen buy photo mike", "sentiment": "none"}, {"name": "stan baker", "sentiment": "none"}, {"name": "mike ilitch anthony fenech", "sentiment": "none"}, {"name": "denise", "sentiment": "none"}, {"name": "paul sancya", "sentiment": "none"}, {"name": "bruce norris", "sentiment": "none"}, {"name": "francisco kjolseth", "sentiment": "none"}, {"name": "coleman young", "sentiment": "none"}], "locations": [{"name": "washington", "sentiment": "none"}, {"name": "quantico", "sentiment": "none"}, {"name": "hart plaza", "sentiment": "none"}, {"name": "joe louis arena", "sentiment": "none"}, {"name": "bloomfield township", "sentiment": "none"}, {"name": "d.c.", "sentiment": "none"}, {"name": "great hall", "sentiment": "none"}, {"name": "toronto", "sentiment": "none"}, {"name": "detroit", "sentiment": "none"}, {"name": "montreal", "sentiment": "none"}, {"name": "new york", "sentiment": "none"}, {"name": "garden city", "sentiment": "none"}, {"name": "va", "sentiment": "none"}, {"name": "fox theater", "sentiment": "none"}, {"name": "michigan sports hall of fame", "sentiment": "none"}, {"name": "detroit", "sentiment": "none"}], "organizations": [{"name": "mike ilitch free press", "sentiment": "neutral"}, {"name": "red wings", "sentiment": "none"}, {"name": "nhl", "sentiment": "none"}, {"name": "wings", "sentiment": "none"}, {"name": "detroit red wings", "sentiment": "none"}, {"name": "marines", "sentiment": "none"}, {"name": "tigers", "sentiment": "none"}, {"name": "facebook", "sentiment": "none"}, {"name": "buy photo newest detroit red wing brett hull", "sentiment": "none"}, {"name": "detroit free press", "sentiment": "none"}, {"name": "chicago blackhawks", "sentiment": "none"}, {"name": "norris", "sentiment": "none"}, {"name": "courtesy detroit red wings", "sentiment": "none"}, {"name": "little caesars pizza", "sentiment": "none"}, {"name": "buy photo detroit red wings", "sentiment": "none"}, {"name": "eric", "sentiment": "none"}, {"name": "post", "sentiment": "none"}, {"name": "patricia beck  detroit tigers", "sentiment": "none"}, {"name": "detroit tigers", "sentiment": "none"}, {"name": "le cirque", "sentiment": "none"}, {"name": "lee  detroit red wings", "sentiment": "none"}, {"name": "fox theater", "sentiment": "none"}, {"name": "kirthmon f dozier  detroit red wings", "sentiment": "none"}, {"name": "hockey hall of fame", "sentiment": "none"}]}, "highlightText": "", "language": "english", "persons": [], "text": "  My 4-year-old self received a letter from Mike Ilitch Free Press sports writer Anthony Fenech on the letter he wrote to Mike Ilitch and the reply he received Post to Facebook My 4-year-old self received a letter from Mike Ilitch Free Press sports writer Anthony Fenech on the letter he wrote to Mike Ilitch and the reply he received  //on.freep.com/2ky5Ojs   Join the Conversation   My 4-year-old self received a letter from Mike Ilitch Anthony Fenech   11:29   Facebook A link has been posted to your Facebook feed. Buy Photo Mike and Marian Ilitch hoist the Stanley Cup on June 16, 1998 in Washington, D.C. after the Red Wings won their second consecutive NHL title by sweeping the Capitals. Vyacheslav Kozlov is at left. Julian H. Gonzalez, DFP Fullscreen Buy Photo Mike Ilitch is remembered on the marquee of the Fox Theater on Friday, Feb. 10, 2017 in downtown Detroit. Elaine Cromie  Mike Ilitch holds up his new uniform when he took the field as Tiger Stadium as the team's new owner. Fred Press archives The Mike Ilitch family after the purchase of the Detroit Red Wings in June of 1982. PATRICIA BECK  Detroit Tigers owners Mike and Marian Ilitch take the field at Tiger Stadium. Free Press archives Fullscreen Buy Photo Mike Ilitch, owner of the Fox Theater, is photographed in the lobby of the Fox on July 9, 1987. JOHN COLLIER  Fullscreen Buy Photo In Nov. 2003, Detroit Red Wings owner Mike Ilitch shows off his Hockey Hall of Fame ring in the Great Hall with the original Stanley Cup in the background in Toronto. Kirthmon F Dozier  Fullscreen Buy Photo In 2003, Mike Ilitch took photos with his wife Marian and the family after he was inducted into the Hockey Hall of Fame in Toronto. Kirthmon F Dozier  Detroit Red Wings and Detroit Tigers owner Mike Ilitch smiles with his wife Marian, during induction ceremonies for the Michigan Sports Hall of Fame in Detroit, Tuesday, March 30, 2004. PAUL SANCYA, AP THE FIRST LITTLE CAESARS STORE Mike and Marian Ilitch invested their $10,000 life savings to open the first Little Caesars store in Garden City in 1959. Little Caesars Little Caesar's owner Mike Ilitch with trophies won by teams he sponsors circa 1976. Little Caesars Mike Ilitch in uniform as a player for the Marines' team from Quantico, VA. Ilitch also played for the Tigers' farm system in the 1950s. Handout Fullscreen Buy Photo In 1977, Mike Ilitch, whose Caesars professional softball team doesn't figure to make money this year, but which Ilitch insists can be a paying proposition in the future. SCOTT ECCKER  In 1980, Little Caesars Mike Ilitch is photographed with his pizza. RICHARD LEE  Detroit Red Wings new owner Mike Ilitch is presented a team jacket rom former owner Bruce Norris. Ilitch bought the team from Norris in 1982. Handout A young Steve Yzerman and Wings owner Mike Ilitch shake hands in a 1983 photo from Yzerman's rookie year with the Red Wings. Courtesy Detroit Red Wings Mike Ilitch at Joe Louis Arena in 1992. Detroit Free Press Fullscreen Buy Photo MARIAN AND MIKE ILITCH, owners of Little Caesars izza restaurants, sample the main dish at the opening of their 1,000th store Tuesday in Bloomfield Township in March of 1986.. WILLIAM ARCHIE  Fullscreen Buy Photo In 1985, Detroit Mayor Coleman Young eats a slice of pizza at a fundraiser for the hungry in Detroit. It was sponsored by Little Caesars Pizza, owned by Mike Ilitch. Detroit Free Press Fullscreen Buy Photo Marian and Mike Ilitch are entertained by Stan Baker of le Cirque, a New York theatrical troupe at a Diabetes fundraiser held in October of 1988. BERT EMANUELE  Fullscreen Buy Photo Owner Mike Ilitch's team includes his daughter Denise, the general counsel, his son in law, Jim Lites, the executive vice president, and his wife, Marian, secretary-treasurer. Picture taken in 1988 at the Joe. Patricia Beck  Mike Ilitch speaks about his acquisition of baseball's Detroit Tigers. John Luke  Fullscreen Buy Photo Mike and Marian Illitch with Sergei Fedorov in the lockerroom with the trophy they won for winning the Western Conference Finals in the fifth game against the Chicago Blackhawks at Joe Louis Arena in 1995. JULIAN H. GONZALEZ  Fullscreen Buy Photo STANLEY CUP--RED WINGS OWNER MIKE ILITCH hugs coach SCOTTY BOWMAN after their Stanley Cup win over the Flyers Saturday night at Joe Louis Arena in 1997. JULIAN H. GONZALEZ, DETROIT FREE PRESS Fullscreen Buy Photo In 2002, Wings coach Scotty Bowman hugs Mike Ilitch at end of game when they won the Stanley Cup. Julian H. Gonzalez  Fullscreen Buy Photo Detroit Red Wings owner Mike Ilitch gives the thumbs up to crowds during the Stanley Cup victory celebration at Hart Plaza in Detroit on June 6, 2008. AMY LEANG, DETROIT FREE PRESS Fullscreen Buy Photo Red Wings Owner Mike Ilitch watchs his Wings play Montreal near the end of the 1994 regular season. JULIAN H. GONZALEZ  Fullscreen Buy Photo In 2008, Mike and Marian Ilitch share a quiet moment along near the ice before they and the team gather for a team picture. ERIC SEALS  Fullscreen Buy Photo MIke Ilitch takes a look at Darren McCarty 40 stiches required to fix his face during a game in 1999. William Archie  Fullscreen Buy Photo Newest Detroit Red Wing BRETT HULL is handed his new jersey by Wings' owner MIKE ILITCH during the formal press conference when he was introduced in 2001. Julian H. Gonzalez  Fullscreen Buy Photo In 1997, Mike Ilitch shakes hands with the parade goers down Woodward Ave. after winning the Stanley Cup. Francisco Kjolseth, DETROIT FREE PRESS Fullscreen Buy Photo In 1998, Detroit Red Wings owner Mike Ilitch during the Detroit Red Wings Stanly Cup parade in Detroit. The Wings swept the Washington Capitals in 4 games. Gabriel B. Tait ", "external_links": [], "published": "2017-02-12T11:29:00.000+02:00", "crawled": "2017-02-12T06:53:51.002+02:00", "highlightTitle": ""}