{"organizations": [], "uuid": "8af5a80f8131b6c9fb39cbf51a284f5270ed16e0", "thread": {"social": {"gplus": {"shares": 0}, "pinterest": {"shares": 0}, "vk": {"shares": 0}, "linkedin": {"shares": 1}, "facebook": {"likes": 583, "shares": 583, "comments": 0}, "stumbledupon": {"shares": 0}}, "site_full": "www.telegraph.co.uk", "main_image": "http://www.telegraph.co.uk/content/dam/Travel/hotels/europe/united-kingdom/Hotels%20-%20England/yorkshire/star-inn-yorkshire-p-xlarge.jpg", "site_section": "http://www.telegraph.co.uk/travel/artsandculture/rss", "section_title": "Travel", "url": "http://www.telegraph.co.uk/travel/destinations/europe/united-kingdom/england/articles/the-best-old-english-inns/", "country": "GB", "domain_rank": 317, "title": "Top 10: the best English inns for overnight stays", "performance_score": 5, "site": "telegraph.co.uk", "participants_count": 1, "title_full": "Top 10: the best English inns for overnight stays", "spam_score": 0.0, "site_type": "news", "published": "2017-02-14T21:59:00.000+02:00", "replies_count": 0, "uuid": "8af5a80f8131b6c9fb39cbf51a284f5270ed16e0"}, "author": "Telegraph Travel experts", "url": "http://www.telegraph.co.uk/travel/destinations/europe/united-kingdom/england/articles/the-best-old-english-inns/", "ord_in_thread": 0, "title": "Top 10: the best English inns for overnight stays", "locations": [], "entities": {"persons": [{"name": "helmsley", "sentiment": "positive"}, {"name": "dwight eisenhower", "sentiment": "none"}, {"name": "winston churchill", "sentiment": "none"}, {"name": "jacobs", "sentiment": "none"}, {"name": "greta garbo", "sentiment": "none"}, {"name": "baron john lovelace", "sentiment": "none"}, {"name": "james ii", "sentiment": "none"}, {"name": "elizabeth taylor", "sentiment": "none"}, {"name": "wight", "sentiment": "none"}], "locations": [{"name": "britain", "sentiment": "none"}, {"name": "surrey", "sentiment": "none"}, {"name": "cotswolds", "sentiment": "none"}, {"name": "yorkshire", "sentiment": "none"}, {"name": "england", "sentiment": "none"}, {"name": "lake district", "sentiment": "none"}, {"name": "lancashire", "sentiment": "none"}], "organizations": [{"name": "pinewood studios", "sentiment": "none"}, {"name": "malt house", "sentiment": "none"}, {"name": "telegraph travel", "sentiment": "none"}, {"name": "telegraph", "sentiment": "none"}, {"name": "berkshire", "sentiment": "none"}]}, "highlightText": "", "language": "english", "persons": [], "text": "Top 10: the best English inns for overnight stays Most guests check into Helmsley's 14th-century Star Inn for the Michelin-starred restaurant. Telegraph Travel experts 14 February 2017 • 2:59pm \nS herelle Jacobs introduces Telegraph Travel's guide to the best old English inns – for Michelin-starred dining, historic architecture, creaking corridors and resident ghosts. Expect the country's finest craft ales, rousing bucolic views, country walks on the doorstep, and four-poster beds, exposed beams and rolltop baths – in the Cotswolds, Berkshire, Lancashire, Surrey, Yorkshire, Helmsley, the Lake District and the Isle of Wight. Berkshire, England 9 Telegraph expert rating This is one of the oldest hotels in Britain – founded in 1135 – so expect inglenook fireplaces and sloping floors aplenty. Ask to see the secret tunnel that leads to the village priory; Baron John Lovelace used it to hide from the authorities when he was involved in the 1688 Glorious Revolution to overthrow King James II. Winston Churchill also met with President Dwight Eisenhower here to discuss wartime strategy, and proximity to Pinewood Studios has attracted Greta Garbo and Elizabeth Taylor as guests in the past. Opt for the rooms in the Main Inn and Malt House for character in shape of wonky beams and clawfoot baths. The inn hosts a 'destination' pub restaurant, with bread baked on site and greens from the vegetable patch. There are also six acres of lovely gardens to explore. Read expert review From £ 53 per night", "external_links": [], "published": "2017-02-14T21:59:00.000+02:00", "crawled": "2017-02-14T17:24:54.164+02:00", "highlightTitle": ""}