{"organizations": [], "uuid": "df33a40c44b0c418a1e11f4a4a04cc3438719020", "thread": {"social": {"gplus": {"shares": 0}, "pinterest": {"shares": 0}, "vk": {"shares": 0}, "linkedin": {"shares": 0}, "facebook": {"likes": 115, "shares": 115, "comments": 1}, "stumbledupon": {"shares": 0}}, "site_full": "ftw.usatoday.com", "main_image": "http://www.gannett-cdn.com/-mm-/029209d2a4355faf2c253ddc0e48da4e3c38b8d2/c=0-10-2116-1205&amp;r=x633&amp;c=1200x630/local/-/media/2017/02/24/USATODAY/USATODAY/636235202137976002-AP-CLIPPERS-WARRIORS-BASKETBALL-89020477.JPG", "site_section": "http://rssfeeds.usatoday.com/_/20/109752670/all-nationnow", "section_title": "GANNETT Syndication Service", "url": "http://ftw.usatoday.com/2017/02/golden-state-warriors-draymond-green-kick-kicking-blake-griffin-clippers-video", "country": "US", "domain_rank": 313, "title": "Did Draymond deliberately kick an opponent again?", "performance_score": 1, "site": "usatoday.com", "participants_count": 1, "title_full": "Did Draymond deliberately kick an opponent again?", "spam_score": 0.0, "site_type": "news", "published": "2017-02-24T20:04:00.000+02:00", "replies_count": 0, "uuid": "df33a40c44b0c418a1e11f4a4a04cc3438719020"}, "author": "USA TODAY", "url": "http://ftw.usatoday.com/2017/02/golden-state-warriors-draymond-green-kick-kicking-blake-griffin-clippers-video", "ord_in_thread": 0, "title": "Did Draymond deliberately kick an opponent again?", "locations": [], "entities": {"persons": [{"name": "draymond", "sentiment": "neutral"}, {"name": "blake griffin", "sentiment": "none"}, {"name": "raymond felton", "sentiment": "none"}, {"name": "charles curtis", "sentiment": "none"}, {"name": "ben margot", "sentiment": "none"}, {"name": "paul pierce", "sentiment": "none"}, {"name": "stephen curry", "sentiment": "none"}], "locations": [{"name": "calif.", "sentiment": "none"}, {"name": "usa", "sentiment": "none"}, {"name": "oakland", "sentiment": "none"}], "organizations": [{"name": "facebook", "sentiment": "neutral"}, {"name": "nba", "sentiment": "none"}, {"name": "los angeles clippers", "sentiment": "none"}, {"name": "ap", "sentiment": "none"}, {"name": "golden state warriors", "sentiment": "none"}]}, "highlightText": "", "language": "english", "persons": [], "text": "  Did Draymond deliberately kick an opponent again? Here we go again. Post to Facebook Did Draymond deliberately kick an opponent again? Here we go again.  //ftw.usatoday.com/2017/02/golden-state-warriors-draymond-green-kick-kicking-blake-griffin-clippers-video   Did Draymond deliberately kick an opponent again? Charles Curtis , USA TODAY 8:04 a.m. ET Feb. 24, 2017 \nLos Angeles Clippers' Raymond Felton (2) and Blake Griffin (32) fight for the ball with Golden State Warriors' Draymond Green as Stephen Curry (30) watches during the first half of an NBA basketball game Thursday, Feb. 23, 2017, in Oakland, Calif. (AP Photo/Ben Margot) ORG XMIT: OAS101 (Photo: Ben Margot, AP) \nWhat a night for Draymond Green. \nOn Thursday, he made some stat-sheet contributions to the Golden State Warriors in their win over the Los Angeles Clippers, he talked some serious trash to Clips vet Paul Pierce and, oh yeah, everyone's now speculating that, yet again, he may have kicked an opponent . \nLet's go to the videotape as he went down to the floor to wrestle with Blake Griffin for a loose ball. Draymond showing off his latest kick skill set ðŸ˜‚ pic.twitter.com/tzKpzETwCf", "external_links": [], "published": "2017-02-24T20:04:00.000+02:00", "crawled": "2017-02-24T15:15:14.061+02:00", "highlightTitle": ""}