{"organizations": [], "uuid": "255302beab903b95250ed096b7c42be398039605", "thread": {"social": {"gplus": {"shares": 0}, "pinterest": {"shares": 2}, "vk": {"shares": 0}, "linkedin": {"shares": 0}, "facebook": {"likes": 578, "shares": 578, "comments": 0}, "stumbledupon": {"shares": 0}}, "site_full": "www.freep.com", "main_image": "http://www.gannett-cdn.com/-mm-/52917a43eee3d1e0e2549bfac20a96174ceb708d/c=0-132-1640-1059&amp;r=x633&amp;c=1200x630/local/-/media/2017/02/20/DetroitFreePress/DetroitFreePress/636232035039370364-tigers-020217-kd-51.jpg", "site_section": "http://rssfeeds.freep.com/freep/home", "section_title": "GANNETT Syndication Service", "url": "http://www.freep.com/story/sports/columnists/jeff-seidel/2017/02/21/detroit-tigers-grayson-greiner/98210634/", "country": "US", "domain_rank": 2980, "title": "Meet the Detroit Tiger: Grayson Greiner", "performance_score": 5, "site": "freep.com", "participants_count": 1, "title_full": "Meet the Detroit Tiger: Grayson Greiner", "spam_score": 0.0, "site_type": "news", "published": "2017-02-22T05:06:00.000+02:00", "replies_count": 0, "uuid": "255302beab903b95250ed096b7c42be398039605"}, "author": "Detroit Free Press Columnist", "url": "http://www.freep.com/story/sports/columnists/jeff-seidel/2017/02/21/detroit-tigers-grayson-greiner/98210634/", "ord_in_thread": 0, "title": "Meet the Detroit Tiger: Grayson Greiner", "locations": [], "entities": {"persons": [{"name": "grayson greiner", "sentiment": "negative"}, {"name": "chad bell", "sentiment": "none"}, {"name": "brad ausmus", "sentiment": "none"}, {"name": "steven moya", "sentiment": "none"}, {"name": "kirthmon f. dozier dfp alan trammell", "sentiment": "none"}, {"name": "tiger kirk gibson", "sentiment": "none"}, {"name": "grayson greiner jeff seidel", "sentiment": "none"}, {"name": "michael fulmer", "sentiment": "none"}, {"name": "mikie mahtook", "sentiment": "none"}, {"name": "j.d. martinez", "sentiment": "none"}, {"name": "ian kinsler", "sentiment": "none"}, {"name": "nick castellanos", "sentiment": "none"}, {"name": "omar vizquel", "sentiment": "none"}, {"name": "jacoby jones", "sentiment": "none"}, {"name": "victor martinez", "sentiment": "none"}, {"name": "joe jimenez", "sentiment": "none"}, {"name": "rich dubee", "sentiment": "none"}, {"name": "al kaline", "sentiment": "none"}, {"name": "kirthmon f. dozier", "sentiment": "none"}, {"name": "justin upton", "sentiment": "none"}, {"name": "jordan zimmermann", "sentiment": "none"}, {"name": "andrew romine", "sentiment": "none"}, {"name": "drew verhagen", "sentiment": "none"}, {"name": "justin verlander", "sentiment": "none"}, {"name": "anibal sanchez", "sentiment": "none"}, {"name": "miguel cabrera", "sentiment": "none"}, {"name": "michael fulemer", "sentiment": "none"}, {"name": "miguel gonzalez", "sentiment": "none"}, {"name": "daniel norris", "sentiment": "none"}, {"name": "anthony gose", "sentiment": "none"}], "locations": [{"name": "fla", "sentiment": "none"}, {"name": "lakeland", "sentiment": "none"}], "organizations": [{"name": "grayson greiner detroit tigers", "sentiment": "negative"}, {"name": "team usa", "sentiment": "none"}, {"name": "detroit free press former tigers", "sentiment": "none"}, {"name": "facebook", "sentiment": "none"}, {"name": "tigers", "sentiment": "none"}, {"name": "detroit free press", "sentiment": "none"}, {"name": "detroit free press tigers", "sentiment": "none"}, {"name": "detroit tigers", "sentiment": "none"}, {"name": "detroit free press the detroit tigers", "sentiment": "none"}, {"name": "dfp pitching", "sentiment": "none"}, {"name": "facebook meet the detroit tiger", "sentiment": "none"}, {"name": "detroit free press detroit tigers", "sentiment": "none"}, {"name": "dfp tigers", "sentiment": "none"}]}, "highlightText": "", "language": "english", "persons": [], "text": "  Meet the Detroit Tiger: Grayson Greiner Detroit Tigers catcher prospect Grayson Greiner busted his finger in his first big-league camp. Post to Facebook Meet the Detroit Tiger: Grayson Greiner Detroit Tigers catcher prospect Grayson Greiner busted his finger in his first big-league camp.   Freep.com: http://on.freep.com/2m5lM9e   Join the Conversation   Meet the Detroit Tiger: Grayson Greiner Jeff Seidel , Detroit Free Press Columnist Published 3:55 p.m. ET Feb. 21, 2017 | Updated 58 minutes ago Facebook Posted! A link has been posted to your Facebook feed. Detroit Tigers outfielder Mikie Mahtook takes part in drills during spring training Monday, Feb. 20, 2017, in Lakeland, Fla. Kirthmon F. Dozier, Detroit Free Press Detroit Tigers infielder Nick Castellanos stretches during spring training Monday, Feb. 20, 2017, in Lakeland, Fla. Kirthmon F. Dozier, Detroit Free Press Detroit Tigers infielder Ian Kinsler stretches during spring training Monday, Feb. 20, 2017, in Lakeland, Fla. Kirthmon F. Dozier, Detroit Free Press Detroit Tigers infielder Miguel Cabrera stretches during spring training Monday, Feb. 20, 2017, in Lakeland, Fla. Kirthmon F. Dozier, Detroit Free Press Detroit Tigers outfielder J.D. Martinez stretches during spring training Monday, Feb. 20, 2017, in Lakeland, Fla. Kirthmon F. Dozier, Detroit Free Press The Detroit Tigers' Victor Martinez stretches during spring training Monday, Feb. 20, 2017, in Lakeland, Fla. Kirthmon F. Dozier, Detroit Free Press Detroit Tigers catcher Grayson Greiner listens to coaches during spring training Monday, Feb. 20, 2017, in Lakeland, Fla. Kirthmon F. Dozier, Detroit Free Press Detroit Tigers outfielder Steven Moya takes part in drills during spring training Monday, Feb. 20, 2017, in Lakeland, Fla. Kirthmon F. Dozier, Detroit Free Press Detroit Tigers outfielder Anthony Gose takes part in drills during spring training Monday, Feb. 20, 2017, in Lakeland, Fla. Kirthmon F. Dozier, Detroit Free Press Detroit Tigers outfielder Anthony Gose takes part in drills during spring training Monday, Feb. 20, 2017, in Lakeland, Fla. Kirthmon F. Dozier, Detroit Free Press Detroit Tigers outfielder Mikie Mahtook takes part in drills during spring training Monday, Feb. 20, 2017, in Lakeland, Fla. Kirthmon F. Dozier, Detroit Free Press Former Tiger Al Kaline works with outfielders during spring training Monday, Feb. 20, 2017, in Lakeland, Fla. Kirthmon F. Dozier, Detroit Free Press Detroit Tigers outfielder Justin Upton takes part in drills during spring training Monday, Feb. 20, 2017, in Lakeland, Fla. Kirthmon F. Dozier, Detroit Free Press Detroit Tigers outfielder Steven Moya takes part in drills during spring training Monday, Feb. 20, 2017, in Lakeland, Fla. Kirthmon F. Dozier, Detroit Free Press Detroit Tigers outfielder Jacoby Jones goes through drills during spring training Monday, Feb. 20, 2017, in Lakeland, Fla. Kirthmon F. Dozier, Detroit Free Press Detroit Tigers outfielder J.D. Martinez takes part in drills during spring training Monday, Feb. 20, 2017, in Lakeland, Fla. Kirthmon F. Dozier, Detroit Free Press Detroit Tigers outfielder Justin Upton takes part in drills during spring training Monday, Feb. 20, 2017, in Lakeland, Fla. Kirthmon F. Dozier, Detroit Free Press Former Tiger star Al Kaline works with outfielders during spring training Monday, Feb. 20, 2017, in Lakeland, Fla. Kirthmon F. Dozier, Detroit Free Press Former Tigers great Al Kaline, right, works with outfielders during spring training Monday, Feb. 20, 2017, in Lakeland, Fla. Kirthmon F. Dozier, Detroit Free Press Detroit Tigers outfielder Jacoby Jones goes through drills during spring training Monday, Feb. 20, 2017, in Lakeland, Fla. Kirthmon F. Dozier, Detroit Free Press Detroit Tigers outfielder Steven Moya takes part in drills during spring training Monday, Feb. 20, 2017, in Lakeland, Fla. Kirthmon F. Dozier, Detroit Free Press Detroit Tigers outfielder Steven Moya takes part in drills during spring training Monday, Feb. 20, 2017, in Lakeland, Fla. Kirthmon F. Dozier, Detroit Free Press Detroit Tigers outfielder J.D. Martinez takes part in drills during spring training Monday, Feb. 20, 2017, in Lakeland, Fla. Kirthmon F. Dozier, Detroit Free Press Detroit Tigers pitcher Chad Bell throws during spring training Monday, Feb. 20, 2017, in Lakeland, Fla. Kirthmon F. Dozier, Detroit Free Press Detroit Tigers pitcher Chad Bell throws during spring training Monday, Feb. 20, 2017, in Lakeland, Fla. Kirthmon F. Dozier, Detroit Free Press Detroit Tigers pitcher Daniel Norris throws during spring training Monday, Feb. 20, 2017, in Lakeland, Fla. Kirthmon F. Dozier, Detroit Free Press Detroit Tigers pitcher Drew Verhagen throws during spring training Monday, Feb. 20, 2017, in Lakeland, Fla. Kirthmon F. Dozier, Detroit Free Press Detroit Tigers pitcher Drew Verhagen throws during spring training Monday, Feb. 20, 2017, in Lakeland, Fla. Kirthmon F. Dozier, Detroit Free Press Detroit Tigers outfielder Steven Moya takes part in drills during spring training Monday, Feb. 20, 2017, in Lakeland, Fla. Kirthmon F. Dozier, Detroit Free Press Detroit Tigers pitcher Joe Jimenez throws during spring training Monday, Feb. 20, 2017, in Lakeland, Fla. Kirthmon F. Dozier, Detroit Free Press Detroit Tigers pitcher Joe Jimenez throws during spring training Monday, Feb. 20, 2017, in Lakeland, Fla. Kirthmon F. Dozier, Detroit Free Press Detroit Tigers infielder Nick Castellanos takes a break during spring training Monday, Feb. 20, 2017, in Lakeland, Fla. Kirthmon F. Dozier, Detroit Free Press Detroit Tigers Victor Martinez, left, and Ian Kinsler talk during spring training Monday, Feb. 20, 2017, in Lakeland, Fla. Kirthmon F. Dozier, Detroit Free Press Detroit Tigers designated hitter Victor Martinez waits to hit during spring training Monday, Feb. 20, 2017, in Lakeland, Fla. Kirthmon F. Dozier, Detroit Free Press Detroit Tigers catcher Grayson Greiner waits to catch batting practice during spring training Monday, Feb. 20, 2017, in Lakeland, Fla. Kirthmon F. Dozier, Detroit Free Press Detroit Tigers designated hitter Victor Martinez, center, and manager Brad Ausmus, right, talk to pitcher Joe Jimenez during spring training Monday, Feb. 20, 2017, in Lakeland, Fla. Kirthmon F. Dozier, Detroit Free Press Tigers pitcher Justin Verlander talks with catcher Miguel Gonzalez, first baseman Miguel Cabrera and rightfielder J.D. Martinez after throwing live batting practice during a workout in spring training on Feb. 19, 2017, in Lakeland, Fla. Kirthmon F. Dozier DFP Tigers outfielder Steven Moya goes through a foul ball drill during a workout in spring training on Feb. 19, 2017, in Lakeland, Fla. Kirthmon F. Dozier DFP Tigers pitcher Jordan Zimmermann pitches batting practice during a workout in spring training on Feb. 19, 2017, in Lakeland, Fla. Kirthmon F. Dozier DFP Tigers outfielder J.D. Martinez takes batting practice during a workout in spring training on Feb. 19, 2017, in Lakeland, Fla. Kirthmon F. Dozier DFP Tigers pitcher Justin Verlander talks with leftfielder Justin Upton after throwing live batting practice during a workout in spring training on Feb. 19, 2017, in Lakeland, Fla. Kirthmon F. Dozier DFP Tigers pitcher Justin Verlander signs autographs after a workout in spring training on Feb. 19, 2017, in Lakeland, Fla. Kirthmon F. Dozier DFP Tigers pitcher Justin Verlander signs autographs after a workout in spring training on Feb. 19, 2017, in Lakeland, Fla. Kirthmon F. Dozier DFP Tigers infielder Miguel Cabrera takes batting practice during a workout in spring training on Feb. 19, 2017, in Lakeland, Fla. Kirthmon F. Dozier DFP Tigers pitcher Justin Verlander goes through a foul ball drill during a workout in spring training on Feb. 19, 2017, in Lakeland, Fla. Kirthmon F. Dozier DFP Tigers pitcher Justin Verlander goes through a foul ball drill during a workout in spring training on Feb. 19, 2017, in Lakeland, Fla. Kirthmon F. Dozier DFP Tigers first baseman Miguel Cabrera during a workout in spring training on Feb. 19, 2017, in Lakeland, Fla. Kirthmon F. Dozier DFP Tigers infielder Ian Kinsler during a workout in spring training on Feb. 19, 2017, in Lakeland, Fla. Kirthmon F. Dozier DFP Tigers pitcher Michael Fulmer throws during a workout in spring training on Feb. 19, 2017, in Lakeland, Fla. Kirthmon F. Dozier DFP Tigers pitcher Michael Fulmer throws during a workout in spring training on Feb. 19, 2017, in Lakeland, Fla. Kirthmon F. Dozier DFP Tigers pitcher Jordan Zimmermann throws during a workout in spring training on Feb. 19, 2017, in Lakeland, Fla. Kirthmon F. Dozier DFP Tigers pitcher Justin Verlander throws during a workout in spring training on Feb. 19, 2017, in Lakeland, Fla. Kirthmon F. Dozier DFP Tigers pitcher Justin Verlander throws during a workout in spring training on Feb. 19, 2017, in Lakeland, Fla. Kirthmon F. Dozier DFP Pitching coach Rich Dubee watches Tigers pitcher Justin Verlander throw during a workout in spring training on Feb. 19, 2017, in Lakeland, Fla. Kirthmon F. Dozier DFP Tigers pitcher Anibal Sanchez throws during a workout in spring training on Feb. 19, 2017, in Lakeland, Fla. Kirthmon F. Dozier DFP Tigers outfielder Anthony Gose watches drills during a workout in spring training on Feb. 19, 2017, in Lakeland, Fla. Kirthmon F. Dozier DFP Former Tiger Kirk Gibson talks with outfielder Anthony Gose during a workout in spring training on Feb. 19, 2017, in Lakeland, Fla. Kirthmon F. Dozier DFP Alan Trammell talks with Tigers outfielder Mikie Mahtook during a workout in spring training on Feb. 19, 2017, in Lakeland, Fla. Kirthmon F. Dozier DFP Former Tiger Kirk Gibson worked with players during a workout in spring training on Feb. 19, 2017, in Lakeland, Fla. Kirthmon F. Dozier DFP Tigers manager Brad Ausmus pitches batting practice during a workout in spring training on Feb. 19, 2017, in Lakeland, Fla. Kirthmon F. Dozier DFP The Tigers players arrive for picture day during in spring training on Feb. 19, 2017, in Lakeland, Fla. Kirthmon F. Dozier DFP Tigers first base coach Omar Vizquel tries on his Team Venezuela hat during picture day during in spring training on Feb. 19, 2017, in Lakeland, Fla. Kirthmon F. Dozier DFP Tigers pitcher Michael Fulemer signs baseballs during picture day during in spring training on Feb. 19, 2017, in Lakeland, Fla. Kirthmon F. Dozier DFP Tigers infielder Nick Castellanos is photographed during picture day during in spring training on Feb. 19, 2017, in Lakeland, Fla. Kirthmon F. Dozier DFP Tigers infielder Ian Kinsler with his Team USA hat during picture day during in spring training on Feb. 19, 2017, in Lakeland, Fla. Kirthmon F. Dozier DFP Tigers outfielder Miguel Cabrera signs baseballs during picture day during in spring training on Feb. 19, 2017, in Lakeland, Fla. Kirthmon F. Dozier DFP Tigers Ian Kinsler and Justin Upton wait to be photographed as Andrew Romine has his turn during picture day during in spring training on Feb. 19, 2017, in Lakeland, Fla. Kirthmon F. Dozier DFP Tigers infielder Miguel Cabrera waits to be photographed during picture day during in spring training on Feb. 19, 2017, in Lakeland, Fla. Kirthmon F. Dozier DFP Like this topic? You may also like these photo galleries: Replay", "external_links": [], "published": "2017-02-22T05:06:00.000+02:00", "crawled": "2017-02-22T01:08:56.897+02:00", "highlightTitle": ""}