{"organizations": [], "uuid": "49b25db51dbf50a7d86c16b080aae3026f2d0ae9", "thread": {"social": {"gplus": {"shares": 0}, "pinterest": {"shares": 0}, "vk": {"shares": 0}, "linkedin": {"shares": 0}, "facebook": {"likes": 345, "shares": 345, "comments": 0}, "stumbledupon": {"shares": 0}}, "site_full": "metro.co.uk", "main_image": "", "site_section": "", "section_title": "", "url": "http://metro.co.uk/2017/02/15/coronation-street-birth-emergency-tragedy-and-return-10-big-spoilers-and-full-episode-guide-6441891/", "country": "US", "domain_rank": 1779, "title": "Corrie birth emergency, tragedy and return 10 big spoilers and episode guide | Metro News", "performance_score": 3, "site": "metro.co.uk", "participants_count": 0, "title_full": "Corrie birth emergency, tragedy and return 10 big spoilers and episode guide | Metro News", "spam_score": 0.17, "site_type": "news", "published": "2017-02-15T22:01:00.000+02:00", "replies_count": 0, "uuid": "49b25db51dbf50a7d86c16b080aae3026f2d0ae9"}, "author": "Duncan Lindsay For Metro.Co.Uk", "url": "http://metro.co.uk/2017/02/15/coronation-street-birth-emergency-tragedy-and-return-10-big-spoilers-and-full-episode-guide-6441891/", "ord_in_thread": 0, "title": "Corrie birth emergency, tragedy and return 10 big spoilers and episode guide | Metro News", "locations": [], "entities": {"persons": [{"name": "duncan lindsay", "sentiment": "negative"}, {"name": "corrie", "sentiment": "negative"}, {"name": "bethany", "sentiment": "none"}, {"name": "jenny bradley", "sentiment": "none"}, {"name": "michelle connor", "sentiment": "none"}, {"name": "robert", "sentiment": "none"}, {"name": "liam", "sentiment": "none"}, {"name": "ken", "sentiment": "none"}, {"name": "michelle", "sentiment": "none"}, {"name": "peter", "sentiment": "none"}, {"name": "sarah", "sentiment": "none"}, {"name": "rana", "sentiment": "none"}, {"name": "sarah platt", "sentiment": "none"}, {"name": "cathy", "sentiment": "none"}, {"name": "aidan", "sentiment": "none"}, {"name": "brian", "sentiment": "none"}, {"name": "eva", "sentiment": "none"}, {"name": "jenny", "sentiment": "none"}, {"name": "leanne", "sentiment": "none"}, {"name": "nick", "sentiment": "none"}, {"name": "craig", "sentiment": "none"}, {"name": "steve", "sentiment": "none"}, {"name": "gail", "sentiment": "none"}, {"name": "ruari", "sentiment": "none"}, {"name": "olly", "sentiment": "none"}, {"name": "darryl", "sentiment": "none"}, {"name": "roy", "sentiment": "none"}, {"name": "leanne tilsley", "sentiment": "none"}, {"name": "yasmeen", "sentiment": "none"}, {"name": "richard drake", "sentiment": "none"}, {"name": "maria", "sentiment": "none"}, {"name": "maria connor", "sentiment": "none"}, {"name": "kate", "sentiment": "none"}, {"name": "ruairi", "sentiment": "none"}, {"name": "toyah", "sentiment": "none"}], "locations": [{"name": "metro", "sentiment": "none"}, {"name": "coronation street", "sentiment": "none"}], "organizations": [{"name": "metro blogs", "sentiment": "none"}, {"name": "rovers", "sentiment": "none"}]}, "highlightText": "", "language": "english", "persons": [], "text": "Duncan Lindsay for Metro.co.uk Wednesday 15 Feb 2017 3:01 pm (Picture: ITV) \nThe agony of mothers is an ongoing theme in Coronation Street in coming episodes as Leanne Tilsley endures a traumatic labour while trapped in a lift and a grieving Michelle Connor faces more heavy emotion as she scatters Ruari’s ashes and then meets Leanne’s newborn. \nElsewhere, jailed mum Maria Connor is reunited with Liam and it’s clear how hard she is finding being separated from him. In other Corrie developments, Sarah Platt is horrified to find out that Bethany has a boyfriend that she may have slept with while Jenny Bradley is at her blackmailing best as she determines to get her own way. \nHere’s your big spoiler roundup: 10 Corrie spoilers Leanne goes into labour while trapped in a lift with Toyah, who tries her best to help her sister through it. Michelle and Steve head to the coast to scatter Ruairi’s ashes. Later, Michelle struggles as she meets baby Olly. Eva takes Liam to see Maria and he asks her if he can stay with Eva and Aidan while she is inside. Steve confronts Robert over Michelle trying to kiss him and tells him he hopes they can stay friends. Nick is gutted when Leanne tells him that it doesn’t feel right for him to be on Olly’s birth certificate. Bethany admits to Sarah that she stayed at her boyfriend’s and Sarah bans her from seeing him. Jenny is knocked back by Richard Drake but resorts to blackmail after spotting a picture of him with his hand on his PA’s bottom. Cathy and Brian grow closer and Yasmeen comments on the spark between them. Aidan grows suspicious of Jenny’s action but she soon hits back. Craig is annoyed when Liam lets Darryl the rat escape from his cage. Monday 20th February Part One \nToyah and Leanne end up trapped in a lift and, as they row over what Leanne said about Toyah not being a mum, Leanne’s waters break. meanwhile, Peter persuades Ken to give him a loan for his and Toyah;s fertility treatment. (Picture: ITV) \nSteve speaks with Robert over the kiss he almost shared with Michelle and tells him that Michelle regrets it. Later, Steve and Michelle head to the seaside and emotions run high as they scatter Ruairi’s ashes. \nBethany lies to Sarah over where she spent the night but Sarah soon discovers the truth from Rana and Kate. Brian assures Roy he will look for somewhere else to live and Craig is irked when Liam lets Darryl escape. Monday 20th February Part Two (Picture: ITV) \nRana shouts instructions up to the lift as Leanne goes into labour and Toyah stays by her sister’s side as she gives birth. Will the new life on the Street lead to a reconciliation between the warring siblings? \nSarah confronts Bethany, who comes clean about having a new boyfriend but denies that she had sex with him. As they row, Sarah bans Bethany from seeing him but will Bethany defy her? \nBrian prepares a meal for Roy to try and make amends. Wednesday 22nd February (Picture: ITV) \nMichelle insists that she is genuinely pleased for Leanne but she struggles enormously when she meets baby Olly. Meanwhile, Nick is devastated when Leanne tells him it doesn’t feel right to name him as the father on the birth certificate. \nAidan returns from abroad and is annoyed to find Jenny in the office, boasting about the order Richard Drake has placed. Liam is desperate to visit Maria. Friday 24th February Part One (Picture: ITV) \nAfter some bad news from Richard Drake, Jenny remains determined and spires an opportunity after spotting a photograph which shows him with his hand on his PA’s bottom. As she prints off the picture, she forms a plan. \nMichelle tells Steve she’d like to try for another baby. Gail organises a party in the bistro for baby Olly’s arrival and Michelle and Steve watch in pain from another table. \nEva takes Liam to visit Maria. Yasmeen comments to Cathy that there are sparks between her and Brian. Friday 24th February Part Two (Picture: ITV) \nAidan discovers the photo of Richard Drake and realises what Jenny is up to. After confronting her, he has another chock in store when Eva reveals that Liam is coming to stay with them. \nCathy joins Brian for a drink in the Rovers while Steve and Michelle struggle to mask their conflicting emotions as baby Olly’s party continues. Metro Blogs is a place for opinions. These opinions belong to the author and are not necessarily shared by Metro. More ", "external_links": [], "published": "2017-02-15T22:01:00.000+02:00", "crawled": "2017-02-16T13:41:41.731+02:00", "highlightTitle": ""}