{"organizations": [], "uuid": "33ea833fb55db9088048c81a80dcceccbd978f68", "thread": {"social": {"gplus": {"shares": 0}, "pinterest": {"shares": 0}, "vk": {"shares": 0}, "linkedin": {"shares": 0}, "facebook": {"likes": 132, "shares": 132, "comments": 0}, "stumbledupon": {"shares": 0}}, "site_full": "www.thesun.co.uk", "main_image": "https://www.thesun.co.uk/wp-content/uploads/2017/02/sport-preview-beer.jpg?strip=all&#038;w=620&#038;h=413&#038;crop=1", "site_section": "https://www.thesun.co.uk/feed", "section_title": "The Sun", "url": "https://www.thesun.co.uk/sport/football/2893673/sutton-united-order-6000-extra-pint-glasses-extra-toilets-and-a-temporary-stand-ahead-of-fa-cup-glamour-tie-against-arsenal/", "country": "GB", "domain_rank": 2180, "title": "Sutton United order 6,000 extra pint glasses, extra toilets and a temporary stand ahead of FA Cup glamour tie against Arsenal", "performance_score": 1, "site": "thesun.co.uk", "participants_count": 1, "title_full": "Sutton United order 6,000 extra pint glasses, extra toilets and a temporary stand ahead of FA Cup glamour tie against Arsenal", "spam_score": 0.0, "site_type": "news", "published": "2017-02-18T05:54:00.000+02:00", "replies_count": 0, "uuid": "33ea833fb55db9088048c81a80dcceccbd978f68"}, "author": "sstreet", "url": "https://www.thesun.co.uk/sport/football/2893673/sutton-united-order-6000-extra-pint-glasses-extra-toilets-and-a-temporary-stand-ahead-of-fa-cup-glamour-tie-against-arsenal/", "ord_in_thread": 0, "title": "Sutton United order 6,000 extra pint glasses, extra toilets and a temporary stand ahead of FA Cup glamour tie against Arsenal", "locations": [], "entities": {"persons": [{"name": "david smith", "sentiment": "none"}, {"name": "sutton", "sentiment": "none"}, {"name": "arsene wenger", "sentiment": "none"}, {"name": "elliott", "sentiment": "none"}, {"name": "bruce elliott", "sentiment": "none"}, {"name": "rooney", "sentiment": "none"}, {"name": "ben hunt comments sutton", "sentiment": "none"}, {"name": "mark irwin", "sentiment": "none"}, {"name": "steve prince", "sentiment": "none"}, {"name": "wenger", "sentiment": "none"}], "locations": [{"name": "cheam", "sentiment": "none"}, {"name": "old trafford", "sentiment": "none"}, {"name": "south west london", "sentiment": "none"}, {"name": "gander green lane", "sentiment": "none"}], "organizations": [{"name": "sutton united", "sentiment": "negative"}, {"name": "arsenal efl", "sentiment": "negative"}, {"name": "team news sutton united vs arsenal", "sentiment": "none"}, {"name": "sutton united members", "sentiment": "none"}, {"name": "bayern munich", "sentiment": "none"}, {"name": "preview sutton united", "sentiment": "none"}, {"name": "village travel", "sentiment": "none"}, {"name": "gander green lane pa", "sentiment": "none"}, {"name": "leeds", "sentiment": "none"}, {"name": "pa:press association wire", "sentiment": "none"}, {"name": "arsenal", "sentiment": "none"}]}, "highlightText": "", "language": "english", "persons": [], "text": "EFL Beer we go Sutton United order 6,000 extra pint glasses, extra toilets and a temporary stand ahead of FA Cup glamour tie against Arsenal \nSun-backed Sutton are leaving nothing to chance ahead of the biggest match in their history on Monday By BEN HUNT Comments SUTTON is stirring as the Sun-backed non-league minnows prepare to face Arsenal on Monday night. \nThe club have restocked their supply of commemorative half-scarfs, while the bar manager, Steve Prince, has ordered in 6,000 extra pint glasses. 4 The Sutton United bar has been restocked with 6,000 pint glasses for the visit of Arsenal \nHe’s also ordered extra beer after the delirious U’s supporters drank the place dry of ale after their victory over Leeds in the last round of the FA Cup. \nKeep up to date with ALL the football gossip and transfers on our club page plus fixtures, results and live match commentary \nIt has been a case of all hands to the pump for this tiny club in South West London. \nYesterday at their Gander Green Lane stadium, extra toilets were being delivered while a temporary stand to seat the away fans was erected. Related Stories IAN WRIGHT Arsenal have no excuses... Sutton's plastic pitch should suit Arsene Wenger's side down to the ground Team News Sutton United vs Arsenal team news: Wenger prepares his reserves to end the Cup fairytale Preview Sutton United vs Arsenal: What time does it kick-off, what TV channel is it on, and what is the latest team news? Sutt get tough Sutton United will give Arsenal flops more to wine about following Bayern Munich humiliation PLOTTING A CUPSET Lowly Sutton United get their ground ready for biggest match in their history as they train ahead of Arsenal FA Cup tie MARK IRWIN My night watching Bayern Munich v Arsenal at the Sutton United Members' Bar ahead of FA Cup clash WATCH OUT GUNNERS Sun-backed Sutton prepare for FA Cup tie vs Arsenal with game against Rooney in front of 664 fans \nSutton employ just THREE full-time members of staff and have been forced to rely on an army of volunteers to ensure the match goes ahead smoothly. \nThe club’s flag has taken pride of place over the council’s offices in nearby Cheam and local shops are getting behind Sutton’s boys by decorating their shop windows in the club’s colours. PA:Press Association Sutton are looking forward to welcoming the Gunners to Gander Green Lane PA:Press Association Sutton celebrate their win over Leeds in the dressing room Getty Images The stadium is having a temporary stand delivered for the match PA:Press Association Wire 4 Sutton United’s away dressing room might not be quite what the Gunners are expecting \nDavid Smith, managing director of Village Travel, said: “I hope they win because I am a Spurs fan!” \nIt has been an eye-opener for the club’s stalwart chairman, Bruce Elliott, who has been involved with Sutton United for more than 50 years. \nHe said: “My dad used to bring me down to games when I was a kid. Sutton United fans queue from 5am to get tickets for Arsenal match \n“There have been lots of lows, but now, thanks to this Cup money, we are getting the jobs done that we have never found money for.” \nElliott could be forgiven for wanting to head for the beach to unwind after the match. \nBut he said: “A holiday sounds like an attractive proposition — but we could be planning for a quarter-final tie or a fifth-round replay! \n“My dream would be away at Old Trafford. How good would that be?”", "external_links": [], "published": "2017-02-18T05:54:00.000+02:00", "crawled": "2017-02-18T02:15:42.368+02:00", "highlightTitle": ""}