{"organizations": [], "uuid": "4f8e52a942960b98ddc2ba7e2cd1622f332946a6", "thread": {"social": {"gplus": {"shares": 0}, "pinterest": {"shares": 0}, "vk": {"shares": 0}, "linkedin": {"shares": 2}, "facebook": {"likes": 486, "shares": 486, "comments": 0}, "stumbledupon": {"shares": 0}}, "site_full": "www.chron.com", "main_image": "http://ww1.hdnux.com/photos/55/15/40/11851836/4/rawImage.jpg", "site_section": "http://www.chron.com/rss/feed/Entertainment-293.php\r", "section_title": "Entertainment", "url": "http://www.chron.com/entertainment/article/The-hottest-news-anchors-in-the-world-according-10941741.php", "country": "US", "domain_rank": 773, "title": "The hottest news anchors in the world, according to Buzzfeed readers", "performance_score": 4, "site": "chron.com", "participants_count": 1, "title_full": "The hottest news anchors in the world, according to Buzzfeed readers", "spam_score": 0.0, "site_type": "news", "published": "2017-02-18T06:34:00.000+02:00", "replies_count": 0, "uuid": "4f8e52a942960b98ddc2ba7e2cd1622f332946a6"}, "author": "Will Axford, Houston Chronicle", "url": "http://www.chron.com/entertainment/article/The-hottest-news-anchors-in-the-world-according-10941741.php", "ord_in_thread": 0, "title": "The hottest news anchors in the world, according to Buzzfeed readers", "locations": [], "entities": {"persons": [{"name": "gerald herbert", "sentiment": "negative"}, {"name": "adam joseph", "sentiment": "none"}, {"name": "dolly parton", "sentiment": "none"}, {"name": "mike woods", "sentiment": "none"}, {"name": "joe moravsky", "sentiment": "none"}, {"name": "morgan chesky", "sentiment": "none"}, {"name": "reggie aqui", "sentiment": "none"}, {"name": "ernie zuniga", "sentiment": "none"}, {"name": "erik barajas", "sentiment": "none"}, {"name": "buzzfeed", "sentiment": "none"}], "locations": [{"name": "new york city", "sentiment": "none"}, {"name": "san francisco", "sentiment": "none"}, {"name": "seattle", "sentiment": "none"}, {"name": "houston", "sentiment": "none"}, {"name": "philadelphia", "sentiment": "none"}, {"name": "texas", "sentiment": "none"}, {"name": "san antonio", "sentiment": "none"}, {"name": "connecticut", "sentiment": "none"}], "organizations": [{"name": "chron.com homepage click", "sentiment": "none"}, {"name": "abc", "sentiment": "none"}, {"name": "komo", "sentiment": "none"}, {"name": "fox", "sentiment": "none"}, {"name": "ktrk", "sentiment": "none"}]}, "highlightText": "", "language": "english", "persons": [], "text": "Photo: Gerald Herbert, Associated Press Image 15 of 15 The hottest news anchors in the world, according to Buzzfeed readers 1 / 15 Back to Gallery \nIf you watch the news in Houston or San Francisco, there's a chance that you've seen one of the hottest news anchors in the world. \nThat's according to Buzzfeed readers who submitted their top picks of hottest news anchors in the world to the website. \nNICE HAIR: Erik Barajas wins best anchor hair in Texas, KTRK says \nErik Barajas of ABC 13 in Houston ranks number six on the list. What makes him hot? \"His arms are huge,\" Buzzfeed wrote. \nReggie Aqui of ABC 7 in San Francisco ranks at number seven. He says he once sang a duet with Dolly Parton. \nAlso on the list in Morgan Chesky of KOMO in Seattle, Joe Moravsky of News 12 in Connecticut and Ernie Zuniga of San Antonio. \nTopping out the list is Adam Joseph for 6 ABC in Philadelphia at number two and Mike Woods of Fox 5 in New York City. \nLatest from the Chron.com Homepage Click below for the top news from around the Houston area and beyond. Sign up for our newsletters to be the first to learn about breaking news and more. Go to 'Sign In' and 'Manage Profile' at the top of the page. Need to Know", "external_links": [], "published": "2017-02-18T06:34:00.000+02:00", "crawled": "2017-02-18T02:10:21.037+02:00", "highlightTitle": ""}