{"organizations": [], "uuid": "05a0f7eb6c5e9b44fa3aa715204e3c6fff72e8b3", "thread": {"social": {"gplus": {"shares": 0}, "pinterest": {"shares": 0}, "vk": {"shares": 0}, "linkedin": {"shares": 0}, "facebook": {"likes": 162, "shares": 162, "comments": 3}, "stumbledupon": {"shares": 0}}, "site_full": "www.freep.com", "main_image": "http://www.gannett-cdn.com/-mm-/8c487a813d74ce29c71b8ac23787b0433565da72/c=0-0-2398-1355&amp;r=x633&amp;c=1200x630/local/-/media/2017/02/16/DetroitFreePress/DetroitFreePress/636228462530227911-tigers-021517-kd-37.jpg", "site_section": "http://rssfeeds.freep.com/freep/home", "section_title": "GANNETT Syndication Service", "url": "http://www.freep.com/story/sports/mlb/tigers/2017/02/27/detroit-tigers-joe-jimenez-spring-training/98501748/", "country": "US", "domain_rank": 2980, "title": "Tigers' Joe Jimenez ends game with flop, then flurry of strikeouts", "performance_score": 1, "site": "freep.com", "participants_count": 1, "title_full": "Tigers' Joe Jimenez ends game with flop, then flurry of strikeouts", "spam_score": 0.0, "site_type": "news", "published": "2017-02-28T07:28:00.000+02:00", "replies_count": 0, "uuid": "05a0f7eb6c5e9b44fa3aa715204e3c6fff72e8b3"}, "author": "Detroit Free Press", "url": "http://www.freep.com/story/sports/mlb/tigers/2017/02/27/detroit-tigers-joe-jimenez-spring-training/98501748/", "ord_in_thread": 0, "title": "Tigers' Joe Jimenez ends game with flop, then flurry of strikeouts", "locations": [], "entities": {"persons": [{"name": "joe jimenez", "sentiment": "negative"}, {"name": "jose iglesias", "sentiment": "none"}, {"name": "dansby swanson", "sentiment": "none"}, {"name": "justin upton", "sentiment": "none"}, {"name": "reinhold matay", "sentiment": "none"}, {"name": "jordan zimmermann", "sentiment": "none"}, {"name": "ava hudge", "sentiment": "none"}, {"name": "dixon machado", "sentiment": "none"}, {"name": "freddie freeman", "sentiment": "none"}, {"name": "anthony fenech", "sentiment": "none"}, {"name": "anibal sanchez", "sentiment": "none"}, {"name": "ian kinsler", "sentiment": "none"}, {"name": "miguel cabrera", "sentiment": "none"}, {"name": "kurt suzuki", "sentiment": "none"}, {"name": "r.a. dickey", "sentiment": "none"}, {"name": "mike gerber", "sentiment": "none"}, {"name": "travis demeritte", "sentiment": "none"}], "locations": [{"name": "fla", "sentiment": "none"}, {"name": "lakeland", "sentiment": "none"}, {"name": "usa", "sentiment": "none"}], "organizations": [{"name": "young tigers", "sentiment": "negative"}, {"name": "tigers", "sentiment": "negative"}, {"name": "braves post", "sentiment": "none"}, {"name": "facebook tigers", "sentiment": "none"}, {"name": "reinhold matay usa today sports braves", "sentiment": "none"}, {"name": "reinhold matay usa today sports tigers", "sentiment": "none"}, {"name": "facebook", "sentiment": "none"}, {"name": "detroit free press", "sentiment": "none"}, {"name": "braves", "sentiment": "none"}]}, "highlightText": "", "language": "english", "persons": [], "text": "  Tigers' Joe Jimenez ends game with flop, then flurry of strikeouts Young Tigers reliever worked himself into and then out of jam in ninth inning Monday against Braves Post to Facebook Tigers' Joe Jimenez ends game with flop, then flurry of strikeouts Young Tigers reliever worked himself into and then out of jam in ninth inning Monday against Braves  //on.freep.com/2mxWeP0   Join the Conversation To   Tigers' Joe Jimenez ends game with flop, then flurry of strikeouts Anthony Fenech , Detroit Free Press 7:28   Facebook Posted! A link has been posted to your Facebook feed. Tigers leftfielder Justin Upton (8) and shortstop Jose Iglesias (1) congratulate each other after they combined on a tipped ball catch during the fourth inning of the Tigers' 10-7 exhibition win Monday in Lakeland, Fla. Reinhold Matay USA TODAY Sports Braves pitcher R.A. Dickey (19) throws a pitch during the first inning of the Tigers' 10-7 exhibition win Monday in Lakeland, Fla. Reinhold Matay USA TODAY Sports Tigers pitcher Jordan Zimmermann (27) throws a pitch during the first inning of the Tigers' 10-7 exhibition win Monday in Lakeland, Fla. Reinhold Matay USA TODAY Sports Tigers shortstop Jose Iglesias (left) looks on as Braves shortstop Dansby Swanson (right) slid safely into second base on a grounder to first base during the first inning of the Tigers' 10-7 exhibition win Monday in Lakeland, Fla. Reinhold Matay USA TODAY Sports Tigers rightfielder Mike Gerber (75) signs autographs before the Tigers' 10-7 exhibition win Monday in Lakeland, Fla. Reinhold Matay USA TODAY Sports Nine-year-old Ava Hudge sings the national anthem before the first inning of the Tigers' 10-7 exhibition win Monday in Lakeland, Fla. Reinhold Matay USA TODAY Sports Tigers first baseman Miguel Cabrera (24) slides into second base as Braves second baseman Travis Demeritte (81) waits on the ball during the third inning of the Tigers' 10-7 exhibition win Monday in Lakeland, Fla. Reinhold Matay USA TODAY Sports Tigers pitcher Anibal Sanchez (19) throws a pitch during the third inning of the Tigers' 10-7 exhibition win Monday in Lakeland, Fla. Reinhold Matay USA TODAY Sports Tigers shortstop Jose Iglesias (1) dives to field a grounder during the first inning of the Tigers' 10-7 exhibition win Monday in Lakeland, Fla. Reinhold Matay USA TODAY Sports Tigers second baseman Ian Kinsler (3) fields the ball at second base but Braves first baseman Freddie Freeman (5) slides in safely during the first inning of the Tigers' 10-7 exhibition win Monday in Lakeland, Fla. Reinhold Matay USA TODAY Sports Tigers shortstop Jose Iglesias (1) throws to second after making a diving infield stop during the first inning of the Tigers' 10-7 exhibition win Monday in Lakeland, Fla. Reinhold Matay USA TODAY Sports Braves catcher Kurt Suzuki (right) is caught sliding into second base by Tigers shortstop Dixon Machado (left) during the first inning of the Tigers' 10-7 exhibition win Monday in Lakeland, Fla. Reinhold Matay USA TODAY Sports Like this topic? You may also like these photo galleries: Replay", "external_links": [], "published": "2017-02-28T07:28:00.000+02:00", "crawled": "2017-02-28T02:48:15.532+02:00", "highlightTitle": ""}