{"organizations": [], "uuid": "b72496954acb65395f597e4f6fce1692463f617d", "thread": {"social": {"gplus": {"shares": 3}, "pinterest": {"shares": 0}, "vk": {"shares": 0}, "linkedin": {"shares": 0}, "facebook": {"likes": 599, "shares": 599, "comments": 0}, "stumbledupon": {"shares": 1}}, "site_full": "www.vulture.com", "main_image": "http://pixel.nymag.com/imgs/daily/vulture/2017/02/21/21-Steve-Buscemi-Broad-City.w1200.h630.jpg", "site_section": "http://feeds.feedburner.com/nymag/vulture", "section_title": "Vulture", "url": "http://www.vulture.com/2017/02/great-news-fellow-kids-steve-buscemi-headed-to-broad-city.html?utm_source=feedburner&utm_medium=feed&utm_campaign=Feed%3A+nymag%2Fvulture+%28Vulture+-+nymag.com%27s+Entertainment+and+Culture+Blog%29", "country": "US", "domain_rank": 2191, "title": "Great News, Fellow Kids: Steve Buscemi Headed to Broad City", "performance_score": 5, "site": "vulture.com", "participants_count": 1, "title_full": "Great News, Fellow Kids: Steve Buscemi Headed to Broad City", "spam_score": 0.0, "site_type": "news", "published": "2017-02-22T04:11:00.000+02:00", "replies_count": 0, "uuid": "6ad8fa88a79468fb8c169318a6811c18f67f37da"}, "author": "", "url": "http://www.vulture.com/2017/02/great-news-fellow-kids-steve-buscemi-headed-to-broad-city.html", "ord_in_thread": 0, "title": "Great News, Fellow Kids: Steve Buscemi Headed to Broad City", "locations": [], "entities": {"persons": [{"name": "steve buscemi", "sentiment": "negative"}, {"name": "pete", "sentiment": "none"}, {"name": "horace", "sentiment": "none"}, {"name": "donald trump", "sentiment": "none"}, {"name": "erika", "sentiment": "none"}, {"name": "milo ventimiglia", "sentiment": "none"}, {"name": "anti-trans bathroom bill", "sentiment": "none"}, {"name": "rihanna", "sentiment": "none"}, {"name": "steven vincent buscemi", "sentiment": "none"}, {"name": "betsy devos", "sentiment": "none"}, {"name": "mykki blanco jimmy kimmel", "sentiment": "none"}, {"name": "k. brown", "sentiment": "none"}, {"name": "danny rand", "sentiment": "none"}, {"name": "dwayne johnson", "sentiment": "none"}, {"name": "ilana", "sentiment": "none"}, {"name": "beyonc√©", "sentiment": "none"}, {"name": "cate blanchett", "sentiment": "none"}, {"name": "branden jacobs-jenkins", "sentiment": "none"}, {"name": "drake", "sentiment": "none"}, {"name": "jimmy kimmel", "sentiment": "none"}, {"name": "abbi", "sentiment": "none"}, {"name": "richard linklater", "sentiment": "none"}, {"name": "kyle", "sentiment": "none"}, {"name": "alan rickman", "sentiment": "none"}, {"name": "brian tyree henry", "sentiment": "none"}, {"name": "david bowie", "sentiment": "none"}, {"name": "chris brown", "sentiment": "none"}], "locations": [{"name": "broad city", "sentiment": "none"}, {"name": "new york city", "sentiment": "none"}, {"name": "brixton", "sentiment": "none"}, {"name": "new york", "sentiment": "none"}, {"name": "new hbo prison doc rock", "sentiment": "none"}, {"name": "broad city share", "sentiment": "none"}, {"name": "south london", "sentiment": "none"}, {"name": "dublin", "sentiment": "none"}, {"name": "texas", "sentiment": "none"}, {"name": "gorilla city", "sentiment": "none"}, {"name": "hulu", "sentiment": "none"}, {"name": "london", "sentiment": "none"}], "organizations": [{"name": "facebook tweet", "sentiment": "none"}, {"name": "trump news network with", "sentiment": "none"}, {"name": "real housewives of beverly hills recap", "sentiment": "none"}, {"name": "paramount", "sentiment": "none"}, {"name": "nick cannon threatens to sue national enquirer", "sentiment": "none"}, {"name": "netflix", "sentiment": "none"}, {"name": "hbo jane", "sentiment": "none"}, {"name": "amazon", "sentiment": "none"}, {"name": "miami-dade county corrections & rehabilitation boot camp", "sentiment": "none"}, {"name": "macarthur genius", "sentiment": "none"}, {"name": "martin scorsese & robert de niro", "sentiment": "none"}]}, "highlightText": "", "language": "english", "persons": [], "text": "Photo: Twitter: @BroadCity What three words can best sum up the kinetic, chaotic lifestyle of two female stoners just getting by in New York City? Obviously the answer is Steven Vincent Buscemi. Broad City p osted an on-set photo of the Brooklyn-born, apparently social media-free actor hanging out with Abbi and Ilana during shooting. There‚Äôs obviously no way to tell what role the Horace and Pete star will play in the show‚Äôs upcoming fourth season, so we‚Äôre going to go with, let‚Äôs see, Abbi‚Äôs adorable baby cousin .\nYU #BTS #BC4 (anyone know Steve Buscemi's handle???)üë©‚Äçüë©‚Äçüë¶ pic.twitter.com/BLwdjJclOJ \n‚Äî Broad City (@broadcity) February 21, 2017 Tags: guest stars steve buscemi broad city tv Great News, Fellow Kids: Steve Buscemi Headed to Broad City Share on Facebook Tweet this Story Top Stories Chris Brown Ordered to Stay Away From Ex Karrueche Tran Following Death Threats Jimmy Kimmel Is Considering Retiring From Late-Night Television Soon Here‚Äôs the First Photo From the Star Wars Han Solo Movie, But What Does It Mean? Most Viewed Stories The Bachelor Recap: No Place Like Home Let‚Äôs Baselessly Speculate About the First Photo From the Star Wars Han Solo Movie Cate Blanchett Lip-Synced ‚ÄòYou Don‚Äôt Own Me‚Äô at a Drag Show, Giving the People Exactly What They Want Airplane Passenger Reportedly Called Police After Feeling ‚ÄòNot Comfortable‚Äô Sitting Next to Mykki Blanco Jimmy Kimmel Is Considering Retiring From Late-Night TV When His Contract Expires What to Stream Now See what's new and notable on Netflix, Amazon, Hulu, and HBO Jane the Virgin Recap: Reality Check Vanderpump Rules Recap: Life Is a Drag Milo Ventimiglia Wants to Mentally Prepare You for Tonight‚Äôs Extra-Emotional This Is Us Episode What‚Äôs New on Netflix: February 2017 The Love Actually Sequel Has Almost Everything, But It Won‚Äôt Have an Alan Rickman Tribute Most Popular Video On Vulture An Evolution of Beyonc√©‚Äôs Grammy Performances Latest News from Vulture 4 seconds ago Video Games Are Better Than Real Life Many Americans have replaced work hours with game play ‚Äî and ended up happier. Which wouldn‚Äôt surprise most gamers.\n7:10 a.m. The Flash Recap: Welcome to the Jungle ‚ÄúAttack on Gorilla City‚Äù is a failure of imagination.\n2:14 a.m. Watch Richard Linklater‚Äôs Ad Against Proposed Anti-Trans Bathroom Bill in Texas The proposed Texas Privacy Act would require trans people to use bathrooms that do not correspond to the gender they identify with.\n1:32 a.m. Future Plans to Drop New Album Hndrxx on Friday ‚ÄúThey said I can‚Äôt I tried I need help but not me #HNDRXX.‚Äù\n12:41 a.m. Tonight Show was Momentarily Taken Over by ‚ÄòDonald Trump‚Äôs‚Äô Trump News Network With special reports from ‚Äúweatherman‚Äù Betsy Devos!\n12:37 a.m. New Marvel‚Äôs Iron Fist Featurette Explores Danny Rand‚Äôs Origin Story The billionaire monk returns to New York, the city so nice, he punches it twice.\nYesterday at 11:49 p.m. David Bowie Fans Are Crowdsourcing For a 3-Story Tall $1.23M Memorial in London The lightning-bolt statue would be placed in Brixton, South London.\nYesterday at 11:23 p.m. Taboo Recap: Cruel and Unusual Punishment This is a relentlessly unpleasant episode.\nYesterday at 10:57 p.m. Martin Scorsese & Robert De Niro‚Äôs The Irishman Reportedly Scooped by Netflix The $100 million movie was first announced in 2008 and was previously attached to Paramount.\nYesterday at 10:38 p.m. Late Night Will See Your Manchester by the Sea and Raise You Oscar Bait The Film You got your racial tension in my latent homosexuality! You‚Äôve got your latent homosexuality in my racial tension!\nYesterday at 10:00 p.m. Brian Tyree Henry on This Is Us and Working With His BFF Sterling K. Brown ‚ÄúI don‚Äôt think people are ready for what this episode is going to dig up.‚Äù\nYesterday at 10:00 p.m. The Real Housewives of Beverly Hills Recap: Volunteering Information I would like an entire show of Kyle and Erika being utterly ridiculous.\nYesterday at 10:00 p.m. This Is Us Recap: The First and the Last ‚ÄúMemphis‚Äù is a beautiful send-off for a beloved character.\nYesterday at 9:30 p.m. Fresh Off the Boat Recap: The Fun Mom ‚ÄúThe Gloves Are Off‚Äù falls flat by focusing on Honey.\nYesterday at 9:24 p.m. Watch Drake Celebrate Rihanna‚Äôs Birthday By Singing Their Songs Together Solo Drake celebrated his favorite holiday (RiRi‚Äôs birthday) in Dublin.\nYesterday at 9:11 p.m. Excellent News, Fellow Kids: Steve Buscemi Will Appear in Season 4 of Broad City A little news flash, pop\nYesterday at 9:01 p.m. The Fosters Recap: Solitary Confinement A mantra for Callie: Always the police work to the police.\nYesterday at 9:00 p.m. Theater Review: Everybody is a 600-Year-Old Play Brought Up to the Moment Branden Jacobs-Jenkins, Macarthur Genius, reworks one of the oldest known English-language plays.\nYesterday at 8:36 p.m. Nick Cannon Threatens To Sue National Enquirer Over Upcoming Gossip Article ‚ÄúOnly Evil operates in this manner.‚Äù\nYesterday at 8:20 p.m. Watch the Trailer for Dwayne Johnson‚Äôs New HBO Prison Doc Rock And A Hard Place Dwayne Johnson visits the inmates in Miami-Dade County Corrections & Rehabilitation Boot Camp", "external_links": [], "published": "2017-02-22T04:11:00.000+02:00", "crawled": "2017-02-22T15:00:16.567+02:00", "highlightTitle": ""}