{"organizations": [], "uuid": "ee61533f1a9e032c256a60d5edbd361c0eb65d18", "thread": {"social": {"gplus": {"shares": 0}, "pinterest": {"shares": 0}, "vk": {"shares": 0}, "linkedin": {"shares": 1}, "facebook": {"likes": 485, "shares": 485, "comments": 0}, "stumbledupon": {"shares": 0}}, "site_full": "www.thesun.co.uk", "main_image": "https://www.thesun.co.uk/wp-content/uploads/2017/02/tp-composite-no-veg.jpg?strip=all&#038;w=750&#038;h=500&#038;crop=1", "site_section": "https://www.thesun.co.uk/feed", "section_title": "The Sun", "url": "https://www.thesun.co.uk/news/2781446/spanish-supermarkets-hoard-fruit-and-veg-while-brit-shoppers-are-being-rationed/", "country": "GB", "domain_rank": 2180, "title": "Spanish supermarkets hoard fruit and veg while Brit shoppers are being rationed", "performance_score": 4, "site": "thesun.co.uk", "participants_count": 1, "title_full": "Spanish supermarkets hoard fruit and veg while Brit shoppers are being rationed", "spam_score": 0.0, "site_type": "news", "published": "2017-02-04T09:20:00.000+02:00", "replies_count": 0, "uuid": "ee61533f1a9e032c256a60d5edbd361c0eb65d18"}, "author": "tbowman", "url": "https://www.thesun.co.uk/news/2781446/spanish-supermarkets-hoard-fruit-and-veg-while-brit-shoppers-are-being-rationed/", "ord_in_thread": 0, "title": "Spanish supermarkets hoard fruit and veg while Brit shoppers are being rationed", "locations": [], "entities": {"persons": [{"name": "donald", "sentiment": "none"}, {"name": "jose", "sentiment": "none"}, {"name": "trump", "sentiment": "none"}, {"name": "jo osmond", "sentiment": "none"}, {"name": "david hockney", "sentiment": "none"}, {"name": "dieter lloyd", "sentiment": "none"}, {"name": "marie webb", "sentiment": "none"}, {"name": "harry", "sentiment": "none"}, {"name": "tom conti", "sentiment": "none"}, {"name": "lucy stewart", "sentiment": "none"}, {"name": "daniel jones", "sentiment": "none"}, {"name": "morrisons", "sentiment": "none"}, {"name": "erotic valentine", "sentiment": "none"}, {"name": "alan titchmarsh", "sentiment": "none"}], "locations": [{"name": "bristol", "sentiment": "none"}, {"name": "us", "sentiment": "none"}, {"name": "molina de segura", "sentiment": "none"}, {"name": "south east london", "sentiment": "none"}, {"name": "spain", "sentiment": "none"}, {"name": "filton", "sentiment": "none"}, {"name": "beckenham", "sentiment": "none"}, {"name": "uk", "sentiment": "none"}, {"name": "chelmsford  some uk", "sentiment": "none"}, {"name": "mercadona", "sentiment": "none"}, {"name": "london", "sentiment": "none"}, {"name": "india", "sentiment": "none"}, {"name": "murcia", "sentiment": "none"}], "organizations": [{"name": "epa", "sentiment": "none"}, {"name": "council", "sentiment": "none"}, {"name": "south west news service", "sentiment": "none"}, {"name": "sainsbury", "sentiment": "none"}, {"name": "budgens", "sentiment": "none"}, {"name": "the sun", "sentiment": "none"}, {"name": "sotheby", "sentiment": "none"}, {"name": "leafy salad growers association", "sentiment": "none"}, {"name": "tesco", "sentiment": "none"}]}, "highlightText": "", "language": "english", "persons": [], "text": "Spanish supermarkets hoard fruit and veg while Brit shoppers are being rationed \nSpaniards stockpile five-a-day as British consumers show signs of panic buying By DANIEL JONES Comments SPANISH supermarkets are stockpiling lettuce and other veg even though British shoppers are being rationed. \nAisles overseas are overflowing with salad veg while shoppers at home are having to go short. SWNS:South West News Service 4 Signs of panic as Sainsbury’s shelves sit empty in Chelmsford \nSome UK stores have run out of sweet gem and romaine lettuces. Tesco and Morrisons are limiting customers to three icebergs each amid signs of panic buying. Experts blame a drought and cold spell in Murcia, Spain, which grows nine in ten UK-sold lettuces. Dieter Lloyd, of the Leafy Salad Growers Association, said: “People are getting very surprised by the notion of rationing.” EPA 4 Spanish producers show off produce at gastronomy event \nBut gardening guru Alan Titchmarsh said of the shortage: “It reminds people not to take food and food producers for granted.” related stories Council slammed as racist after naming crackdown on dodgy drivers 'Operation India' NHS 'SEX RING' EXPOSED Two doctors quit after exchanging coded emails to arrange romps with staff at top hospital 'DONALD'S A MORON' Prince Harry slams Trump's election as 'terrifying' and 'condemns his policies to friends' ‘Murder by acid' Woman charged with murder after ex dies 15 months after UK's first fatal acid attack BORDER FARCE Immigration chiefs prepare to throw nan out of UK after 27yrs because she spent too long with dying parents RAY OF SUNSHINE David Hockney's transformation of The Sun's logo hailed as 'genius' and an 'optimistic vision of the world's beauty' fool conti Actor Tom Conti fights to stop Tesco coverting Budgens - despite it being a mile away from his £17.5m home 'I GOT MY EYE ON YOU' Father hunted by cops over 2008 'honour killing' of his two daughters filmed pair in bed in disturbing video that also shows his gun 'I'M NOT A F***ING BOY' Entrepreneur acquitted of harassing a transgender woman and calling her an 'old geezer' JAMES FORSYTH With the average London house to cost £1million by 2022 - home owners will make or break Theresa May TRAVEL BAN TRUMPED Judge puts block on controversial 'Muslim ban' that caused chaos across US GOING, GOING, DONG! Erotic Valentine's auction at Sotheby's offering a penis table, orgy necklace and saucy sketches \nIn Spain, we saw dozens of icebergs for sale at Mercadona supermarket in Molina de Segura, Murcia. 4 No way Jose! Spanish supermarket shelves overflow \nBrits hit out. Lucy Stewart, 28, from Beckenham, South East London, seethed: “It’s sickening. The Spaniards should make sure more gets to us.” The bad weather in Spain is also causing a shortage of tomatoes, broccoli, spinach, cabbage and courgettes. Getty Images 4 Warning signs say fruit and veg could soon cost an Armada-and-a-leg \nMarie Webb, 57, with mum Jo Osmond, 81, outside Sainsbury’s in Filton, Bristol, said: “I have to say the shelves are looking a little bare.” Getting your kid to enjoy their fruit and veg doesn’t have to be a chore", "external_links": [], "published": "2017-02-04T09:20:00.000+02:00", "crawled": "2017-02-04T05:51:21.025+02:00", "highlightTitle": ""}