{"organizations": [], "uuid": "d5599ca31292f9b210c5cbe8987afe9411e31555", "thread": {"social": {"gplus": {"shares": 0}, "pinterest": {"shares": 0}, "vk": {"shares": 0}, "linkedin": {"shares": 0}, "facebook": {"likes": 384, "shares": 384, "comments": 0}, "stumbledupon": {"shares": 0}}, "site_full": "au.news.yahoo.com", "main_image": "https://s.yimg.com/iu/api/res/1.2/Kxj2ymivoKefU9yVK8EHXg--/YXBwaWQ9eXZpZGVvO3c9NjMwO2g9MzU0O2R4PTE7ZHk9MTtjdz0xMjc5O2NoPTcxOTtxPTcwO249MTt1bGNyb3A7cm90YXRlPWF1dG8-/https://s.yimg.com/ea/img/-/170219/58a8fbbe804fd_243trumpinline.jpg", "site_section": "", "section_title": "", "url": "https://au.news.yahoo.com/a/34447745/donald-trump-back-on-the-campaign-trail-already-touts-promises-kept/", "country": "US", "domain_rank": 5, "title": "Donald Trump back on the campaign trail already, touts promises kept - Yahoo7", "performance_score": 3, "site": "yahoo.com", "participants_count": 0, "title_full": "Donald Trump back on the campaign trail already, touts promises kept - Yahoo7", "spam_score": 0.042, "site_type": "news", "published": "2017-02-19T08:01:00.000+02:00", "replies_count": 0, "uuid": "d5599ca31292f9b210c5cbe8987afe9411e31555"}, "author": "Jeff Mason", "url": "https://au.news.yahoo.com/a/34447745/donald-trump-back-on-the-campaign-trail-already-touts-promises-kept/", "ord_in_thread": 0, "title": "Donald Trump back on the campaign trail already, touts promises kept - Yahoo7", "locations": [], "entities": {"persons": [{"name": "jeff mason", "sentiment": "negative"}, {"name": "irene klotz - reuter", "sentiment": "negative"}, {"name": "donald trump", "sentiment": "negative"}, {"name": "trump", "sentiment": "negative"}, {"name": "gene huber", "sentiment": "none"}, {"name": "michael flynn", "sentiment": "none"}, {"name": "carmela rocheleau", "sentiment": "none"}, {"name": "mike pence", "sentiment": "none"}, {"name": "melania", "sentiment": "none"}, {"name": "huber", "sentiment": "none"}], "locations": [{"name": "port st. lucie", "sentiment": "none"}, {"name": "united states", "sentiment": "none"}, {"name": "us", "sentiment": "none"}, {"name": "mexico", "sentiment": "none"}, {"name": "u.s.", "sentiment": "none"}, {"name": "newsbreak", "sentiment": "none"}, {"name": "dallas", "sentiment": "none"}, {"name": "white house", "sentiment": "none"}, {"name": "russia", "sentiment": "none"}, {"name": "florida", "sentiment": "none"}, {"name": "west palm beach", "sentiment": "none"}], "organizations": [{"name": "senate", "sentiment": "none"}, {"name": "trump", "sentiment": "none"}, {"name": "ap  trump", "sentiment": "none"}, {"name": "white house", "sentiment": "none"}, {"name": "secret service", "sentiment": "none"}, {"name": "federal election commission", "sentiment": "none"}, {"name": "ap", "sentiment": "none"}]}, "highlightText": "", "language": "english", "persons": [], "text": "Trump back on the campaign trail already, touts promises kept By Jeff Mason and Irene Klotz - Reuters on February 19, 2017, 11:38 am Share Donald Trump back on the campaign trail already, touts promises kept - Yahoo7 President Donald Trump, after a rocky first month in office, returned to the campaign trail on Saturday to deliver another attack on the media and tout his White House accomplishments in the friendly and familiar atmosphere of a rally with supporters. Close Donald Trump begins 2020 presidential campaign UP NEXT VIDEO Donald Trump begins 2020 presidential campaign. Source: 7 News Donald Trump begins 2020 presidential campaign \nLanding on Air Force One as the sun set near a hangar filled with thousands of people, Trump reveled in the crowd and listed promises he had kept, including starting the process of building a wall on the U.S. border with Mexico, deporting immigrants, and pulling the country out of a trade agreement with Asian nations. \n\"Life is a campaign. Making our country great again is a campaign,\" he told reporters on Air Force One when asked about criticism that he was starting to campaign so early. US President Donald Trump has started his 2020 campaign extemely early, only a month after being elected. Photo: AP Mr Trump was joined on the stage by his wife Melania. Photo: AP \nThe rally marks an especially early start to the 2020 election campaign. Trump filed re-election papers with the Federal Election Commission five hours after he was sworn in as president on Jan. 20. \nThe businessman-turned-politician told the crowd he wanted to speak to them without the filter of \"fake news,\" his standard critique of the journalists and media organizations that cover him. \nThe White House has been unhappy with stories portraying Trump's first weeks as chaotic. \nHis short tenure has been marked by turmoil over a contentious executive order limiting immigration from seven Muslim-majority countries and the resignation of his national security adviser. Close President Trump invites supporter on stage at rally UP NEXT VIDEO President Trump invites supporter on stage at rally Donald Trump has defended his first month in office at a rally in Florida. Photo: AP \nThe abrupt departure of Michael Flynn followed revelations that he had discussed U.S. sanctions on Russia with the Russian ambassador to the United States before Trump took office and misled Vice President Mike Pence about the conversations. \n“I want him to know that we support him,\" said Carmela Rocheleau, 33, a registered nurse from Port St. Lucie, Florida, who attended Trump's rally. \n\"Everybody is going against him and I want him to know that we care about all the hard work that he’s doing because it seems like everybody attacks him for anything and nobody shows him any good credit,\" she said.\" He delivered another attack on the media, which he believes is treating him unfairly. Photo: AP \nGene Huber, 47, a car salesman from West Palm Beach, Florida, had been waiting in line to see Trump since 4 a.m. \n\"His excitement and the love that he shows us, the people, that’s why each day brought me stronger and closer to him,\" Huber said. \nIn an unusual move, Trump allowed Huber to join him on stage and address the crowd during the rally. He acknowledged later that the move probably did not please the Secret Service. Close President Trump goes back on the 'campaign trail' UP NEXT VIDEO President Trump goes back on the 'campaign trail' Protesters were out in force in Dallas to speak out against Mr Trump's immigration policies. Photo: AP \nAt one point, Trump also read aloud the federal statute at issue in the litigation challenging his immigration executive order, while again criticizing the appellate panel that blocked its enforcement. \nHe pledged a revised order would come in a matter of days. \"We don't give up,\" Trump said. \"We never give up.\" Mr Trump with his wife Melania at the rally. Photo: AP \nTrump also heavily criticized Senate Democrats for holding up confirmation of his cabinet nominees. \n\"They're doing the wrong thing for the American people,\" he said. He decried public-opinion polls that show him with a high disapproval rating as \"phony\" and urged his supporters to pay no attention to them. \nBut after a speech filled with attacks on the media and his opponents, the president tried to close on a unifying note. \n\"Let us move past the differences of party and find a new loyalty rooted deeply in our country,\" Trump told the crowd. \nNewsbreak – February 19 ", "external_links": [], "published": "2017-02-19T08:01:00.000+02:00", "crawled": "2017-02-19T05:35:49.673+02:00", "highlightTitle": ""}